{
  "command": "brocade_netiron_show_interfaces",
  "source": "ntc",
  "status": "success",
  "match_ratio": 1.2222222222222223,
  "textfsm_rows": 9,
  "ttp_rows": 11,
  "ttp_template": "<group name=\"openflowindex_dropprecedencelevel_hardwaretype_stprootguard\">\n{{openflowindex}}{{dropprecedencelevel}}{{hardwaretype | ORPHRASE}}3/6 is {{stprootguard | ORPHRASE}}, line protocol is down \n</group>\n<group name=\"interface_intstate_protostate\">\n{{interface}} is {{intstate | ORPHRASE}}, line protocol is {{protostate | ORPHRASE}} \n</group>",
  "error": null,
  "textfsm_parsed": [
    {
      "interface": "GigabitEthernet1/1",
      "intstate": "up",
      "protostate": "up",
      "stprootguard": "disabled",
      "stpbpduguard": "disabled",
      "hardwaretype": "GigabitEthernet",
      "mac": "0024.38a5.1c00",
      "bia": "0024.38a5.1c00",
      "conffiberspeed": "auto",
      "conffiberduplex": "fdx",
      "actualspeed": "1Gbit",
      "actualduplex": "fdx",
      "l2portstate": "Forwarding",
      "l2portmode": "tagged",
      "numtaggedvlans": "36",
      "stpconfstate": "ON",
      "priority": "level0",
      "flowcontrolstate": "enabled",
      "priorityforcedstate": "disabled",
      "dropprecedencelevel": "0",
      "dropprecedenceforcestate": "disabled",
      "dhcpsnooptrust": "OFF",
      "mirrorstate": "disabled",
      "monitorstate": "disabled",
      "lacpbpduforward": "Disabled",
      "lldpbpduforward": "Disabled",
      "portname": "ATM1-G0-1",
      "l2mtubytes": "9216",
      "encapsulation": "ethernet",
      "openflowopstate": "Disabled",
      "openflowindex": "1",
      "clusterl2protoforwarding": "enabled",
      "loadinterval": "300",
      "inputbitssec": "235649647",
      "inputpacketssec": "27522",
      "inputpercentutilization": "24.00",
      "outputbitssec": "140641094",
      "outputpacketssec": "31382",
      "outputpercentutilization": "14.56",
      "inputpacketstotal": "74818592872",
      "inputbytestotal": "72400348503374",
      "inputnobuffers": "0",
      "inputbroadcasts": "3639493",
      "inputmulticasts": "2736343",
      "inputunicasts": "74812217036",
      "inputerrors": "0",
      "inputcrcerrors": "0",
      "inputframeerrors": "0",
      "inputignorederrors": "0",
      "inputrunts": "0",
      "inputgiants": "16192705827",
      "inputnpreceivedpackets": "74819287581",
      "inputsenttotmpackets": "74819282240",
      "inputnpingressdroppedpackets": "5369",
      "outputpacketstotal": "95864830955",
      "outputbytestotal": "54017992924883",
      "outputunderruns": "0",
      "outputbroadcasts": "2406581209",
      "outputmulticasts": "82143416",
      "outputunicasts": "93376106330",
      "outputerrors": "0",
      "outputcollisions": "0",
      "outputnptransmittedpackets": "95865699894",
      "outputreceivedfromtmpackets": "95872239709"
    },
    {
      "interface": "GigabitEthernet1/2",
      "intstate": "disabled",
      "protostate": "down",
      "stprootguard": "disabled",
      "stpbpduguard": "disabled",
      "hardwaretype": "GigabitEthernet",
      "mac": "0024.38a5.1c01",
      "bia": "0024.38a5.1c01",
      "conffiberspeed": "auto",
      "conffiberduplex": "fdx",
      "actualspeed": "unknown",
      "actualduplex": "unknown",
      "l2portstate": "Disabled",
      "l2portmode": "untagged",
      "untaggedvlan": "1",
      "stpconfstate": "ON",
      "priority": "level0",
      "flowcontrolstate": "enabled",
      "priorityforcedstate": "disabled",
      "dropprecedencelevel": "0",
      "dropprecedenceforcestate": "disabled",
      "dhcpsnooptrust": "OFF",
      "mirrorstate": "disabled",
      "monitorstate": "disabled",
      "lacpbpduforward": "Disabled",
      "lldpbpduforward": "Disabled",
      "l2mtubytes": "9216",
      "encapsulation": "ethernet",
      "openflowopstate": "Disabled",
      "openflowindex": "2",
      "clusterl2protoforwarding": "enabled",
      "loadinterval": "300",
      "inputbitssec": "0",
      "inputpacketssec": "0",
      "inputpercentutilization": "0.00",
      "outputbitssec": "0",
      "outputpacketssec": "0",
      "outputpercentutilization": "0.00",
      "inputpacketstotal": "0",
      "inputbytestotal": "0",
      "inputnobuffers": "0",
      "inputbroadcasts": "0",
      "inputmulticasts": "0",
      "inputunicasts": "0",
      "inputerrors": "0",
      "inputcrcerrors": "0",
      "inputframeerrors": "0",
      "inputignorederrors": "0",
      "inputrunts": "0",
      "inputgiants": "0",
      "inputnpreceivedpackets": "0",
      "inputsenttotmpackets": "0",
      "inputnpingressdroppedpackets": "0",
      "outputpacketstotal": "0",
      "outputbytestotal": "0",
      "outputunderruns": "0",
      "outputbroadcasts": "0",
      "outputmulticasts": "0",
      "outputunicasts": "0",
      "outputerrors": "0",
      "outputcollisions": "0",
      "outputnptransmittedpackets": "0",
      "outputreceivedfromtmpackets": "0"
    },
    {
      "interface": "10GigabitEthernet3/4",
      "intstate": "up",
      "protostate": "up",
      "stprootguard": "disabled",
      "stpbpduguard": "disabled",
      "hardwaretype": "10GigabitEthernet",
      "mac": "0024.38a5.1c00",
      "bia": "0024.38a5.1c63",
      "conffiberspeed": "10Gbit",
      "conffiberduplex": "fdx",
      "actualspeed": "10Gbit",
      "actualduplex": "fdx",
      "l2portstate": "Forwarding",
      "l2portmode": "tagged",
      "numtaggedvlans": "77",
      "stpconfstate": "ON",
      "priority": "level0",
      "flowcontrolstate": "enabled",
      "priorityforcedstate": "disabled",
      "dropprecedencelevel": "0",
      "dropprecedenceforcestate": "disabled",
      "dhcpsnooptrust": "OFF",
      "mirrorstate": "disabled",
      "monitorstate": "disabled",
      "lacpbpduforward": "Disabled",
      "lldpbpduforward": "Disabled",
      "portname": "OL2.CLMAMO-ten3/0/0",
      "l2mtubytes": "9216",
      "encapsulation": "ethernet",
      "openflowopstate": "Disabled",
      "openflowindex": "100",
      "clusterl2protoforwarding": "enabled",
      "loadinterval": "30",
      "inputbitssec": "300338645",
      "inputpacketssec": "41100",
      "inputpercentutilization": "3.07",
      "outputbitssec": "190540328",
      "outputpacketssec": "39304",
      "outputpercentutilization": "1.97",
      "inputpacketstotal": "121863253313",
      "inputbytestotal": "99644389312061",
      "inputnobuffers": "0",
      "inputbroadcasts": "44852728",
      "inputmulticasts": "9170942",
      "inputunicasts": "121809229643",
      "inputerrors": "0",
      "inputcrcerrors": "0",
      "inputframeerrors": "0",
      "inputignorederrors": "0",
      "inputrunts": "0",
      "inputgiants": "26930828870",
      "inputnpreceivedpackets": "121864501462",
      "inputsenttotmpackets": "121862218321",
      "inputnpingressdroppedpackets": "5",
      "outputpacketstotal": "145158405355",
      "outputbytestotal": "102580338487220",
      "outputunderruns": "0",
      "outputbroadcasts": "9556629",
      "outputmulticasts": "65490504",
      "outputunicasts": "145083358222",
      "outputerrors": "0",
      "outputcollisions": "0",
      "outputnptransmittedpackets": "145159557118",
      "outputreceivedfromtmpackets": "145218386173"
    },
    {
      "interface": "10GigabitEthernet3/5",
      "intstate": "up",
      "protostate": "up",
      "stprootguard": "disabled",
      "stpbpduguard": "disabled",
      "hardwaretype": "10GigabitEthernet",
      "mac": "0024.38a5.1c00",
      "bia": "0024.38a5.1c64",
      "conffiberspeed": "10Gbit",
      "conffiberduplex": "fdx",
      "actualspeed": "10Gbit",
      "actualduplex": "fdx",
      "l2portstate": "Forwarding",
      "l2portmode": "tagged",
      "numtaggedvlans": "9",
      "stpconfstate": "ON",
      "priority": "level0",
      "flowcontrolstate": "enabled",
      "priorityforcedstate": "disabled",
      "dropprecedencelevel": "0",
      "dropprecedenceforcestate": "disabled",
      "dhcpsnooptrust": "OFF",
      "mirrorstate": "disabled",
      "monitorstate": "disabled",
      "lacpbpduforward": "Disabled",
      "lldpbpduforward": "Disabled",
      "activelagports": "3/5",
      "activelagrole": "primary",
      "conflagports": "3/5",
      "conflagrole": "primary",
      "portname": "CLMA-STLS 10G-Centurylink",
      "l2mtubytes": "9216",
      "encapsulation": "ethernet",
      "openflowopstate": "Disabled",
      "openflowindex": "101",
      "clusterl2protoforwarding": "enabled",
      "loadinterval": "30",
      "inputbitssec": "2602741516",
      "inputpacketssec": "269941",
      "inputpercentutilization": "26.46",
      "outputbitssec": "262142094",
      "outputpacketssec": "111277",
      "outputpercentutilization": "2.79",
      "inputpacketstotal": "924970842630",
      "inputbytestotal": "1088460975408035",
      "inputnobuffers": "0",
      "inputbroadcasts": "4575649",
      "inputmulticasts": "102909425",
      "inputunicasts": "924863357556",
      "inputerrors": "0",
      "inputcrcerrors": "0",
      "inputframeerrors": "0",
      "inputignorederrors": "0",
      "inputrunts": "0",
      "inputgiants": "321137547437",
      "inputnpreceivedpackets": "924979272212",
      "inputsenttotmpackets": "924677624613",
      "inputnpingressdroppedpackets": "213578234",
      "outputpacketstotal": "526574341236",
      "outputbytestotal": "159588031939808",
      "outputunderruns": "0",
      "outputbroadcasts": "121307096",
      "outputmulticasts": "317528800",
      "outputunicasts": "526135505340",
      "outputerrors": "0",
      "outputcollisions": "0",
      "outputnptransmittedpackets": "526580335261",
      "outputreceivedfromtmpackets": "526680374565"
    },
    {
      "interface": "10GigabitEthernet3/6",
      "intstate": "disabled",
      "protostate": "down",
      "stprootguard": "disabled",
      "stpbpduguard": "disabled",
      "hardwaretype": "10GigabitEthernet",
      "mac": "0024.38a5.1c65",
      "bia": "0024.38a5.1c65",
      "conffiberspeed": "10Gbit",
      "conffiberduplex": "fdx",
      "actualspeed": "unknown",
      "actualduplex": "unknown",
      "l2portstate": "Disabled",
      "l2portmode": "untagged",
      "untaggedvlan": "1",
      "stpconfstate": "ON",
      "priority": "level0",
      "flowcontrolstate": "enabled",
      "priorityforcedstate": "disabled",
      "dropprecedencelevel": "0",
      "dropprecedenceforcestate": "disabled",
      "dhcpsnooptrust": "OFF",
      "mirrorstate": "disabled",
      "monitorstate": "disabled",
      "lacpbpduforward": "Disabled",
      "lldpbpduforward": "Disabled",
      "l2mtubytes": "9216",
      "encapsulation": "ethernet",
      "openflowopstate": "Disabled",
      "openflowindex": "102",
      "clusterl2protoforwarding": "enabled",
      "loadinterval": "300",
      "inputbitssec": "0",
      "inputpacketssec": "0",
      "inputpercentutilization": "0.00",
      "outputbitssec": "0",
      "outputpacketssec": "0",
      "outputpercentutilization": "0.00",
      "inputpacketstotal": "0",
      "inputbytestotal": "0",
      "inputnobuffers": "0",
      "inputbroadcasts": "0",
      "inputmulticasts": "0",
      "inputunicasts": "0",
      "inputerrors": "0",
      "inputcrcerrors": "0",
      "inputframeerrors": "0",
      "inputignorederrors": "0",
      "inputrunts": "0",
      "inputgiants": "0",
      "inputnpreceivedpackets": "0",
      "inputsenttotmpackets": "0",
      "inputnpingressdroppedpackets": "0",
      "outputpacketstotal": "0",
      "outputbytestotal": "0",
      "outputunderruns": "0",
      "outputbroadcasts": "0",
      "outputmulticasts": "0",
      "outputunicasts": "0",
      "outputerrors": "0",
      "outputcollisions": "0",
      "outputnptransmittedpackets": "0",
      "outputreceivedfromtmpackets": "0"
    },
    {
      "interface": "Ve1395",
      "intstate": "up",
      "protostate": "up",
      "hardwaretype": "Virtual Ethernet",
      "mac": "0024.38a5.1c00",
      "bia": "0024.38a5.1c00",
      "untaggedvlan": "1395",
      "portname": "TA5000A.CLMAMOXI-PON-VOICE",
      "l3mtubytes": "1500",
      "ipaddress": "172.24.18.1/24",
      "ipencapsulation": "ethernet"
    },
    {
      "interface": "Ve1400",
      "intstate": "up",
      "protostate": "down",
      "hardwaretype": "Virtual Ethernet",
      "mac": "0024.38a5.1c00",
      "bia": "0024.38a5.1c00",
      "untaggedvlan": "1400",
      "l3mtubytes": "1500",
      "ipaddress": "0.0.0.0/0",
      "ipencapsulation": "ethernet"
    },
    {
      "interface": "Loopback1",
      "intstate": "up",
      "protostate": "up",
      "hardwaretype": "Loopback",
      "portname": "MPLS Loopback",
      "l3mtubytes": "1500",
      "ipaddress": "174.34.31.29/32",
      "ipencapsulation": "LOOPBACK"
    },
    {
      "interface": "Loopback6",
      "intstate": "up",
      "protostate": "up",
      "hardwaretype": "Loopback",
      "l3mtubytes": "1500",
      "ipencapsulation": "LOOPBACK"
    }
  ],
  "ttp_parsed": [
    {
      "openflowindex_dropprecedencelevel_hardwaretype_stprootguard": [
        {
          "openflowindex": "GigabitEthern",
          "dropprecedencelevel": "e",
          "hardwaretype": "t",
          "stprootguard": "disabled"
        },
        {
          "openflowindex": "10GigabitEthern",
          "dropprecedencelevel": "e",
          "hardwaretype": "t",
          "stprootguard": "disabled"
        }
      ],
      "interface_intstate_protostate": [
        {
          "interface": "GigabitEthernet1/1",
          "intstate": "up",
          "protostate": "up"
        },
        {
          "interface": "GigabitEthernet1/2",
          "intstate": "disabled",
          "protostate": "down"
        },
        {
          "interface": "10GigabitEthernet3/4",
          "intstate": "up",
          "protostate": "up"
        },
        {
          "interface": "10GigabitEthernet3/5",
          "intstate": "up",
          "protostate": "up"
        },
        {
          "interface": "10GigabitEthernet3/6",
          "intstate": "disabled",
          "protostate": "down"
        },
        {
          "interface": "Ve1395",
          "intstate": "up",
          "protostate": "up"
        },
        {
          "interface": "Ve1400",
          "intstate": "up",
          "protostate": "down"
        },
        {
          "interface": "Loopback1",
          "intstate": "up",
          "protostate": "up"
        },
        {
          "interface": "Loopback6",
          "intstate": "up",
          "protostate": "up"
        }
      ]
    }
  ],
  "cli_content": "GigabitEthernet1/1 is up, line protocol is up \n  STP Root Guard is disabled, STP BPDU Guard is disabled\n  Hardware is GigabitEthernet, address is 0024.38a5.1c00 (bia 0024.38a5.1c00)\n  Configured speed auto, actual 1Gbit, configured duplex fdx, actual fdx\n  Member of Control VLAN 4095, 36 L2 VLAN(S) (tagged), port is in tagged mode, port state is Forwarding\n  STP configured to ON, Priority is level0, flow control enabled\n  Priority force disabled, Drop precedence level 0, Drop precedence force disabled\n  dhcp-snooping-trust configured to OFF\n  mirror disabled, monitor disabled\n  LACP BPDU Forwarding:Disabled \n  LLDP BPDU Forwarding:Disabled \n  Not member of any active trunks\n  Not member of any configured trunks\n  Port name is ATM1-G0-1\n  Port is not enabled to receive all vlan packets for pbr\n  MTU 9216 bytes, encapsulation ethernet\n  Openflow: Disabled, Openflow Index 1\n  Cluster L2 protocol forwarding enabled\n  300 second input rate: 235649647 bits/sec, 27522 packets/sec, 24.00% utilization\n  300 second output rate: 140641094 bits/sec, 31382 packets/sec, 14.56% utilization\n  74818592872 packets input, 72400348503374 bytes, 0 no buffer\n  Received 3639493 broadcasts, 2736343 multicasts, 74812217036 unicasts\n  0 input errors, 0 CRC, 0 frame, 0 ignored\n  0 runts, 16192705827 giants                                     \n  NP received 74819287581 packets, Sent to TM 74819282240 packets\n  NP Ingress dropped 5369 packets\n  95864830955 packets output, 54017992924883 bytes, 0 underruns\n  Transmitted 2406581209 broadcasts, 82143416 multicasts, 93376106330 unicasts\n  0 output errors, 0 collisions\n  NP transmitted 95865699894 packets, Received from TM 95872239709 packets\nGigabitEthernet1/2 is disabled, line protocol is down \n  STP Root Guard is disabled, STP BPDU Guard is disabled\n  Hardware is GigabitEthernet, address is 0024.38a5.1c01 (bia 0024.38a5.1c01)\n  Configured speed auto, actual unknown, configured duplex fdx, actual unknown\n  Member of Control VLAN 4095, VLAN 1 (untagged), port is in untagged mode, port state is Disabled\n  STP configured to ON, Priority is level0, flow control enabled\n  Priority force disabled, Drop precedence level 0, Drop precedence force disabled\n  dhcp-snooping-trust configured to OFF\n  mirror disabled, monitor disabled\n  LACP BPDU Forwarding:Disabled \n  LLDP BPDU Forwarding:Disabled \n  Not member of any active trunks\n  Not member of any configured trunks\n  No port name\n  Port is not enabled to receive all vlan packets for pbr\n  MTU 9216 bytes, encapsulation ethernet\n  Openflow: Disabled, Openflow Index 2                            \n  Cluster L2 protocol forwarding enabled\n  300 second input rate: 0 bits/sec, 0 packets/sec, 0.00% utilization\n  300 second output rate: 0 bits/sec, 0 packets/sec, 0.00% utilization\n  0 packets input, 0 bytes, 0 no buffer\n  Received 0 broadcasts, 0 multicasts, 0 unicasts\n  0 input errors, 0 CRC, 0 frame, 0 ignored\n  0 runts, 0 giants\n  NP received 0 packets, Sent to TM 0 packets\n  NP Ingress dropped 0 packets\n  0 packets output, 0 bytes, 0 underruns\n  Transmitted 0 broadcasts, 0 multicasts, 0 unicasts\n  0 output errors, 0 collisions\n  NP transmitted 0 packets, Received from TM 0 packets\n10GigabitEthernet3/4 is up, line protocol is up \n  STP Root Guard is disabled, STP BPDU Guard is disabled\n  Hardware is 10GigabitEthernet, address is 0024.38a5.1c00 (bia 0024.38a5.1c63)\n  Configured speed 10Gbit, actual 10Gbit, configured duplex fdx, actual fdx\n  Member of Control VLAN 4095, 77 L2 VLAN(S) (tagged), port is in tagged mode, port state is Forwarding\n  STP configured to ON, Priority is level0, flow control enabled\n  Priority force disabled, Drop precedence level 0, Drop precedence force disabled\n  dhcp-snooping-trust configured to OFF\n  mirror disabled, monitor disabled\n  LACP BPDU Forwarding:Disabled \n  LLDP BPDU Forwarding:Disabled \n  Not member of any active trunks\n  Not member of any configured trunks\n  Port name is OL2.CLMAMO-ten3/0/0\n  Port is not enabled to receive all vlan packets for pbr\n  MTU 9216 bytes, encapsulation ethernet\n  Openflow: Disabled, Openflow Index 100\n  Cluster L2 protocol forwarding enabled\n  30 second input rate: 300338645 bits/sec, 41100 packets/sec, 3.07% utilization\n  30 second output rate: 190540328 bits/sec, 39304 packets/sec, 1.97% utilization\n  121863253313 packets input, 99644389312061 bytes, 0 no buffer\n  Received 44852728 broadcasts, 9170942 multicasts, 121809229643 unicasts\n  0 input errors, 0 CRC, 0 frame, 0 ignored\n  0 runts, 26930828870 giants\n  NP received 121864501462 packets, Sent to TM 121862218321 packets\n  NP Ingress dropped 5 packets\n  145158405355 packets output, 102580338487220 bytes, 0 underruns\n  Transmitted 9556629 broadcasts, 65490504 multicasts, 145083358222 unicasts\n  0 output errors, 0 collisions\n  NP transmitted 145159557118 packets, Received from TM 145218386173 packets\n10GigabitEthernet3/5 is up, line protocol is up \n  STP Root Guard is disabled, STP BPDU Guard is disabled\n  Hardware is 10GigabitEthernet, address is 0024.38a5.1c00 (bia 0024.38a5.1c64)\n  Configured speed 10Gbit, actual 10Gbit, configured duplex fdx, actual fdx\n  Member of Control VLAN 4095, 9 L2 VLAN(S) (tagged), port is in tagged mode, port state is Forwarding\n  STP configured to ON, Priority is level0, flow control enabled\n  Priority force disabled, Drop precedence level 0, Drop precedence force disabled\n  dhcp-snooping-trust configured to OFF\n  mirror disabled, monitor disabled\n  LACP BPDU Forwarding:Disabled \n  LLDP BPDU Forwarding:Disabled \n  Member of active trunk ports 3/5, primary port\n  Member of configured trunk ports 3/5, primary port\n  Port name is CLMA-STLS 10G-Centurylink\n  Port is not enabled to receive all vlan packets for pbr         \n  MTU 9216 bytes, encapsulation ethernet\n  Openflow: Disabled, Openflow Index 101\n  Cluster L2 protocol forwarding enabled\n  30 second input rate: 2602741516 bits/sec, 269941 packets/sec, 26.46% utilization\n  30 second output rate: 262142094 bits/sec, 111277 packets/sec, 2.79% utilization\n  924970842630 packets input, 1088460975408035 bytes, 0 no buffer\n  Received 4575649 broadcasts, 102909425 multicasts, 924863357556 unicasts\n  0 input errors, 0 CRC, 0 frame, 0 ignored\n  0 runts, 321137547437 giants\n  NP received 924979272212 packets, Sent to TM 924677624613 packets\n  NP Ingress dropped 213578234 packets\n  526574341236 packets output, 159588031939808 bytes, 0 underruns\n  Transmitted 121307096 broadcasts, 317528800 multicasts, 526135505340 unicasts\n  0 output errors, 0 collisions\n  NP transmitted 526580335261 packets, Received from TM 526680374565 packets\n10GigabitEthernet3/6 is disabled, line protocol is down \n  STP Root Guard is disabled, STP BPDU Guard is disabled\n  Hardware is 10GigabitEthernet, address is 0024.38a5.1c65 (bia 0024.38a5.1c65)\n  Configured speed 10Gbit, actual unknown, configured duplex fdx, actual unknown\n  Member of Control VLAN 4095, VLAN 1 (untagged), port is in untagged mode, port state is Disabled\n  STP configured to ON, Priority is level0, flow control enabled\n  Priority force disabled, Drop precedence level 0, Drop precedence force disabled\n  dhcp-snooping-trust configured to OFF                           \n  mirror disabled, monitor disabled\n  LACP BPDU Forwarding:Disabled \n  LLDP BPDU Forwarding:Disabled \n  Not member of any active trunks\n  Not member of any configured trunks\n  No port name\n  Port is not enabled to receive all vlan packets for pbr\n  MTU 9216 bytes, encapsulation ethernet\n  Openflow: Disabled, Openflow Index 102\n  Cluster L2 protocol forwarding enabled\n  300 second input rate: 0 bits/sec, 0 packets/sec, 0.00% utilization\n  300 second output rate: 0 bits/sec, 0 packets/sec, 0.00% utilization\n  0 packets input, 0 bytes, 0 no buffer\n  Received 0 broadcasts, 0 multicasts, 0 unicasts\n  0 input errors, 0 CRC, 0 frame, 0 ignored\n  0 runts, 0 giants\n  NP received 0 packets, Sent to TM 0 packets\n  NP Ingress dropped 0 packets\n  0 packets output, 0 bytes, 0 underruns\n  Transmitted 0 broadcasts, 0 multicasts, 0 unicasts\n  0 output errors, 0 collisions\n  NP transmitted 0 packets, Received from TM 0 packets\nVe1395 is up, line protocol is up \n  Type is Vlan (Vlan Id: 1395)\n  Hardware is Virtual Ethernet, address is 0024.38a5.1c00 (bia 0024.38a5.1c00)\n  Port name is TA5000A.CLMAMOXI-PON-VOICE \n  Vlan id: 1395\n  Internet address is 172.24.18.1/24, IP MTU 1500 bytes, encapsulation ethernet\nVe1400 is up, line protocol is down \n  Type is Vlan (Vlan Id: 1400)\n  Hardware is Virtual Ethernet, address is 0024.38a5.1c00 (bia 0024.38a5.1c00)\n  No port name\n  Vlan id: 1400\n  Internet address is 0.0.0.0/0, IP MTU 1500 bytes, encapsulation ethernet\nLoopback1 is up, line protocol is up \n  Hardware is Loopback\n  Port name is MPLS Loopback\n  Internet address is 174.34.31.29/32, IP MTU 1500 bytes, encapsulation LOOPBACK\nLoopback6 is up, line protocol is up \n  Hardware is Loopback\n  No port name\n  IP MTU 1500 bytes, encapsulation LOOPBACK",
  "textfsm_template": "Value interface ([a-zA-Z0-9\\/]+)\nValue Required intstate (up|down|disabled)\nValue protostate (up|down)\nValue stprootguard (enabled|disabled)\nValue stpbpduguard (enabled|disabled)\nValue hardwaretype ([a-zA-Z0-9\\s]+)\nValue mac ([0-9a-f\\.]+)\nValue bia ([0-9a-f\\.]+)\nValue conffiberspeed ([0-9a-zA-Z]+)\nValue confcopperspeed ([0-9a-zA-Z]+)\nValue conffiberduplex ([0-9a-zA-Z]+)\nValue confcopperduplex ([0-9a-zA-Z]+)\nValue actualspeed ([0-9a-zA-Z]+)\nValue actualduplex ([0-9a-zA-Z]+)\nValue l2portstate (Forwarding|Disabled)\nValue l2portmode (tagged|untagged|dual)\nValue untaggedvlan (\\d+)\nValue numtaggedvlans (\\d+)\nValue stpconfstate (ON|OFF)\nValue priority ([a-zA-Z0-9]+)\nValue flowcontrolstate (enabled|disabled)\nValue priorityforcedstate (enabled|disabled)\nValue dropprecedencelevel (\\d+)\nValue dropprecedenceforcestate (enabled|disabled)\nValue dhcpsnooptrust (ON|OFF)\nValue mirrorstate (enabled|disabled)\nValue monitorstate (enabled|disabled)\nValue lacpbpduforward (Enabled|Disabled)\nValue lldpbpduforward (Enabled|Disabled)\nValue activelagports ([0-9\\/\\-\\,]+)\nValue activelagrole (primary|secondary)\nValue activelagprimaryport ([0-9\\/]+)\nValue conflagports ([0-9\\/\\-\\,]+)\nValue conflagrole (primary|secondary)\nValue conflagprimaryport ([0-9\\/]+)\nValue portname ([a-zA-Z0-9\\.\\ \\\"\\(\\)\\#\\/\\-]+)\nValue l2mtubytes (\\d+)\nValue encapsulation ([a-zA-Z0-9]+)\nValue openflowopstate (Disabled|Enabled)\nValue openflowindex (\\d+)\nValue clusterl2protoforwarding (disabled|enabled)\nValue loadinterval (\\d+)\nValue inputbitssec (\\d+)\nValue inputpacketssec (\\d+)\nValue inputpercentutilization ([\\d\\.]+)\nValue outputbitssec (\\d+)\nValue outputpacketssec (\\d+)\nValue outputpercentutilization ([\\d\\.]+)\nValue inputpacketstotal (\\d+)\nValue inputbytestotal (\\d+)\nValue inputnobuffers (\\d+)\nValue inputbroadcasts (\\d+)\nValue inputmulticasts (\\d+)\nValue inputunicasts (\\d+)\nValue inputerrors (\\d+)\nValue inputcrcerrors (\\d+)\nValue inputframeerrors (\\d+)\nValue inputignorederrors (\\d+)\nValue inputrunts (\\d+)\nValue inputgiants (\\d+)\nValue inputnpreceivedpackets (\\d+)\nValue inputsenttotmpackets (\\d+)\nValue inputnpingressdroppedpackets (\\d+)\nValue outputpacketstotal (\\d+)\nValue outputbytestotal (\\d+)\nValue outputunderruns (\\d+)\nValue outputbroadcasts (\\d+)\nValue outputmulticasts (\\d+)\nValue outputunicasts (\\d+)\nValue outputerrors (\\d+)\nValue outputcollisions (\\d+)\nValue outputnptransmittedpackets (\\d+)\nValue outputreceivedfromtmpackets (\\d+)\nValue l3mtubytes (\\d+)\nValue ipaddress ([0-9\\.\\/]+)\nValue ipencapsulation ([a-zA-Z]+)\n\nStart\n  ^\\w -> Continue.Record\n  ^${interface} is ${intstate}, line protocol is ${protostate}\n  ^\\s+Hardware is ${hardwaretype} -> Continue\n  ^\\s+Hardware is ${hardwaretype}, address is ${mac} \\(bia ${bia}\\) -> Continue\n  ^\\s+STP Root Guard is ${stprootguard}, STP BPDU Guard is ${stpbpduguard} -> Continue\n  ^\\s+Configured speed ${conffiberspeed}, actual ${actualspeed}, configured duplex ${conffiberduplex}, actual ${actualduplex} -> Continue\n  ^\\s+Configured fiber speed ${conffiberspeed}, configured copper speed ${confcopperspeed}, actual ${actualspeed}, configured fiber duplex ${conffiberduplex}, configured copper duplex ${confcopperduplex}, actual ${actualduplex} -> Continue\n  ^\\s+Member of VLAN ${untaggedvlan} \\(untagged\\), port is in ${l2portmode} mode, port state is ${l2portstate} -> Continue\n  ^\\s+Member of Control VLAN 4095, ${numtaggedvlans} L2 VLAN\\(S\\) \\(tagged\\), port is in ${l2portmode} mode, port state is ${l2portstate} -> Continue\n  ^\\s+Member of Control VLAN 4095, VLAN ${untaggedvlan} \\(untagged\\), port is in ${l2portmode} mode, port state is ${l2portstate} -> Continue\n  ^\\s+Member of Control VLAN 4095, VLAN ${untaggedvlan} \\(untagged\\), ${numtaggedvlans} L2 VLANS \\(tagged\\), -> Continue\n  ^\\s+port is in ${l2portmode} mode, port state is ${l2portstate} -> Continue\n  ^\\s+Type is Vlan \\(Vlan Id: ${untaggedvlan}\\) -> Continue\n  ^\\s+STP configured to ${stpconfstate}, Priority is ${priority}, flow control ${flowcontrolstate} -> Continue\n  ^\\s+Priority force ${priorityforcedstate}, Drop precedence level ${dropprecedencelevel}, Drop precedence force ${dropprecedenceforcestate} -> Continue\n  ^\\s+dhcp-snooping-trust configured to ${dhcpsnooptrust} -> Continue\n  ^\\s+mirror ${mirrorstate}, monitor ${monitorstate} -> Continue\n  ^\\s+LACP BPDU Forwarding:${lacpbpduforward} -> Continue\n  ^\\s+LLDP BPDU Forwarding:${lldpbpduforward} -> Continue\n  ^\\s+Member of active trunk ports ${activelagports}, ${activelagrole} port, primary port is ${activelagprimaryport} -> Continue\n  ^\\s+Member of configured trunk ports ${conflagports}, ${conflagrole} port, primary port is ${conflagprimaryport} -> Continue\n  ^\\s+Member of active trunk ports ${activelagports}, ${activelagrole} port -> Continue\n  ^\\s+Member of configured trunk ports ${conflagports}, ${conflagrole} port -> Continue\n  ^\\s+Port name is ${portname} -> Continue\n  ^\\s+MTU ${l2mtubytes} bytes, encapsulation ${encapsulation} -> Continue\n  ^\\s+Openflow: ${openflowopstate}, Openflow Index ${openflowindex} -> Continue\n  ^\\s+Cluster L2 protocol forwarding ${clusterl2protoforwarding} -> Continue\n  ^\\s+${loadinterval} second input rate: ${inputbitssec} bits/sec, ${inputpacketssec} packets/sec, ${inputpercentutilization}% utilization -> Continue\n  ^\\s+(\\d+) second output rate: ${outputbitssec} bits/sec, ${outputpacketssec} packets/sec, ${outputpercentutilization}% utilization -> Continue\n  ^\\s+${inputpacketstotal} packets input, ${inputbytestotal} bytes, ${inputnobuffers} no buffer -> Continue\n  ^\\s+Received ${inputbroadcasts} broadcasts, ${inputmulticasts} multicasts, ${inputunicasts} unicasts -> Continue\n  ^\\s+${inputerrors} input errors, ${inputcrcerrors} CRC, ${inputframeerrors} frame, ${inputignorederrors} ignored -> Continue\n  ^\\s+${inputrunts} runts, ${inputgiants} giants -> Continue\n  ^\\s+NP received ${inputnpreceivedpackets} packets, Sent to TM ${inputsenttotmpackets} packets -> Continue\n  ^\\s+NP Ingress dropped ${inputnpingressdroppedpackets} packets -> Continue\n  ^\\s+${outputpacketstotal} packets output, ${outputbytestotal} bytes, ${outputunderruns} underruns -> Continue\n  ^\\s+Transmitted ${outputbroadcasts} broadcasts, ${outputmulticasts} multicasts, ${outputunicasts} unicasts -> Continue\n  ^\\s+${outputerrors} output errors, ${outputcollisions} collisions -> Continue\n  ^\\s+NP transmitted ${outputnptransmittedpackets} packets, Received from TM ${outputreceivedfromtmpackets} packets -> Continue\n  ^\\s+IP MTU ${l3mtubytes} bytes, encapsulation ${ipencapsulation} -> Continue\n  ^\\s+Internet address is ${ipaddress}, IP MTU ${l3mtubytes} bytes, encapsulation ${ipencapsulation} -> Continue\n\n"
}