{
  "command": "brocade_fastiron_show_lldp_neighbors_detail",
  "source": "ntc",
  "status": "success",
  "match_ratio": 1.0,
  "textfsm_rows": 3,
  "ttp_rows": 3,
  "ttp_template": "<group name=\"neighbor_port_id_holdtime\">\n  Neighbor: {{NEIGHBOR_PORT_ID}}, TTL {{HOLDTIME | ORPHRASE}} seconds\n</group>",
  "error": null,
  "textfsm_parsed": [
    {
      "LOCAL_INTERFACE": "1",
      "NEIGHBOR_PORT_ID": "0024.38a5.5f31",
      "HOLDTIME": "101",
      "NEIGHBOR_NAME": "mlx1.clmamofw",
      "NEIGHBOR_INTERFACE": "GigabitEthernet2/2",
      "VLAN_ID": "none",
      "MGMT_ADDRESS": "216.106.44.48",
      "NEIGHBOR_LACP_INDEX": "66",
      "NEIGHBOR_MAX_FRAME_SIZE": "9216",
      "NEIGHBOR_MAU": "1000BaseT-FD",
      "CAPABILITIES": "bridge, router"
    },
    {
      "LOCAL_INTERFACE": "2",
      "NEIGHBOR_PORT_ID": "001b.ed6b.3102",
      "HOLDTIME": "98",
      "NEIGHBOR_NAME": "switch1b.clmamofw",
      "NEIGHBOR_INTERFACE": "GigabitEthernet3",
      "VLAN_ID": "1",
      "MGMT_ADDRESS": "10.255.1.47",
      "NEIGHBOR_LACP_INDEX": "0",
      "NEIGHBOR_MAX_FRAME_SIZE": "10240",
      "NEIGHBOR_MAU": "1000BaseLX-FD",
      "CAPABILITIES": "bridge"
    },
    {
      "LOCAL_INTERFACE": "11",
      "NEIGHBOR_PORT_ID": "609c.9f46.6e34",
      "HOLDTIME": "96",
      "NEIGHBOR_NAME": "switch2.clmamoxo",
      "NEIGHBOR_INTERFACE": "GigabitEthernet2/1/1",
      "VLAN_ID": "none",
      "MGMT_ADDRESS": "10.255.13.30",
      "NEIGHBOR_LACP_INDEX": "257",
      "NEIGHBOR_MAX_FRAME_SIZE": "10200",
      "NEIGHBOR_MAU": "1000BaseT-FD",
      "CAPABILITIES": "bridge"
    }
  ],
  "ttp_parsed": [
    {
      "neighbor_port_id_holdtime": [
        {
          "NEIGHBOR_PORT_ID": "0024.38a5.5f31",
          "HOLDTIME": "101"
        },
        {
          "NEIGHBOR_PORT_ID": "001b.ed6b.3102",
          "HOLDTIME": "98"
        },
        {
          "NEIGHBOR_PORT_ID": "609c.9f46.6e34",
          "HOLDTIME": "96"
        }
      ]
    }
  ],
  "cli_content": "Local port: 1\n  Neighbor: 0024.38a5.5f31, TTL 101 seconds\n    + Chassis ID (MAC address): 0024.38a5.5f00\n    + Port ID (MAC address): 0024.38a5.5f31\n    + Time to live: 120 seconds\n    + System name         : \"mlx1.clmamofw\"\n    + Port description    : \"GigabitEthernet2/2\"\n    + System capabilities : bridge, router\n      Enabled capabilities: bridge, router\n    + 802.3 MAC/PHY          : auto-negotiation enabled\n      Advertised capabilities: 1000BaseX-FD\n      Operational MAU type   : 1000BaseT-FD\n    + Link aggregation: aggregated (aggregated port ifIndex: 66)\n    + Maximum frame size: 9216 octets\n    + Port VLAN ID: none\n    + Management address (IPv4): 216.106.44.48\n\nLocal port: 2\n  Neighbor: 001b.ed6b.3102, TTL 98 seconds\n    + Chassis ID (MAC address): 001b.ed6b.3100\n    + Port ID (MAC address): 001b.ed6b.3102\n    + Time to live: 120 seconds\n    + System name         : \"switch1b.clmamofw\"\n    + Port description    : \"GigabitEthernet3\"                    \n    + System capabilities : bridge\n      Enabled capabilities: bridge\n    + 802.3 MAC/PHY          : auto-negotiation enabled\n      Advertised capabilities: 1000BaseX-FD\n      Operational MAU type   : 1000BaseLX-FD\n    + Link aggregation: aggregated (aggregated port ifIndex: 0)\n    + Maximum frame size: 10240 octets\n    + Port VLAN ID: 1\n    + Management address (IPv4): 10.255.1.47\n\nLocal port: 11\n  Neighbor: 609c.9f46.6e34, TTL 96 seconds\n    + Chassis ID (MAC address): 609c.9f44.9450\n    + Port ID (MAC address): 609c.9f46.6e34\n    + Time to live: 120 seconds\n    + System name         : \"switch2.clmamoxo\"\n    + Port description    : \"GigabitEthernet2/1/1\"\n    + System capabilities : bridge\n      Enabled capabilities: bridge\n    + 802.3 MAC/PHY          : auto-negotiation enabled\n      Advertised capabilities: fdxSPause, fdxBPause\n      Operational MAU type   : 1000BaseT-FD\n    + Link aggregation: aggregated (aggregated port ifIndex: 257) \n    + Maximum frame size: 10200 octets\n    + Port VLAN ID: none\n    + Management address (IPv4): 10.255.13.30\n\n",
  "textfsm_template": "Value Filldown LOCAL_INTERFACE ([0-9\\/]+)\nValue Required NEIGHBOR_PORT_ID (\\w+\\.\\w+\\.\\w+)\nValue HOLDTIME (\\d+)\nValue NEIGHBOR_NAME (.+)\nValue NEIGHBOR_INTERFACE ([a-zA-Z0-9\\/\\s]+)\nValue VLAN_ID (\\d+|none)\nValue MGMT_ADDRESS (\\d+\\.\\d+\\.\\d+\\.\\d+)\nValue NEIGHBOR_LACP_INDEX (\\d+)\nValue NEIGHBOR_MAX_FRAME_SIZE (\\d+)\nValue NEIGHBOR_MAU ([a-zA-Z0-9\\-]+)\nValue CAPABILITIES (.+)\n\nStart\n  ^\\w -> Continue.Record\n  ^Local\\s+port:\\s+${LOCAL_INTERFACE}\n  ^\\s+\\+\\s+System\\s+name\\s+:\\s+\"${NEIGHBOR_NAME}\"\n  ^\\s+\\+\\s+Port\\s+description\\s+:\\s+\"${NEIGHBOR_INTERFACE}\"\n  ^\\s+Enabled\\s+capabilities\\s*:\\s+${CAPABILITIES}\n  ^\\s+\\+\\s+Port\\s+VLAN\\s+ID:\\s+${VLAN_ID}\n  ^\\s+\\+\\s+Management\\s+address\\s+\\(IPv4\\):\\s+${MGMT_ADDRESS}\n  ^\\s+\\+\\s+Link\\s+aggregation:\\s+aggregated\\s+\\(aggregated\\s+port\\s+ifIndex:\\s+${NEIGHBOR_LACP_INDEX}\\)\n  ^\\s+\\+\\s+Maximum\\s+frame\\s+size:\\s+${NEIGHBOR_MAX_FRAME_SIZE}\n  ^\\s+Operational\\s+MAU\\s+type\\s+:\\s+${NEIGHBOR_MAU}\n  ^\\s+Neighbor:\\s+${NEIGHBOR_PORT_ID},\\s+TTL\\s+${HOLDTIME}\n"
}