{
  "command": "cisco_nxos_show_interface_transceiver",
  "source": "ntc",
  "status": "success",
  "match_ratio": 1.0,
  "textfsm_rows": 52,
  "ttp_rows": 52,
  "ttp_template": "<group name=\"type\">\n    type is {{TYPE | ORPHRASE}}\n</group>",
  "error": null,
  "textfsm_parsed": [
    {
      "INTERFACE": "Ethernet1/1",
      "STATUS": "present",
      "MANUFACTURER": "OEM",
      "TYPE": "SFP-H25GB-Unknown",
      "SERIAL": "CI1906290051",
      "PART_NUMBER": "BZ-SFP28-25G-DA1"
    },
    {
      "INTERFACE": "Ethernet1/2",
      "STATUS": "present",
      "MANUFACTURER": "OEM",
      "TYPE": "SFP-H25GB-Unknown",
      "SERIAL": "CI1906290092",
      "PART_NUMBER": "BZ-SFP28-25G-DA2"
    },
    {
      "INTERFACE": "Ethernet1/3",
      "STATUS": "present",
      "MANUFACTURER": "OEM",
      "TYPE": "SFP-H25GB-Unknown",
      "SERIAL": "CI1906290092",
      "PART_NUMBER": "BZ-SFP28-25G-DA2"
    },
    {
      "INTERFACE": "Ethernet1/4",
      "STATUS": "present",
      "MANUFACTURER": "OEM",
      "TYPE": "SFP-H25GB-Unknown",
      "SERIAL": "CI1906290092",
      "PART_NUMBER": "BZ-SFP28-25G-DA2"
    },
    {
      "INTERFACE": "Ethernet1/5",
      "STATUS": "present",
      "MANUFACTURER": "OEM",
      "TYPE": "SFP-H25GB-Unknown",
      "SERIAL": "CI1906290092",
      "PART_NUMBER": "BZ-SFP28-25G-DA2"
    },
    {
      "INTERFACE": "Ethernet1/6",
      "STATUS": "present",
      "MANUFACTURER": "OEM",
      "TYPE": "SFP-H10GB-CU1M",
      "SERIAL": "CSS11F80668",
      "PART_NUMBER": "SFP-H10GB-CU1M"
    },
    {
      "INTERFACE": "Ethernet1/7",
      "STATUS": "present",
      "MANUFACTURER": "OEM",
      "TYPE": "SFP-H25GB-Unknown",
      "SERIAL": "CI1906290092",
      "PART_NUMBER": "BZ-SFP28-25G-DA2"
    },
    {
      "INTERFACE": "Ethernet1/8",
      "STATUS": "present",
      "MANUFACTURER": "OEM",
      "TYPE": "SFP-H25GB-Unknown",
      "SERIAL": "CI1906290092",
      "PART_NUMBER": "BZ-SFP28-25G-DA2"
    },
    {
      "INTERFACE": "Ethernet1/9",
      "STATUS": "present",
      "MANUFACTURER": "UPNET",
      "TYPE": "SFP-H10GB-CU2M",
      "SERIAL": "FO1810250113",
      "PART_NUMBER": "SFP+-10G-DA-2"
    },
    {
      "INTERFACE": "Ethernet1/10",
      "STATUS": "present",
      "MANUFACTURER": "UPNET",
      "TYPE": "SFP-H10GB-CU2M",
      "SERIAL": "FO1810250145",
      "PART_NUMBER": "SFP+-10G-DA-2"
    },
    {
      "INTERFACE": "Ethernet1/11",
      "STATUS": "present",
      "MANUFACTURER": "UPNET",
      "TYPE": "SFP-H10GB-CU2M",
      "SERIAL": "FO1810250115",
      "PART_NUMBER": "SFP+-10G-DA-2"
    },
    {
      "INTERFACE": "Ethernet1/12",
      "STATUS": "present",
      "MANUFACTURER": "UPNET",
      "TYPE": "SFP-H10GB-CU2M",
      "SERIAL": "FO1810250131",
      "PART_NUMBER": "SFP+-10G-DA-2"
    },
    {
      "INTERFACE": "Ethernet1/13",
      "STATUS": "present",
      "MANUFACTURER": "UPNET",
      "TYPE": "SFP-H10GB-CU2M",
      "SERIAL": "FO1810250138",
      "PART_NUMBER": "SFP+-10G-DA-2"
    },
    {
      "INTERFACE": "Ethernet1/14",
      "STATUS": "present",
      "MANUFACTURER": "UPNET",
      "TYPE": "SFP-H10GB-CU2M",
      "SERIAL": "FO1810250171",
      "PART_NUMBER": "SFP+-10G-DA-2"
    },
    {
      "INTERFACE": "Ethernet1/15",
      "STATUS": "present",
      "MANUFACTURER": "UPNET",
      "TYPE": "SFP-H10GB-CU1M",
      "SERIAL": "FO1810250047",
      "PART_NUMBER": "SFP+-10G-DA-1"
    },
    {
      "INTERFACE": "Ethernet1/16",
      "STATUS": "present",
      "MANUFACTURER": "OEM",
      "TYPE": "SFP-H25GB-Unknown",
      "SERIAL": "CI1906290092",
      "PART_NUMBER": "BZ-SFP28-25G-DA2"
    },
    {
      "INTERFACE": "Ethernet1/17",
      "STATUS": "present",
      "MANUFACTURER": "OEM",
      "TYPE": "SFP-H25GB-Unknown",
      "SERIAL": "CI1906290049",
      "PART_NUMBER": "BZ-SFP28-25G-DA1"
    },
    {
      "INTERFACE": "Ethernet1/18",
      "STATUS": "present",
      "MANUFACTURER": "OEM",
      "TYPE": "SFP-H25GB-Unknown",
      "SERIAL": "CI1906290023",
      "PART_NUMBER": "BZ-SFP28-25G-DA1"
    },
    {
      "INTERFACE": "Ethernet1/19",
      "STATUS": "present",
      "MANUFACTURER": "OEM",
      "TYPE": "SFP-H25GB-Unknown",
      "SERIAL": "CI1906290063",
      "PART_NUMBER": "BZ-SFP28-25G-DA1"
    },
    {
      "INTERFACE": "Ethernet1/20",
      "STATUS": "present",
      "MANUFACTURER": "OEM",
      "TYPE": "SFP-H25GB-Unknown",
      "SERIAL": "CI1906290033",
      "PART_NUMBER": "BZ-SFP28-25G-DA1"
    },
    {
      "INTERFACE": "Ethernet1/21",
      "STATUS": "present",
      "MANUFACTURER": "OEM",
      "TYPE": "SFP-H25GB-Unknown",
      "SERIAL": "CI1906290092",
      "PART_NUMBER": "BZ-SFP28-25G-DA2"
    },
    {
      "INTERFACE": "Ethernet1/22",
      "STATUS": "present",
      "MANUFACTURER": "OEM",
      "TYPE": "SFP-H25GB-Unknown",
      "SERIAL": "CI1906290092",
      "PART_NUMBER": "BZ-SFP28-25G-DA2"
    },
    {
      "INTERFACE": "Ethernet1/23",
      "STATUS": "present",
      "MANUFACTURER": "CISCO-UPNET",
      "TYPE": "SFP-H25GB-CU2M",
      "SERIAL": "7522046139(A)",
      "PART_NUMBER": "SFP28-25G-DA-2m"
    },
    {
      "INTERFACE": "Ethernet1/24",
      "STATUS": "present",
      "MANUFACTURER": "CISCO-UPNET",
      "TYPE": "SFP-H25GB-CU2M",
      "SERIAL": "7522046129(A)",
      "PART_NUMBER": "SFP28-25G-DA-2m"
    },
    {
      "INTERFACE": "Ethernet1/26",
      "STATUS": "present",
      "MANUFACTURER": "UPNET",
      "TYPE": "SFP-H10GB-CU3M",
      "SERIAL": "FO1810250348",
      "PART_NUMBER": "SFP+-10G-DA-3"
    },
    {
      "INTERFACE": "Ethernet1/27",
      "STATUS": "present",
      "MANUFACTURER": "UPNET",
      "TYPE": "SFP-H10GB-CU3M",
      "SERIAL": "FO1810250259",
      "PART_NUMBER": "SFP+-10G-DA-3"
    },
    {
      "INTERFACE": "Ethernet1/33",
      "STATUS": "present",
      "MANUFACTURER": "OEM",
      "TYPE": "SFP-H25GB-Unknown",
      "SERIAL": "CI1906290092",
      "PART_NUMBER": "BZ-SFP28-25G-DA2"
    },
    {
      "INTERFACE": "Ethernet1/34",
      "STATUS": "present",
      "MANUFACTURER": "OEM",
      "TYPE": "SFP-H25GB-Unknown",
      "SERIAL": "CI1906290092",
      "PART_NUMBER": "BZ-SFP28-25G-DA2"
    },
    {
      "INTERFACE": "Ethernet1/35",
      "STATUS": "present",
      "MANUFACTURER": "OEM",
      "TYPE": "SFP-H25GB-Unknown",
      "SERIAL": "CI1906290092",
      "PART_NUMBER": "BZ-SFP28-25G-DA2"
    },
    {
      "INTERFACE": "Ethernet1/36",
      "STATUS": "present",
      "MANUFACTURER": "OEM",
      "TYPE": "SFP-H25GB-Unknown",
      "SERIAL": "CI1906290092",
      "PART_NUMBER": "BZ-SFP28-25G-DA2"
    },
    {
      "INTERFACE": "Ethernet1/37",
      "STATUS": "present",
      "MANUFACTURER": "TAYLE",
      "TYPE": "Unknown Type-(unknown)",
      "SERIAL": "PI#556600002",
      "PART_NUMBER": "GL-CC-SFP-030"
    },
    {
      "INTERFACE": "Ethernet1/38",
      "STATUS": "present",
      "MANUFACTURER": "UPNET",
      "TYPE": "SFP-H10GB-CU3M",
      "SERIAL": "FO1810250253",
      "PART_NUMBER": "SFP+-10G-DA-3"
    },
    {
      "INTERFACE": "Ethernet1/39",
      "STATUS": "present",
      "MANUFACTURER": "UPNET",
      "TYPE": "SFP-H10GB-CU2M",
      "SERIAL": "FO1810250130",
      "PART_NUMBER": "SFP+-10G-DA-2"
    },
    {
      "INTERFACE": "Ethernet1/40",
      "STATUS": "present",
      "MANUFACTURER": "UPNET",
      "TYPE": "SFP-H10GB-CU2M",
      "SERIAL": "FO1810250123",
      "PART_NUMBER": "SFP+-10G-DA-2"
    },
    {
      "INTERFACE": "Ethernet1/41",
      "STATUS": "present",
      "MANUFACTURER": "OEM",
      "TYPE": "SFP-H25GB-Unknown",
      "SERIAL": "CI1906290092",
      "PART_NUMBER": "BZ-SFP28-25G-DA2"
    },
    {
      "INTERFACE": "Ethernet1/42",
      "STATUS": "present",
      "MANUFACTURER": "OEM",
      "TYPE": "SFP-H25GB-Unknown",
      "SERIAL": "CI1906290092",
      "PART_NUMBER": "BZ-SFP28-25G-DA2"
    },
    {
      "INTERFACE": "Ethernet1/43",
      "STATUS": "present",
      "MANUFACTURER": "OEM",
      "TYPE": "SFP-H25GB-Unknown",
      "SERIAL": "CI1906290092",
      "PART_NUMBER": "BZ-SFP28-25G-DA2"
    },
    {
      "INTERFACE": "Ethernet1/44",
      "STATUS": "present",
      "MANUFACTURER": "OEM",
      "TYPE": "SFP-H25GB-Unknown",
      "SERIAL": "CI1906290092",
      "PART_NUMBER": "BZ-SFP28-25G-DA2"
    },
    {
      "INTERFACE": "Ethernet1/47",
      "STATUS": "present",
      "MANUFACTURER": "UPNET",
      "TYPE": "SFP-H10GB-CU3M",
      "SERIAL": "FO1810250320",
      "PART_NUMBER": "SFP+-10G-DA-3"
    },
    {
      "INTERFACE": "Ethernet1/48",
      "STATUS": "present",
      "MANUFACTURER": "UPNET",
      "TYPE": "SFP-H10GB-CU2M",
      "SERIAL": "FO1810250200",
      "PART_NUMBER": "SFP+-10G-DA-2"
    },
    {
      "INTERFACE": "Ethernet1/49",
      "STATUS": "present",
      "MANUFACTURER": "OEM",
      "TYPE": "QSFP-100G-LR4",
      "SERIAL": "GS2008105001",
      "PART_NUMBER": "BZ-QSFP28-100G-E"
    },
    {
      "INTERFACE": "Ethernet1/50",
      "STATUS": "present",
      "MANUFACTURER": "CISCO-AVAGO",
      "TYPE": "QSFP-40G-SR-BD",
      "SERIAL": "AVM2152U54A",
      "PART_NUMBER": "AFBR-79EBPZ-CS2",
      "PRODUCT_ID": "QSFP-40G-SR-BD"
    },
    {
      "INTERFACE": "Ethernet1/51",
      "STATUS": "present",
      "MANUFACTURER": "CISCO-AVAGO",
      "TYPE": "QSFP-40G-SR-BD",
      "SERIAL": "AVM1828U4JG",
      "PART_NUMBER": "AFBR-79EBPZ-CS2",
      "PRODUCT_ID": "QSFP-40G-SR-BD"
    },
    {
      "INTERFACE": "Ethernet1/52",
      "STATUS": "present",
      "MANUFACTURER": "UPNET",
      "TYPE": "QSFP-40G-SR-BD",
      "SERIAL": "52CI19022808",
      "PART_NUMBER": "WDM"
    },
    {
      "INTERFACE": "Ethernet1/53",
      "STATUS": "present",
      "MANUFACTURER": "CISCO-AVAGO",
      "TYPE": "QSFP-40G-SR-BD",
      "SERIAL": "AVM1828U4HW",
      "PART_NUMBER": "AFBR-79EBPZ-CS2",
      "PRODUCT_ID": "QSFP-40G-SR-BD"
    },
    {
      "INTERFACE": "Ethernet1/54",
      "STATUS": "present",
      "MANUFACTURER": "CISCO-AVAGO",
      "TYPE": "QSFP-40G-SR-BD",
      "SERIAL": "AVM2152U54D",
      "PART_NUMBER": "AFBR-79EBPZ-CS2",
      "PRODUCT_ID": "QSFP-40G-SR-BD"
    },
    {
      "INTERFACE": "Ethernet1/55",
      "STATUS": "present",
      "MANUFACTURER": "CISCO-AVAGO",
      "TYPE": "QSFP-40G-SR-BD",
      "SERIAL": "AVM2152U5BR",
      "PART_NUMBER": "AFBR-79EBPZ-CS2",
      "PRODUCT_ID": "QSFP-40G-SR-BD"
    },
    {
      "INTERFACE": "Ethernet1/56",
      "STATUS": "present",
      "MANUFACTURER": "CISCO-AVAGO",
      "TYPE": "QSFP-40G-SR-BD",
      "SERIAL": "AVM2152U54V",
      "PART_NUMBER": "AFBR-79EBPZ-CS2",
      "PRODUCT_ID": "QSFP-40G-SR-BD"
    },
    {
      "INTERFACE": "Ethernet1/57",
      "STATUS": "present",
      "MANUFACTURER": "CISCO-AVAGO",
      "TYPE": "QSFP-40G-SR-BD",
      "SERIAL": "AVM2152U0R0",
      "PART_NUMBER": "AFBR-79EBPZ-CS2",
      "PRODUCT_ID": "QSFP-40G-SR-BD"
    },
    {
      "INTERFACE": "Ethernet1/58",
      "STATUS": "present",
      "MANUFACTURER": "CISCO-AVAGO",
      "TYPE": "QSFP-40G-SR-BD",
      "SERIAL": "AVM1832U1WK",
      "PART_NUMBER": "AFBR-79EBPZ-CS2",
      "PRODUCT_ID": "QSFP-40G-SR-BD"
    },
    {
      "INTERFACE": "Ethernet1/59",
      "STATUS": "present",
      "MANUFACTURER": "UPNET",
      "TYPE": "QSFP-40G-SR-BD",
      "SERIAL": "52CI19022817",
      "PART_NUMBER": "WDM"
    },
    {
      "INTERFACE": "Ethernet1/60",
      "STATUS": "present",
      "MANUFACTURER": "CISCO-AVAGO",
      "TYPE": "QSFP-40G-SR-BD",
      "SERIAL": "AVM1829U7HN",
      "PART_NUMBER": "AFBR-79EBPZ-CS2",
      "PRODUCT_ID": "QSFP-40G-SR-BD"
    }
  ],
  "ttp_parsed": [
    {
      "type": [
        {
          "TYPE": "SFP-H25GB-Unknown"
        },
        {
          "TYPE": "SFP-H25GB-Unknown"
        },
        {
          "TYPE": "SFP-H25GB-Unknown"
        },
        {
          "TYPE": "SFP-H25GB-Unknown"
        },
        {
          "TYPE": "SFP-H25GB-Unknown"
        },
        {
          "TYPE": "SFP-H10GB-CU1M"
        },
        {
          "TYPE": "SFP-H25GB-Unknown"
        },
        {
          "TYPE": "SFP-H25GB-Unknown"
        },
        {
          "TYPE": "SFP-H10GB-CU2M"
        },
        {
          "TYPE": "SFP-H10GB-CU2M"
        },
        {
          "TYPE": "SFP-H10GB-CU2M"
        },
        {
          "TYPE": "SFP-H10GB-CU2M"
        },
        {
          "TYPE": "SFP-H10GB-CU2M"
        },
        {
          "TYPE": "SFP-H10GB-CU2M"
        },
        {
          "TYPE": "SFP-H10GB-CU1M"
        },
        {
          "TYPE": "SFP-H25GB-Unknown"
        },
        {
          "TYPE": "SFP-H25GB-Unknown"
        },
        {
          "TYPE": "SFP-H25GB-Unknown"
        },
        {
          "TYPE": "SFP-H25GB-Unknown"
        },
        {
          "TYPE": "SFP-H25GB-Unknown"
        },
        {
          "TYPE": "SFP-H25GB-Unknown"
        },
        {
          "TYPE": "SFP-H25GB-Unknown"
        },
        {
          "TYPE": "SFP-H25GB-CU2M"
        },
        {
          "TYPE": "SFP-H25GB-CU2M"
        },
        {
          "TYPE": "SFP-H10GB-CU3M"
        },
        {
          "TYPE": "SFP-H10GB-CU3M"
        },
        {
          "TYPE": "SFP-H25GB-Unknown"
        },
        {
          "TYPE": "SFP-H25GB-Unknown"
        },
        {
          "TYPE": "SFP-H25GB-Unknown"
        },
        {
          "TYPE": "SFP-H25GB-Unknown"
        },
        {
          "TYPE": "Unknown Type-(unknown)"
        },
        {
          "TYPE": "SFP-H10GB-CU3M"
        },
        {
          "TYPE": "SFP-H10GB-CU2M"
        },
        {
          "TYPE": "SFP-H10GB-CU2M"
        },
        {
          "TYPE": "SFP-H25GB-Unknown"
        },
        {
          "TYPE": "SFP-H25GB-Unknown"
        },
        {
          "TYPE": "SFP-H25GB-Unknown"
        },
        {
          "TYPE": "SFP-H25GB-Unknown"
        },
        {
          "TYPE": "SFP-H10GB-CU3M"
        },
        {
          "TYPE": "SFP-H10GB-CU2M"
        },
        {
          "TYPE": "QSFP-100G-LR4"
        },
        {
          "TYPE": "QSFP-40G-SR-BD"
        },
        {
          "TYPE": "QSFP-40G-SR-BD"
        },
        {
          "TYPE": "QSFP-40G-SR-BD"
        },
        {
          "TYPE": "QSFP-40G-SR-BD"
        },
        {
          "TYPE": "QSFP-40G-SR-BD"
        },
        {
          "TYPE": "QSFP-40G-SR-BD"
        },
        {
          "TYPE": "QSFP-40G-SR-BD"
        },
        {
          "TYPE": "QSFP-40G-SR-BD"
        },
        {
          "TYPE": "QSFP-40G-SR-BD"
        },
        {
          "TYPE": "QSFP-40G-SR-BD"
        },
        {
          "TYPE": "QSFP-40G-SR-BD"
        }
      ]
    }
  ],
  "cli_content": "Ethernet1/1\n    transceiver is present\n    type is SFP-H25GB-Unknown\n    name is OEM\n    part number is BZ-SFP28-25G-DA1\n    revision is 01\n    serial number is CI1906290051\n    nominal bitrate is 25500 MBit/sec\n    Link length supported for copper is 1 m\n    cable type is unknown\n    cisco id is 3\n    cisco extended id number is 4\n\nEthernet1/2\n    transceiver is present\n    type is SFP-H25GB-Unknown\n    name is OEM\n    part number is BZ-SFP28-25G-DA2\n    revision is 01\n    serial number is CI1906290092\n    nominal bitrate is 25500 MBit/sec\n    Link length supported for copper is 2 m\n    cable type is unknown\n    cisco id is 3\n    cisco extended id number is 4\n\nEthernet1/3\n    transceiver is present\n    type is SFP-H25GB-Unknown\n    name is OEM\n    part number is BZ-SFP28-25G-DA2\n    revision is 01\n    serial number is CI1906290092\n    nominal bitrate is 25500 MBit/sec\n    Link length supported for copper is 2 m\n    cable type is unknown\n    cisco id is 3\n    cisco extended id number is 4\n\nEthernet1/4\n    transceiver is present\n    type is SFP-H25GB-Unknown\n    name is OEM\n    part number is BZ-SFP28-25G-DA2\n    revision is 01\n    serial number is CI1906290092\n    nominal bitrate is 25500 MBit/sec\n    Link length supported for copper is 2 m\n    cable type is unknown\n    cisco id is 3\n    cisco extended id number is 4\n\nEthernet1/5\n    transceiver is present\n    type is SFP-H25GB-Unknown\n    name is OEM\n    part number is BZ-SFP28-25G-DA2\n    revision is 01\n    serial number is CI1906290092\n    nominal bitrate is 25500 MBit/sec\n    Link length supported for copper is 2 m\n    cable type is unknown\n    cisco id is 3\n    cisco extended id number is 4\n\nEthernet1/6\n    transceiver is present\n    type is SFP-H10GB-CU1M\n    name is OEM\n    part number is SFP-H10GB-CU1M\n    revision is R\n    serial number is CSS11F80668\n    nominal bitrate is 10300 MBit/sec\n    Link length supported for copper is 1 m\n    cisco id is 3\n    cisco extended id number is 4\n\nEthernet1/7\n    transceiver is present\n    type is SFP-H25GB-Unknown\n    name is OEM\n    part number is BZ-SFP28-25G-DA2\n    revision is 01\n    serial number is CI1906290092\n    nominal bitrate is 25500 MBit/sec\n    Link length supported for copper is 2 m\n    cable type is unknown\n    cisco id is 3\n    cisco extended id number is 4\n\nEthernet1/8\n    transceiver is present\n    type is SFP-H25GB-Unknown\n    name is OEM\n    part number is BZ-SFP28-25G-DA2\n    revision is 01\n    serial number is CI1906290092\n    nominal bitrate is 25500 MBit/sec\n    Link length supported for copper is 2 m\n    cable type is unknown\n    cisco id is 3\n    cisco extended id number is 4\n\nEthernet1/9\n    transceiver is present\n    type is SFP-H10GB-CU2M\n    name is UPNET\n    part number is SFP+-10G-DA-2\n    revision is A0\n    serial number is FO1810250113\n    nominal bitrate is 10300 MBit/sec\n    Link length supported for copper is 2 m\n    cisco id is 3\n    cisco extended id number is 4\n\nEthernet1/10\n    transceiver is present\n    type is SFP-H10GB-CU2M\n    name is UPNET\n    part number is SFP+-10G-DA-2\n    revision is A0\n    serial number is FO1810250145\n    nominal bitrate is 10300 MBit/sec\n    Link length supported for copper is 2 m\n    cisco id is 3\n    cisco extended id number is 4\n\nEthernet1/11\n    transceiver is present\n    type is SFP-H10GB-CU2M\n    name is UPNET\n    part number is SFP+-10G-DA-2\n    revision is A0\n    serial number is FO1810250115\n    nominal bitrate is 10300 MBit/sec\n    Link length supported for copper is 2 m\n    cisco id is 3\n    cisco extended id number is 4\n\nEthernet1/12\n    transceiver is present\n    type is SFP-H10GB-CU2M\n    name is UPNET\n    part number is SFP+-10G-DA-2\n    revision is A0\n    serial number is FO1810250131\n    nominal bitrate is 10300 MBit/sec\n    Link length supported for copper is 2 m\n    cisco id is 3\n    cisco extended id number is 4\n\nEthernet1/13\n    transceiver is present\n    type is SFP-H10GB-CU2M\n    name is UPNET\n    part number is SFP+-10G-DA-2\n    revision is A0\n    serial number is FO1810250138\n    nominal bitrate is 10300 MBit/sec\n    Link length supported for copper is 2 m\n    cisco id is 3\n    cisco extended id number is 4\n\nEthernet1/14\n    transceiver is present\n    type is SFP-H10GB-CU2M\n    name is UPNET\n    part number is SFP+-10G-DA-2\n    revision is A0\n    serial number is FO1810250171\n    nominal bitrate is 10300 MBit/sec\n    Link length supported for copper is 2 m\n    cisco id is 3\n    cisco extended id number is 4\n\nEthernet1/15\n    transceiver is present\n    type is SFP-H10GB-CU1M\n    name is UPNET\n    part number is SFP+-10G-DA-1\n    revision is A0\n    serial number is FO1810250047\n    nominal bitrate is 10300 MBit/sec\n    Link length supported for copper is 1 m\n    cisco id is 3\n    cisco extended id number is 4\n\nEthernet1/16\n    transceiver is present\n    type is SFP-H25GB-Unknown\n    name is OEM\n    part number is BZ-SFP28-25G-DA2\n    revision is 01\n    serial number is CI1906290092\n    nominal bitrate is 25500 MBit/sec\n    Link length supported for copper is 2 m\n    cable type is unknown\n    cisco id is 3\n    cisco extended id number is 4\n\nEthernet1/17\n    transceiver is present\n    type is SFP-H25GB-Unknown\n    name is OEM\n    part number is BZ-SFP28-25G-DA1\n    revision is 01\n    serial number is CI1906290049\n    nominal bitrate is 25500 MBit/sec\n    Link length supported for copper is 1 m\n    cable type is unknown\n    cisco id is 3\n    cisco extended id number is 4\n\nEthernet1/18\n    transceiver is present\n    type is SFP-H25GB-Unknown\n    name is OEM\n    part number is BZ-SFP28-25G-DA1\n    revision is 01\n    serial number is CI1906290023\n    nominal bitrate is 25500 MBit/sec\n    Link length supported for copper is 1 m\n    cable type is unknown\n    cisco id is 3\n    cisco extended id number is 4\n\nEthernet1/19\n    transceiver is present\n    type is SFP-H25GB-Unknown\n    name is OEM\n    part number is BZ-SFP28-25G-DA1\n    revision is 01\n    serial number is CI1906290063\n    nominal bitrate is 25500 MBit/sec\n    Link length supported for copper is 1 m\n    cable type is unknown\n    cisco id is 3\n    cisco extended id number is 4\n\nEthernet1/20\n    transceiver is present\n    type is SFP-H25GB-Unknown\n    name is OEM\n    part number is BZ-SFP28-25G-DA1\n    revision is 01\n    serial number is CI1906290033\n    nominal bitrate is 25500 MBit/sec\n    Link length supported for copper is 1 m\n    cable type is unknown\n    cisco id is 3\n    cisco extended id number is 4\n\nEthernet1/21\n    transceiver is present\n    type is SFP-H25GB-Unknown\n    name is OEM\n    part number is BZ-SFP28-25G-DA2\n    revision is 01\n    serial number is CI1906290092\n    nominal bitrate is 25500 MBit/sec\n    Link length supported for copper is 2 m\n    cable type is unknown\n    cisco id is 3\n    cisco extended id number is 4\n\nEthernet1/22\n    transceiver is present\n    type is SFP-H25GB-Unknown\n    name is OEM\n    part number is BZ-SFP28-25G-DA2\n    revision is 01\n    serial number is CI1906290092\n    nominal bitrate is 25500 MBit/sec\n    Link length supported for copper is 2 m\n    cable type is unknown\n    cisco id is 3\n    cisco extended id number is 4\n\nEthernet1/23\n    transceiver is present\n    type is SFP-H25GB-CU2M\n    name is CISCO-UPNET\n    part number is SFP28-25G-DA-2m\n    revision is 01\n    serial number is 7522046139(A)\n    nominal bitrate is 25500 MBit/sec\n    Link length supported for copper is 2 m\n    cable type is CA-L\n    cisco id is 3\n    cisco extended id number is 4\n\nEthernet1/24\n    transceiver is present\n    type is SFP-H25GB-CU2M\n    name is CISCO-UPNET\n    part number is SFP28-25G-DA-2m\n    revision is 01\n    serial number is 7522046129(A)\n    nominal bitrate is 25500 MBit/sec\n    Link length supported for copper is 2 m\n    cable type is CA-L\n    cisco id is 3\n    cisco extended id number is 4\n\nEthernet1/25\n    transceiver is not present\n\nEthernet1/26\n    transceiver is present\n    type is SFP-H10GB-CU3M\n    name is UPNET\n    part number is SFP+-10G-DA-3\n    revision is A0\n    serial number is FO1810250348\n    nominal bitrate is 10300 MBit/sec\n    Link length supported for copper is 3 m\n    cisco id is 3\n    cisco extended id number is 4\n\nEthernet1/27\n    transceiver is present\n    type is SFP-H10GB-CU3M\n    name is UPNET\n    part number is SFP+-10G-DA-3\n    revision is A0\n    serial number is FO1810250259\n    nominal bitrate is 10300 MBit/sec\n    Link length supported for copper is 3 m\n    cisco id is 3\n    cisco extended id number is 4\n\nEthernet1/28\n    transceiver is not present\n\nEthernet1/29\n    transceiver is not present\n\nEthernet1/30\n    transceiver is not present\n\nEthernet1/31\n    transceiver is not present\n\nEthernet1/32\n    transceiver is not present\n\nEthernet1/33\n    transceiver is present\n    type is SFP-H25GB-Unknown\n    name is OEM\n    part number is BZ-SFP28-25G-DA2\n    revision is 01\n    serial number is CI1906290092\n    nominal bitrate is 25500 MBit/sec\n    Link length supported for copper is 2 m\n    cable type is unknown\n    cisco id is 3\n    cisco extended id number is 4\n\nEthernet1/34\n    transceiver is present\n    type is SFP-H25GB-Unknown\n    name is OEM\n    part number is BZ-SFP28-25G-DA2\n    revision is 01\n    serial number is CI1906290092\n    nominal bitrate is 25500 MBit/sec\n    Link length supported for copper is 2 m\n    cable type is unknown\n    cisco id is 3\n    cisco extended id number is 4\n\nEthernet1/35\n    transceiver is present\n    type is SFP-H25GB-Unknown\n    name is OEM\n    part number is BZ-SFP28-25G-DA2\n    revision is 01\n    serial number is CI1906290092\n    nominal bitrate is 25500 MBit/sec\n    Link length supported for copper is 2 m\n    cable type is unknown\n    cisco id is 3\n    cisco extended id number is 4\n\nEthernet1/36\n    transceiver is present\n    type is SFP-H25GB-Unknown\n    name is OEM\n    part number is BZ-SFP28-25G-DA2\n    revision is 01\n    serial number is CI1906290092\n    nominal bitrate is 25500 MBit/sec\n    Link length supported for copper is 2 m\n    cable type is unknown\n    cisco id is 3\n    cisco extended id number is 4\n\nEthernet1/37\n    transceiver is present\n    type is Unknown Type-(unknown)\n    name is TAYLE\n    part number is GL-CC-SFP-030\n    revision is 0000\n    serial number is PI#556600002\n    nominal bitrate is 10300 MBit/sec\n    Link length supported for copper is 3 m\n    cisco id is 3\n    cisco extended id number is 4\n\nEthernet1/38\n    transceiver is present\n    type is SFP-H10GB-CU3M\n    name is UPNET\n    part number is SFP+-10G-DA-3\n    revision is A0\n    serial number is FO1810250253\n    nominal bitrate is 10300 MBit/sec\n    Link length supported for copper is 3 m\n    cisco id is 3\n    cisco extended id number is 4\n\nEthernet1/39\n    transceiver is present\n    type is SFP-H10GB-CU2M\n    name is UPNET\n    part number is SFP+-10G-DA-2\n    revision is A0\n    serial number is FO1810250130\n    nominal bitrate is 10300 MBit/sec\n    Link length supported for copper is 2 m\n    cisco id is 3\n    cisco extended id number is 4\n\nEthernet1/40\n    transceiver is present\n    type is SFP-H10GB-CU2M\n    name is UPNET\n    part number is SFP+-10G-DA-2\n    revision is A0\n    serial number is FO1810250123\n    nominal bitrate is 10300 MBit/sec\n    Link length supported for copper is 2 m\n    cisco id is 3\n    cisco extended id number is 4\n\nEthernet1/41\n    transceiver is present\n    type is SFP-H25GB-Unknown\n    name is OEM\n    part number is BZ-SFP28-25G-DA2\n    revision is 01\n    serial number is CI1906290092\n    nominal bitrate is 25500 MBit/sec\n    Link length supported for copper is 2 m\n    cable type is unknown\n    cisco id is 3\n    cisco extended id number is 4\n\nEthernet1/42\n    transceiver is present\n    type is SFP-H25GB-Unknown\n    name is OEM\n    part number is BZ-SFP28-25G-DA2\n    revision is 01\n    serial number is CI1906290092\n    nominal bitrate is 25500 MBit/sec\n    Link length supported for copper is 2 m\n    cable type is unknown\n    cisco id is 3\n    cisco extended id number is 4\n\nEthernet1/43\n    transceiver is present\n    type is SFP-H25GB-Unknown\n    name is OEM\n    part number is BZ-SFP28-25G-DA2\n    revision is 01\n    serial number is CI1906290092\n    nominal bitrate is 25500 MBit/sec\n    Link length supported for copper is 2 m\n    cable type is unknown\n    cisco id is 3\n    cisco extended id number is 4\n\nEthernet1/44\n    transceiver is present\n    type is SFP-H25GB-Unknown\n    name is OEM\n    part number is BZ-SFP28-25G-DA2\n    revision is 01\n    serial number is CI1906290092\n    nominal bitrate is 25500 MBit/sec\n    Link length supported for copper is 2 m\n    cable type is unknown\n    cisco id is 3\n    cisco extended id number is 4\n\nEthernet1/45\n    transceiver is not present\n\nEthernet1/46\n    transceiver is not present\n\nEthernet1/47\n    transceiver is present\n    type is SFP-H10GB-CU3M\n    name is UPNET\n    part number is SFP+-10G-DA-3\n    revision is A0\n    serial number is FO1810250320\n    nominal bitrate is 10300 MBit/sec\n    Link length supported for copper is 3 m\n    cisco id is 3\n    cisco extended id number is 4\n\nEthernet1/48\n    transceiver is present\n    type is SFP-H10GB-CU2M\n    name is UPNET\n    part number is SFP+-10G-DA-2\n    revision is A0\n    serial number is FO1810250200\n    nominal bitrate is 10300 MBit/sec\n    Link length supported for copper is 2 m\n    cisco id is 3\n    cisco extended id number is 4\n\nEthernet1/49\n    transceiver is present\n    type is QSFP-100G-LR4\n    name is OEM\n    part number is BZ-QSFP28-100G-E\n    revision is A \n    serial number is GS2008105001\n    nominal bitrate is 25500 MBit/sec\n    Link length supported for 9/125um fiber is 40 km\n    cisco id is 17\n    cisco extended id number is 204\n\nEthernet1/50\n    transceiver is present\n    type is QSFP-40G-SR-BD\n    name is CISCO-AVAGO\n    part number is AFBR-79EBPZ-CS2\n    revision is 01\n    serial number is AVM2152U54A\n    nominal bitrate is 20600 MBit/sec per channel\n    Link length supported for 50/125um OM3 fiber is 100 m\n    cisco id is 13\n    cisco extended id number is 220\n    cisco part number is 10-2945-02\n    cisco product id is QSFP-40G-SR-BD\n    cisco version id is V02\n\nEthernet1/51\n    transceiver is present\n    type is QSFP-40G-SR-BD\n    name is CISCO-AVAGO\n    part number is AFBR-79EBPZ-CS2\n    revision is 01\n    serial number is AVM1828U4JG\n    nominal bitrate is 20600 MBit/sec per channel\n    Link length supported for 50/125um OM3 fiber is 100 m\n    cisco id is 13\n    cisco extended id number is 220\n    cisco part number is 10-2945-02\n    cisco product id is QSFP-40G-SR-BD\n    cisco version id is V02\n\nEthernet1/52\n    transceiver is present\n    type is QSFP-40G-SR-BD\n    name is UPNET\n    part number is WDM QSFP+-40G-SR\n    revision is 01\n    serial number is 52CI19022808\n    nominal bitrate is 20600 MBit/sec per channel\n    Link length supported for 50/125um OM3 fiber is 100 m\n    cisco id is 13\n    cisco extended id number is 220\n\nEthernet1/53\n    transceiver is present\n    type is QSFP-40G-SR-BD\n    name is CISCO-AVAGO\n    part number is AFBR-79EBPZ-CS2\n    revision is 01\n    serial number is AVM1828U4HW\n    nominal bitrate is 20600 MBit/sec per channel\n    Link length supported for 50/125um OM3 fiber is 100 m\n    cisco id is 13\n    cisco extended id number is 220\n    cisco part number is 10-2945-02\n    cisco product id is QSFP-40G-SR-BD\n    cisco version id is V02\n\nEthernet1/54\n    transceiver is present\n    type is QSFP-40G-SR-BD\n    name is CISCO-AVAGO\n    part number is AFBR-79EBPZ-CS2\n    revision is 01\n    serial number is AVM2152U54D\n    nominal bitrate is 20600 MBit/sec per channel\n    Link length supported for 50/125um OM3 fiber is 100 m\n    cisco id is 13\n    cisco extended id number is 220\n    cisco part number is 10-2945-02\n    cisco product id is QSFP-40G-SR-BD\n    cisco version id is V02\n\nEthernet1/55\n    transceiver is present\n    type is QSFP-40G-SR-BD\n    name is CISCO-AVAGO\n    part number is AFBR-79EBPZ-CS2\n    revision is 01\n    serial number is AVM2152U5BR\n    nominal bitrate is 20600 MBit/sec per channel\n    Link length supported for 50/125um OM3 fiber is 100 m\n    cisco id is 13\n    cisco extended id number is 220\n    cisco part number is 10-2945-02\n    cisco product id is QSFP-40G-SR-BD\n    cisco version id is V02\n\nEthernet1/56\n    transceiver is present\n    type is QSFP-40G-SR-BD\n    name is CISCO-AVAGO\n    part number is AFBR-79EBPZ-CS2\n    revision is 01\n    serial number is AVM2152U54V\n    nominal bitrate is 20600 MBit/sec per channel\n    Link length supported for 50/125um OM3 fiber is 100 m\n    cisco id is 13\n    cisco extended id number is 220\n    cisco part number is 10-2945-02\n    cisco product id is QSFP-40G-SR-BD\n    cisco version id is V02\n\nEthernet1/57\n    transceiver is present\n    type is QSFP-40G-SR-BD\n    name is CISCO-AVAGO\n    part number is AFBR-79EBPZ-CS2\n    revision is 01\n    serial number is AVM2152U0R0\n    nominal bitrate is 20600 MBit/sec per channel\n    Link length supported for 50/125um OM3 fiber is 100 m\n    cisco id is 13\n    cisco extended id number is 220\n    cisco part number is 10-2945-02\n    cisco product id is QSFP-40G-SR-BD\n    cisco version id is V02\n\nEthernet1/58\n    transceiver is present\n    type is QSFP-40G-SR-BD\n    name is CISCO-AVAGO\n    part number is AFBR-79EBPZ-CS2\n    revision is 01\n    serial number is AVM1832U1WK\n    nominal bitrate is 20600 MBit/sec per channel\n    Link length supported for 50/125um OM3 fiber is 100 m\n    cisco id is 13\n    cisco extended id number is 220\n    cisco part number is 10-2945-02\n    cisco product id is QSFP-40G-SR-BD\n    cisco version id is V02\n\nEthernet1/59\n    transceiver is present\n    type is QSFP-40G-SR-BD\n    name is UPNET\n    part number is WDM QSFP+-40G-SR\n    revision is 01\n    serial number is 52CI19022817\n    nominal bitrate is 20600 MBit/sec per channel\n    Link length supported for 50/125um OM3 fiber is 100 m\n    cisco id is 13\n    cisco extended id number is 220\n\nEthernet1/60\n    transceiver is present\n    type is QSFP-40G-SR-BD\n    name is CISCO-AVAGO\n    part number is AFBR-79EBPZ-CS2\n    revision is 01\n    serial number is AVM1829U7HN\n    nominal bitrate is 20600 MBit/sec per channel\n    Link length supported for 50/125um OM3 fiber is 100 m\n    cisco id is 13\n    cisco extended id number is 220\n    cisco part number is 10-2945-02\n    cisco product id is QSFP-40G-SR-BD\n    cisco version id is V02",
  "textfsm_template": "Value INTERFACE (\\S+/\\S+)\nValue STATUS (not\\s\\w+|\\w+)\nValue MANUFACTURER (\\S+)\nValue TYPE (.+)\nValue SERIAL (\\S+)\nValue PART_NUMBER (\\S+)\nValue PRODUCT_ID (\\S+)\n\nStart\n  ^${INTERFACE}\n  ^\\s+transceiver\\sis\\s+${STATUS}\n  ^\\s+type\\s+is(\\s+${TYPE})?\n  ^\\s+name\\s+is(\\s+${MANUFACTURER})?\n  ^\\s+part\\s+number\\s+is(\\s+${PART_NUMBER})?\n  ^\\s+serial\\s+number\\s+is(\\s+${SERIAL})?\n  ^\\s+transceiver\\s+\n  ^\\s+nominal\\s+\n  ^\\s+revision\\s+\n  ^\\s+Link\\s+\n  ^\\s+cable\\s+type\\s+is\n  ^\\s+cisco\\s+id\n  ^\\s+cisco\\s+extended\n  ^\\s+cisco\\s+part\\s+number\n  ^\\s+cisco\\s+product\\s+id\\sis(\\s+${PRODUCT_ID})?\n  ^\\s+cisco\\s+version\\s+id\n  ^\\s+cisco\\s+vendor\\s+id\n  ^\\s*$$ -> Record\n  ^. -> Error\n"
}