{
  "command": "cisco_nxos_show_route-map",
  "source": "ntc",
  "status": "success",
  "match_ratio": 1.0,
  "textfsm_rows": 16,
  "ttp_rows": 16,
  "ttp_template": "<group name=\"name_action_seq\">\nroute-map {{NAME}}, {{ACTION}}, sequence {{SEQ | ORPHRASE}} \n</group>",
  "error": null,
  "textfsm_parsed": [
    {
      "NAME": "RM-TEST-OUT",
      "ACTION": "permit",
      "SEQ": "10",
      "MATCH_CLAUSES": "as-path (as-path filter): AS-TEST"
    },
    {
      "NAME": "RM-BGP-TO-OSPF",
      "ACTION": "deny",
      "SEQ": "10",
      "MATCH_CLAUSES": "tag: 12345"
    },
    {
      "NAME": "RM-BGP-TO-OSPF",
      "ACTION": "permit",
      "SEQ": "20"
    },
    {
      "NAME": "RM-ISP1-IN",
      "ACTION": "permit",
      "SEQ": "1000",
      "SET_CLAUSES": "local-preference 300"
    },
    {
      "NAME": "RM-ISP1-OUT",
      "ACTION": "permit",
      "SEQ": "1000",
      "MATCH_CLAUSES": "as-path (as-path filter): AS-ISP2"
    },
    {
      "NAME": "RM-ISP1-MAITENANCE",
      "ACTION": "permit",
      "SEQ": "10",
      "SET_CLAUSES": "local-preference 50"
    },
    {
      "NAME": "RM-FW-LP",
      "ACTION": "permit",
      "SEQ": "10",
      "SET_CLAUSES": "local-preference 25"
    },
    {
      "NAME": "RM-FW-MAITENANCE",
      "ACTION": "permit",
      "SEQ": "10"
    },
    {
      "NAME": "RM-FW-OUTBOUND",
      "ACTION": "permit",
      "SEQ": "10",
      "MATCH_CLAUSES": "as-path (as-path filter): TEST-AS-FW"
    },
    {
      "NAME": "RM-X-SIDE-INTERNAL",
      "ACTION": "permit",
      "SEQ": "10",
      "MATCH_CLAUSES": "ip address prefix-lists: PF-PATH-X-INTERNAL"
    },
    {
      "NAME": "RM-Z-SIDE-INTERNAL",
      "ACTION": "permit",
      "SEQ": "10",
      "MATCH_CLAUSES": "ip address prefix-lists: PF-PATH-Z-INTERNAL"
    },
    {
      "NAME": "RM-FILTER-IN",
      "ACTION": "permit",
      "SEQ": "10",
      "MATCH_CLAUSES": "ip address prefix-lists: PL-PERMIT-IN"
    },
    {
      "NAME": "TEST_THIS",
      "ACTION": "permit",
      "SEQ": "10",
      "MATCH_CLAUSES": "ip address (access-lists): AL_TEST_TEST",
      "SET_CLAUSES": "ip next-hop 2.2.2.2"
    },
    {
      "NAME": "RM-N3K1-TO-N3K2",
      "ACTION": "permit",
      "SEQ": "10",
      "MATCH_CLAUSES": "ip address prefix-lists: PF-N3K1-TO-N3K2",
      "SET_CLAUSES": "extcommunity RT:100:1"
    },
    {
      "NAME": "RM-N3K2-TO-N3K1",
      "ACTION": "permit",
      "SEQ": "10",
      "MATCH_CLAUSES": "ip address prefix-lists: PF-N3K2-TO-N3K1",
      "SET_CLAUSES": "extcommunity RT:200:1"
    },
    {
      "NAME": "RM-PATH-A-DEFAULT-ROUTE",
      "ACTION": "permit",
      "SEQ": "10",
      "MATCH_CLAUSES": "ip address prefix-lists: PF-A-DEFAULT-ROUTE"
    }
  ],
  "ttp_parsed": [
    {
      "name_action_seq": [
        {
          "NAME": "RM-TEST-OUT",
          "ACTION": "permit",
          "SEQ": "10"
        },
        {
          "NAME": "RM-BGP-TO-OSPF",
          "ACTION": "deny",
          "SEQ": "10"
        },
        {
          "NAME": "RM-BGP-TO-OSPF",
          "ACTION": "permit",
          "SEQ": "20"
        },
        {
          "NAME": "RM-ISP1-IN",
          "ACTION": "permit",
          "SEQ": "1000"
        },
        {
          "NAME": "RM-ISP1-OUT",
          "ACTION": "permit",
          "SEQ": "1000"
        },
        {
          "NAME": "RM-ISP1-MAITENANCE",
          "ACTION": "permit",
          "SEQ": "10"
        },
        {
          "NAME": "RM-FW-LP",
          "ACTION": "permit",
          "SEQ": "10"
        },
        {
          "NAME": "RM-FW-MAITENANCE",
          "ACTION": "permit",
          "SEQ": "10"
        },
        {
          "NAME": "RM-FW-OUTBOUND",
          "ACTION": "permit",
          "SEQ": "10"
        },
        {
          "NAME": "RM-X-SIDE-INTERNAL",
          "ACTION": "permit",
          "SEQ": "10"
        },
        {
          "NAME": "RM-Z-SIDE-INTERNAL",
          "ACTION": "permit",
          "SEQ": "10"
        },
        {
          "NAME": "RM-FILTER-IN",
          "ACTION": "permit",
          "SEQ": "10"
        },
        {
          "NAME": "TEST_THIS",
          "ACTION": "permit",
          "SEQ": "10"
        },
        {
          "NAME": "RM-N3K1-TO-N3K2",
          "ACTION": "permit",
          "SEQ": "10"
        },
        {
          "NAME": "RM-N3K2-TO-N3K1",
          "ACTION": "permit",
          "SEQ": "10"
        },
        {
          "NAME": "RM-PATH-A-DEFAULT-ROUTE",
          "ACTION": "permit",
          "SEQ": "10"
        }
      ]
    }
  ],
  "cli_content": "route-map RM-TEST-OUT, permit, sequence 10 \n  Match clauses:\n    as-path (as-path filter): AS-TEST \n  Set clauses:\nroute-map RM-BGP-TO-OSPF, deny, sequence 10 \n  Match clauses:\n    tag: 12345\n  Set clauses:\nroute-map RM-BGP-TO-OSPF, permit, sequence 20 \n  Match clauses:\n  Set clauses:\nroute-map RM-ISP1-IN, permit, sequence 1000 \n  Match clauses:\n  Set clauses:\n    local-preference 300\nroute-map RM-ISP1-OUT, permit, sequence 1000 \n  Match clauses:\n    as-path (as-path filter): AS-ISP2 \n  Set clauses:\nroute-map RM-ISP1-MAITENANCE, permit, sequence 10 \n  Match clauses:\n  Set clauses:\n    local-preference 50\nroute-map RM-FW-LP, permit, sequence 10 \n  Match clauses:\n  Set clauses:\n    local-preference 25\nroute-map RM-FW-MAITENANCE, permit, sequence 10 \n  Match clauses:\n  Set clauses:\nroute-map RM-FW-OUTBOUND, permit, sequence 10 \n  Match clauses:\n    as-path (as-path filter): TEST-AS-FW \n  Set clauses:\n\nroute-map RM-X-SIDE-INTERNAL, permit, sequence 10 \n  Match clauses:\n    ip address prefix-lists: PF-PATH-X-INTERNAL \n  Set clauses:\nroute-map RM-Z-SIDE-INTERNAL, permit, sequence 10 \n  Match clauses:\n    ip address prefix-lists: PF-PATH-Z-INTERNAL \n  Set clauses:\nroute-map RM-FILTER-IN, permit, sequence 10 \n  Match clauses:\n    ip address prefix-lists: PL-PERMIT-IN \n  Set clauses:\nroute-map TEST_THIS, permit, sequence 10 \n  Match clauses:\n    ip address (access-lists): AL_TEST_TEST \n  Set clauses:\n    ip next-hop 2.2.2.2 \nroute-map RM-N3K1-TO-N3K2, permit, sequence 10 \n  Match clauses:\n    ip address prefix-lists: PF-N3K1-TO-N3K2 \n  Set clauses:\n    extcommunity RT:100:1\nroute-map RM-N3K2-TO-N3K1, permit, sequence 10 \n  Match clauses:\n    ip address prefix-lists: PF-N3K2-TO-N3K1 \n  Set clauses:\n    extcommunity RT:200:1\nroute-map RM-PATH-A-DEFAULT-ROUTE, permit, sequence 10 \n  Match clauses:\n    ip address prefix-lists: PF-A-DEFAULT-ROUTE \n  Set clauses:\n",
  "textfsm_template": "Value Required NAME (\\S+)\nValue Required ACTION (\\S+)\nValue Required SEQ (\\d+)\nValue List MATCH_CLAUSES (.+?)\nValue List SET_CLAUSES (.+?)\n\nStart\n  ^route-map\\s+${NAME},\\s+${ACTION},\\s+sequence\\s+${SEQ}\\s*$$\n  ^\\s+Match\\s+clauses -> Match\n  ^\\s+Set\\s+clauses -> Set\n  ^\\s*$$\n  ^. -> Error\n\nMatch\n  ^\\s*$$\n  ^\\s+Set\\s+clauses -> Set\n  ^\\s+Policy\\s+routing\n  ^\\s+${MATCH_CLAUSES}\\s*$$\n  ^route-map -> Continue.Record\n  ^route-map\\s+${NAME},\\s+${ACTION},\\s+sequence\\s+${SEQ}\\s*$$ -> Start\n  ^\\s*$$\n  ^. -> Error\n\nSet\n  ^\\s*$$\n  ^\\s+Policy\\s+routing\n  ^\\s+${SET_CLAUSES}\\s*$$\n  ^route-map -> Continue.Record\n  ^route-map\\s+${NAME},\\s+${ACTION},\\s+sequence\\s+${SEQ}\\s*$$ -> Start\n  ^\\s*$$\n  ^. -> Error\n"
}