{
  "command": "cisco_ios_show_interfaces",
  "source": "ntc",
  "status": "success",
  "match_ratio": 4.214285714285714,
  "textfsm_rows": 56,
  "ttp_rows": 236,
  "ttp_template": "<group name=\"hardware_type_mac_address_bia\">\n  Hardware is {{HARDWARE_TYPE | ORPHRASE}}, address is {{MAC_ADDRESS | ORPHRASE}} (bia {{BIA}})\n</group>\n<group name=\"mtu_bandwidth_delay\">\n  MTU {{MTU}} bytes, BW {{BANDWIDTH | ORPHRASE}}, DLY {{DELAY | ORPHRASE}},\n</group>\n<group name=\"duplex_speed_media_type\">\n  {{DUPLEX}}, {{SPEED}}, media type is {{MEDIA_TYPE | ORPHRASE}}\n</group>\n<group name=\"input_rate_output_rate_input_pps_output_pps_input_packets_output_packets_last_input_last_output\">\n  Last input {{INPUT_RATE}}{{OUTPUT_RATE}}:{{INPUT_PPS}}{{OUTPUT_PPS}}:{{INPUT_PACKETS}}{{OUTPUT_PACKETS}}, output {{LAST_INPUT | ORPHRASE}}, output hang {{LAST_OUTPUT}}\n</group>\n<group name=\"interface_link_status_protocol_status\">\n{{INTERFACE}} is {{LINK_STATUS | ORPHRASE}}, line protocol is {{PROTOCOL_STATUS | ORPHRASE}}\n</group>",
  "error": null,
  "textfsm_parsed": [
    {
      "INTERFACE": "Vlan1",
      "LINK_STATUS": "up",
      "PROTOCOL_STATUS": "up",
      "HARDWARE_TYPE": "EtherSVI",
      "MAC_ADDRESS": "0014.1c57.a4c0",
      "BIA": "0014.1c57.a4c0",
      "MTU": "1500",
      "BANDWIDTH": "1000000 Kbit",
      "DELAY": "10 usec",
      "ENCAPSULATION": "ARPA",
      "LAST_INPUT": "00:00:00",
      "LAST_OUTPUT": "never",
      "LAST_OUTPUT_HANG": "never",
      "QUEUE_STRATEGY": "fifo",
      "INPUT_RATE": "0",
      "OUTPUT_RATE": "0",
      "INPUT_PPS": "0",
      "OUTPUT_PPS": "0",
      "INPUT_PACKETS": "37453340",
      "OUTPUT_PACKETS": "0",
      "RUNTS": "0",
      "GIANTS": "0",
      "INPUT_ERRORS": "0",
      "CRC": "0",
      "FRAME": "0",
      "OVERRUN": "0"
    },
    {
      "INTERFACE": "Vlan50",
      "LINK_STATUS": "up",
      "PROTOCOL_STATUS": "up",
      "HARDWARE_TYPE": "EtherSVI",
      "MAC_ADDRESS": "0014.1c57.a4c1",
      "BIA": "0014.1c57.a4c1",
      "IP_ADDRESS": "10.1.50.1",
      "PREFIX_LENGTH": "24",
      "MTU": "1500",
      "BANDWIDTH": "1000000 Kbit",
      "DELAY": "10 usec",
      "ENCAPSULATION": "ARPA",
      "LAST_INPUT": "01:04:54",
      "LAST_OUTPUT": "01:04:54",
      "LAST_OUTPUT_HANG": "never",
      "QUEUE_STRATEGY": "fifo",
      "INPUT_RATE": "0",
      "OUTPUT_RATE": "0",
      "INPUT_PPS": "0",
      "OUTPUT_PPS": "0",
      "INPUT_PACKETS": "3772",
      "OUTPUT_PACKETS": "3804",
      "RUNTS": "0",
      "GIANTS": "0",
      "INPUT_ERRORS": "0",
      "CRC": "0",
      "FRAME": "0",
      "OVERRUN": "0"
    },
    {
      "INTERFACE": "Vlan100",
      "LINK_STATUS": "up",
      "PROTOCOL_STATUS": "up",
      "HARDWARE_TYPE": "EtherSVI",
      "MAC_ADDRESS": "0014.1c57.a4c2",
      "BIA": "0014.1c57.a4c2",
      "IP_ADDRESS": "10.1.100.1",
      "PREFIX_LENGTH": "24",
      "MTU": "1500",
      "BANDWIDTH": "1000000 Kbit",
      "DELAY": "10 usec",
      "ENCAPSULATION": "ARPA",
      "LAST_INPUT": "00:00:00",
      "LAST_OUTPUT": "00:00:00",
      "LAST_OUTPUT_HANG": "never",
      "QUEUE_STRATEGY": "fifo",
      "INPUT_RATE": "2000",
      "OUTPUT_RATE": "2000",
      "INPUT_PPS": "2",
      "OUTPUT_PPS": "2",
      "INPUT_PACKETS": "6313297",
      "OUTPUT_PACKETS": "10453439",
      "RUNTS": "0",
      "GIANTS": "0",
      "INPUT_ERRORS": "0",
      "CRC": "0",
      "FRAME": "0",
      "OVERRUN": "0"
    },
    {
      "INTERFACE": "Vlan254",
      "LINK_STATUS": "up",
      "PROTOCOL_STATUS": "up",
      "HARDWARE_TYPE": "EtherSVI",
      "MAC_ADDRESS": "0014.1c57.a4c3",
      "BIA": "0014.1c57.a4c3",
      "IP_ADDRESS": "10.1.254.1",
      "PREFIX_LENGTH": "24",
      "MTU": "1500",
      "BANDWIDTH": "1000000 Kbit",
      "DELAY": "10 usec",
      "ENCAPSULATION": "ARPA",
      "LAST_INPUT": "00:08:48",
      "LAST_OUTPUT": "00:08:48",
      "LAST_OUTPUT_HANG": "never",
      "QUEUE_STRATEGY": "fifo",
      "INPUT_RATE": "0",
      "OUTPUT_RATE": "0",
      "INPUT_PPS": "0",
      "OUTPUT_PPS": "0",
      "INPUT_PACKETS": "7881502",
      "OUTPUT_PACKETS": "47843",
      "RUNTS": "0",
      "GIANTS": "0",
      "INPUT_ERRORS": "0",
      "CRC": "0",
      "FRAME": "0",
      "OVERRUN": "0"
    },
    {
      "INTERFACE": "FastEthernet1/0/1",
      "LINK_STATUS": "up",
      "PROTOCOL_STATUS": "up (connected)",
      "HARDWARE_TYPE": "Fast Ethernet",
      "MAC_ADDRESS": "0014.1c57.a483",
      "BIA": "0014.1c57.a483",
      "MTU": "1500",
      "DUPLEX": "Full-duplex",
      "SPEED": "100Mb/s",
      "MEDIA_TYPE": "10/100BaseTX",
      "BANDWIDTH": "100000 Kbit",
      "DELAY": "100 usec",
      "ENCAPSULATION": "ARPA",
      "LAST_INPUT": "00:00:01",
      "LAST_OUTPUT": "00:00:06",
      "LAST_OUTPUT_HANG": "never",
      "QUEUE_STRATEGY": "fifo",
      "INPUT_RATE": "182000",
      "OUTPUT_RATE": "38883000",
      "INPUT_PPS": "334",
      "OUTPUT_PPS": "10094",
      "INPUT_PACKETS": "8647579827",
      "OUTPUT_PACKETS": "86941746207",
      "RUNTS": "0",
      "GIANTS": "0",
      "INPUT_ERRORS": "1",
      "CRC": "0",
      "FRAME": "0",
      "OVERRUN": "0",
      "OUTPUT_ERRORS": "0"
    },
    {
      "INTERFACE": "FastEthernet1/0/2",
      "LINK_STATUS": "up",
      "PROTOCOL_STATUS": "up (connected)",
      "HARDWARE_TYPE": "Fast Ethernet",
      "MAC_ADDRESS": "0014.1c57.a484",
      "BIA": "0014.1c57.a484",
      "MTU": "1500",
      "DUPLEX": "Full-duplex",
      "SPEED": "100Mb/s",
      "MEDIA_TYPE": "10/100BaseTX",
      "BANDWIDTH": "100000 Kbit",
      "DELAY": "100 usec",
      "ENCAPSULATION": "ARPA",
      "LAST_INPUT": "never",
      "LAST_OUTPUT": "00:00:01",
      "LAST_OUTPUT_HANG": "never",
      "QUEUE_STRATEGY": "fifo",
      "INPUT_RATE": "38882000",
      "OUTPUT_RATE": "182000",
      "INPUT_PPS": "10093",
      "OUTPUT_PPS": "334",
      "INPUT_PACKETS": "86697408651",
      "OUTPUT_PACKETS": "8485702870",
      "RUNTS": "0",
      "GIANTS": "0",
      "INPUT_ERRORS": "0",
      "CRC": "0",
      "FRAME": "0",
      "OVERRUN": "0",
      "OUTPUT_ERRORS": "0"
    },
    {
      "INTERFACE": "FastEthernet1/0/3",
      "LINK_STATUS": "up",
      "PROTOCOL_STATUS": "up (connected)",
      "HARDWARE_TYPE": "Fast Ethernet",
      "MAC_ADDRESS": "0014.1c57.a485",
      "BIA": "0014.1c57.a485",
      "MTU": "1500",
      "DUPLEX": "Full-duplex",
      "SPEED": "100Mb/s",
      "MEDIA_TYPE": "10/100BaseTX",
      "BANDWIDTH": "100000 Kbit",
      "DELAY": "100 usec",
      "ENCAPSULATION": "ARPA",
      "LAST_INPUT": "never",
      "LAST_OUTPUT": "00:00:01",
      "LAST_OUTPUT_HANG": "never",
      "QUEUE_STRATEGY": "fifo",
      "INPUT_RATE": "0",
      "OUTPUT_RATE": "1000",
      "INPUT_PPS": "0",
      "OUTPUT_PPS": "1",
      "INPUT_PACKETS": "233361378",
      "OUTPUT_PACKETS": "246128007",
      "RUNTS": "0",
      "GIANTS": "0",
      "INPUT_ERRORS": "0",
      "CRC": "0",
      "FRAME": "0",
      "OVERRUN": "0",
      "OUTPUT_ERRORS": "0"
    },
    {
      "INTERFACE": "FastEthernet1/0/4",
      "LINK_STATUS": "down",
      "PROTOCOL_STATUS": "down (notconnect)",
      "HARDWARE_TYPE": "Fast Ethernet",
      "MAC_ADDRESS": "0014.1c57.a486",
      "BIA": "0014.1c57.a486",
      "MTU": "1500",
      "DUPLEX": "Auto-duplex",
      "SPEED": "Auto-speed",
      "MEDIA_TYPE": "10/100BaseTX",
      "BANDWIDTH": "10000 Kbit",
      "DELAY": "1000 usec",
      "ENCAPSULATION": "ARPA",
      "LAST_INPUT": "never",
      "LAST_OUTPUT": "never",
      "LAST_OUTPUT_HANG": "never",
      "QUEUE_STRATEGY": "fifo",
      "INPUT_RATE": "0",
      "OUTPUT_RATE": "0",
      "INPUT_PPS": "0",
      "OUTPUT_PPS": "0",
      "INPUT_PACKETS": "0",
      "OUTPUT_PACKETS": "0",
      "RUNTS": "0",
      "GIANTS": "0",
      "INPUT_ERRORS": "0",
      "CRC": "0",
      "FRAME": "0",
      "OVERRUN": "0",
      "OUTPUT_ERRORS": "0"
    },
    {
      "INTERFACE": "FastEthernet1/0/5",
      "LINK_STATUS": "down",
      "PROTOCOL_STATUS": "down (notconnect)",
      "HARDWARE_TYPE": "Fast Ethernet",
      "MAC_ADDRESS": "0014.1c57.a487",
      "BIA": "0014.1c57.a487",
      "MTU": "1500",
      "DUPLEX": "Auto-duplex",
      "SPEED": "Auto-speed",
      "MEDIA_TYPE": "10/100BaseTX",
      "BANDWIDTH": "10000 Kbit",
      "DELAY": "1000 usec",
      "ENCAPSULATION": "ARPA",
      "LAST_INPUT": "never",
      "LAST_OUTPUT": "never",
      "LAST_OUTPUT_HANG": "never",
      "QUEUE_STRATEGY": "fifo",
      "INPUT_RATE": "0",
      "OUTPUT_RATE": "0",
      "INPUT_PPS": "0",
      "OUTPUT_PPS": "0",
      "INPUT_PACKETS": "0",
      "OUTPUT_PACKETS": "0",
      "RUNTS": "0",
      "GIANTS": "0",
      "INPUT_ERRORS": "0",
      "CRC": "0",
      "FRAME": "0",
      "OVERRUN": "0",
      "OUTPUT_ERRORS": "0"
    },
    {
      "INTERFACE": "FastEthernet1/0/6",
      "LINK_STATUS": "down",
      "PROTOCOL_STATUS": "down (notconnect)",
      "HARDWARE_TYPE": "Fast Ethernet",
      "MAC_ADDRESS": "0014.1c57.a488",
      "BIA": "0014.1c57.a488",
      "MTU": "1500",
      "DUPLEX": "Auto-duplex",
      "SPEED": "Auto-speed",
      "MEDIA_TYPE": "10/100BaseTX",
      "BANDWIDTH": "10000 Kbit",
      "DELAY": "1000 usec",
      "ENCAPSULATION": "ARPA",
      "LAST_INPUT": "never",
      "LAST_OUTPUT": "never",
      "LAST_OUTPUT_HANG": "never",
      "QUEUE_STRATEGY": "fifo",
      "INPUT_RATE": "0",
      "OUTPUT_RATE": "0",
      "INPUT_PPS": "0",
      "OUTPUT_PPS": "0",
      "INPUT_PACKETS": "0",
      "OUTPUT_PACKETS": "0",
      "RUNTS": "0",
      "GIANTS": "0",
      "INPUT_ERRORS": "0",
      "CRC": "0",
      "FRAME": "0",
      "OVERRUN": "0",
      "OUTPUT_ERRORS": "0"
    },
    {
      "INTERFACE": "FastEthernet1/0/7",
      "LINK_STATUS": "down",
      "PROTOCOL_STATUS": "down (notconnect)",
      "HARDWARE_TYPE": "Fast Ethernet",
      "MAC_ADDRESS": "0014.1c57.a489",
      "BIA": "0014.1c57.a489",
      "MTU": "1500",
      "DUPLEX": "Auto-duplex",
      "SPEED": "Auto-speed",
      "MEDIA_TYPE": "10/100BaseTX",
      "BANDWIDTH": "10000 Kbit",
      "DELAY": "1000 usec",
      "ENCAPSULATION": "ARPA",
      "LAST_INPUT": "never",
      "LAST_OUTPUT": "never",
      "LAST_OUTPUT_HANG": "never",
      "QUEUE_STRATEGY": "fifo",
      "INPUT_RATE": "0",
      "OUTPUT_RATE": "0",
      "INPUT_PPS": "0",
      "OUTPUT_PPS": "0",
      "INPUT_PACKETS": "0",
      "OUTPUT_PACKETS": "0",
      "RUNTS": "0",
      "GIANTS": "0",
      "INPUT_ERRORS": "0",
      "CRC": "0",
      "FRAME": "0",
      "OVERRUN": "0",
      "OUTPUT_ERRORS": "0"
    },
    {
      "INTERFACE": "FastEthernet1/0/8",
      "LINK_STATUS": "down",
      "PROTOCOL_STATUS": "down (notconnect)",
      "HARDWARE_TYPE": "Fast Ethernet",
      "MAC_ADDRESS": "0014.1c57.a48a",
      "BIA": "0014.1c57.a48a",
      "MTU": "1500",
      "DUPLEX": "Auto-duplex",
      "SPEED": "Auto-speed",
      "MEDIA_TYPE": "10/100BaseTX",
      "BANDWIDTH": "10000 Kbit",
      "DELAY": "1000 usec",
      "ENCAPSULATION": "ARPA",
      "LAST_INPUT": "never",
      "LAST_OUTPUT": "never",
      "LAST_OUTPUT_HANG": "never",
      "QUEUE_STRATEGY": "fifo",
      "INPUT_RATE": "0",
      "OUTPUT_RATE": "0",
      "INPUT_PPS": "0",
      "OUTPUT_PPS": "0",
      "INPUT_PACKETS": "0",
      "OUTPUT_PACKETS": "0",
      "RUNTS": "0",
      "GIANTS": "0",
      "INPUT_ERRORS": "0",
      "CRC": "0",
      "FRAME": "0",
      "OVERRUN": "0",
      "OUTPUT_ERRORS": "0"
    },
    {
      "INTERFACE": "FastEthernet1/0/9",
      "LINK_STATUS": "up",
      "PROTOCOL_STATUS": "up (connected)",
      "HARDWARE_TYPE": "Fast Ethernet",
      "MAC_ADDRESS": "0014.1c57.a48b",
      "BIA": "0014.1c57.a48b",
      "MTU": "1500",
      "DUPLEX": "Full-duplex",
      "SPEED": "100Mb/s",
      "MEDIA_TYPE": "10/100BaseTX",
      "BANDWIDTH": "100000 Kbit",
      "DELAY": "100 usec",
      "ENCAPSULATION": "ARPA",
      "LAST_INPUT": "00:00:27",
      "LAST_OUTPUT": "00:00:00",
      "LAST_OUTPUT_HANG": "never",
      "QUEUE_STRATEGY": "fifo",
      "INPUT_RATE": "38871000",
      "OUTPUT_RATE": "174000",
      "INPUT_PPS": "10083",
      "OUTPUT_PPS": "327",
      "INPUT_PACKETS": "86293954347",
      "OUTPUT_PACKETS": "8120676183",
      "RUNTS": "0",
      "GIANTS": "0",
      "INPUT_ERRORS": "0",
      "CRC": "0",
      "FRAME": "0",
      "OVERRUN": "0",
      "OUTPUT_ERRORS": "0"
    },
    {
      "INTERFACE": "FastEthernet1/0/10",
      "LINK_STATUS": "up",
      "PROTOCOL_STATUS": "up (connected)",
      "HARDWARE_TYPE": "Fast Ethernet",
      "MAC_ADDRESS": "0014.1c57.a48c",
      "BIA": "0014.1c57.a48c",
      "MTU": "1500",
      "DUPLEX": "Full-duplex",
      "SPEED": "100Mb/s",
      "MEDIA_TYPE": "10/100BaseTX",
      "BANDWIDTH": "100000 Kbit",
      "DELAY": "100 usec",
      "ENCAPSULATION": "ARPA",
      "LAST_INPUT": "00:00:27",
      "LAST_OUTPUT": "00:00:00",
      "LAST_OUTPUT_HANG": "never",
      "QUEUE_STRATEGY": "fifo",
      "INPUT_RATE": "0",
      "OUTPUT_RATE": "0",
      "INPUT_PPS": "0",
      "OUTPUT_PPS": "0",
      "INPUT_PACKETS": "85011546",
      "OUTPUT_PACKETS": "118427887",
      "RUNTS": "0",
      "GIANTS": "0",
      "INPUT_ERRORS": "0",
      "CRC": "0",
      "FRAME": "0",
      "OVERRUN": "0",
      "OUTPUT_ERRORS": "0"
    },
    {
      "INTERFACE": "FastEthernet1/0/11",
      "LINK_STATUS": "down",
      "PROTOCOL_STATUS": "down (notconnect)",
      "HARDWARE_TYPE": "Fast Ethernet",
      "MAC_ADDRESS": "0014.1c57.a48d",
      "BIA": "0014.1c57.a48d",
      "MTU": "1500",
      "DUPLEX": "Auto-duplex",
      "SPEED": "Auto-speed",
      "MEDIA_TYPE": "10/100BaseTX",
      "BANDWIDTH": "100000 Kbit",
      "DELAY": "100 usec",
      "ENCAPSULATION": "ARPA",
      "LAST_INPUT": "21w5d",
      "LAST_OUTPUT": "21w5d",
      "LAST_OUTPUT_HANG": "never",
      "QUEUE_STRATEGY": "fifo",
      "INPUT_RATE": "0",
      "OUTPUT_RATE": "0",
      "INPUT_PPS": "0",
      "OUTPUT_PPS": "0",
      "INPUT_PACKETS": "13503663",
      "OUTPUT_PACKETS": "96706284",
      "RUNTS": "0",
      "GIANTS": "0",
      "INPUT_ERRORS": "0",
      "CRC": "0",
      "FRAME": "0",
      "OVERRUN": "0",
      "OUTPUT_ERRORS": "0"
    },
    {
      "INTERFACE": "FastEthernet1/0/12",
      "LINK_STATUS": "up",
      "PROTOCOL_STATUS": "up (connected)",
      "HARDWARE_TYPE": "Fast Ethernet",
      "MAC_ADDRESS": "0014.1c57.a48e",
      "BIA": "0014.1c57.a48e",
      "MTU": "1500",
      "DUPLEX": "Full-duplex",
      "SPEED": "100Mb/s",
      "MEDIA_TYPE": "10/100BaseTX",
      "BANDWIDTH": "100000 Kbit",
      "DELAY": "100 usec",
      "ENCAPSULATION": "ARPA",
      "LAST_INPUT": "00:00:27",
      "LAST_OUTPUT": "00:00:00",
      "LAST_OUTPUT_HANG": "never",
      "QUEUE_STRATEGY": "fifo",
      "INPUT_RATE": "0",
      "OUTPUT_RATE": "0",
      "INPUT_PPS": "0",
      "OUTPUT_PPS": "0",
      "INPUT_PACKETS": "566684",
      "OUTPUT_PACKETS": "10387099",
      "RUNTS": "0",
      "GIANTS": "0",
      "INPUT_ERRORS": "0",
      "CRC": "0",
      "FRAME": "0",
      "OVERRUN": "0",
      "OUTPUT_ERRORS": "0"
    },
    {
      "INTERFACE": "FastEthernet1/0/13",
      "LINK_STATUS": "up",
      "PROTOCOL_STATUS": "up (connected)",
      "HARDWARE_TYPE": "Fast Ethernet",
      "MAC_ADDRESS": "0014.1c57.a48f",
      "BIA": "0014.1c57.a48f",
      "MTU": "1500",
      "DUPLEX": "Full-duplex",
      "SPEED": "100Mb/s",
      "MEDIA_TYPE": "10/100BaseTX",
      "BANDWIDTH": "100000 Kbit",
      "DELAY": "100 usec",
      "ENCAPSULATION": "ARPA",
      "LAST_INPUT": "00:00:13",
      "LAST_OUTPUT": "00:00:00",
      "LAST_OUTPUT_HANG": "never",
      "QUEUE_STRATEGY": "fifo",
      "INPUT_RATE": "0",
      "OUTPUT_RATE": "0",
      "INPUT_PPS": "0",
      "OUTPUT_PPS": "0",
      "INPUT_PACKETS": "5093298",
      "OUTPUT_PACKETS": "35059143",
      "RUNTS": "0",
      "GIANTS": "0",
      "INPUT_ERRORS": "0",
      "CRC": "0",
      "FRAME": "0",
      "OVERRUN": "0",
      "OUTPUT_ERRORS": "0"
    },
    {
      "INTERFACE": "FastEthernet1/0/14",
      "LINK_STATUS": "up",
      "PROTOCOL_STATUS": "up (connected)",
      "HARDWARE_TYPE": "Fast Ethernet",
      "MAC_ADDRESS": "0014.1c57.a490",
      "BIA": "0014.1c57.a490",
      "MTU": "1500",
      "DUPLEX": "Full-duplex",
      "SPEED": "100Mb/s",
      "MEDIA_TYPE": "10/100BaseTX",
      "BANDWIDTH": "100000 Kbit",
      "DELAY": "100 usec",
      "ENCAPSULATION": "ARPA",
      "LAST_INPUT": "00:00:13",
      "LAST_OUTPUT": "00:00:00",
      "LAST_OUTPUT_HANG": "never",
      "QUEUE_STRATEGY": "fifo",
      "INPUT_RATE": "0",
      "OUTPUT_RATE": "0",
      "INPUT_PPS": "0",
      "OUTPUT_PPS": "0",
      "INPUT_PACKETS": "4381776",
      "OUTPUT_PACKETS": "33579140",
      "RUNTS": "0",
      "GIANTS": "0",
      "INPUT_ERRORS": "0",
      "CRC": "0",
      "FRAME": "0",
      "OVERRUN": "0",
      "OUTPUT_ERRORS": "0"
    },
    {
      "INTERFACE": "FastEthernet1/0/15",
      "LINK_STATUS": "down",
      "PROTOCOL_STATUS": "down (notconnect)",
      "HARDWARE_TYPE": "Fast Ethernet",
      "MAC_ADDRESS": "0014.1c57.a491",
      "BIA": "0014.1c57.a491",
      "MTU": "1500",
      "DUPLEX": "Auto-duplex",
      "SPEED": "Auto-speed",
      "MEDIA_TYPE": "10/100BaseTX",
      "BANDWIDTH": "100000 Kbit",
      "DELAY": "100 usec",
      "ENCAPSULATION": "ARPA",
      "LAST_INPUT": "36w5d",
      "LAST_OUTPUT": "36w5d",
      "LAST_OUTPUT_HANG": "never",
      "QUEUE_STRATEGY": "fifo",
      "INPUT_RATE": "0",
      "OUTPUT_RATE": "0",
      "INPUT_PPS": "0",
      "OUTPUT_PPS": "0",
      "INPUT_PACKETS": "6095906",
      "OUTPUT_PACKETS": "31933579",
      "RUNTS": "0",
      "GIANTS": "0",
      "INPUT_ERRORS": "0",
      "CRC": "0",
      "FRAME": "0",
      "OVERRUN": "0",
      "OUTPUT_ERRORS": "0"
    },
    {
      "INTERFACE": "FastEthernet1/0/16",
      "LINK_STATUS": "down",
      "PROTOCOL_STATUS": "down (notconnect)",
      "HARDWARE_TYPE": "Fast Ethernet",
      "MAC_ADDRESS": "0014.1c57.a492",
      "BIA": "0014.1c57.a492",
      "MTU": "1500",
      "DUPLEX": "Auto-duplex",
      "SPEED": "Auto-speed",
      "MEDIA_TYPE": "10/100BaseTX",
      "BANDWIDTH": "100000 Kbit",
      "DELAY": "100 usec",
      "ENCAPSULATION": "ARPA",
      "LAST_INPUT": "36w5d",
      "LAST_OUTPUT": "36w5d",
      "LAST_OUTPUT_HANG": "never",
      "QUEUE_STRATEGY": "fifo",
      "INPUT_RATE": "0",
      "OUTPUT_RATE": "0",
      "INPUT_PPS": "0",
      "OUTPUT_PPS": "0",
      "INPUT_PACKETS": "3048741",
      "OUTPUT_PACKETS": "23191458",
      "RUNTS": "0",
      "GIANTS": "0",
      "INPUT_ERRORS": "0",
      "CRC": "0",
      "FRAME": "0",
      "OVERRUN": "0",
      "OUTPUT_ERRORS": "0"
    },
    {
      "INTERFACE": "FastEthernet1/0/17",
      "LINK_STATUS": "down",
      "PROTOCOL_STATUS": "down (notconnect)",
      "HARDWARE_TYPE": "Fast Ethernet",
      "MAC_ADDRESS": "0014.1c57.a493",
      "BIA": "0014.1c57.a493",
      "MTU": "1500",
      "DUPLEX": "Auto-duplex",
      "SPEED": "Auto-speed",
      "MEDIA_TYPE": "10/100BaseTX",
      "BANDWIDTH": "100000 Kbit",
      "DELAY": "100 usec",
      "ENCAPSULATION": "ARPA",
      "LAST_INPUT": "1y28w",
      "LAST_OUTPUT": "1y28w",
      "LAST_OUTPUT_HANG": "never",
      "QUEUE_STRATEGY": "fifo",
      "INPUT_RATE": "0",
      "OUTPUT_RATE": "0",
      "INPUT_PPS": "0",
      "OUTPUT_PPS": "0",
      "INPUT_PACKETS": "515815",
      "OUTPUT_PACKETS": "3364092",
      "RUNTS": "0",
      "GIANTS": "0",
      "INPUT_ERRORS": "0",
      "CRC": "0",
      "FRAME": "0",
      "OVERRUN": "0",
      "OUTPUT_ERRORS": "0"
    },
    {
      "INTERFACE": "FastEthernet1/0/18",
      "LINK_STATUS": "down",
      "PROTOCOL_STATUS": "down (notconnect)",
      "HARDWARE_TYPE": "Fast Ethernet",
      "MAC_ADDRESS": "0014.1c57.a494",
      "BIA": "0014.1c57.a494",
      "MTU": "1500",
      "DUPLEX": "Auto-duplex",
      "SPEED": "Auto-speed",
      "MEDIA_TYPE": "10/100BaseTX",
      "BANDWIDTH": "100000 Kbit",
      "DELAY": "100 usec",
      "ENCAPSULATION": "ARPA",
      "LAST_INPUT": "1y29w",
      "LAST_OUTPUT": "1y29w",
      "LAST_OUTPUT_HANG": "never",
      "QUEUE_STRATEGY": "fifo",
      "INPUT_RATE": "0",
      "OUTPUT_RATE": "0",
      "INPUT_PPS": "0",
      "OUTPUT_PPS": "0",
      "INPUT_PACKETS": "56335",
      "OUTPUT_PACKETS": "2263838",
      "RUNTS": "0",
      "GIANTS": "0",
      "INPUT_ERRORS": "0",
      "CRC": "0",
      "FRAME": "0",
      "OVERRUN": "0",
      "OUTPUT_ERRORS": "0"
    },
    {
      "INTERFACE": "FastEthernet1/0/19",
      "LINK_STATUS": "up",
      "PROTOCOL_STATUS": "up (connected)",
      "HARDWARE_TYPE": "Fast Ethernet",
      "MAC_ADDRESS": "0014.1c57.a495",
      "BIA": "0014.1c57.a495",
      "MTU": "1500",
      "DUPLEX": "Full-duplex",
      "SPEED": "100Mb/s",
      "MEDIA_TYPE": "10/100BaseTX",
      "BANDWIDTH": "100000 Kbit",
      "DELAY": "100 usec",
      "ENCAPSULATION": "ARPA",
      "LAST_INPUT": "00:00:13",
      "LAST_OUTPUT": "00:00:00",
      "LAST_OUTPUT_HANG": "never",
      "QUEUE_STRATEGY": "fifo",
      "INPUT_RATE": "0",
      "OUTPUT_RATE": "0",
      "INPUT_PPS": "0",
      "OUTPUT_PPS": "0",
      "INPUT_PACKETS": "2154038",
      "OUTPUT_PACKETS": "15816478",
      "RUNTS": "0",
      "GIANTS": "0",
      "INPUT_ERRORS": "0",
      "CRC": "0",
      "FRAME": "0",
      "OVERRUN": "0",
      "OUTPUT_ERRORS": "0"
    },
    {
      "INTERFACE": "FastEthernet1/0/20",
      "LINK_STATUS": "up",
      "PROTOCOL_STATUS": "up (connected)",
      "HARDWARE_TYPE": "Fast Ethernet",
      "MAC_ADDRESS": "0014.1c57.a496",
      "BIA": "0014.1c57.a496",
      "MTU": "1500",
      "DUPLEX": "Full-duplex",
      "SPEED": "100Mb/s",
      "MEDIA_TYPE": "10/100BaseTX",
      "BANDWIDTH": "100000 Kbit",
      "DELAY": "100 usec",
      "ENCAPSULATION": "ARPA",
      "LAST_INPUT": "00:00:13",
      "LAST_OUTPUT": "00:00:00",
      "LAST_OUTPUT_HANG": "never",
      "QUEUE_STRATEGY": "fifo",
      "INPUT_RATE": "0",
      "OUTPUT_RATE": "0",
      "INPUT_PPS": "0",
      "OUTPUT_PPS": "0",
      "INPUT_PACKETS": "2238092",
      "OUTPUT_PACKETS": "15877977",
      "RUNTS": "0",
      "GIANTS": "0",
      "INPUT_ERRORS": "0",
      "CRC": "0",
      "FRAME": "0",
      "OVERRUN": "0",
      "OUTPUT_ERRORS": "0"
    },
    {
      "INTERFACE": "FastEthernet1/0/21",
      "LINK_STATUS": "up",
      "PROTOCOL_STATUS": "up (connected)",
      "HARDWARE_TYPE": "Fast Ethernet",
      "MAC_ADDRESS": "0014.1c57.a497",
      "BIA": "0014.1c57.a497",
      "MTU": "1500",
      "DUPLEX": "Full-duplex",
      "SPEED": "100Mb/s",
      "MEDIA_TYPE": "10/100BaseTX",
      "BANDWIDTH": "100000 Kbit",
      "DELAY": "100 usec",
      "ENCAPSULATION": "ARPA",
      "LAST_INPUT": "00:00:25",
      "LAST_OUTPUT": "00:00:00",
      "LAST_OUTPUT_HANG": "never",
      "QUEUE_STRATEGY": "fifo",
      "INPUT_RATE": "0",
      "OUTPUT_RATE": "0",
      "INPUT_PPS": "0",
      "OUTPUT_PPS": "0",
      "INPUT_PACKETS": "4942593",
      "OUTPUT_PACKETS": "43723513",
      "RUNTS": "0",
      "GIANTS": "0",
      "INPUT_ERRORS": "1",
      "CRC": "0",
      "FRAME": "0",
      "OVERRUN": "0",
      "OUTPUT_ERRORS": "0"
    },
    {
      "INTERFACE": "FastEthernet1/0/22",
      "LINK_STATUS": "up",
      "PROTOCOL_STATUS": "up (connected)",
      "HARDWARE_TYPE": "Fast Ethernet",
      "MAC_ADDRESS": "0014.1c57.a498",
      "BIA": "0014.1c57.a498",
      "MTU": "1500",
      "DUPLEX": "Full-duplex",
      "SPEED": "100Mb/s",
      "MEDIA_TYPE": "10/100BaseTX",
      "BANDWIDTH": "100000 Kbit",
      "DELAY": "100 usec",
      "ENCAPSULATION": "ARPA",
      "LAST_INPUT": "00:00:00",
      "LAST_OUTPUT": "00:00:00",
      "LAST_OUTPUT_HANG": "never",
      "QUEUE_STRATEGY": "fifo",
      "INPUT_RATE": "0",
      "OUTPUT_RATE": "0",
      "INPUT_PPS": "0",
      "OUTPUT_PPS": "0",
      "INPUT_PACKETS": "6201152",
      "OUTPUT_PACKETS": "43660027",
      "RUNTS": "0",
      "GIANTS": "0",
      "INPUT_ERRORS": "1",
      "CRC": "0",
      "FRAME": "0",
      "OVERRUN": "0",
      "OUTPUT_ERRORS": "0"
    },
    {
      "INTERFACE": "FastEthernet1/0/23",
      "LINK_STATUS": "down",
      "PROTOCOL_STATUS": "down (notconnect)",
      "HARDWARE_TYPE": "Fast Ethernet",
      "MAC_ADDRESS": "0014.1c57.a499",
      "BIA": "0014.1c57.a499",
      "MTU": "1500",
      "DUPLEX": "Auto-duplex",
      "SPEED": "Auto-speed",
      "MEDIA_TYPE": "10/100BaseTX",
      "BANDWIDTH": "100000 Kbit",
      "DELAY": "100 usec",
      "ENCAPSULATION": "ARPA",
      "LAST_INPUT": "never",
      "LAST_OUTPUT": "25w5d",
      "LAST_OUTPUT_HANG": "never",
      "QUEUE_STRATEGY": "fifo",
      "INPUT_RATE": "0",
      "OUTPUT_RATE": "0",
      "INPUT_PPS": "0",
      "OUTPUT_PPS": "0",
      "INPUT_PACKETS": "0",
      "OUTPUT_PACKETS": "56",
      "RUNTS": "0",
      "GIANTS": "0",
      "INPUT_ERRORS": "0",
      "CRC": "0",
      "FRAME": "0",
      "OVERRUN": "0",
      "OUTPUT_ERRORS": "0"
    },
    {
      "INTERFACE": "FastEthernet1/0/24",
      "LINK_STATUS": "up",
      "PROTOCOL_STATUS": "up (connected)",
      "HARDWARE_TYPE": "Fast Ethernet",
      "MAC_ADDRESS": "0014.1c57.a49a",
      "BIA": "0014.1c57.a49a",
      "MTU": "1500",
      "DUPLEX": "Full-duplex",
      "SPEED": "100Mb/s",
      "MEDIA_TYPE": "10/100BaseTX",
      "BANDWIDTH": "100000 Kbit",
      "DELAY": "100 usec",
      "ENCAPSULATION": "ARPA",
      "LAST_INPUT": "00:00:05",
      "LAST_OUTPUT": "00:00:00",
      "LAST_OUTPUT_HANG": "never",
      "QUEUE_STRATEGY": "fifo",
      "INPUT_RATE": "0",
      "OUTPUT_RATE": "0",
      "INPUT_PPS": "0",
      "OUTPUT_PPS": "0",
      "INPUT_PACKETS": "2397801",
      "OUTPUT_PACKETS": "45635335",
      "RUNTS": "0",
      "GIANTS": "0",
      "INPUT_ERRORS": "0",
      "CRC": "0",
      "FRAME": "0",
      "OVERRUN": "0",
      "OUTPUT_ERRORS": "0"
    },
    {
      "INTERFACE": "FastEthernet1/0/25",
      "LINK_STATUS": "down",
      "PROTOCOL_STATUS": "down (notconnect)",
      "HARDWARE_TYPE": "Fast Ethernet",
      "MAC_ADDRESS": "0014.1c57.a49d",
      "BIA": "0014.1c57.a49d",
      "MTU": "1500",
      "DUPLEX": "Auto-duplex",
      "SPEED": "Auto-speed",
      "MEDIA_TYPE": "10/100BaseTX",
      "BANDWIDTH": "10000 Kbit",
      "DELAY": "1000 usec",
      "ENCAPSULATION": "ARPA",
      "LAST_INPUT": "never",
      "LAST_OUTPUT": "never",
      "LAST_OUTPUT_HANG": "never",
      "QUEUE_STRATEGY": "fifo",
      "INPUT_RATE": "0",
      "OUTPUT_RATE": "0",
      "INPUT_PPS": "0",
      "OUTPUT_PPS": "0",
      "INPUT_PACKETS": "0",
      "OUTPUT_PACKETS": "0",
      "RUNTS": "0",
      "GIANTS": "0",
      "INPUT_ERRORS": "0",
      "CRC": "0",
      "FRAME": "0",
      "OVERRUN": "0",
      "OUTPUT_ERRORS": "0"
    },
    {
      "INTERFACE": "FastEthernet1/0/26",
      "LINK_STATUS": "down",
      "PROTOCOL_STATUS": "down (notconnect)",
      "HARDWARE_TYPE": "Fast Ethernet",
      "MAC_ADDRESS": "0014.1c57.a49e",
      "BIA": "0014.1c57.a49e",
      "MTU": "1500",
      "DUPLEX": "Auto-duplex",
      "SPEED": "Auto-speed",
      "MEDIA_TYPE": "10/100BaseTX",
      "BANDWIDTH": "10000 Kbit",
      "DELAY": "1000 usec",
      "ENCAPSULATION": "ARPA",
      "LAST_INPUT": "never",
      "LAST_OUTPUT": "never",
      "LAST_OUTPUT_HANG": "never",
      "QUEUE_STRATEGY": "fifo",
      "INPUT_RATE": "0",
      "OUTPUT_RATE": "0",
      "INPUT_PPS": "0",
      "OUTPUT_PPS": "0",
      "INPUT_PACKETS": "0",
      "OUTPUT_PACKETS": "0",
      "RUNTS": "0",
      "GIANTS": "0",
      "INPUT_ERRORS": "0",
      "CRC": "0",
      "FRAME": "0",
      "OVERRUN": "0",
      "OUTPUT_ERRORS": "0"
    },
    {
      "INTERFACE": "FastEthernet1/0/27",
      "LINK_STATUS": "up",
      "PROTOCOL_STATUS": "up (connected)",
      "HARDWARE_TYPE": "Fast Ethernet",
      "MAC_ADDRESS": "0014.1c57.a49f",
      "BIA": "0014.1c57.a49f",
      "MTU": "1500",
      "DUPLEX": "Half-duplex",
      "SPEED": "100Mb/s",
      "MEDIA_TYPE": "10/100BaseTX",
      "BANDWIDTH": "100000 Kbit",
      "DELAY": "100 usec",
      "ENCAPSULATION": "ARPA",
      "LAST_INPUT": "never",
      "LAST_OUTPUT": "00:00:00",
      "LAST_OUTPUT_HANG": "never",
      "QUEUE_STRATEGY": "fifo",
      "INPUT_RATE": "0",
      "OUTPUT_RATE": "0",
      "INPUT_PPS": "0",
      "OUTPUT_PPS": "0",
      "INPUT_PACKETS": "288816",
      "OUTPUT_PACKETS": "55357995",
      "RUNTS": "0",
      "GIANTS": "0",
      "INPUT_ERRORS": "0",
      "CRC": "0",
      "FRAME": "0",
      "OVERRUN": "0",
      "OUTPUT_ERRORS": "0"
    },
    {
      "INTERFACE": "FastEthernet1/0/28",
      "LINK_STATUS": "up",
      "PROTOCOL_STATUS": "up (connected)",
      "HARDWARE_TYPE": "Fast Ethernet",
      "MAC_ADDRESS": "0014.1c57.a4a0",
      "BIA": "0014.1c57.a4a0",
      "MTU": "1500",
      "DUPLEX": "Full-duplex",
      "SPEED": "100Mb/s",
      "MEDIA_TYPE": "10/100BaseTX",
      "BANDWIDTH": "100000 Kbit",
      "DELAY": "100 usec",
      "ENCAPSULATION": "ARPA",
      "LAST_INPUT": "never",
      "LAST_OUTPUT": "00:00:00",
      "LAST_OUTPUT_HANG": "never",
      "QUEUE_STRATEGY": "fifo",
      "INPUT_RATE": "0",
      "OUTPUT_RATE": "0",
      "INPUT_PPS": "0",
      "OUTPUT_PPS": "0",
      "INPUT_PACKETS": "295313",
      "OUTPUT_PACKETS": "55364859",
      "RUNTS": "0",
      "GIANTS": "0",
      "INPUT_ERRORS": "2",
      "CRC": "1",
      "FRAME": "0",
      "OVERRUN": "0",
      "OUTPUT_ERRORS": "0"
    },
    {
      "INTERFACE": "FastEthernet1/0/29",
      "LINK_STATUS": "up",
      "PROTOCOL_STATUS": "up (connected)",
      "HARDWARE_TYPE": "Fast Ethernet",
      "MAC_ADDRESS": "0014.1c57.a4a1",
      "BIA": "0014.1c57.a4a1",
      "MTU": "1500",
      "DUPLEX": "Full-duplex",
      "SPEED": "100Mb/s",
      "MEDIA_TYPE": "10/100BaseTX",
      "BANDWIDTH": "100000 Kbit",
      "DELAY": "100 usec",
      "ENCAPSULATION": "ARPA",
      "LAST_INPUT": "never",
      "LAST_OUTPUT": "00:00:00",
      "LAST_OUTPUT_HANG": "never",
      "QUEUE_STRATEGY": "fifo",
      "INPUT_RATE": "1000",
      "OUTPUT_RATE": "2000",
      "INPUT_PPS": "1",
      "OUTPUT_PPS": "2",
      "INPUT_PACKETS": "39214781",
      "OUTPUT_PACKETS": "90202230",
      "RUNTS": "0",
      "GIANTS": "39",
      "INPUT_ERRORS": "28898",
      "CRC": "14167",
      "FRAME": "0",
      "OVERRUN": "0",
      "OUTPUT_ERRORS": "0"
    },
    {
      "INTERFACE": "FastEthernet1/0/30",
      "LINK_STATUS": "up",
      "PROTOCOL_STATUS": "up (connected)",
      "HARDWARE_TYPE": "Fast Ethernet",
      "MAC_ADDRESS": "0014.1c57.a4a2",
      "BIA": "0014.1c57.a4a2",
      "MTU": "1500",
      "DUPLEX": "Full-duplex",
      "SPEED": "100Mb/s",
      "MEDIA_TYPE": "10/100BaseTX",
      "BANDWIDTH": "100000 Kbit",
      "DELAY": "100 usec",
      "ENCAPSULATION": "ARPA",
      "LAST_INPUT": "never",
      "LAST_OUTPUT": "00:00:00",
      "LAST_OUTPUT_HANG": "never",
      "QUEUE_STRATEGY": "fifo",
      "INPUT_RATE": "0",
      "OUTPUT_RATE": "0",
      "INPUT_PPS": "0",
      "OUTPUT_PPS": "0",
      "INPUT_PACKETS": "4811284",
      "OUTPUT_PACKETS": "55162378",
      "RUNTS": "0",
      "GIANTS": "0",
      "INPUT_ERRORS": "0",
      "CRC": "0",
      "FRAME": "0",
      "OVERRUN": "0",
      "OUTPUT_ERRORS": "0"
    },
    {
      "INTERFACE": "FastEthernet1/0/31",
      "LINK_STATUS": "up",
      "PROTOCOL_STATUS": "up (connected)",
      "HARDWARE_TYPE": "Fast Ethernet",
      "MAC_ADDRESS": "0014.1c57.a4a3",
      "BIA": "0014.1c57.a4a3",
      "MTU": "1500",
      "DUPLEX": "Full-duplex",
      "SPEED": "100Mb/s",
      "MEDIA_TYPE": "10/100BaseTX",
      "BANDWIDTH": "100000 Kbit",
      "DELAY": "100 usec",
      "ENCAPSULATION": "ARPA",
      "LAST_INPUT": "00:00:13",
      "LAST_OUTPUT": "00:00:00",
      "LAST_OUTPUT_HANG": "never",
      "QUEUE_STRATEGY": "fifo",
      "INPUT_RATE": "0",
      "OUTPUT_RATE": "0",
      "INPUT_PPS": "0",
      "OUTPUT_PPS": "0",
      "INPUT_PACKETS": "2255624",
      "OUTPUT_PACKETS": "15969856",
      "RUNTS": "0",
      "GIANTS": "0",
      "INPUT_ERRORS": "0",
      "CRC": "0",
      "FRAME": "0",
      "OVERRUN": "0",
      "OUTPUT_ERRORS": "0"
    },
    {
      "INTERFACE": "FastEthernet1/0/32",
      "LINK_STATUS": "up",
      "PROTOCOL_STATUS": "up (connected)",
      "HARDWARE_TYPE": "Fast Ethernet",
      "MAC_ADDRESS": "0014.1c57.a4a4",
      "BIA": "0014.1c57.a4a4",
      "MTU": "1500",
      "DUPLEX": "Full-duplex",
      "SPEED": "100Mb/s",
      "MEDIA_TYPE": "10/100BaseTX",
      "BANDWIDTH": "100000 Kbit",
      "DELAY": "100 usec",
      "ENCAPSULATION": "ARPA",
      "LAST_INPUT": "00:00:13",
      "LAST_OUTPUT": "00:00:00",
      "LAST_OUTPUT_HANG": "never",
      "QUEUE_STRATEGY": "fifo",
      "INPUT_RATE": "0",
      "OUTPUT_RATE": "0",
      "INPUT_PPS": "0",
      "OUTPUT_PPS": "0",
      "INPUT_PACKETS": "5743877",
      "OUTPUT_PACKETS": "20133314",
      "RUNTS": "0",
      "GIANTS": "0",
      "INPUT_ERRORS": "0",
      "CRC": "0",
      "FRAME": "0",
      "OVERRUN": "0",
      "OUTPUT_ERRORS": "0"
    },
    {
      "INTERFACE": "FastEthernet1/0/33",
      "LINK_STATUS": "up",
      "PROTOCOL_STATUS": "up (connected)",
      "HARDWARE_TYPE": "Fast Ethernet",
      "MAC_ADDRESS": "0014.1c57.a4a5",
      "BIA": "0014.1c57.a4a5",
      "MTU": "1500",
      "DUPLEX": "Full-duplex",
      "SPEED": "100Mb/s",
      "MEDIA_TYPE": "10/100BaseTX",
      "BANDWIDTH": "100000 Kbit",
      "DELAY": "100 usec",
      "ENCAPSULATION": "ARPA",
      "LAST_INPUT": "00:00:13",
      "LAST_OUTPUT": "00:00:00",
      "LAST_OUTPUT_HANG": "never",
      "QUEUE_STRATEGY": "fifo",
      "INPUT_RATE": "0",
      "OUTPUT_RATE": "0",
      "INPUT_PPS": "0",
      "OUTPUT_PPS": "0",
      "INPUT_PACKETS": "11086568",
      "OUTPUT_PACKETS": "46398900",
      "RUNTS": "0",
      "GIANTS": "0",
      "INPUT_ERRORS": "1",
      "CRC": "0",
      "FRAME": "0",
      "OVERRUN": "0",
      "OUTPUT_ERRORS": "0"
    },
    {
      "INTERFACE": "FastEthernet1/0/34",
      "LINK_STATUS": "up",
      "PROTOCOL_STATUS": "up (connected)",
      "HARDWARE_TYPE": "Fast Ethernet",
      "MAC_ADDRESS": "0014.1c57.a4a6",
      "BIA": "0014.1c57.a4a6",
      "MTU": "1500",
      "DUPLEX": "Full-duplex",
      "SPEED": "100Mb/s",
      "MEDIA_TYPE": "10/100BaseTX",
      "BANDWIDTH": "100000 Kbit",
      "DELAY": "100 usec",
      "ENCAPSULATION": "ARPA",
      "LAST_INPUT": "00:00:13",
      "LAST_OUTPUT": "00:00:00",
      "LAST_OUTPUT_HANG": "never",
      "QUEUE_STRATEGY": "fifo",
      "INPUT_RATE": "0",
      "OUTPUT_RATE": "0",
      "INPUT_PPS": "0",
      "OUTPUT_PPS": "0",
      "INPUT_PACKETS": "1071483",
      "OUTPUT_PACKETS": "11192764",
      "RUNTS": "0",
      "GIANTS": "0",
      "INPUT_ERRORS": "0",
      "CRC": "0",
      "FRAME": "0",
      "OVERRUN": "0",
      "OUTPUT_ERRORS": "0"
    },
    {
      "INTERFACE": "FastEthernet1/0/35",
      "LINK_STATUS": "up",
      "PROTOCOL_STATUS": "up (connected)",
      "HARDWARE_TYPE": "Fast Ethernet",
      "MAC_ADDRESS": "0014.1c57.a4a7",
      "BIA": "0014.1c57.a4a7",
      "MTU": "1500",
      "DUPLEX": "Full-duplex",
      "SPEED": "100Mb/s",
      "MEDIA_TYPE": "10/100BaseTX",
      "BANDWIDTH": "100000 Kbit",
      "DELAY": "100 usec",
      "ENCAPSULATION": "ARPA",
      "LAST_INPUT": "25w5d",
      "LAST_OUTPUT": "00:00:00",
      "LAST_OUTPUT_HANG": "never",
      "QUEUE_STRATEGY": "fifo",
      "INPUT_RATE": "3000",
      "OUTPUT_RATE": "2000",
      "INPUT_PPS": "3",
      "OUTPUT_PPS": "3",
      "INPUT_PACKETS": "252774135",
      "OUTPUT_PACKETS": "136849790",
      "RUNTS": "0",
      "GIANTS": "0",
      "INPUT_ERRORS": "0",
      "CRC": "0",
      "FRAME": "0",
      "OVERRUN": "0",
      "OUTPUT_ERRORS": "0"
    },
    {
      "INTERFACE": "FastEthernet1/0/36",
      "LINK_STATUS": "up",
      "PROTOCOL_STATUS": "up (connected)",
      "HARDWARE_TYPE": "Fast Ethernet",
      "MAC_ADDRESS": "0014.1c57.a4a8",
      "BIA": "0014.1c57.a4a8",
      "MTU": "1500",
      "DUPLEX": "Full-duplex",
      "SPEED": "100Mb/s",
      "MEDIA_TYPE": "10/100BaseTX",
      "BANDWIDTH": "100000 Kbit",
      "DELAY": "100 usec",
      "ENCAPSULATION": "ARPA",
      "LAST_INPUT": "00:00:00",
      "LAST_OUTPUT": "00:00:00",
      "LAST_OUTPUT_HANG": "never",
      "QUEUE_STRATEGY": "fifo",
      "INPUT_RATE": "0",
      "OUTPUT_RATE": "0",
      "INPUT_PPS": "0",
      "OUTPUT_PPS": "0",
      "INPUT_PACKETS": "30561744",
      "OUTPUT_PACKETS": "25816556",
      "RUNTS": "0",
      "GIANTS": "0",
      "INPUT_ERRORS": "0",
      "CRC": "0",
      "FRAME": "0",
      "OVERRUN": "0",
      "OUTPUT_ERRORS": "0"
    },
    {
      "INTERFACE": "FastEthernet1/0/37",
      "LINK_STATUS": "down",
      "PROTOCOL_STATUS": "down (notconnect)",
      "HARDWARE_TYPE": "Fast Ethernet",
      "MAC_ADDRESS": "0014.1c57.a4a9",
      "BIA": "0014.1c57.a4a9",
      "MTU": "1500",
      "DUPLEX": "Auto-duplex",
      "SPEED": "Auto-speed",
      "MEDIA_TYPE": "10/100BaseTX",
      "BANDWIDTH": "100000 Kbit",
      "DELAY": "100 usec",
      "ENCAPSULATION": "ARPA",
      "LAST_INPUT": "25w5d",
      "LAST_OUTPUT": "25w5d",
      "LAST_OUTPUT_HANG": "never",
      "QUEUE_STRATEGY": "fifo",
      "INPUT_RATE": "0",
      "OUTPUT_RATE": "0",
      "INPUT_PPS": "0",
      "OUTPUT_PPS": "0",
      "INPUT_PACKETS": "23",
      "OUTPUT_PACKETS": "110",
      "RUNTS": "0",
      "GIANTS": "0",
      "INPUT_ERRORS": "0",
      "CRC": "0",
      "FRAME": "0",
      "OVERRUN": "0",
      "OUTPUT_ERRORS": "0"
    },
    {
      "INTERFACE": "FastEthernet1/0/38",
      "LINK_STATUS": "down",
      "PROTOCOL_STATUS": "down (notconnect)",
      "HARDWARE_TYPE": "Fast Ethernet",
      "MAC_ADDRESS": "0014.1c57.a4aa",
      "BIA": "0014.1c57.a4aa",
      "MTU": "1500",
      "DUPLEX": "Auto-duplex",
      "SPEED": "Auto-speed",
      "MEDIA_TYPE": "10/100BaseTX",
      "BANDWIDTH": "10000 Kbit",
      "DELAY": "1000 usec",
      "ENCAPSULATION": "ARPA",
      "LAST_INPUT": "never",
      "LAST_OUTPUT": "never",
      "LAST_OUTPUT_HANG": "never",
      "QUEUE_STRATEGY": "fifo",
      "INPUT_RATE": "0",
      "OUTPUT_RATE": "0",
      "INPUT_PPS": "0",
      "OUTPUT_PPS": "0",
      "INPUT_PACKETS": "0",
      "OUTPUT_PACKETS": "0",
      "RUNTS": "0",
      "GIANTS": "0",
      "INPUT_ERRORS": "0",
      "CRC": "0",
      "FRAME": "0",
      "OVERRUN": "0",
      "OUTPUT_ERRORS": "0"
    },
    {
      "INTERFACE": "FastEthernet1/0/39",
      "LINK_STATUS": "down",
      "PROTOCOL_STATUS": "down (notconnect)",
      "HARDWARE_TYPE": "Fast Ethernet",
      "MAC_ADDRESS": "0014.1c57.a4ab",
      "BIA": "0014.1c57.a4ab",
      "MTU": "1500",
      "DUPLEX": "Auto-duplex",
      "SPEED": "Auto-speed",
      "MEDIA_TYPE": "10/100BaseTX",
      "BANDWIDTH": "10000 Kbit",
      "DELAY": "1000 usec",
      "ENCAPSULATION": "ARPA",
      "LAST_INPUT": "never",
      "LAST_OUTPUT": "never",
      "LAST_OUTPUT_HANG": "never",
      "QUEUE_STRATEGY": "fifo",
      "INPUT_RATE": "0",
      "OUTPUT_RATE": "0",
      "INPUT_PPS": "0",
      "OUTPUT_PPS": "0",
      "INPUT_PACKETS": "0",
      "OUTPUT_PACKETS": "0",
      "RUNTS": "0",
      "GIANTS": "0",
      "INPUT_ERRORS": "0",
      "CRC": "0",
      "FRAME": "0",
      "OVERRUN": "0",
      "OUTPUT_ERRORS": "0"
    },
    {
      "INTERFACE": "FastEthernet1/0/40",
      "LINK_STATUS": "down",
      "PROTOCOL_STATUS": "down (notconnect)",
      "HARDWARE_TYPE": "Fast Ethernet",
      "MAC_ADDRESS": "0014.1c57.a4ac",
      "BIA": "0014.1c57.a4ac",
      "MTU": "1500",
      "DUPLEX": "Auto-duplex",
      "SPEED": "Auto-speed",
      "MEDIA_TYPE": "10/100BaseTX",
      "BANDWIDTH": "10000 Kbit",
      "DELAY": "1000 usec",
      "ENCAPSULATION": "ARPA",
      "LAST_INPUT": "never",
      "LAST_OUTPUT": "never",
      "LAST_OUTPUT_HANG": "never",
      "QUEUE_STRATEGY": "fifo",
      "INPUT_RATE": "0",
      "OUTPUT_RATE": "0",
      "INPUT_PPS": "0",
      "OUTPUT_PPS": "0",
      "INPUT_PACKETS": "0",
      "OUTPUT_PACKETS": "0",
      "RUNTS": "0",
      "GIANTS": "0",
      "INPUT_ERRORS": "0",
      "CRC": "0",
      "FRAME": "0",
      "OVERRUN": "0",
      "OUTPUT_ERRORS": "0"
    },
    {
      "INTERFACE": "FastEthernet1/0/41",
      "LINK_STATUS": "down",
      "PROTOCOL_STATUS": "down (notconnect)",
      "HARDWARE_TYPE": "Fast Ethernet",
      "MAC_ADDRESS": "0014.1c57.a4ad",
      "BIA": "0014.1c57.a4ad",
      "MTU": "1500",
      "DUPLEX": "Auto-duplex",
      "SPEED": "Auto-speed",
      "MEDIA_TYPE": "10/100BaseTX",
      "BANDWIDTH": "10000 Kbit",
      "DELAY": "1000 usec",
      "ENCAPSULATION": "ARPA",
      "LAST_INPUT": "never",
      "LAST_OUTPUT": "never",
      "LAST_OUTPUT_HANG": "never",
      "QUEUE_STRATEGY": "fifo",
      "INPUT_RATE": "0",
      "OUTPUT_RATE": "0",
      "INPUT_PPS": "0",
      "OUTPUT_PPS": "0",
      "INPUT_PACKETS": "0",
      "OUTPUT_PACKETS": "0",
      "RUNTS": "0",
      "GIANTS": "0",
      "INPUT_ERRORS": "0",
      "CRC": "0",
      "FRAME": "0",
      "OVERRUN": "0",
      "OUTPUT_ERRORS": "0"
    },
    {
      "INTERFACE": "FastEthernet1/0/42",
      "LINK_STATUS": "down",
      "PROTOCOL_STATUS": "down (notconnect)",
      "HARDWARE_TYPE": "Fast Ethernet",
      "MAC_ADDRESS": "0014.1c57.a4ae",
      "BIA": "0014.1c57.a4ae",
      "MTU": "1500",
      "DUPLEX": "Auto-duplex",
      "SPEED": "Auto-speed",
      "MEDIA_TYPE": "10/100BaseTX",
      "BANDWIDTH": "10000 Kbit",
      "DELAY": "1000 usec",
      "ENCAPSULATION": "ARPA",
      "LAST_INPUT": "never",
      "LAST_OUTPUT": "never",
      "LAST_OUTPUT_HANG": "never",
      "QUEUE_STRATEGY": "fifo",
      "INPUT_RATE": "0",
      "OUTPUT_RATE": "0",
      "INPUT_PPS": "0",
      "OUTPUT_PPS": "0",
      "INPUT_PACKETS": "0",
      "OUTPUT_PACKETS": "0",
      "RUNTS": "0",
      "GIANTS": "0",
      "INPUT_ERRORS": "0",
      "CRC": "0",
      "FRAME": "0",
      "OVERRUN": "0",
      "OUTPUT_ERRORS": "0"
    },
    {
      "INTERFACE": "FastEthernet1/0/43",
      "LINK_STATUS": "down",
      "PROTOCOL_STATUS": "down (notconnect)",
      "HARDWARE_TYPE": "Fast Ethernet",
      "MAC_ADDRESS": "0014.1c57.a4af",
      "BIA": "0014.1c57.a4af",
      "MTU": "1500",
      "DUPLEX": "Auto-duplex",
      "SPEED": "Auto-speed",
      "MEDIA_TYPE": "10/100BaseTX",
      "BANDWIDTH": "100000 Kbit",
      "DELAY": "100 usec",
      "ENCAPSULATION": "ARPA",
      "LAST_INPUT": "never",
      "LAST_OUTPUT": "25w5d",
      "LAST_OUTPUT_HANG": "never",
      "QUEUE_STRATEGY": "fifo",
      "INPUT_RATE": "0",
      "OUTPUT_RATE": "0",
      "INPUT_PPS": "0",
      "OUTPUT_PPS": "0",
      "INPUT_PACKETS": "33944",
      "OUTPUT_PACKETS": "52215",
      "RUNTS": "0",
      "GIANTS": "0",
      "INPUT_ERRORS": "0",
      "CRC": "0",
      "FRAME": "0",
      "OVERRUN": "0",
      "OUTPUT_ERRORS": "0"
    },
    {
      "INTERFACE": "FastEthernet1/0/44",
      "LINK_STATUS": "down",
      "PROTOCOL_STATUS": "down (notconnect)",
      "HARDWARE_TYPE": "Fast Ethernet",
      "MAC_ADDRESS": "0014.1c57.a4b0",
      "BIA": "0014.1c57.a4b0",
      "MTU": "1500",
      "DUPLEX": "Auto-duplex",
      "SPEED": "Auto-speed",
      "MEDIA_TYPE": "10/100BaseTX",
      "BANDWIDTH": "10000 Kbit",
      "DELAY": "1000 usec",
      "ENCAPSULATION": "ARPA",
      "LAST_INPUT": "never",
      "LAST_OUTPUT": "never",
      "LAST_OUTPUT_HANG": "never",
      "QUEUE_STRATEGY": "fifo",
      "INPUT_RATE": "0",
      "OUTPUT_RATE": "0",
      "INPUT_PPS": "0",
      "OUTPUT_PPS": "0",
      "INPUT_PACKETS": "0",
      "OUTPUT_PACKETS": "0",
      "RUNTS": "0",
      "GIANTS": "0",
      "INPUT_ERRORS": "0",
      "CRC": "0",
      "FRAME": "0",
      "OVERRUN": "0",
      "OUTPUT_ERRORS": "0"
    },
    {
      "INTERFACE": "FastEthernet1/0/45",
      "LINK_STATUS": "up",
      "PROTOCOL_STATUS": "up (connected)",
      "HARDWARE_TYPE": "Fast Ethernet",
      "MAC_ADDRESS": "0014.1c57.a4b1",
      "BIA": "0014.1c57.a4b1",
      "MTU": "1500",
      "DUPLEX": "Full-duplex",
      "SPEED": "100Mb/s",
      "MEDIA_TYPE": "10/100BaseTX",
      "BANDWIDTH": "100000 Kbit",
      "DELAY": "100 usec",
      "ENCAPSULATION": "ARPA",
      "LAST_INPUT": "never",
      "LAST_OUTPUT": "00:00:01",
      "LAST_OUTPUT_HANG": "never",
      "QUEUE_STRATEGY": "fifo",
      "INPUT_RATE": "0",
      "OUTPUT_RATE": "0",
      "INPUT_PPS": "0",
      "OUTPUT_PPS": "0",
      "INPUT_PACKETS": "1103",
      "OUTPUT_PACKETS": "10099477",
      "RUNTS": "0",
      "GIANTS": "0",
      "INPUT_ERRORS": "0",
      "CRC": "0",
      "FRAME": "0",
      "OVERRUN": "0",
      "OUTPUT_ERRORS": "0"
    },
    {
      "INTERFACE": "FastEthernet1/0/46",
      "LINK_STATUS": "down",
      "PROTOCOL_STATUS": "down (notconnect)",
      "HARDWARE_TYPE": "Fast Ethernet",
      "MAC_ADDRESS": "0014.1c57.a4b2",
      "BIA": "0014.1c57.a4b2",
      "MTU": "1500",
      "DUPLEX": "Auto-duplex",
      "SPEED": "Auto-speed",
      "MEDIA_TYPE": "10/100BaseTX",
      "BANDWIDTH": "10000 Kbit",
      "DELAY": "1000 usec",
      "ENCAPSULATION": "ARPA",
      "LAST_INPUT": "never",
      "LAST_OUTPUT": "never",
      "LAST_OUTPUT_HANG": "never",
      "QUEUE_STRATEGY": "fifo",
      "INPUT_RATE": "0",
      "OUTPUT_RATE": "0",
      "INPUT_PPS": "0",
      "OUTPUT_PPS": "0",
      "INPUT_PACKETS": "0",
      "OUTPUT_PACKETS": "0",
      "RUNTS": "0",
      "GIANTS": "0",
      "INPUT_ERRORS": "0",
      "CRC": "0",
      "FRAME": "0",
      "OVERRUN": "0",
      "OUTPUT_ERRORS": "0"
    },
    {
      "INTERFACE": "FastEthernet1/0/47",
      "LINK_STATUS": "down",
      "PROTOCOL_STATUS": "down (notconnect)",
      "HARDWARE_TYPE": "Fast Ethernet",
      "MAC_ADDRESS": "0014.1c57.a4b3",
      "BIA": "0014.1c57.a4b3",
      "MTU": "1500",
      "DUPLEX": "Auto-duplex",
      "SPEED": "Auto-speed",
      "MEDIA_TYPE": "10/100BaseTX",
      "BANDWIDTH": "10000 Kbit",
      "DELAY": "1000 usec",
      "ENCAPSULATION": "ARPA",
      "LAST_INPUT": "never",
      "LAST_OUTPUT": "never",
      "LAST_OUTPUT_HANG": "never",
      "QUEUE_STRATEGY": "fifo",
      "INPUT_RATE": "0",
      "OUTPUT_RATE": "0",
      "INPUT_PPS": "0",
      "OUTPUT_PPS": "0",
      "INPUT_PACKETS": "0",
      "OUTPUT_PACKETS": "0",
      "RUNTS": "0",
      "GIANTS": "0",
      "INPUT_ERRORS": "0",
      "CRC": "0",
      "FRAME": "0",
      "OVERRUN": "0",
      "OUTPUT_ERRORS": "0"
    },
    {
      "INTERFACE": "FastEthernet1/0/48",
      "LINK_STATUS": "up",
      "PROTOCOL_STATUS": "up (connected)",
      "HARDWARE_TYPE": "Fast Ethernet",
      "MAC_ADDRESS": "0014.1c57.a4b4",
      "BIA": "0014.1c57.a4b4",
      "MTU": "1500",
      "DUPLEX": "Full-duplex",
      "SPEED": "100Mb/s",
      "MEDIA_TYPE": "10/100BaseTX",
      "BANDWIDTH": "100000 Kbit",
      "DELAY": "100 usec",
      "ENCAPSULATION": "ARPA",
      "LAST_INPUT": "never",
      "LAST_OUTPUT": "00:00:00",
      "LAST_OUTPUT_HANG": "never",
      "QUEUE_STRATEGY": "fifo",
      "INPUT_RATE": "180000",
      "OUTPUT_RATE": "38881000",
      "INPUT_PPS": "332",
      "OUTPUT_PPS": "10093",
      "INPUT_PACKETS": "8407299374",
      "OUTPUT_PACKETS": "86731716396",
      "RUNTS": "0",
      "GIANTS": "0",
      "INPUT_ERRORS": "0",
      "CRC": "0",
      "FRAME": "0",
      "OVERRUN": "0",
      "OUTPUT_ERRORS": "0"
    },
    {
      "INTERFACE": "GigabitEthernet1/0/1",
      "LINK_STATUS": "down",
      "PROTOCOL_STATUS": "down (notconnect)",
      "HARDWARE_TYPE": "Gigabit Ethernet",
      "MAC_ADDRESS": "0014.1c57.a481",
      "BIA": "0014.1c57.a481",
      "MTU": "1500",
      "DUPLEX": "Auto-duplex",
      "SPEED": "Auto-speed",
      "MEDIA_TYPE": "Not Present",
      "BANDWIDTH": "10000 Kbit",
      "DELAY": "1000 usec",
      "ENCAPSULATION": "ARPA",
      "LAST_INPUT": "never",
      "LAST_OUTPUT": "never",
      "LAST_OUTPUT_HANG": "never",
      "QUEUE_STRATEGY": "fifo",
      "INPUT_RATE": "0",
      "OUTPUT_RATE": "0",
      "INPUT_PPS": "0",
      "OUTPUT_PPS": "0",
      "INPUT_PACKETS": "0",
      "OUTPUT_PACKETS": "0",
      "RUNTS": "0",
      "GIANTS": "0",
      "INPUT_ERRORS": "0",
      "CRC": "0",
      "FRAME": "0",
      "OVERRUN": "0",
      "OUTPUT_ERRORS": "0"
    },
    {
      "INTERFACE": "GigabitEthernet1/0/2",
      "LINK_STATUS": "down",
      "PROTOCOL_STATUS": "down (notconnect)",
      "HARDWARE_TYPE": "Gigabit Ethernet",
      "MAC_ADDRESS": "0014.1c57.a482",
      "BIA": "0014.1c57.a482",
      "MTU": "1500",
      "DUPLEX": "Auto-duplex",
      "SPEED": "Auto-speed",
      "MEDIA_TYPE": "Not Present",
      "BANDWIDTH": "10000 Kbit",
      "DELAY": "1000 usec",
      "ENCAPSULATION": "ARPA",
      "LAST_INPUT": "never",
      "LAST_OUTPUT": "never",
      "LAST_OUTPUT_HANG": "never",
      "QUEUE_STRATEGY": "fifo",
      "INPUT_RATE": "0",
      "OUTPUT_RATE": "0",
      "INPUT_PPS": "0",
      "OUTPUT_PPS": "0",
      "INPUT_PACKETS": "0",
      "OUTPUT_PACKETS": "0",
      "RUNTS": "0",
      "GIANTS": "0",
      "INPUT_ERRORS": "0",
      "CRC": "0",
      "FRAME": "0",
      "OVERRUN": "0",
      "OUTPUT_ERRORS": "0"
    },
    {
      "INTERFACE": "GigabitEthernet1/0/3",
      "LINK_STATUS": "down",
      "PROTOCOL_STATUS": "down (notconnect)",
      "HARDWARE_TYPE": "Gigabit Ethernet",
      "MAC_ADDRESS": "0014.1c57.a49b",
      "BIA": "0014.1c57.a49b",
      "MTU": "1500",
      "DUPLEX": "Auto-duplex",
      "SPEED": "Auto-speed",
      "MEDIA_TYPE": "Not Present",
      "BANDWIDTH": "10000 Kbit",
      "DELAY": "1000 usec",
      "ENCAPSULATION": "ARPA",
      "LAST_INPUT": "never",
      "LAST_OUTPUT": "never",
      "LAST_OUTPUT_HANG": "never",
      "QUEUE_STRATEGY": "fifo",
      "INPUT_RATE": "0",
      "OUTPUT_RATE": "0",
      "INPUT_PPS": "0",
      "OUTPUT_PPS": "0",
      "INPUT_PACKETS": "0",
      "OUTPUT_PACKETS": "0",
      "RUNTS": "0",
      "GIANTS": "0",
      "INPUT_ERRORS": "0",
      "CRC": "0",
      "FRAME": "0",
      "OVERRUN": "0",
      "OUTPUT_ERRORS": "0"
    },
    {
      "INTERFACE": "GigabitEthernet1/0/4",
      "LINK_STATUS": "down",
      "PROTOCOL_STATUS": "down (notconnect)",
      "HARDWARE_TYPE": "Gigabit Ethernet",
      "MAC_ADDRESS": "0014.1c57.a49c",
      "BIA": "0014.1c57.a49c",
      "MTU": "1500",
      "DUPLEX": "Auto-duplex",
      "SPEED": "Auto-speed",
      "MEDIA_TYPE": "Not Present",
      "BANDWIDTH": "10000 Kbit",
      "DELAY": "1000 usec",
      "ENCAPSULATION": "ARPA",
      "LAST_INPUT": "never",
      "LAST_OUTPUT": "never",
      "LAST_OUTPUT_HANG": "never",
      "QUEUE_STRATEGY": "fifo",
      "INPUT_RATE": "0",
      "OUTPUT_RATE": "0",
      "INPUT_PPS": "0",
      "OUTPUT_PPS": "0",
      "INPUT_PACKETS": "0",
      "OUTPUT_PACKETS": "0",
      "RUNTS": "0",
      "GIANTS": "0",
      "INPUT_ERRORS": "0",
      "CRC": "0",
      "FRAME": "0",
      "OVERRUN": "0",
      "OUTPUT_ERRORS": "0"
    }
  ],
  "ttp_parsed": [
    {
      "hardware_type_mac_address_bia": [
        {
          "HARDWARE_TYPE": "EtherSVI",
          "MAC_ADDRESS": "0014.1c57.a4c0",
          "BIA": "0014.1c57.a4c0"
        },
        {
          "HARDWARE_TYPE": "EtherSVI",
          "MAC_ADDRESS": "0014.1c57.a4c1",
          "BIA": "0014.1c57.a4c1"
        },
        {
          "HARDWARE_TYPE": "EtherSVI",
          "MAC_ADDRESS": "0014.1c57.a4c2",
          "BIA": "0014.1c57.a4c2"
        },
        {
          "HARDWARE_TYPE": "EtherSVI",
          "MAC_ADDRESS": "0014.1c57.a4c3",
          "BIA": "0014.1c57.a4c3"
        },
        {
          "HARDWARE_TYPE": "Fast Ethernet",
          "MAC_ADDRESS": "0014.1c57.a483",
          "BIA": "0014.1c57.a483"
        },
        {
          "HARDWARE_TYPE": "Fast Ethernet",
          "MAC_ADDRESS": "0014.1c57.a484",
          "BIA": "0014.1c57.a484"
        },
        {
          "HARDWARE_TYPE": "Fast Ethernet",
          "MAC_ADDRESS": "0014.1c57.a485",
          "BIA": "0014.1c57.a485"
        },
        {
          "HARDWARE_TYPE": "Fast Ethernet",
          "MAC_ADDRESS": "0014.1c57.a486",
          "BIA": "0014.1c57.a486"
        },
        {
          "HARDWARE_TYPE": "Fast Ethernet",
          "MAC_ADDRESS": "0014.1c57.a487",
          "BIA": "0014.1c57.a487"
        },
        {
          "HARDWARE_TYPE": "Fast Ethernet",
          "MAC_ADDRESS": "0014.1c57.a488",
          "BIA": "0014.1c57.a488"
        },
        {
          "HARDWARE_TYPE": "Fast Ethernet",
          "MAC_ADDRESS": "0014.1c57.a489",
          "BIA": "0014.1c57.a489"
        },
        {
          "HARDWARE_TYPE": "Fast Ethernet",
          "MAC_ADDRESS": "0014.1c57.a48a",
          "BIA": "0014.1c57.a48a"
        },
        {
          "HARDWARE_TYPE": "Fast Ethernet",
          "MAC_ADDRESS": "0014.1c57.a48b",
          "BIA": "0014.1c57.a48b"
        },
        {
          "HARDWARE_TYPE": "Fast Ethernet",
          "MAC_ADDRESS": "0014.1c57.a48c",
          "BIA": "0014.1c57.a48c"
        },
        {
          "HARDWARE_TYPE": "Fast Ethernet",
          "MAC_ADDRESS": "0014.1c57.a48d",
          "BIA": "0014.1c57.a48d"
        },
        {
          "HARDWARE_TYPE": "Fast Ethernet",
          "MAC_ADDRESS": "0014.1c57.a48e",
          "BIA": "0014.1c57.a48e"
        },
        {
          "HARDWARE_TYPE": "Fast Ethernet",
          "MAC_ADDRESS": "0014.1c57.a48f",
          "BIA": "0014.1c57.a48f"
        },
        {
          "HARDWARE_TYPE": "Fast Ethernet",
          "MAC_ADDRESS": "0014.1c57.a490",
          "BIA": "0014.1c57.a490"
        },
        {
          "HARDWARE_TYPE": "Fast Ethernet",
          "MAC_ADDRESS": "0014.1c57.a491",
          "BIA": "0014.1c57.a491"
        },
        {
          "HARDWARE_TYPE": "Fast Ethernet",
          "MAC_ADDRESS": "0014.1c57.a492",
          "BIA": "0014.1c57.a492"
        },
        {
          "HARDWARE_TYPE": "Fast Ethernet",
          "MAC_ADDRESS": "0014.1c57.a493",
          "BIA": "0014.1c57.a493"
        },
        {
          "HARDWARE_TYPE": "Fast Ethernet",
          "MAC_ADDRESS": "0014.1c57.a494",
          "BIA": "0014.1c57.a494"
        },
        {
          "HARDWARE_TYPE": "Fast Ethernet",
          "MAC_ADDRESS": "0014.1c57.a495",
          "BIA": "0014.1c57.a495"
        },
        {
          "HARDWARE_TYPE": "Fast Ethernet",
          "MAC_ADDRESS": "0014.1c57.a496",
          "BIA": "0014.1c57.a496"
        },
        {
          "HARDWARE_TYPE": "Fast Ethernet",
          "MAC_ADDRESS": "0014.1c57.a497",
          "BIA": "0014.1c57.a497"
        },
        {
          "HARDWARE_TYPE": "Fast Ethernet",
          "MAC_ADDRESS": "0014.1c57.a498",
          "BIA": "0014.1c57.a498"
        },
        {
          "HARDWARE_TYPE": "Fast Ethernet",
          "MAC_ADDRESS": "0014.1c57.a499",
          "BIA": "0014.1c57.a499"
        },
        {
          "HARDWARE_TYPE": "Fast Ethernet",
          "MAC_ADDRESS": "0014.1c57.a49a",
          "BIA": "0014.1c57.a49a"
        },
        {
          "HARDWARE_TYPE": "Fast Ethernet",
          "MAC_ADDRESS": "0014.1c57.a49d",
          "BIA": "0014.1c57.a49d"
        },
        {
          "HARDWARE_TYPE": "Fast Ethernet",
          "MAC_ADDRESS": "0014.1c57.a49e",
          "BIA": "0014.1c57.a49e"
        },
        {
          "HARDWARE_TYPE": "Fast Ethernet",
          "MAC_ADDRESS": "0014.1c57.a49f",
          "BIA": "0014.1c57.a49f"
        },
        {
          "HARDWARE_TYPE": "Fast Ethernet",
          "MAC_ADDRESS": "0014.1c57.a4a0",
          "BIA": "0014.1c57.a4a0"
        },
        {
          "HARDWARE_TYPE": "Fast Ethernet",
          "MAC_ADDRESS": "0014.1c57.a4a1",
          "BIA": "0014.1c57.a4a1"
        },
        {
          "HARDWARE_TYPE": "Fast Ethernet",
          "MAC_ADDRESS": "0014.1c57.a4a2",
          "BIA": "0014.1c57.a4a2"
        },
        {
          "HARDWARE_TYPE": "Fast Ethernet",
          "MAC_ADDRESS": "0014.1c57.a4a3",
          "BIA": "0014.1c57.a4a3"
        },
        {
          "HARDWARE_TYPE": "Fast Ethernet",
          "MAC_ADDRESS": "0014.1c57.a4a4",
          "BIA": "0014.1c57.a4a4"
        },
        {
          "HARDWARE_TYPE": "Fast Ethernet",
          "MAC_ADDRESS": "0014.1c57.a4a5",
          "BIA": "0014.1c57.a4a5"
        },
        {
          "HARDWARE_TYPE": "Fast Ethernet",
          "MAC_ADDRESS": "0014.1c57.a4a6",
          "BIA": "0014.1c57.a4a6"
        },
        {
          "HARDWARE_TYPE": "Fast Ethernet",
          "MAC_ADDRESS": "0014.1c57.a4a7",
          "BIA": "0014.1c57.a4a7"
        },
        {
          "HARDWARE_TYPE": "Fast Ethernet",
          "MAC_ADDRESS": "0014.1c57.a4a8",
          "BIA": "0014.1c57.a4a8"
        },
        {
          "HARDWARE_TYPE": "Fast Ethernet",
          "MAC_ADDRESS": "0014.1c57.a4a9",
          "BIA": "0014.1c57.a4a9"
        },
        {
          "HARDWARE_TYPE": "Fast Ethernet",
          "MAC_ADDRESS": "0014.1c57.a4aa",
          "BIA": "0014.1c57.a4aa"
        },
        {
          "HARDWARE_TYPE": "Fast Ethernet",
          "MAC_ADDRESS": "0014.1c57.a4ab",
          "BIA": "0014.1c57.a4ab"
        },
        {
          "HARDWARE_TYPE": "Fast Ethernet",
          "MAC_ADDRESS": "0014.1c57.a4ac",
          "BIA": "0014.1c57.a4ac"
        },
        {
          "HARDWARE_TYPE": "Fast Ethernet",
          "MAC_ADDRESS": "0014.1c57.a4ad",
          "BIA": "0014.1c57.a4ad"
        },
        {
          "HARDWARE_TYPE": "Fast Ethernet",
          "MAC_ADDRESS": "0014.1c57.a4ae",
          "BIA": "0014.1c57.a4ae"
        },
        {
          "HARDWARE_TYPE": "Fast Ethernet",
          "MAC_ADDRESS": "0014.1c57.a4af",
          "BIA": "0014.1c57.a4af"
        },
        {
          "HARDWARE_TYPE": "Fast Ethernet",
          "MAC_ADDRESS": "0014.1c57.a4b0",
          "BIA": "0014.1c57.a4b0"
        },
        {
          "HARDWARE_TYPE": "Fast Ethernet",
          "MAC_ADDRESS": "0014.1c57.a4b1",
          "BIA": "0014.1c57.a4b1"
        },
        {
          "HARDWARE_TYPE": "Fast Ethernet",
          "MAC_ADDRESS": "0014.1c57.a4b2",
          "BIA": "0014.1c57.a4b2"
        },
        {
          "HARDWARE_TYPE": "Fast Ethernet",
          "MAC_ADDRESS": "0014.1c57.a4b3",
          "BIA": "0014.1c57.a4b3"
        },
        {
          "HARDWARE_TYPE": "Fast Ethernet",
          "MAC_ADDRESS": "0014.1c57.a4b4",
          "BIA": "0014.1c57.a4b4"
        },
        {
          "HARDWARE_TYPE": "Gigabit Ethernet",
          "MAC_ADDRESS": "0014.1c57.a481",
          "BIA": "0014.1c57.a481"
        },
        {
          "HARDWARE_TYPE": "Gigabit Ethernet",
          "MAC_ADDRESS": "0014.1c57.a482",
          "BIA": "0014.1c57.a482"
        },
        {
          "HARDWARE_TYPE": "Gigabit Ethernet",
          "MAC_ADDRESS": "0014.1c57.a49b",
          "BIA": "0014.1c57.a49b"
        },
        {
          "HARDWARE_TYPE": "Gigabit Ethernet",
          "MAC_ADDRESS": "0014.1c57.a49c",
          "BIA": "0014.1c57.a49c"
        }
      ],
      "mtu_bandwidth_delay": [
        {
          "MTU": "1500",
          "BANDWIDTH": "1000000 Kbit",
          "DELAY": "10 usec"
        },
        {
          "MTU": "1500",
          "BANDWIDTH": "1000000 Kbit",
          "DELAY": "10 usec"
        },
        {
          "MTU": "1500",
          "BANDWIDTH": "1000000 Kbit",
          "DELAY": "10 usec"
        },
        {
          "MTU": "1500",
          "BANDWIDTH": "1000000 Kbit",
          "DELAY": "10 usec"
        },
        {
          "MTU": "1500",
          "BANDWIDTH": "100000 Kbit",
          "DELAY": "100 usec"
        },
        {
          "MTU": "1500",
          "BANDWIDTH": "100000 Kbit",
          "DELAY": "100 usec"
        },
        {
          "MTU": "1500",
          "BANDWIDTH": "100000 Kbit",
          "DELAY": "100 usec"
        },
        {
          "MTU": "1500",
          "BANDWIDTH": "10000 Kbit",
          "DELAY": "1000 usec"
        },
        {
          "MTU": "1500",
          "BANDWIDTH": "10000 Kbit",
          "DELAY": "1000 usec"
        },
        {
          "MTU": "1500",
          "BANDWIDTH": "10000 Kbit",
          "DELAY": "1000 usec"
        },
        {
          "MTU": "1500",
          "BANDWIDTH": "10000 Kbit",
          "DELAY": "1000 usec"
        },
        {
          "MTU": "1500",
          "BANDWIDTH": "10000 Kbit",
          "DELAY": "1000 usec"
        },
        {
          "MTU": "1500",
          "BANDWIDTH": "100000 Kbit",
          "DELAY": "100 usec"
        },
        {
          "MTU": "1500",
          "BANDWIDTH": "100000 Kbit",
          "DELAY": "100 usec"
        },
        {
          "MTU": "1500",
          "BANDWIDTH": "100000 Kbit",
          "DELAY": "100 usec"
        },
        {
          "MTU": "1500",
          "BANDWIDTH": "100000 Kbit",
          "DELAY": "100 usec"
        },
        {
          "MTU": "1500",
          "BANDWIDTH": "100000 Kbit",
          "DELAY": "100 usec"
        },
        {
          "MTU": "1500",
          "BANDWIDTH": "100000 Kbit",
          "DELAY": "100 usec"
        },
        {
          "MTU": "1500",
          "BANDWIDTH": "100000 Kbit",
          "DELAY": "100 usec"
        },
        {
          "MTU": "1500",
          "BANDWIDTH": "100000 Kbit",
          "DELAY": "100 usec"
        },
        {
          "MTU": "1500",
          "BANDWIDTH": "100000 Kbit",
          "DELAY": "100 usec"
        },
        {
          "MTU": "1500",
          "BANDWIDTH": "100000 Kbit",
          "DELAY": "100 usec"
        },
        {
          "MTU": "1500",
          "BANDWIDTH": "100000 Kbit",
          "DELAY": "100 usec"
        },
        {
          "MTU": "1500",
          "BANDWIDTH": "100000 Kbit",
          "DELAY": "100 usec"
        },
        {
          "MTU": "1500",
          "BANDWIDTH": "100000 Kbit",
          "DELAY": "100 usec"
        },
        {
          "MTU": "1500",
          "BANDWIDTH": "100000 Kbit",
          "DELAY": "100 usec"
        },
        {
          "MTU": "1500",
          "BANDWIDTH": "100000 Kbit",
          "DELAY": "100 usec"
        },
        {
          "MTU": "1500",
          "BANDWIDTH": "100000 Kbit",
          "DELAY": "100 usec"
        },
        {
          "MTU": "1500",
          "BANDWIDTH": "10000 Kbit",
          "DELAY": "1000 usec"
        },
        {
          "MTU": "1500",
          "BANDWIDTH": "10000 Kbit",
          "DELAY": "1000 usec"
        },
        {
          "MTU": "1500",
          "BANDWIDTH": "100000 Kbit",
          "DELAY": "100 usec"
        },
        {
          "MTU": "1500",
          "BANDWIDTH": "100000 Kbit",
          "DELAY": "100 usec"
        },
        {
          "MTU": "1500",
          "BANDWIDTH": "100000 Kbit",
          "DELAY": "100 usec"
        },
        {
          "MTU": "1500",
          "BANDWIDTH": "100000 Kbit",
          "DELAY": "100 usec"
        },
        {
          "MTU": "1500",
          "BANDWIDTH": "100000 Kbit",
          "DELAY": "100 usec"
        },
        {
          "MTU": "1500",
          "BANDWIDTH": "100000 Kbit",
          "DELAY": "100 usec"
        },
        {
          "MTU": "1500",
          "BANDWIDTH": "100000 Kbit",
          "DELAY": "100 usec"
        },
        {
          "MTU": "1500",
          "BANDWIDTH": "100000 Kbit",
          "DELAY": "100 usec"
        },
        {
          "MTU": "1500",
          "BANDWIDTH": "100000 Kbit",
          "DELAY": "100 usec"
        },
        {
          "MTU": "1500",
          "BANDWIDTH": "100000 Kbit",
          "DELAY": "100 usec"
        },
        {
          "MTU": "1500",
          "BANDWIDTH": "100000 Kbit",
          "DELAY": "100 usec"
        },
        {
          "MTU": "1500",
          "BANDWIDTH": "10000 Kbit",
          "DELAY": "1000 usec"
        },
        {
          "MTU": "1500",
          "BANDWIDTH": "10000 Kbit",
          "DELAY": "1000 usec"
        },
        {
          "MTU": "1500",
          "BANDWIDTH": "10000 Kbit",
          "DELAY": "1000 usec"
        },
        {
          "MTU": "1500",
          "BANDWIDTH": "10000 Kbit",
          "DELAY": "1000 usec"
        },
        {
          "MTU": "1500",
          "BANDWIDTH": "10000 Kbit",
          "DELAY": "1000 usec"
        },
        {
          "MTU": "1500",
          "BANDWIDTH": "100000 Kbit",
          "DELAY": "100 usec"
        },
        {
          "MTU": "1500",
          "BANDWIDTH": "10000 Kbit",
          "DELAY": "1000 usec"
        },
        {
          "MTU": "1500",
          "BANDWIDTH": "100000 Kbit",
          "DELAY": "100 usec"
        },
        {
          "MTU": "1500",
          "BANDWIDTH": "10000 Kbit",
          "DELAY": "1000 usec"
        },
        {
          "MTU": "1500",
          "BANDWIDTH": "10000 Kbit",
          "DELAY": "1000 usec"
        },
        {
          "MTU": "1500",
          "BANDWIDTH": "100000 Kbit",
          "DELAY": "100 usec"
        },
        {
          "MTU": "1500",
          "BANDWIDTH": "10000 Kbit",
          "DELAY": "1000 usec"
        },
        {
          "MTU": "1500",
          "BANDWIDTH": "10000 Kbit",
          "DELAY": "1000 usec"
        },
        {
          "MTU": "1500",
          "BANDWIDTH": "10000 Kbit",
          "DELAY": "1000 usec"
        },
        {
          "MTU": "1500",
          "BANDWIDTH": "10000 Kbit",
          "DELAY": "1000 usec"
        }
      ],
      "duplex_speed_media_type": [
        {
          "DUPLEX": "Full-duplex",
          "SPEED": "100Mb/s",
          "MEDIA_TYPE": "10/100BaseTX"
        },
        {
          "DUPLEX": "Full-duplex",
          "SPEED": "100Mb/s",
          "MEDIA_TYPE": "10/100BaseTX"
        },
        {
          "DUPLEX": "Full-duplex",
          "SPEED": "100Mb/s",
          "MEDIA_TYPE": "10/100BaseTX"
        },
        {
          "DUPLEX": "Auto-duplex",
          "SPEED": "Auto-speed",
          "MEDIA_TYPE": "10/100BaseTX"
        },
        {
          "DUPLEX": "Auto-duplex",
          "SPEED": "Auto-speed",
          "MEDIA_TYPE": "10/100BaseTX"
        },
        {
          "DUPLEX": "Auto-duplex",
          "SPEED": "Auto-speed",
          "MEDIA_TYPE": "10/100BaseTX"
        },
        {
          "DUPLEX": "Auto-duplex",
          "SPEED": "Auto-speed",
          "MEDIA_TYPE": "10/100BaseTX"
        },
        {
          "DUPLEX": "Auto-duplex",
          "SPEED": "Auto-speed",
          "MEDIA_TYPE": "10/100BaseTX"
        },
        {
          "DUPLEX": "Full-duplex",
          "SPEED": "100Mb/s",
          "MEDIA_TYPE": "10/100BaseTX"
        },
        {
          "DUPLEX": "Full-duplex",
          "SPEED": "100Mb/s",
          "MEDIA_TYPE": "10/100BaseTX"
        },
        {
          "DUPLEX": "Auto-duplex",
          "SPEED": "Auto-speed",
          "MEDIA_TYPE": "10/100BaseTX"
        },
        {
          "DUPLEX": "Full-duplex",
          "SPEED": "100Mb/s",
          "MEDIA_TYPE": "10/100BaseTX"
        },
        {
          "DUPLEX": "Full-duplex",
          "SPEED": "100Mb/s",
          "MEDIA_TYPE": "10/100BaseTX"
        },
        {
          "DUPLEX": "Full-duplex",
          "SPEED": "100Mb/s",
          "MEDIA_TYPE": "10/100BaseTX"
        },
        {
          "DUPLEX": "Auto-duplex",
          "SPEED": "Auto-speed",
          "MEDIA_TYPE": "10/100BaseTX"
        },
        {
          "DUPLEX": "Auto-duplex",
          "SPEED": "Auto-speed",
          "MEDIA_TYPE": "10/100BaseTX"
        },
        {
          "DUPLEX": "Auto-duplex",
          "SPEED": "Auto-speed",
          "MEDIA_TYPE": "10/100BaseTX"
        },
        {
          "DUPLEX": "Auto-duplex",
          "SPEED": "Auto-speed",
          "MEDIA_TYPE": "10/100BaseTX"
        },
        {
          "DUPLEX": "Full-duplex",
          "SPEED": "100Mb/s",
          "MEDIA_TYPE": "10/100BaseTX"
        },
        {
          "DUPLEX": "Full-duplex",
          "SPEED": "100Mb/s",
          "MEDIA_TYPE": "10/100BaseTX"
        },
        {
          "DUPLEX": "Full-duplex",
          "SPEED": "100Mb/s",
          "MEDIA_TYPE": "10/100BaseTX"
        },
        {
          "DUPLEX": "Full-duplex",
          "SPEED": "100Mb/s",
          "MEDIA_TYPE": "10/100BaseTX"
        },
        {
          "DUPLEX": "Auto-duplex",
          "SPEED": "Auto-speed",
          "MEDIA_TYPE": "10/100BaseTX"
        },
        {
          "DUPLEX": "Full-duplex",
          "SPEED": "100Mb/s",
          "MEDIA_TYPE": "10/100BaseTX"
        },
        {
          "DUPLEX": "Auto-duplex",
          "SPEED": "Auto-speed",
          "MEDIA_TYPE": "10/100BaseTX"
        },
        {
          "DUPLEX": "Auto-duplex",
          "SPEED": "Auto-speed",
          "MEDIA_TYPE": "10/100BaseTX"
        },
        {
          "DUPLEX": "Half-duplex",
          "SPEED": "100Mb/s",
          "MEDIA_TYPE": "10/100BaseTX"
        },
        {
          "DUPLEX": "Full-duplex",
          "SPEED": "100Mb/s",
          "MEDIA_TYPE": "10/100BaseTX"
        },
        {
          "DUPLEX": "Full-duplex",
          "SPEED": "100Mb/s",
          "MEDIA_TYPE": "10/100BaseTX"
        },
        {
          "DUPLEX": "Full-duplex",
          "SPEED": "100Mb/s",
          "MEDIA_TYPE": "10/100BaseTX"
        },
        {
          "DUPLEX": "Full-duplex",
          "SPEED": "100Mb/s",
          "MEDIA_TYPE": "10/100BaseTX"
        },
        {
          "DUPLEX": "Full-duplex",
          "SPEED": "100Mb/s",
          "MEDIA_TYPE": "10/100BaseTX"
        },
        {
          "DUPLEX": "Full-duplex",
          "SPEED": "100Mb/s",
          "MEDIA_TYPE": "10/100BaseTX"
        },
        {
          "DUPLEX": "Full-duplex",
          "SPEED": "100Mb/s",
          "MEDIA_TYPE": "10/100BaseTX"
        },
        {
          "DUPLEX": "Full-duplex",
          "SPEED": "100Mb/s",
          "MEDIA_TYPE": "10/100BaseTX"
        },
        {
          "DUPLEX": "Full-duplex",
          "SPEED": "100Mb/s",
          "MEDIA_TYPE": "10/100BaseTX"
        },
        {
          "DUPLEX": "Auto-duplex",
          "SPEED": "Auto-speed",
          "MEDIA_TYPE": "10/100BaseTX"
        },
        {
          "DUPLEX": "Auto-duplex",
          "SPEED": "Auto-speed",
          "MEDIA_TYPE": "10/100BaseTX"
        },
        {
          "DUPLEX": "Auto-duplex",
          "SPEED": "Auto-speed",
          "MEDIA_TYPE": "10/100BaseTX"
        },
        {
          "DUPLEX": "Auto-duplex",
          "SPEED": "Auto-speed",
          "MEDIA_TYPE": "10/100BaseTX"
        },
        {
          "DUPLEX": "Auto-duplex",
          "SPEED": "Auto-speed",
          "MEDIA_TYPE": "10/100BaseTX"
        },
        {
          "DUPLEX": "Auto-duplex",
          "SPEED": "Auto-speed",
          "MEDIA_TYPE": "10/100BaseTX"
        },
        {
          "DUPLEX": "Auto-duplex",
          "SPEED": "Auto-speed",
          "MEDIA_TYPE": "10/100BaseTX"
        },
        {
          "DUPLEX": "Auto-duplex",
          "SPEED": "Auto-speed",
          "MEDIA_TYPE": "10/100BaseTX"
        },
        {
          "DUPLEX": "Full-duplex",
          "SPEED": "100Mb/s",
          "MEDIA_TYPE": "10/100BaseTX"
        },
        {
          "DUPLEX": "Auto-duplex",
          "SPEED": "Auto-speed",
          "MEDIA_TYPE": "10/100BaseTX"
        },
        {
          "DUPLEX": "Auto-duplex",
          "SPEED": "Auto-speed",
          "MEDIA_TYPE": "10/100BaseTX"
        },
        {
          "DUPLEX": "Full-duplex",
          "SPEED": "100Mb/s",
          "MEDIA_TYPE": "10/100BaseTX"
        }
      ],
      "input_rate_output_rate_input_pps_output_pps_input_packets_output_packets_last_input_last_output": [
        {
          "INPUT_RATE": "0",
          "OUTPUT_RATE": "0",
          "INPUT_PPS": "0",
          "OUTPUT_PPS": "0",
          "INPUT_PACKETS": "0",
          "OUTPUT_PACKETS": "0",
          "LAST_INPUT": "never",
          "LAST_OUTPUT": "never"
        },
        {
          "INPUT_RATE": "0",
          "OUTPUT_RATE": "1",
          "INPUT_PPS": "0",
          "OUTPUT_PPS": "4",
          "INPUT_PACKETS": "5",
          "OUTPUT_PACKETS": "4",
          "LAST_INPUT": "01:04:54",
          "LAST_OUTPUT": "never"
        },
        {
          "INPUT_RATE": "0",
          "OUTPUT_RATE": "0",
          "INPUT_PPS": "0",
          "OUTPUT_PPS": "0",
          "INPUT_PACKETS": "0",
          "OUTPUT_PACKETS": "0",
          "LAST_INPUT": "00:00:00",
          "LAST_OUTPUT": "never"
        },
        {
          "INPUT_RATE": "0",
          "OUTPUT_RATE": "0",
          "INPUT_PPS": "0",
          "OUTPUT_PPS": "8",
          "INPUT_PACKETS": "4",
          "OUTPUT_PACKETS": "8",
          "LAST_INPUT": "00:08:48",
          "LAST_OUTPUT": "never"
        },
        {
          "INPUT_RATE": "0",
          "OUTPUT_RATE": "0",
          "INPUT_PPS": "0",
          "OUTPUT_PPS": "0",
          "INPUT_PACKETS": "0",
          "OUTPUT_PACKETS": "1",
          "LAST_INPUT": "00:00:06",
          "LAST_OUTPUT": "never"
        },
        {
          "INPUT_RATE": "0",
          "OUTPUT_RATE": "0",
          "INPUT_PPS": "0",
          "OUTPUT_PPS": "0",
          "INPUT_PACKETS": "2",
          "OUTPUT_PACKETS": "7",
          "LAST_INPUT": "00:00:00",
          "LAST_OUTPUT": "never"
        },
        {
          "INPUT_RATE": "0",
          "OUTPUT_RATE": "0",
          "INPUT_PPS": "0",
          "OUTPUT_PPS": "0",
          "INPUT_PACKETS": "2",
          "OUTPUT_PACKETS": "7",
          "LAST_INPUT": "00:00:00",
          "LAST_OUTPUT": "never"
        },
        {
          "INPUT_RATE": "0",
          "OUTPUT_RATE": "0",
          "INPUT_PPS": "0",
          "OUTPUT_PPS": "0",
          "INPUT_PACKETS": "2",
          "OUTPUT_PACKETS": "7",
          "LAST_INPUT": "00:00:00",
          "LAST_OUTPUT": "never"
        },
        {
          "INPUT_RATE": "0",
          "OUTPUT_RATE": "0",
          "INPUT_PPS": "0",
          "OUTPUT_PPS": "0",
          "INPUT_PACKETS": "1",
          "OUTPUT_PACKETS": "3",
          "LAST_INPUT": "00:00:00",
          "LAST_OUTPUT": "never"
        },
        {
          "INPUT_RATE": "0",
          "OUTPUT_RATE": "0",
          "INPUT_PPS": "0",
          "OUTPUT_PPS": "0",
          "INPUT_PACKETS": "1",
          "OUTPUT_PACKETS": "3",
          "LAST_INPUT": "00:00:00",
          "LAST_OUTPUT": "never"
        },
        {
          "INPUT_RATE": "0",
          "OUTPUT_RATE": "0",
          "INPUT_PPS": "0",
          "OUTPUT_PPS": "0",
          "INPUT_PACKETS": "1",
          "OUTPUT_PACKETS": "3",
          "LAST_INPUT": "00:00:00",
          "LAST_OUTPUT": "never"
        },
        {
          "INPUT_RATE": "0",
          "OUTPUT_RATE": "0",
          "INPUT_PPS": "0",
          "OUTPUT_PPS": "0",
          "INPUT_PACKETS": "1",
          "OUTPUT_PACKETS": "3",
          "LAST_INPUT": "00:00:00",
          "LAST_OUTPUT": "never"
        },
        {
          "INPUT_RATE": "0",
          "OUTPUT_RATE": "0",
          "INPUT_PPS": "0",
          "OUTPUT_PPS": "0",
          "INPUT_PACKETS": "2",
          "OUTPUT_PACKETS": "5",
          "LAST_INPUT": "00:00:00",
          "LAST_OUTPUT": "never"
        },
        {
          "INPUT_RATE": "0",
          "OUTPUT_RATE": "0",
          "INPUT_PPS": "0",
          "OUTPUT_PPS": "0",
          "INPUT_PACKETS": "0",
          "OUTPUT_PACKETS": "0",
          "LAST_INPUT": "00:00:00",
          "LAST_OUTPUT": "never"
        },
        {
          "INPUT_RATE": "0",
          "OUTPUT_RATE": "0",
          "INPUT_PPS": "0",
          "OUTPUT_PPS": "0",
          "INPUT_PACKETS": "0",
          "OUTPUT_PACKETS": "5",
          "LAST_INPUT": "00:00:00",
          "LAST_OUTPUT": "never"
        },
        {
          "INPUT_RATE": "0",
          "OUTPUT_RATE": "0",
          "INPUT_PPS": "0",
          "OUTPUT_PPS": "0",
          "INPUT_PACKETS": "1",
          "OUTPUT_PACKETS": "3",
          "LAST_INPUT": "00:00:00",
          "LAST_OUTPUT": "never"
        },
        {
          "INPUT_RATE": "0",
          "OUTPUT_RATE": "0",
          "INPUT_PPS": "0",
          "OUTPUT_PPS": "0",
          "INPUT_PACKETS": "1",
          "OUTPUT_PACKETS": "3",
          "LAST_INPUT": "00:00:00",
          "LAST_OUTPUT": "never"
        },
        {
          "INPUT_RATE": "0",
          "OUTPUT_RATE": "0",
          "INPUT_PPS": "0",
          "OUTPUT_PPS": "0",
          "INPUT_PACKETS": "1",
          "OUTPUT_PACKETS": "3",
          "LAST_INPUT": "00:00:00",
          "LAST_OUTPUT": "never"
        },
        {
          "INPUT_RATE": "0",
          "OUTPUT_RATE": "0",
          "INPUT_PPS": "0",
          "OUTPUT_PPS": "0",
          "INPUT_PACKETS": "1",
          "OUTPUT_PACKETS": "3",
          "LAST_INPUT": "00:00:00",
          "LAST_OUTPUT": "never"
        },
        {
          "INPUT_RATE": "0",
          "OUTPUT_RATE": "0",
          "INPUT_PPS": "0",
          "OUTPUT_PPS": "0",
          "INPUT_PACKETS": "0",
          "OUTPUT_PACKETS": "0",
          "LAST_INPUT": "00:00:00",
          "LAST_OUTPUT": "never"
        }
      ],
      "interface_link_status_protocol_status": [
        {
          "INTERFACE": "Vlan1",
          "LINK_STATUS": "up",
          "PROTOCOL_STATUS": "up"
        },
        {
          "INTERFACE": "Vlan50",
          "LINK_STATUS": "up",
          "PROTOCOL_STATUS": "up"
        },
        {
          "INTERFACE": "Vlan100",
          "LINK_STATUS": "up",
          "PROTOCOL_STATUS": "up"
        },
        {
          "INTERFACE": "Vlan254",
          "LINK_STATUS": "up",
          "PROTOCOL_STATUS": "up"
        },
        {
          "INTERFACE": "FastEthernet1/0/1",
          "LINK_STATUS": "up",
          "PROTOCOL_STATUS": "up (connected)"
        },
        {
          "INTERFACE": "FastEthernet1/0/2",
          "LINK_STATUS": "up",
          "PROTOCOL_STATUS": "up (connected)"
        },
        {
          "INTERFACE": "FastEthernet1/0/3",
          "LINK_STATUS": "up",
          "PROTOCOL_STATUS": "up (connected)"
        },
        {
          "INTERFACE": "FastEthernet1/0/4",
          "LINK_STATUS": "down",
          "PROTOCOL_STATUS": "down (notconnect)"
        },
        {
          "INTERFACE": "FastEthernet1/0/5",
          "LINK_STATUS": "down",
          "PROTOCOL_STATUS": "down (notconnect)"
        },
        {
          "INTERFACE": "FastEthernet1/0/6",
          "LINK_STATUS": "down",
          "PROTOCOL_STATUS": "down (notconnect)"
        },
        {
          "INTERFACE": "FastEthernet1/0/7",
          "LINK_STATUS": "down",
          "PROTOCOL_STATUS": "down (notconnect)"
        },
        {
          "INTERFACE": "FastEthernet1/0/8",
          "LINK_STATUS": "down",
          "PROTOCOL_STATUS": "down (notconnect)"
        },
        {
          "INTERFACE": "FastEthernet1/0/9",
          "LINK_STATUS": "up",
          "PROTOCOL_STATUS": "up (connected)"
        },
        {
          "INTERFACE": "FastEthernet1/0/10",
          "LINK_STATUS": "up",
          "PROTOCOL_STATUS": "up (connected)"
        },
        {
          "INTERFACE": "FastEthernet1/0/11",
          "LINK_STATUS": "down",
          "PROTOCOL_STATUS": "down (notconnect)"
        },
        {
          "INTERFACE": "FastEthernet1/0/12",
          "LINK_STATUS": "up",
          "PROTOCOL_STATUS": "up (connected)"
        },
        {
          "INTERFACE": "FastEthernet1/0/13",
          "LINK_STATUS": "up",
          "PROTOCOL_STATUS": "up (connected)"
        },
        {
          "INTERFACE": "FastEthernet1/0/14",
          "LINK_STATUS": "up",
          "PROTOCOL_STATUS": "up (connected)"
        },
        {
          "INTERFACE": "FastEthernet1/0/15",
          "LINK_STATUS": "down",
          "PROTOCOL_STATUS": "down (notconnect)"
        },
        {
          "INTERFACE": "FastEthernet1/0/16",
          "LINK_STATUS": "down",
          "PROTOCOL_STATUS": "down (notconnect)"
        },
        {
          "INTERFACE": "FastEthernet1/0/17",
          "LINK_STATUS": "down",
          "PROTOCOL_STATUS": "down (notconnect)"
        },
        {
          "INTERFACE": "FastEthernet1/0/18",
          "LINK_STATUS": "down",
          "PROTOCOL_STATUS": "down (notconnect)"
        },
        {
          "INTERFACE": "FastEthernet1/0/19",
          "LINK_STATUS": "up",
          "PROTOCOL_STATUS": "up (connected)"
        },
        {
          "INTERFACE": "FastEthernet1/0/20",
          "LINK_STATUS": "up",
          "PROTOCOL_STATUS": "up (connected)"
        },
        {
          "INTERFACE": "FastEthernet1/0/21",
          "LINK_STATUS": "up",
          "PROTOCOL_STATUS": "up (connected)"
        },
        {
          "INTERFACE": "FastEthernet1/0/22",
          "LINK_STATUS": "up",
          "PROTOCOL_STATUS": "up (connected)"
        },
        {
          "INTERFACE": "FastEthernet1/0/23",
          "LINK_STATUS": "down",
          "PROTOCOL_STATUS": "down (notconnect)"
        },
        {
          "INTERFACE": "FastEthernet1/0/24",
          "LINK_STATUS": "up",
          "PROTOCOL_STATUS": "up (connected)"
        },
        {
          "INTERFACE": "FastEthernet1/0/25",
          "LINK_STATUS": "down",
          "PROTOCOL_STATUS": "down (notconnect)"
        },
        {
          "INTERFACE": "FastEthernet1/0/26",
          "LINK_STATUS": "down",
          "PROTOCOL_STATUS": "down (notconnect)"
        },
        {
          "INTERFACE": "FastEthernet1/0/27",
          "LINK_STATUS": "up",
          "PROTOCOL_STATUS": "up (connected)"
        },
        {
          "INTERFACE": "FastEthernet1/0/28",
          "LINK_STATUS": "up",
          "PROTOCOL_STATUS": "up (connected)"
        },
        {
          "INTERFACE": "FastEthernet1/0/29",
          "LINK_STATUS": "up",
          "PROTOCOL_STATUS": "up (connected)"
        },
        {
          "INTERFACE": "FastEthernet1/0/30",
          "LINK_STATUS": "up",
          "PROTOCOL_STATUS": "up (connected)"
        },
        {
          "INTERFACE": "FastEthernet1/0/31",
          "LINK_STATUS": "up",
          "PROTOCOL_STATUS": "up (connected)"
        },
        {
          "INTERFACE": "FastEthernet1/0/32",
          "LINK_STATUS": "up",
          "PROTOCOL_STATUS": "up (connected)"
        },
        {
          "INTERFACE": "FastEthernet1/0/33",
          "LINK_STATUS": "up",
          "PROTOCOL_STATUS": "up (connected)"
        },
        {
          "INTERFACE": "FastEthernet1/0/34",
          "LINK_STATUS": "up",
          "PROTOCOL_STATUS": "up (connected)"
        },
        {
          "INTERFACE": "FastEthernet1/0/35",
          "LINK_STATUS": "up",
          "PROTOCOL_STATUS": "up (connected)"
        },
        {
          "INTERFACE": "FastEthernet1/0/36",
          "LINK_STATUS": "up",
          "PROTOCOL_STATUS": "up (connected)"
        },
        {
          "INTERFACE": "FastEthernet1/0/37",
          "LINK_STATUS": "down",
          "PROTOCOL_STATUS": "down (notconnect)"
        },
        {
          "INTERFACE": "FastEthernet1/0/38",
          "LINK_STATUS": "down",
          "PROTOCOL_STATUS": "down (notconnect)"
        },
        {
          "INTERFACE": "FastEthernet1/0/39",
          "LINK_STATUS": "down",
          "PROTOCOL_STATUS": "down (notconnect)"
        },
        {
          "INTERFACE": "FastEthernet1/0/40",
          "LINK_STATUS": "down",
          "PROTOCOL_STATUS": "down (notconnect)"
        },
        {
          "INTERFACE": "FastEthernet1/0/41",
          "LINK_STATUS": "down",
          "PROTOCOL_STATUS": "down (notconnect)"
        },
        {
          "INTERFACE": "FastEthernet1/0/42",
          "LINK_STATUS": "down",
          "PROTOCOL_STATUS": "down (notconnect)"
        },
        {
          "INTERFACE": "FastEthernet1/0/43",
          "LINK_STATUS": "down",
          "PROTOCOL_STATUS": "down (notconnect)"
        },
        {
          "INTERFACE": "FastEthernet1/0/44",
          "LINK_STATUS": "down",
          "PROTOCOL_STATUS": "down (notconnect)"
        },
        {
          "INTERFACE": "FastEthernet1/0/45",
          "LINK_STATUS": "up",
          "PROTOCOL_STATUS": "up (connected)"
        },
        {
          "INTERFACE": "FastEthernet1/0/46",
          "LINK_STATUS": "down",
          "PROTOCOL_STATUS": "down (notconnect)"
        },
        {
          "INTERFACE": "FastEthernet1/0/47",
          "LINK_STATUS": "down",
          "PROTOCOL_STATUS": "down (notconnect)"
        },
        {
          "INTERFACE": "FastEthernet1/0/48",
          "LINK_STATUS": "up",
          "PROTOCOL_STATUS": "up (connected)"
        },
        {
          "INTERFACE": "GigabitEthernet1/0/1",
          "LINK_STATUS": "down",
          "PROTOCOL_STATUS": "down (notconnect)"
        },
        {
          "INTERFACE": "GigabitEthernet1/0/2",
          "LINK_STATUS": "down",
          "PROTOCOL_STATUS": "down (notconnect)"
        },
        {
          "INTERFACE": "GigabitEthernet1/0/3",
          "LINK_STATUS": "down",
          "PROTOCOL_STATUS": "down (notconnect)"
        },
        {
          "INTERFACE": "GigabitEthernet1/0/4",
          "LINK_STATUS": "down",
          "PROTOCOL_STATUS": "down (notconnect)"
        }
      ]
    }
  ],
  "cli_content": "Vlan1 is up, line protocol is up\n  Hardware is EtherSVI, address is 0014.1c57.a4c0 (bia 0014.1c57.a4c0)\n  MTU 1500 bytes, BW 1000000 Kbit, DLY 10 usec,\n     reliability 255/255, txload 1/255, rxload 1/255\n  Encapsulation ARPA, loopback not set\n  Keepalive not supported\n  ARP type: ARPA, ARP Timeout 04:00:00\n  Last input 00:00:00, output never, output hang never\n  Last clearing of \"show interface\" counters never\n  Input queue: 0/75/0/0 (size/max/drops/flushes); Total output drops: 0\n  Queueing strategy: fifo\n  Output queue: 0/40 (size/max)\n  5 minute input rate 0 bits/sec, 0 packets/sec\n  5 minute output rate 0 bits/sec, 0 packets/sec\n     37453340 packets input, 2249839744 bytes, 0 no buffer\n     Received 0 broadcasts (0 IP multicasts)\n     0 runts, 0 giants, 0 throttles\n     0 input errors, 0 CRC, 0 frame, 0 overrun, 0 ignored\n     0 packets output, 0 bytes, 0 underruns\n     0 output errors, 0 interface resets\n     0 output buffer failures, 0 output buffers swapped out\nVlan50 is up, line protocol is up\n  Hardware is EtherSVI, address is 0014.1c57.a4c1 (bia 0014.1c57.a4c1)\n  Internet address is 10.1.50.1/24\n  MTU 1500 bytes, BW 1000000 Kbit, DLY 10 usec,\n     reliability 255/255, txload 1/255, rxload 1/255\n  Encapsulation ARPA, loopback not set\n  Keepalive not supported\n  ARP type: ARPA, ARP Timeout 04:00:00\n  Last input 01:04:54, output 01:04:54, output hang never\n  Last clearing of \"show interface\" counters never\n  Input queue: 0/75/0/0 (size/max/drops/flushes); Total output drops: 0\n  Queueing strategy: fifo\n  Output queue: 0/40 (size/max)\n  5 minute input rate 0 bits/sec, 0 packets/sec\n  5 minute output rate 0 bits/sec, 0 packets/sec\n     3772 packets input, 226742 bytes, 0 no buffer\n     Received 0 broadcasts (0 IP multicasts)\n     0 runts, 0 giants, 0 throttles\n     0 input errors, 0 CRC, 0 frame, 0 overrun, 0 ignored\n     3804 packets output, 243514 bytes, 0 underruns\n     0 output errors, 0 interface resets\n     0 output buffer failures, 0 output buffers swapped out\nVlan100 is up, line protocol is up\n  Hardware is EtherSVI, address is 0014.1c57.a4c2 (bia 0014.1c57.a4c2)\n  Internet address is 10.1.100.1/24\n  MTU 1500 bytes, BW 1000000 Kbit, DLY 10 usec,\n     reliability 255/255, txload 1/255, rxload 1/255\n  Encapsulation ARPA, loopback not set\n  Keepalive not supported\n  ARP type: ARPA, ARP Timeout 04:00:00\n  Last input 00:00:00, output 00:00:00, output hang never\n  Last clearing of \"show interface\" counters never\n  Input queue: 0/75/0/0 (size/max/drops/flushes); Total output drops: 0\n  Queueing strategy: fifo\n  Output queue: 0/40 (size/max)\n  5 minute input rate 2000 bits/sec, 2 packets/sec\n  5 minute output rate 2000 bits/sec, 2 packets/sec\n     6313297 packets input, 426193389 bytes, 0 no buffer\n     Received 0 broadcasts (31802 IP multicasts)\n     0 runts, 0 giants, 0 throttles\n     0 input errors, 0 CRC, 0 frame, 0 overrun, 0 ignored\n     10453439 packets output, 695857497 bytes, 0 underruns\n     0 output errors, 0 interface resets\n     0 output buffer failures, 0 output buffers swapped out\nVlan254 is up, line protocol is up\n  Hardware is EtherSVI, address is 0014.1c57.a4c3 (bia 0014.1c57.a4c3)\n  Internet address is 10.1.254.1/24\n  MTU 1500 bytes, BW 1000000 Kbit, DLY 10 usec,\n     reliability 255/255, txload 1/255, rxload 1/255\n  Encapsulation ARPA, loopback not set\n  Keepalive not supported\n  ARP type: ARPA, ARP Timeout 04:00:00\n  Last input 00:08:48, output 00:08:48, output hang never\n  Last clearing of \"show interface\" counters never\n  Input queue: 0/75/0/0 (size/max/drops/flushes); Total output drops: 0\n  Queueing strategy: fifo\n  Output queue: 0/40 (size/max)\n  5 minute input rate 0 bits/sec, 0 packets/sec\n  5 minute output rate 0 bits/sec, 0 packets/sec\n     7881502 packets input, 565885779 bytes, 0 no buffer\n     Received 0 broadcasts (0 IP multicasts)\n     0 runts, 0 giants, 0 throttles\n     0 input errors, 0 CRC, 0 frame, 0 overrun, 0 ignored\n     47843 packets output, 3119470 bytes, 0 underruns\n     0 output errors, 0 interface resets\n     0 output buffer failures, 0 output buffers swapped out\nFastEthernet1/0/1 is up, line protocol is up (connected)\n  Hardware is Fast Ethernet, address is 0014.1c57.a483 (bia 0014.1c57.a483)\n  MTU 1500 bytes, BW 100000 Kbit, DLY 100 usec,\n     reliability 255/255, txload 99/255, rxload 1/255\n  Encapsulation ARPA, loopback not set\n  Keepalive set (10 sec)\n  Full-duplex, 100Mb/s, media type is 10/100BaseTX\n  input flow-control is off, output flow-control is unsupported\n  ARP type: ARPA, ARP Timeout 04:00:00\n  Last input 00:00:01, output 00:00:06, output hang never\n  Last clearing of \"show interface\" counters never\n  Input queue: 0/75/0/0 (size/max/drops/flushes); Total output drops: 0\n  Queueing strategy: fifo\n  Output queue: 0/40 (size/max)\n  5 minute input rate 182000 bits/sec, 334 packets/sec\n  5 minute output rate 38883000 bits/sec, 10094 packets/sec\n     8647579827 packets input, 638901996995 bytes, 0 no buffer\n     Received 61011302 broadcasts (28370454 multicasts)\n     0 runts, 0 giants, 0 throttles\n     1 input errors, 0 CRC, 0 frame, 0 overrun, 0 ignored\n     0 watchdog, 28370454 multicast, 0 pause input\n     0 input packets with dribble condition detected\n     86941746207 packets output, 41399413469427 bytes, 0 underruns\n     0 output errors, 0 collisions, 1 interface resets\n     0 babbles, 0 late collision, 0 deferred\n     0 lost carrier, 0 no carrier, 0 PAUSE output\n     0 output buffer failures, 0 output buffers swapped out\nFastEthernet1/0/2 is up, line protocol is up (connected)\n  Hardware is Fast Ethernet, address is 0014.1c57.a484 (bia 0014.1c57.a484)\n  MTU 1500 bytes, BW 100000 Kbit, DLY 100 usec,\n     reliability 255/255, txload 1/255, rxload 99/255\n  Encapsulation ARPA, loopback not set\n  Keepalive set (10 sec)\n  Full-duplex, 100Mb/s, media type is 10/100BaseTX\n  input flow-control is off, output flow-control is unsupported\n  ARP type: ARPA, ARP Timeout 04:00:00\n  Last input never, output 00:00:01, output hang never\n  Last clearing of \"show interface\" counters never\n  Input queue: 0/75/0/0 (size/max/drops/flushes); Total output drops: 0\n  Queueing strategy: fifo\n  Output queue: 0/40 (size/max)\n  5 minute input rate 38882000 bits/sec, 10093 packets/sec\n  5 minute output rate 182000 bits/sec, 334 packets/sec\n     86697408651 packets input, 41363381670535 bytes, 0 no buffer\n     Received 8 broadcasts (0 multicasts)\n     0 runts, 0 giants, 0 throttles\n     0 input errors, 0 CRC, 0 frame, 0 overrun, 0 ignored\n     0 watchdog, 0 multicast, 0 pause input\n     0 input packets with dribble condition detected\n     8485702870 packets output, 609564954763 bytes, 0 underruns\n     0 output errors, 0 collisions, 1 interface resets\n     0 babbles, 0 late collision, 0 deferred\n     0 lost carrier, 0 no carrier, 0 PAUSE output\n     0 output buffer failures, 0 output buffers swapped out\nFastEthernet1/0/3 is up, line protocol is up (connected)\n  Hardware is Fast Ethernet, address is 0014.1c57.a485 (bia 0014.1c57.a485)\n  MTU 1500 bytes, BW 100000 Kbit, DLY 100 usec,\n     reliability 255/255, txload 1/255, rxload 1/255\n  Encapsulation ARPA, loopback not set\n  Keepalive set (10 sec)\n  Full-duplex, 100Mb/s, media type is 10/100BaseTX\n  input flow-control is off, output flow-control is unsupported\n  ARP type: ARPA, ARP Timeout 04:00:00\n  Last input never, output 00:00:01, output hang never\n  Last clearing of \"show interface\" counters never\n  Input queue: 0/75/0/0 (size/max/drops/flushes); Total output drops: 0\n  Queueing strategy: fifo\n  Output queue: 0/40 (size/max)\n  5 minute input rate 0 bits/sec, 0 packets/sec\n  5 minute output rate 1000 bits/sec, 1 packets/sec\n     233361378 packets input, 34485100658 bytes, 0 no buffer\n     Received 4812693 broadcasts (0 multicasts)\n     0 runts, 0 giants, 0 throttles\n     0 input errors, 0 CRC, 0 frame, 0 overrun, 0 ignored\n     0 watchdog, 0 multicast, 0 pause input\n     0 input packets with dribble condition detected\n     246128007 packets output, 35790595839 bytes, 0 underruns\n     0 output errors, 0 collisions, 1 interface resets\n     0 babbles, 0 late collision, 0 deferred\n     0 lost carrier, 0 no carrier, 0 PAUSE output\n     0 output buffer failures, 0 output buffers swapped out\nFastEthernet1/0/4 is down, line protocol is down (notconnect)\n  Hardware is Fast Ethernet, address is 0014.1c57.a486 (bia 0014.1c57.a486)\n  MTU 1500 bytes, BW 10000 Kbit, DLY 1000 usec,\n     reliability 255/255, txload 1/255, rxload 1/255\n  Encapsulation ARPA, loopback not set\n  Keepalive set (10 sec)\n  Auto-duplex, Auto-speed, media type is 10/100BaseTX\n  input flow-control is off, output flow-control is unsupported\n  ARP type: ARPA, ARP Timeout 04:00:00\n  Last input never, output never, output hang never\n  Last clearing of \"show interface\" counters never\n  Input queue: 0/75/0/0 (size/max/drops/flushes); Total output drops: 0\n  Queueing strategy: fifo\n  Output queue: 0/40 (size/max)\n  5 minute input rate 0 bits/sec, 0 packets/sec\n  5 minute output rate 0 bits/sec, 0 packets/sec\n     0 packets input, 0 bytes, 0 no buffer\n     Received 0 broadcasts (0 multicasts)\n     0 runts, 0 giants, 0 throttles\n     0 input errors, 0 CRC, 0 frame, 0 overrun, 0 ignored\n     0 watchdog, 0 multicast, 0 pause input\n     0 input packets with dribble condition detected\n     0 packets output, 0 bytes, 0 underruns\n     0 output errors, 0 collisions, 1 interface resets\n     0 babbles, 0 late collision, 0 deferred\n     0 lost carrier, 0 no carrier, 0 PAUSE output\n     0 output buffer failures, 0 output buffers swapped out\nFastEthernet1/0/5 is down, line protocol is down (notconnect)\n  Hardware is Fast Ethernet, address is 0014.1c57.a487 (bia 0014.1c57.a487)\n  MTU 1500 bytes, BW 10000 Kbit, DLY 1000 usec,\n     reliability 255/255, txload 1/255, rxload 1/255\n  Encapsulation ARPA, loopback not set\n  Keepalive set (10 sec)\n  Auto-duplex, Auto-speed, media type is 10/100BaseTX\n  input flow-control is off, output flow-control is unsupported\n  ARP type: ARPA, ARP Timeout 04:00:00\n  Last input never, output never, output hang never\n  Last clearing of \"show interface\" counters never\n  Input queue: 0/75/0/0 (size/max/drops/flushes); Total output drops: 0\n  Queueing strategy: fifo\n  Output queue: 0/40 (size/max)\n  5 minute input rate 0 bits/sec, 0 packets/sec\n  5 minute output rate 0 bits/sec, 0 packets/sec\n     0 packets input, 0 bytes, 0 no buffer\n     Received 0 broadcasts (0 multicasts)\n     0 runts, 0 giants, 0 throttles\n     0 input errors, 0 CRC, 0 frame, 0 overrun, 0 ignored\n     0 watchdog, 0 multicast, 0 pause input\n     0 input packets with dribble condition detected\n     0 packets output, 0 bytes, 0 underruns\n     0 output errors, 0 collisions, 1 interface resets\n     0 babbles, 0 late collision, 0 deferred\n     0 lost carrier, 0 no carrier, 0 PAUSE output\n     0 output buffer failures, 0 output buffers swapped out\nFastEthernet1/0/6 is down, line protocol is down (notconnect)\n  Hardware is Fast Ethernet, address is 0014.1c57.a488 (bia 0014.1c57.a488)\n  MTU 1500 bytes, BW 10000 Kbit, DLY 1000 usec,\n     reliability 255/255, txload 1/255, rxload 1/255\n  Encapsulation ARPA, loopback not set\n  Keepalive set (10 sec)\n  Auto-duplex, Auto-speed, media type is 10/100BaseTX\n  input flow-control is off, output flow-control is unsupported\n  ARP type: ARPA, ARP Timeout 04:00:00\n  Last input never, output never, output hang never\n  Last clearing of \"show interface\" counters never\n  Input queue: 0/75/0/0 (size/max/drops/flushes); Total output drops: 0\n  Queueing strategy: fifo\n  Output queue: 0/40 (size/max)\n  5 minute input rate 0 bits/sec, 0 packets/sec\n  5 minute output rate 0 bits/sec, 0 packets/sec\n     0 packets input, 0 bytes, 0 no buffer\n     Received 0 broadcasts (0 multicasts)\n     0 runts, 0 giants, 0 throttles\n     0 input errors, 0 CRC, 0 frame, 0 overrun, 0 ignored\n     0 watchdog, 0 multicast, 0 pause input\n     0 input packets with dribble condition detected\n     0 packets output, 0 bytes, 0 underruns\n     0 output errors, 0 collisions, 1 interface resets\n     0 babbles, 0 late collision, 0 deferred\n     0 lost carrier, 0 no carrier, 0 PAUSE output\n     0 output buffer failures, 0 output buffers swapped out\nFastEthernet1/0/7 is down, line protocol is down (notconnect)\n  Hardware is Fast Ethernet, address is 0014.1c57.a489 (bia 0014.1c57.a489)\n  MTU 1500 bytes, BW 10000 Kbit, DLY 1000 usec,\n     reliability 255/255, txload 1/255, rxload 1/255\n  Encapsulation ARPA, loopback not set\n  Keepalive set (10 sec)\n  Auto-duplex, Auto-speed, media type is 10/100BaseTX\n  input flow-control is off, output flow-control is unsupported\n  ARP type: ARPA, ARP Timeout 04:00:00\n  Last input never, output never, output hang never\n  Last clearing of \"show interface\" counters never\n  Input queue: 0/75/0/0 (size/max/drops/flushes); Total output drops: 0\n  Queueing strategy: fifo\n  Output queue: 0/40 (size/max)\n  5 minute input rate 0 bits/sec, 0 packets/sec\n  5 minute output rate 0 bits/sec, 0 packets/sec\n     0 packets input, 0 bytes, 0 no buffer\n     Received 0 broadcasts (0 multicasts)\n     0 runts, 0 giants, 0 throttles\n     0 input errors, 0 CRC, 0 frame, 0 overrun, 0 ignored\n     0 watchdog, 0 multicast, 0 pause input\n     0 input packets with dribble condition detected\n     0 packets output, 0 bytes, 0 underruns\n     0 output errors, 0 collisions, 1 interface resets\n     0 babbles, 0 late collision, 0 deferred\n     0 lost carrier, 0 no carrier, 0 PAUSE output\n     0 output buffer failures, 0 output buffers swapped out\nFastEthernet1/0/8 is down, line protocol is down (notconnect)\n  Hardware is Fast Ethernet, address is 0014.1c57.a48a (bia 0014.1c57.a48a)\n  MTU 1500 bytes, BW 10000 Kbit, DLY 1000 usec,\n     reliability 255/255, txload 1/255, rxload 1/255\n  Encapsulation ARPA, loopback not set\n  Keepalive set (10 sec)\n  Auto-duplex, Auto-speed, media type is 10/100BaseTX\n  input flow-control is off, output flow-control is unsupported\n  ARP type: ARPA, ARP Timeout 04:00:00\n  Last input never, output never, output hang never\n  Last clearing of \"show interface\" counters never\n  Input queue: 0/75/0/0 (size/max/drops/flushes); Total output drops: 0\n  Queueing strategy: fifo\n  Output queue: 0/40 (size/max)\n  5 minute input rate 0 bits/sec, 0 packets/sec\n  5 minute output rate 0 bits/sec, 0 packets/sec\n     0 packets input, 0 bytes, 0 no buffer\n     Received 0 broadcasts (0 multicasts)\n     0 runts, 0 giants, 0 throttles\n     0 input errors, 0 CRC, 0 frame, 0 overrun, 0 ignored\n     0 watchdog, 0 multicast, 0 pause input\n     0 input packets with dribble condition detected\n     0 packets output, 0 bytes, 0 underruns\n     0 output errors, 0 collisions, 1 interface resets\n     0 babbles, 0 late collision, 0 deferred\n     0 lost carrier, 0 no carrier, 0 PAUSE output\n     0 output buffer failures, 0 output buffers swapped out\nFastEthernet1/0/9 is up, line protocol is up (connected)\n  Hardware is Fast Ethernet, address is 0014.1c57.a48b (bia 0014.1c57.a48b)\n  MTU 1500 bytes, BW 100000 Kbit, DLY 100 usec,\n     reliability 255/255, txload 1/255, rxload 99/255\n  Encapsulation ARPA, loopback not set\n  Keepalive set (10 sec)\n  Full-duplex, 100Mb/s, media type is 10/100BaseTX\n  input flow-control is off, output flow-control is unsupported\n  ARP type: ARPA, ARP Timeout 04:00:00\n  Last input 00:00:27, output 00:00:00, output hang never\n  Last clearing of \"show interface\" counters never\n  Input queue: 0/75/0/0 (size/max/drops/flushes); Total output drops: 0\n  Queueing strategy: fifo\n  Output queue: 0/40 (size/max)\n  5 minute input rate 38871000 bits/sec, 10083 packets/sec\n  5 minute output rate 174000 bits/sec, 327 packets/sec\n     86293954347 packets input, 41067077112070 bytes, 0 no buffer\n     Received 1862329 broadcasts (1861711 multicasts)\n     0 runts, 0 giants, 0 throttles\n     0 input errors, 0 CRC, 0 frame, 0 overrun, 0 ignored\n     0 watchdog, 1861711 multicast, 0 pause input\n     0 input packets with dribble condition detected\n     8120676183 packets output, 530792567729 bytes, 0 underruns\n     0 output errors, 0 collisions, 1 interface resets\n     0 babbles, 0 late collision, 0 deferred\n     0 lost carrier, 0 no carrier, 0 PAUSE output\n     0 output buffer failures, 0 output buffers swapped out\nFastEthernet1/0/10 is up, line protocol is up (connected)\n  Hardware is Fast Ethernet, address is 0014.1c57.a48c (bia 0014.1c57.a48c)\n  MTU 1500 bytes, BW 100000 Kbit, DLY 100 usec,\n     reliability 255/255, txload 1/255, rxload 1/255\n  Encapsulation ARPA, loopback not set\n  Keepalive set (10 sec)\n  Full-duplex, 100Mb/s, media type is 10/100BaseTX\n  input flow-control is off, output flow-control is unsupported\n  ARP type: ARPA, ARP Timeout 04:00:00\n  Last input 00:00:27, output 00:00:00, output hang never\n  Last clearing of \"show interface\" counters never\n  Input queue: 0/75/0/0 (size/max/drops/flushes); Total output drops: 0\n  Queueing strategy: fifo\n  Output queue: 0/40 (size/max)\n  5 minute input rate 0 bits/sec, 0 packets/sec\n  5 minute output rate 0 bits/sec, 0 packets/sec\n     85011546 packets input, 11989861828 bytes, 0 no buffer\n     Received 2516226 broadcasts (2515452 multicasts)\n     0 runts, 0 giants, 0 throttles\n     0 input errors, 0 CRC, 0 frame, 0 overrun, 0 ignored\n     0 watchdog, 2515452 multicast, 0 pause input\n     0 input packets with dribble condition detected\n     118427887 packets output, 13878610375 bytes, 0 underruns\n     0 output errors, 0 collisions, 1 interface resets\n     0 babbles, 0 late collision, 0 deferred\n     0 lost carrier, 0 no carrier, 0 PAUSE output\n     0 output buffer failures, 0 output buffers swapped out\nFastEthernet1/0/11 is down, line protocol is down (notconnect)\n  Hardware is Fast Ethernet, address is 0014.1c57.a48d (bia 0014.1c57.a48d)\n  MTU 1500 bytes, BW 100000 Kbit, DLY 100 usec,\n     reliability 255/255, txload 1/255, rxload 1/255\n  Encapsulation ARPA, loopback not set\n  Keepalive set (10 sec)\n  Auto-duplex, Auto-speed, media type is 10/100BaseTX\n  input flow-control is off, output flow-control is unsupported\n  ARP type: ARPA, ARP Timeout 04:00:00\n  Last input 21w5d, output 21w5d, output hang never\n  Last clearing of \"show interface\" counters never\n  Input queue: 0/75/0/0 (size/max/drops/flushes); Total output drops: 0\n  Queueing strategy: fifo\n  Output queue: 0/40 (size/max)\n  5 minute input rate 0 bits/sec, 0 packets/sec\n  5 minute output rate 0 bits/sec, 0 packets/sec\n     13503663 packets input, 4753753238 bytes, 0 no buffer\n     Received 1253486 broadcasts (1253337 multicasts)\n     0 runts, 0 giants, 0 throttles\n     0 input errors, 0 CRC, 0 frame, 0 overrun, 0 ignored\n     0 watchdog, 1253337 multicast, 0 pause input\n     0 input packets with dribble condition detected\n     96706284 packets output, 8355857467 bytes, 0 underruns\n     0 output errors, 0 collisions, 1 interface resets\n     0 babbles, 0 late collision, 0 deferred\n     0 lost carrier, 0 no carrier, 0 PAUSE output\n     0 output buffer failures, 0 output buffers swapped out\nFastEthernet1/0/12 is up, line protocol is up (connected)\n  Hardware is Fast Ethernet, address is 0014.1c57.a48e (bia 0014.1c57.a48e)\n  MTU 1500 bytes, BW 100000 Kbit, DLY 100 usec,\n     reliability 255/255, txload 1/255, rxload 1/255\n  Encapsulation ARPA, loopback not set\n  Keepalive set (10 sec)\n  Full-duplex, 100Mb/s, media type is 10/100BaseTX\n  input flow-control is off, output flow-control is unsupported\n  ARP type: ARPA, ARP Timeout 04:00:00\n  Last input 00:00:27, output 00:00:00, output hang never\n  Last clearing of \"show interface\" counters never\n  Input queue: 0/75/0/0 (size/max/drops/flushes); Total output drops: 0\n  Queueing strategy: fifo\n  Output queue: 0/40 (size/max)\n  5 minute input rate 0 bits/sec, 0 packets/sec\n  5 minute output rate 0 bits/sec, 0 packets/sec\n     566684 packets input, 149322191 bytes, 0 no buffer\n     Received 554098 broadcasts (554096 multicasts)\n     0 runts, 0 giants, 0 throttles\n     0 input errors, 0 CRC, 0 frame, 0 overrun, 0 ignored\n     0 watchdog, 554096 multicast, 0 pause input\n     0 input packets with dribble condition detected\n     10387099 packets output, 839593247 bytes, 0 underruns\n     0 output errors, 0 collisions, 1 interface resets\n     0 babbles, 0 late collision, 0 deferred\n     0 lost carrier, 0 no carrier, 0 PAUSE output\n     0 output buffer failures, 0 output buffers swapped out\nFastEthernet1/0/13 is up, line protocol is up (connected)\n  Hardware is Fast Ethernet, address is 0014.1c57.a48f (bia 0014.1c57.a48f)\n  MTU 1500 bytes, BW 100000 Kbit, DLY 100 usec,\n     reliability 255/255, txload 1/255, rxload 1/255\n  Encapsulation ARPA, loopback not set\n  Keepalive set (10 sec)\n  Full-duplex, 100Mb/s, media type is 10/100BaseTX\n  input flow-control is off, output flow-control is unsupported\n  ARP type: ARPA, ARP Timeout 04:00:00\n  Last input 00:00:13, output 00:00:00, output hang never\n  Last clearing of \"show interface\" counters never\n  Input queue: 0/75/0/0 (size/max/drops/flushes); Total output drops: 0\n  Queueing strategy: fifo\n  Output queue: 0/40 (size/max)\n  5 minute input rate 0 bits/sec, 0 packets/sec\n  5 minute output rate 0 bits/sec, 0 packets/sec\n     5093298 packets input, 808035580 bytes, 0 no buffer\n     Received 827918 broadcasts (826665 multicasts)\n     0 runts, 0 giants, 0 throttles\n     0 input errors, 0 CRC, 0 frame, 0 overrun, 0 ignored\n     0 watchdog, 826665 multicast, 0 pause input\n     0 input packets with dribble condition detected\n     35059143 packets output, 4327552848 bytes, 0 underruns\n     0 output errors, 0 collisions, 1 interface resets\n     0 babbles, 0 late collision, 0 deferred\n     0 lost carrier, 0 no carrier, 0 PAUSE output\n     0 output buffer failures, 0 output buffers swapped out\nFastEthernet1/0/14 is up, line protocol is up (connected)\n  Hardware is Fast Ethernet, address is 0014.1c57.a490 (bia 0014.1c57.a490)\n  MTU 1500 bytes, BW 100000 Kbit, DLY 100 usec,\n     reliability 255/255, txload 1/255, rxload 1/255\n  Encapsulation ARPA, loopback not set\n  Keepalive set (10 sec)\n  Full-duplex, 100Mb/s, media type is 10/100BaseTX\n  input flow-control is off, output flow-control is unsupported\n  ARP type: ARPA, ARP Timeout 04:00:00\n  Last input 00:00:13, output 00:00:00, output hang never\n  Last clearing of \"show interface\" counters never\n  Input queue: 0/75/0/0 (size/max/drops/flushes); Total output drops: 0\n  Queueing strategy: fifo\n  Output queue: 0/40 (size/max)\n  5 minute input rate 0 bits/sec, 0 packets/sec\n  5 minute output rate 0 bits/sec, 0 packets/sec\n     4381776 packets input, 714050947 bytes, 0 no buffer\n     Received 888514 broadcasts (825040 multicasts)\n     0 runts, 0 giants, 0 throttles\n     0 input errors, 0 CRC, 0 frame, 0 overrun, 0 ignored\n     0 watchdog, 825040 multicast, 0 pause input\n     0 input packets with dribble condition detected\n     33579140 packets output, 4215972552 bytes, 0 underruns\n     0 output errors, 0 collisions, 1 interface resets\n     0 babbles, 0 late collision, 0 deferred\n     0 lost carrier, 0 no carrier, 0 PAUSE output\n     0 output buffer failures, 0 output buffers swapped out\nFastEthernet1/0/15 is down, line protocol is down (notconnect)\n  Hardware is Fast Ethernet, address is 0014.1c57.a491 (bia 0014.1c57.a491)\n  MTU 1500 bytes, BW 100000 Kbit, DLY 100 usec,\n     reliability 255/255, txload 1/255, rxload 1/255\n  Encapsulation ARPA, loopback not set\n  Keepalive set (10 sec)\n  Auto-duplex, Auto-speed, media type is 10/100BaseTX\n  input flow-control is off, output flow-control is unsupported\n  ARP type: ARPA, ARP Timeout 04:00:00\n  Last input 36w5d, output 36w5d, output hang never\n  Last clearing of \"show interface\" counters never\n  Input queue: 0/75/0/0 (size/max/drops/flushes); Total output drops: 0\n  Queueing strategy: fifo\n  Output queue: 0/40 (size/max)\n  5 minute input rate 0 bits/sec, 0 packets/sec\n  5 minute output rate 0 bits/sec, 0 packets/sec\n     6095906 packets input, 969445394 bytes, 0 no buffer\n     Received 739894 broadcasts (738041 multicasts)\n     0 runts, 0 giants, 0 throttles\n     0 input errors, 0 CRC, 0 frame, 0 overrun, 0 ignored\n     0 watchdog, 738041 multicast, 0 pause input\n     0 input packets with dribble condition detected\n     31933579 packets output, 2817760810 bytes, 0 underruns\n     0 output errors, 0 collisions, 1 interface resets\n     0 babbles, 0 late collision, 0 deferred\n     0 lost carrier, 0 no carrier, 0 PAUSE output\n     0 output buffer failures, 0 output buffers swapped out\nFastEthernet1/0/16 is down, line protocol is down (notconnect)\n  Hardware is Fast Ethernet, address is 0014.1c57.a492 (bia 0014.1c57.a492)\n  MTU 1500 bytes, BW 100000 Kbit, DLY 100 usec,\n     reliability 255/255, txload 1/255, rxload 1/255\n  Encapsulation ARPA, loopback not set\n  Keepalive set (10 sec)\n  Auto-duplex, Auto-speed, media type is 10/100BaseTX\n  input flow-control is off, output flow-control is unsupported\n  ARP type: ARPA, ARP Timeout 04:00:00\n  Last input 36w5d, output 36w5d, output hang never\n  Last clearing of \"show interface\" counters never\n  Input queue: 0/75/0/0 (size/max/drops/flushes); Total output drops: 0\n  Queueing strategy: fifo\n  Output queue: 0/40 (size/max)\n  5 minute input rate 0 bits/sec, 0 packets/sec\n  5 minute output rate 0 bits/sec, 0 packets/sec\n     3048741 packets input, 489808413 bytes, 0 no buffer\n     Received 495442 broadcasts (495388 multicasts)\n     0 runts, 0 giants, 0 throttles\n     0 input errors, 0 CRC, 0 frame, 0 overrun, 0 ignored\n     0 watchdog, 495388 multicast, 0 pause input\n     0 input packets with dribble condition detected\n     23191458 packets output, 1834173050 bytes, 0 underruns\n     0 output errors, 0 collisions, 1 interface resets\n     0 babbles, 0 late collision, 0 deferred\n     0 lost carrier, 0 no carrier, 0 PAUSE output\n     0 output buffer failures, 0 output buffers swapped out\nFastEthernet1/0/17 is down, line protocol is down (notconnect)\n  Hardware is Fast Ethernet, address is 0014.1c57.a493 (bia 0014.1c57.a493)\n  MTU 1500 bytes, BW 100000 Kbit, DLY 100 usec,\n     reliability 255/255, txload 1/255, rxload 1/255\n  Encapsulation ARPA, loopback not set\n  Keepalive set (10 sec)\n  Auto-duplex, Auto-speed, media type is 10/100BaseTX\n  input flow-control is off, output flow-control is unsupported\n  ARP type: ARPA, ARP Timeout 04:00:00\n  Last input 1y28w, output 1y28w, output hang never\n  Last clearing of \"show interface\" counters never\n  Input queue: 0/75/0/0 (size/max/drops/flushes); Total output drops: 0\n  Queueing strategy: fifo\n  Output queue: 0/40 (size/max)\n  5 minute input rate 0 bits/sec, 0 packets/sec\n  5 minute output rate 0 bits/sec, 0 packets/sec\n     515815 packets input, 79623043 bytes, 0 no buffer\n     Received 41131 broadcasts (41093 multicasts)\n     0 runts, 0 giants, 0 throttles\n     0 input errors, 0 CRC, 0 frame, 0 overrun, 0 ignored\n     0 watchdog, 41093 multicast, 0 pause input\n     0 input packets with dribble condition detected\n     3364092 packets output, 256764837 bytes, 0 underruns\n     0 output errors, 0 collisions, 1 interface resets\n     0 babbles, 0 late collision, 0 deferred\n     0 lost carrier, 0 no carrier, 0 PAUSE output\n     0 output buffer failures, 0 output buffers swapped out\nFastEthernet1/0/18 is down, line protocol is down (notconnect)\n  Hardware is Fast Ethernet, address is 0014.1c57.a494 (bia 0014.1c57.a494)\n  MTU 1500 bytes, BW 100000 Kbit, DLY 100 usec,\n     reliability 255/255, txload 1/255, rxload 1/255\n  Encapsulation ARPA, loopback not set\n  Keepalive set (10 sec)\n  Auto-duplex, Auto-speed, media type is 10/100BaseTX\n  input flow-control is off, output flow-control is unsupported\n  ARP type: ARPA, ARP Timeout 04:00:00\n  Last input 1y29w, output 1y29w, output hang never\n  Last clearing of \"show interface\" counters never\n  Input queue: 0/75/0/0 (size/max/drops/flushes); Total output drops: 0\n  Queueing strategy: fifo\n  Output queue: 0/40 (size/max)\n  5 minute input rate 0 bits/sec, 0 packets/sec\n  5 minute output rate 0 bits/sec, 0 packets/sec\n     56335 packets input, 9435768 bytes, 0 no buffer\n     Received 9185 broadcasts (9149 multicasts)\n     0 runts, 0 giants, 0 throttles\n     0 input errors, 0 CRC, 0 frame, 0 overrun, 0 ignored\n     0 watchdog, 9149 multicast, 0 pause input\n     0 input packets with dribble condition detected\n     2263838 packets output, 151796214 bytes, 0 underruns\n     0 output errors, 0 collisions, 1 interface resets\n     0 babbles, 0 late collision, 0 deferred\n     0 lost carrier, 0 no carrier, 0 PAUSE output\n     0 output buffer failures, 0 output buffers swapped out\nFastEthernet1/0/19 is up, line protocol is up (connected)\n  Hardware is Fast Ethernet, address is 0014.1c57.a495 (bia 0014.1c57.a495)\n  MTU 1500 bytes, BW 100000 Kbit, DLY 100 usec,\n     reliability 255/255, txload 1/255, rxload 1/255\n  Encapsulation ARPA, loopback not set\n  Keepalive set (10 sec)\n  Full-duplex, 100Mb/s, media type is 10/100BaseTX\n  input flow-control is off, output flow-control is unsupported\n  ARP type: ARPA, ARP Timeout 04:00:00\n  Last input 00:00:13, output 00:00:00, output hang never\n  Last clearing of \"show interface\" counters never\n  Input queue: 0/75/0/0 (size/max/drops/flushes); Total output drops: 0\n  Queueing strategy: fifo\n  Output queue: 0/40 (size/max)\n  5 minute input rate 0 bits/sec, 0 packets/sec\n  5 minute output rate 0 bits/sec, 0 packets/sec\n     2154038 packets input, 348457077 bytes, 0 no buffer\n     Received 549246 broadcasts (548182 multicasts)\n     0 runts, 0 giants, 0 throttles\n     0 input errors, 0 CRC, 0 frame, 0 overrun, 0 ignored\n     0 watchdog, 548182 multicast, 0 pause input\n     0 input packets with dribble condition detected\n     15816478 packets output, 2861125524 bytes, 0 underruns\n     0 output errors, 0 collisions, 1 interface resets\n     0 babbles, 0 late collision, 0 deferred\n     0 lost carrier, 0 no carrier, 0 PAUSE output\n     0 output buffer failures, 0 output buffers swapped out\nFastEthernet1/0/20 is up, line protocol is up (connected)\n  Hardware is Fast Ethernet, address is 0014.1c57.a496 (bia 0014.1c57.a496)\n  MTU 1500 bytes, BW 100000 Kbit, DLY 100 usec,\n     reliability 255/255, txload 1/255, rxload 1/255\n  Encapsulation ARPA, loopback not set\n  Keepalive set (10 sec)\n  Full-duplex, 100Mb/s, media type is 10/100BaseTX\n  input flow-control is off, output flow-control is unsupported\n  ARP type: ARPA, ARP Timeout 04:00:00\n  Last input 00:00:13, output 00:00:00, output hang never\n  Last clearing of \"show interface\" counters never\n  Input queue: 0/75/0/0 (size/max/drops/flushes); Total output drops: 0\n  Queueing strategy: fifo\n  Output queue: 0/40 (size/max)\n  5 minute input rate 0 bits/sec, 0 packets/sec\n  5 minute output rate 0 bits/sec, 0 packets/sec\n     2238092 packets input, 360874580 bytes, 0 no buffer\n     Received 549631 broadcasts (548228 multicasts)\n     0 runts, 0 giants, 0 throttles\n     0 input errors, 0 CRC, 0 frame, 0 overrun, 0 ignored\n     0 watchdog, 548228 multicast, 0 pause input\n     0 input packets with dribble condition detected\n     15877977 packets output, 2842501679 bytes, 0 underruns\n     0 output errors, 0 collisions, 1 interface resets\n     0 babbles, 0 late collision, 0 deferred\n     0 lost carrier, 0 no carrier, 0 PAUSE output\n     0 output buffer failures, 0 output buffers swapped out\nFastEthernet1/0/21 is up, line protocol is up (connected)\n  Hardware is Fast Ethernet, address is 0014.1c57.a497 (bia 0014.1c57.a497)\n  MTU 1500 bytes, BW 100000 Kbit, DLY 100 usec,\n     reliability 255/255, txload 1/255, rxload 1/255\n  Encapsulation ARPA, loopback not set\n  Keepalive set (10 sec)\n  Full-duplex, 100Mb/s, media type is 10/100BaseTX\n  input flow-control is off, output flow-control is unsupported\n  ARP type: ARPA, ARP Timeout 04:00:00\n  Last input 00:00:25, output 00:00:00, output hang never\n  Last clearing of \"show interface\" counters never\n  Input queue: 0/75/0/0 (size/max/drops/flushes); Total output drops: 0\n  Queueing strategy: fifo\n  Output queue: 0/40 (size/max)\n  5 minute input rate 0 bits/sec, 0 packets/sec\n  5 minute output rate 0 bits/sec, 0 packets/sec\n     4942593 packets input, 553715331 bytes, 0 no buffer\n     Received 816566 broadcasts (814921 multicasts)\n     0 runts, 0 giants, 0 throttles\n     1 input errors, 0 CRC, 0 frame, 0 overrun, 0 ignored\n     0 watchdog, 814921 multicast, 0 pause input\n     0 input packets with dribble condition detected\n     43723513 packets output, 3415744145 bytes, 0 underruns\n     0 output errors, 0 collisions, 1 interface resets\n     0 babbles, 0 late collision, 0 deferred\n     0 lost carrier, 0 no carrier, 0 PAUSE output\n     0 output buffer failures, 0 output buffers swapped out\nFastEthernet1/0/22 is up, line protocol is up (connected)\n  Hardware is Fast Ethernet, address is 0014.1c57.a498 (bia 0014.1c57.a498)\n  MTU 1500 bytes, BW 100000 Kbit, DLY 100 usec,\n     reliability 255/255, txload 1/255, rxload 1/255\n  Encapsulation ARPA, loopback not set\n  Keepalive set (10 sec)\n  Full-duplex, 100Mb/s, media type is 10/100BaseTX\n  input flow-control is off, output flow-control is unsupported\n  ARP type: ARPA, ARP Timeout 04:00:00\n  Last input 00:00:00, output 00:00:00, output hang never\n  Last clearing of \"show interface\" counters never\n  Input queue: 0/75/0/0 (size/max/drops/flushes); Total output drops: 0\n  Queueing strategy: fifo\n  Output queue: 0/40 (size/max)\n  5 minute input rate 0 bits/sec, 0 packets/sec\n  5 minute output rate 0 bits/sec, 0 packets/sec\n     6201152 packets input, 700304632 bytes, 0 no buffer\n     Received 652574 broadcasts (652397 multicasts)\n     0 runts, 0 giants, 0 throttles\n     1 input errors, 0 CRC, 0 frame, 0 overrun, 0 ignored\n     0 watchdog, 652397 multicast, 0 pause input\n     0 input packets with dribble condition detected\n     43660027 packets output, 3409805231 bytes, 0 underruns\n     0 output errors, 0 collisions, 1 interface resets\n     0 babbles, 0 late collision, 0 deferred\n     0 lost carrier, 0 no carrier, 0 PAUSE output\n     0 output buffer failures, 0 output buffers swapped out\nFastEthernet1/0/23 is down, line protocol is down (notconnect)\n  Hardware is Fast Ethernet, address is 0014.1c57.a499 (bia 0014.1c57.a499)\n  MTU 1500 bytes, BW 100000 Kbit, DLY 100 usec,\n     reliability 255/255, txload 1/255, rxload 1/255\n  Encapsulation ARPA, loopback not set\n  Keepalive set (10 sec)\n  Auto-duplex, Auto-speed, media type is 10/100BaseTX\n  input flow-control is off, output flow-control is unsupported\n  ARP type: ARPA, ARP Timeout 04:00:00\n  Last input never, output 25w5d, output hang never\n  Last clearing of \"show interface\" counters never\n  Input queue: 0/75/0/0 (size/max/drops/flushes); Total output drops: 0\n  Queueing strategy: fifo\n  Output queue: 0/40 (size/max)\n  5 minute input rate 0 bits/sec, 0 packets/sec\n  5 minute output rate 0 bits/sec, 0 packets/sec\n     0 packets input, 0 bytes, 0 no buffer\n     Received 0 broadcasts (0 multicasts)\n     0 runts, 0 giants, 0 throttles\n     0 input errors, 0 CRC, 0 frame, 0 overrun, 0 ignored\n     0 watchdog, 0 multicast, 0 pause input\n     0 input packets with dribble condition detected\n     56 packets output, 5194 bytes, 0 underruns\n     0 output errors, 0 collisions, 1 interface resets\n     0 babbles, 0 late collision, 0 deferred\n     0 lost carrier, 0 no carrier, 0 PAUSE output\n     0 output buffer failures, 0 output buffers swapped out\nFastEthernet1/0/24 is up, line protocol is up (connected)\n  Hardware is Fast Ethernet, address is 0014.1c57.a49a (bia 0014.1c57.a49a)\n  MTU 1500 bytes, BW 100000 Kbit, DLY 100 usec,\n     reliability 255/255, txload 1/255, rxload 1/255\n  Encapsulation ARPA, loopback not set\n  Keepalive set (10 sec)\n  Full-duplex, 100Mb/s, media type is 10/100BaseTX\n  input flow-control is off, output flow-control is unsupported\n  ARP type: ARPA, ARP Timeout 04:00:00\n  Last input 00:00:05, output 00:00:00, output hang never\n  Last clearing of \"show interface\" counters never\n  Input queue: 0/75/0/0 (size/max/drops/flushes); Total output drops: 0\n  Queueing strategy: fifo\n  Output queue: 0/40 (size/max)\n  5 minute input rate 0 bits/sec, 0 packets/sec\n  5 minute output rate 0 bits/sec, 0 packets/sec\n     2397801 packets input, 533671784 bytes, 0 no buffer\n     Received 2031277 broadcasts (2031248 multicasts)\n     0 runts, 0 giants, 0 throttles\n     0 input errors, 0 CRC, 0 frame, 0 overrun, 0 ignored\n     0 watchdog, 2031248 multicast, 0 pause input\n     0 input packets with dribble condition detected\n     45635335 packets output, 4268271556 bytes, 0 underruns\n     0 output errors, 0 collisions, 1 interface resets\n     0 babbles, 0 late collision, 0 deferred\n     0 lost carrier, 0 no carrier, 0 PAUSE output\n     0 output buffer failures, 0 output buffers swapped out\nFastEthernet1/0/25 is down, line protocol is down (notconnect)\n  Hardware is Fast Ethernet, address is 0014.1c57.a49d (bia 0014.1c57.a49d)\n  MTU 1500 bytes, BW 10000 Kbit, DLY 1000 usec,\n     reliability 255/255, txload 1/255, rxload 1/255\n  Encapsulation ARPA, loopback not set\n  Keepalive set (10 sec)\n  Auto-duplex, Auto-speed, media type is 10/100BaseTX\n  input flow-control is off, output flow-control is unsupported\n  ARP type: ARPA, ARP Timeout 04:00:00\n  Last input never, output never, output hang never\n  Last clearing of \"show interface\" counters never\n  Input queue: 0/75/0/0 (size/max/drops/flushes); Total output drops: 0\n  Queueing strategy: fifo\n  Output queue: 0/40 (size/max)\n  5 minute input rate 0 bits/sec, 0 packets/sec\n  5 minute output rate 0 bits/sec, 0 packets/sec\n     0 packets input, 0 bytes, 0 no buffer\n     Received 0 broadcasts (0 multicasts)\n     0 runts, 0 giants, 0 throttles\n     0 input errors, 0 CRC, 0 frame, 0 overrun, 0 ignored\n     0 watchdog, 0 multicast, 0 pause input\n     0 input packets with dribble condition detected\n     0 packets output, 0 bytes, 0 underruns\n     0 output errors, 0 collisions, 1 interface resets\n     0 babbles, 0 late collision, 0 deferred\n     0 lost carrier, 0 no carrier, 0 PAUSE output\n     0 output buffer failures, 0 output buffers swapped out\nFastEthernet1/0/26 is down, line protocol is down (notconnect)\n  Hardware is Fast Ethernet, address is 0014.1c57.a49e (bia 0014.1c57.a49e)\n  MTU 1500 bytes, BW 10000 Kbit, DLY 1000 usec,\n     reliability 255/255, txload 1/255, rxload 1/255\n  Encapsulation ARPA, loopback not set\n  Keepalive set (10 sec)\n  Auto-duplex, Auto-speed, media type is 10/100BaseTX\n  input flow-control is off, output flow-control is unsupported\n  ARP type: ARPA, ARP Timeout 04:00:00\n  Last input never, output never, output hang never\n  Last clearing of \"show interface\" counters never\n  Input queue: 0/75/0/0 (size/max/drops/flushes); Total output drops: 0\n  Queueing strategy: fifo\n  Output queue: 0/40 (size/max)\n  5 minute input rate 0 bits/sec, 0 packets/sec\n  5 minute output rate 0 bits/sec, 0 packets/sec\n     0 packets input, 0 bytes, 0 no buffer\n     Received 0 broadcasts (0 multicasts)\n     0 runts, 0 giants, 0 throttles\n     0 input errors, 0 CRC, 0 frame, 0 overrun, 0 ignored\n     0 watchdog, 0 multicast, 0 pause input\n     0 input packets with dribble condition detected\n     0 packets output, 0 bytes, 0 underruns\n     0 output errors, 0 collisions, 1 interface resets\n     0 babbles, 0 late collision, 0 deferred\n     0 lost carrier, 0 no carrier, 0 PAUSE output\n     0 output buffer failures, 0 output buffers swapped out\nFastEthernet1/0/27 is up, line protocol is up (connected)\n  Hardware is Fast Ethernet, address is 0014.1c57.a49f (bia 0014.1c57.a49f)\n  MTU 1500 bytes, BW 100000 Kbit, DLY 100 usec,\n     reliability 255/255, txload 1/255, rxload 1/255\n  Encapsulation ARPA, loopback not set\n  Keepalive set (10 sec)\n  Half-duplex, 100Mb/s, media type is 10/100BaseTX\n  input flow-control is off, output flow-control is unsupported\n  ARP type: ARPA, ARP Timeout 04:00:00\n  Last input never, output 00:00:00, output hang never\n  Last clearing of \"show interface\" counters never\n  Input queue: 0/75/0/0 (size/max/drops/flushes); Total output drops: 0\n  Queueing strategy: fifo\n  Output queue: 0/40 (size/max)\n  5 minute input rate 0 bits/sec, 0 packets/sec\n  5 minute output rate 0 bits/sec, 0 packets/sec\n     288816 packets input, 29063120 bytes, 0 no buffer\n     Received 93730 broadcasts (0 multicasts)\n     0 runts, 0 giants, 0 throttles\n     0 input errors, 0 CRC, 0 frame, 0 overrun, 0 ignored\n     0 watchdog, 0 multicast, 0 pause input\n     0 input packets with dribble condition detected\n     55357995 packets output, 4340952662 bytes, 0 underruns\n     0 output errors, 3 collisions, 1 interface resets\n     0 babbles, 0 late collision, 0 deferred\n     0 lost carrier, 0 no carrier, 0 PAUSE output\n     0 output buffer failures, 0 output buffers swapped out\nFastEthernet1/0/28 is up, line protocol is up (connected)\n  Hardware is Fast Ethernet, address is 0014.1c57.a4a0 (bia 0014.1c57.a4a0)\n  MTU 1500 bytes, BW 100000 Kbit, DLY 100 usec,\n     reliability 255/255, txload 1/255, rxload 1/255\n  Encapsulation ARPA, loopback not set\n  Keepalive set (10 sec)\n  Full-duplex, 100Mb/s, media type is 10/100BaseTX\n  input flow-control is off, output flow-control is unsupported\n  ARP type: ARPA, ARP Timeout 04:00:00\n  Last input never, output 00:00:00, output hang never\n  Last clearing of \"show interface\" counters never\n  Input queue: 0/75/0/0 (size/max/drops/flushes); Total output drops: 0\n  Queueing strategy: fifo\n  Output queue: 0/40 (size/max)\n  5 minute input rate 0 bits/sec, 0 packets/sec\n  5 minute output rate 0 bits/sec, 0 packets/sec\n     295313 packets input, 31891003 bytes, 0 no buffer\n     Received 93743 broadcasts (0 multicasts)\n     0 runts, 0 giants, 0 throttles\n     2 input errors, 1 CRC, 0 frame, 0 overrun, 0 ignored\n     0 watchdog, 0 multicast, 0 pause input\n     0 input packets with dribble condition detected\n     55364859 packets output, 4341674021 bytes, 0 underruns\n     0 output errors, 0 collisions, 1 interface resets\n     0 babbles, 0 late collision, 0 deferred\n     0 lost carrier, 0 no carrier, 0 PAUSE output\n     0 output buffer failures, 0 output buffers swapped out\nFastEthernet1/0/29 is up, line protocol is up (connected)\n  Hardware is Fast Ethernet, address is 0014.1c57.a4a1 (bia 0014.1c57.a4a1)\n  MTU 1500 bytes, BW 100000 Kbit, DLY 100 usec,\n     reliability 255/255, txload 1/255, rxload 1/255\n  Encapsulation ARPA, loopback not set\n  Keepalive set (10 sec)\n  Full-duplex, 100Mb/s, media type is 10/100BaseTX\n  input flow-control is off, output flow-control is unsupported\n  ARP type: ARPA, ARP Timeout 04:00:00\n  Last input never, output 00:00:00, output hang never\n  Last clearing of \"show interface\" counters never\n  Input queue: 0/75/0/0 (size/max/drops/flushes); Total output drops: 0\n  Queueing strategy: fifo\n  Output queue: 0/40 (size/max)\n  5 minute input rate 1000 bits/sec, 1 packets/sec\n  5 minute output rate 2000 bits/sec, 2 packets/sec\n     39214781 packets input, 7433968714 bytes, 0 no buffer\n     Received 2429 broadcasts (190 multicasts)\n     0 runts, 39 giants, 0 throttles\n     28898 input errors, 14167 CRC, 0 frame, 0 overrun, 0 ignored\n     0 watchdog, 190 multicast, 0 pause input\n     0 input packets with dribble condition detected\n     90202230 packets output, 9923517076 bytes, 0 underruns\n     0 output errors, 0 collisions, 3 interface resets\n     0 babbles, 0 late collision, 0 deferred\n     0 lost carrier, 0 no carrier, 0 PAUSE output\n     0 output buffer failures, 0 output buffers swapped out\nFastEthernet1/0/30 is up, line protocol is up (connected)\n  Hardware is Fast Ethernet, address is 0014.1c57.a4a2 (bia 0014.1c57.a4a2)\n  MTU 1500 bytes, BW 100000 Kbit, DLY 100 usec,\n     reliability 255/255, txload 1/255, rxload 1/255\n  Encapsulation ARPA, loopback not set\n  Keepalive set (10 sec)\n  Full-duplex, 100Mb/s, media type is 10/100BaseTX\n  input flow-control is off, output flow-control is unsupported\n  ARP type: ARPA, ARP Timeout 04:00:00\n  Last input never, output 00:00:00, output hang never\n  Last clearing of \"show interface\" counters never\n  Input queue: 0/75/0/0 (size/max/drops/flushes); Total output drops: 0\n  Queueing strategy: fifo\n  Output queue: 0/40 (size/max)\n  5 minute input rate 0 bits/sec, 0 packets/sec\n  5 minute output rate 0 bits/sec, 0 packets/sec\n     4811284 packets input, 307924495 bytes, 0 no buffer\n     Received 4811274 broadcasts (60 multicasts)\n     0 runts, 0 giants, 0 throttles\n     0 input errors, 0 CRC, 0 frame, 0 overrun, 0 ignored\n     0 watchdog, 60 multicast, 0 pause input\n     0 input packets with dribble condition detected\n     55162378 packets output, 4320891856 bytes, 0 underruns\n     0 output errors, 0 collisions, 1 interface resets\n     0 babbles, 0 late collision, 0 deferred\n     0 lost carrier, 0 no carrier, 0 PAUSE output\n     0 output buffer failures, 0 output buffers swapped out\nFastEthernet1/0/31 is up, line protocol is up (connected)\n  Hardware is Fast Ethernet, address is 0014.1c57.a4a3 (bia 0014.1c57.a4a3)\n  MTU 1500 bytes, BW 100000 Kbit, DLY 100 usec,\n     reliability 255/255, txload 1/255, rxload 1/255\n  Encapsulation ARPA, loopback not set\n  Keepalive set (10 sec)\n  Full-duplex, 100Mb/s, media type is 10/100BaseTX\n  input flow-control is off, output flow-control is unsupported\n  ARP type: ARPA, ARP Timeout 04:00:00\n  Last input 00:00:13, output 00:00:00, output hang never\n  Last clearing of \"show interface\" counters never\n  Input queue: 0/75/0/0 (size/max/drops/flushes); Total output drops: 0\n  Queueing strategy: fifo\n  Output queue: 0/40 (size/max)\n  5 minute input rate 0 bits/sec, 0 packets/sec\n  5 minute output rate 0 bits/sec, 0 packets/sec\n     2255624 packets input, 378850249 bytes, 0 no buffer\n     Received 559581 broadcasts (551530 multicasts)\n     0 runts, 0 giants, 0 throttles\n     0 input errors, 0 CRC, 0 frame, 0 overrun, 0 ignored\n     0 watchdog, 551530 multicast, 0 pause input\n     0 input packets with dribble condition detected\n     15969856 packets output, 2990878148 bytes, 0 underruns\n     0 output errors, 0 collisions, 1 interface resets\n     0 babbles, 0 late collision, 0 deferred\n     0 lost carrier, 0 no carrier, 0 PAUSE output\n     0 output buffer failures, 0 output buffers swapped out\nFastEthernet1/0/32 is up, line protocol is up (connected)\n  Hardware is Fast Ethernet, address is 0014.1c57.a4a4 (bia 0014.1c57.a4a4)\n  MTU 1500 bytes, BW 100000 Kbit, DLY 100 usec,\n     reliability 255/255, txload 1/255, rxload 1/255\n  Encapsulation ARPA, loopback not set\n  Keepalive set (10 sec)\n  Full-duplex, 100Mb/s, media type is 10/100BaseTX\n  input flow-control is off, output flow-control is unsupported\n  ARP type: ARPA, ARP Timeout 04:00:00\n  Last input 00:00:13, output 00:00:00, output hang never\n  Last clearing of \"show interface\" counters never\n  Input queue: 0/75/0/0 (size/max/drops/flushes); Total output drops: 0\n  Queueing strategy: fifo\n  Output queue: 0/40 (size/max)\n  5 minute input rate 0 bits/sec, 0 packets/sec\n  5 minute output rate 0 bits/sec, 0 packets/sec\n     5743877 packets input, 940903033 bytes, 0 no buffer\n     Received 504351 broadcasts (503679 multicasts)\n     0 runts, 0 giants, 0 throttles\n     0 input errors, 0 CRC, 0 frame, 0 overrun, 0 ignored\n     0 watchdog, 503679 multicast, 0 pause input\n     0 input packets with dribble condition detected\n     20133314 packets output, 3482805506 bytes, 0 underruns\n     0 output errors, 0 collisions, 1 interface resets\n     0 babbles, 0 late collision, 0 deferred\n     0 lost carrier, 0 no carrier, 0 PAUSE output\n     0 output buffer failures, 0 output buffers swapped out\nFastEthernet1/0/33 is up, line protocol is up (connected)\n  Hardware is Fast Ethernet, address is 0014.1c57.a4a5 (bia 0014.1c57.a4a5)\n  MTU 1500 bytes, BW 100000 Kbit, DLY 100 usec,\n     reliability 255/255, txload 1/255, rxload 1/255\n  Encapsulation ARPA, loopback not set\n  Keepalive set (10 sec)\n  Full-duplex, 100Mb/s, media type is 10/100BaseTX\n  input flow-control is off, output flow-control is unsupported\n  ARP type: ARPA, ARP Timeout 04:00:00\n  Last input 00:00:13, output 00:00:00, output hang never\n  Last clearing of \"show interface\" counters never\n  Input queue: 0/75/0/0 (size/max/drops/flushes); Total output drops: 0\n  Queueing strategy: fifo\n  Output queue: 0/40 (size/max)\n  5 minute input rate 0 bits/sec, 0 packets/sec\n  5 minute output rate 0 bits/sec, 0 packets/sec\n     11086568 packets input, 2419043608 bytes, 0 no buffer\n     Received 694838 broadcasts (689889 multicasts)\n     0 runts, 0 giants, 0 throttles\n     1 input errors, 0 CRC, 0 frame, 0 overrun, 0 ignored\n     0 watchdog, 689889 multicast, 0 pause input\n     0 input packets with dribble condition detected\n     46398900 packets output, 10652109924 bytes, 0 underruns\n     0 output errors, 0 collisions, 1 interface resets\n     0 babbles, 0 late collision, 0 deferred\n     0 lost carrier, 0 no carrier, 0 PAUSE output\n     0 output buffer failures, 0 output buffers swapped out\nFastEthernet1/0/34 is up, line protocol is up (connected)\n  Hardware is Fast Ethernet, address is 0014.1c57.a4a6 (bia 0014.1c57.a4a6)\n  MTU 1500 bytes, BW 100000 Kbit, DLY 100 usec,\n     reliability 255/255, txload 1/255, rxload 1/255\n  Encapsulation ARPA, loopback not set\n  Keepalive set (10 sec)\n  Full-duplex, 100Mb/s, media type is 10/100BaseTX\n  input flow-control is off, output flow-control is unsupported\n  ARP type: ARPA, ARP Timeout 04:00:00\n  Last input 00:00:13, output 00:00:00, output hang never\n  Last clearing of \"show interface\" counters never\n  Input queue: 0/75/0/0 (size/max/drops/flushes); Total output drops: 0\n  Queueing strategy: fifo\n  Output queue: 0/40 (size/max)\n  5 minute input rate 0 bits/sec, 0 packets/sec\n  5 minute output rate 0 bits/sec, 0 packets/sec\n     1071483 packets input, 185592800 bytes, 0 no buffer\n     Received 596225 broadcasts (592703 multicasts)\n     0 runts, 0 giants, 0 throttles\n     0 input errors, 0 CRC, 0 frame, 0 overrun, 0 ignored\n     0 watchdog, 592703 multicast, 0 pause input\n     0 input packets with dribble condition detected\n     11192764 packets output, 2239833866 bytes, 0 underruns\n     0 output errors, 0 collisions, 1 interface resets\n     0 babbles, 0 late collision, 0 deferred\n     0 lost carrier, 0 no carrier, 0 PAUSE output\n     0 output buffer failures, 0 output buffers swapped out\nFastEthernet1/0/35 is up, line protocol is up (connected)\n  Hardware is Fast Ethernet, address is 0014.1c57.a4a7 (bia 0014.1c57.a4a7)\n  MTU 1500 bytes, BW 100000 Kbit, DLY 100 usec,\n     reliability 255/255, txload 1/255, rxload 1/255\n  Encapsulation ARPA, loopback not set\n  Keepalive set (10 sec)\n  Full-duplex, 100Mb/s, media type is 10/100BaseTX\n  input flow-control is off, output flow-control is unsupported\n  ARP type: ARPA, ARP Timeout 04:00:00\n  Last input 25w5d, output 00:00:00, output hang never\n  Last clearing of \"show interface\" counters never\n  Input queue: 0/75/0/0 (size/max/drops/flushes); Total output drops: 252\n  Queueing strategy: fifo\n  Output queue: 0/40 (size/max)\n  5 minute input rate 3000 bits/sec, 3 packets/sec\n  5 minute output rate 2000 bits/sec, 3 packets/sec\n     252774135 packets input, 267313974161 bytes, 0 no buffer\n     Received 108008 broadcasts (63919 multicasts)\n     0 runts, 0 giants, 0 throttles\n     0 input errors, 0 CRC, 0 frame, 0 overrun, 0 ignored\n     0 watchdog, 63919 multicast, 0 pause input\n     0 input packets with dribble condition detected\n     136849790 packets output, 51880935835 bytes, 0 underruns\n     0 output errors, 0 collisions, 1 interface resets\n     0 babbles, 0 late collision, 0 deferred\n     0 lost carrier, 0 no carrier, 0 PAUSE output\n     0 output buffer failures, 0 output buffers swapped out\nFastEthernet1/0/36 is up, line protocol is up (connected)\n  Hardware is Fast Ethernet, address is 0014.1c57.a4a8 (bia 0014.1c57.a4a8)\n  MTU 1500 bytes, BW 100000 Kbit, DLY 100 usec,\n     reliability 255/255, txload 1/255, rxload 1/255\n  Encapsulation ARPA, loopback not set\n  Keepalive set (10 sec)\n  Full-duplex, 100Mb/s, media type is 10/100BaseTX\n  input flow-control is off, output flow-control is unsupported\n  ARP type: ARPA, ARP Timeout 04:00:00\n  Last input 00:00:00, output 00:00:00, output hang never\n  Last clearing of \"show interface\" counters never\n  Input queue: 0/75/0/0 (size/max/drops/flushes); Total output drops: 0\n  Queueing strategy: fifo\n  Output queue: 0/40 (size/max)\n  5 minute input rate 0 bits/sec, 0 packets/sec\n  5 minute output rate 0 bits/sec, 0 packets/sec\n     30561744 packets input, 33540275610 bytes, 0 no buffer\n     Received 688013 broadcasts (625257 multicasts)\n     0 runts, 0 giants, 0 throttles\n     0 input errors, 0 CRC, 0 frame, 0 overrun, 0 ignored\n     0 watchdog, 625257 multicast, 0 pause input\n     0 input packets with dribble condition detected\n     25816556 packets output, 13469425319 bytes, 0 underruns\n     0 output errors, 0 collisions, 1 interface resets\n     0 babbles, 0 late collision, 0 deferred\n     0 lost carrier, 0 no carrier, 0 PAUSE output\n     0 output buffer failures, 0 output buffers swapped out\nFastEthernet1/0/37 is down, line protocol is down (notconnect)\n  Hardware is Fast Ethernet, address is 0014.1c57.a4a9 (bia 0014.1c57.a4a9)\n  MTU 1500 bytes, BW 100000 Kbit, DLY 100 usec,\n     reliability 255/255, txload 1/255, rxload 1/255\n  Encapsulation ARPA, loopback not set\n  Keepalive set (10 sec)\n  Auto-duplex, Auto-speed, media type is 10/100BaseTX\n  input flow-control is off, output flow-control is unsupported\n  ARP type: ARPA, ARP Timeout 04:00:00\n  Last input 25w5d, output 25w5d, output hang never\n  Last clearing of \"show interface\" counters never\n  Input queue: 0/75/0/0 (size/max/drops/flushes); Total output drops: 0\n  Queueing strategy: fifo\n  Output queue: 0/40 (size/max)\n  5 minute input rate 0 bits/sec, 0 packets/sec\n  5 minute output rate 0 bits/sec, 0 packets/sec\n     23 packets input, 7026 bytes, 0 no buffer\n     Received 23 broadcasts (5 multicasts)\n     0 runts, 0 giants, 0 throttles\n     0 input errors, 0 CRC, 0 frame, 0 overrun, 0 ignored\n     0 watchdog, 5 multicast, 0 pause input\n     0 input packets with dribble condition detected\n     110 packets output, 14268 bytes, 0 underruns\n     0 output errors, 0 collisions, 1 interface resets\n     0 babbles, 0 late collision, 0 deferred\n     0 lost carrier, 0 no carrier, 0 PAUSE output\n     0 output buffer failures, 0 output buffers swapped out\nFastEthernet1/0/38 is down, line protocol is down (notconnect)\n  Hardware is Fast Ethernet, address is 0014.1c57.a4aa (bia 0014.1c57.a4aa)\n  MTU 1500 bytes, BW 10000 Kbit, DLY 1000 usec,\n     reliability 255/255, txload 1/255, rxload 1/255\n  Encapsulation ARPA, loopback not set\n  Keepalive set (10 sec)\n  Auto-duplex, Auto-speed, media type is 10/100BaseTX\n  input flow-control is off, output flow-control is unsupported\n  ARP type: ARPA, ARP Timeout 04:00:00\n  Last input never, output never, output hang never\n  Last clearing of \"show interface\" counters never\n  Input queue: 0/75/0/0 (size/max/drops/flushes); Total output drops: 0\n  Queueing strategy: fifo\n  Output queue: 0/40 (size/max)\n  5 minute input rate 0 bits/sec, 0 packets/sec\n  5 minute output rate 0 bits/sec, 0 packets/sec\n     0 packets input, 0 bytes, 0 no buffer\n     Received 0 broadcasts (0 multicasts)\n     0 runts, 0 giants, 0 throttles\n     0 input errors, 0 CRC, 0 frame, 0 overrun, 0 ignored\n     0 watchdog, 0 multicast, 0 pause input\n     0 input packets with dribble condition detected\n     0 packets output, 0 bytes, 0 underruns\n     0 output errors, 0 collisions, 1 interface resets\n     0 babbles, 0 late collision, 0 deferred\n     0 lost carrier, 0 no carrier, 0 PAUSE output\n     0 output buffer failures, 0 output buffers swapped out\nFastEthernet1/0/39 is down, line protocol is down (notconnect)\n  Hardware is Fast Ethernet, address is 0014.1c57.a4ab (bia 0014.1c57.a4ab)\n  MTU 1500 bytes, BW 10000 Kbit, DLY 1000 usec,\n     reliability 255/255, txload 1/255, rxload 1/255\n  Encapsulation ARPA, loopback not set\n  Keepalive set (10 sec)\n  Auto-duplex, Auto-speed, media type is 10/100BaseTX\n  input flow-control is off, output flow-control is unsupported\n  ARP type: ARPA, ARP Timeout 04:00:00\n  Last input never, output never, output hang never\n  Last clearing of \"show interface\" counters never\n  Input queue: 0/75/0/0 (size/max/drops/flushes); Total output drops: 0\n  Queueing strategy: fifo\n  Output queue: 0/40 (size/max)\n  5 minute input rate 0 bits/sec, 0 packets/sec\n  5 minute output rate 0 bits/sec, 0 packets/sec\n     0 packets input, 0 bytes, 0 no buffer\n     Received 0 broadcasts (0 multicasts)\n     0 runts, 0 giants, 0 throttles\n     0 input errors, 0 CRC, 0 frame, 0 overrun, 0 ignored\n     0 watchdog, 0 multicast, 0 pause input\n     0 input packets with dribble condition detected\n     0 packets output, 0 bytes, 0 underruns\n     0 output errors, 0 collisions, 1 interface resets\n     0 babbles, 0 late collision, 0 deferred\n     0 lost carrier, 0 no carrier, 0 PAUSE output\n     0 output buffer failures, 0 output buffers swapped out\nFastEthernet1/0/40 is down, line protocol is down (notconnect)\n  Hardware is Fast Ethernet, address is 0014.1c57.a4ac (bia 0014.1c57.a4ac)\n  MTU 1500 bytes, BW 10000 Kbit, DLY 1000 usec,\n     reliability 255/255, txload 1/255, rxload 1/255\n  Encapsulation ARPA, loopback not set\n  Keepalive set (10 sec)\n  Auto-duplex, Auto-speed, media type is 10/100BaseTX\n  input flow-control is off, output flow-control is unsupported\n  ARP type: ARPA, ARP Timeout 04:00:00\n  Last input never, output never, output hang never\n  Last clearing of \"show interface\" counters never\n  Input queue: 0/75/0/0 (size/max/drops/flushes); Total output drops: 0\n  Queueing strategy: fifo\n  Output queue: 0/40 (size/max)\n  5 minute input rate 0 bits/sec, 0 packets/sec\n  5 minute output rate 0 bits/sec, 0 packets/sec\n     0 packets input, 0 bytes, 0 no buffer\n     Received 0 broadcasts (0 multicasts)\n     0 runts, 0 giants, 0 throttles\n     0 input errors, 0 CRC, 0 frame, 0 overrun, 0 ignored\n     0 watchdog, 0 multicast, 0 pause input\n     0 input packets with dribble condition detected\n     0 packets output, 0 bytes, 0 underruns\n     0 output errors, 0 collisions, 1 interface resets\n     0 babbles, 0 late collision, 0 deferred\n     0 lost carrier, 0 no carrier, 0 PAUSE output\n     0 output buffer failures, 0 output buffers swapped out\nFastEthernet1/0/41 is down, line protocol is down (notconnect)\n  Hardware is Fast Ethernet, address is 0014.1c57.a4ad (bia 0014.1c57.a4ad)\n  MTU 1500 bytes, BW 10000 Kbit, DLY 1000 usec,\n     reliability 255/255, txload 1/255, rxload 1/255\n  Encapsulation ARPA, loopback not set\n  Keepalive set (10 sec)\n  Auto-duplex, Auto-speed, media type is 10/100BaseTX\n  input flow-control is off, output flow-control is unsupported\n  ARP type: ARPA, ARP Timeout 04:00:00\n  Last input never, output never, output hang never\n  Last clearing of \"show interface\" counters never\n  Input queue: 0/75/0/0 (size/max/drops/flushes); Total output drops: 0\n  Queueing strategy: fifo\n  Output queue: 0/40 (size/max)\n  5 minute input rate 0 bits/sec, 0 packets/sec\n  5 minute output rate 0 bits/sec, 0 packets/sec\n     0 packets input, 0 bytes, 0 no buffer\n     Received 0 broadcasts (0 multicasts)\n     0 runts, 0 giants, 0 throttles\n     0 input errors, 0 CRC, 0 frame, 0 overrun, 0 ignored\n     0 watchdog, 0 multicast, 0 pause input\n     0 input packets with dribble condition detected\n     0 packets output, 0 bytes, 0 underruns\n     0 output errors, 0 collisions, 1 interface resets\n     0 babbles, 0 late collision, 0 deferred\n     0 lost carrier, 0 no carrier, 0 PAUSE output\n     0 output buffer failures, 0 output buffers swapped out\nFastEthernet1/0/42 is down, line protocol is down (notconnect)\n  Hardware is Fast Ethernet, address is 0014.1c57.a4ae (bia 0014.1c57.a4ae)\n  MTU 1500 bytes, BW 10000 Kbit, DLY 1000 usec,\n     reliability 255/255, txload 1/255, rxload 1/255\n  Encapsulation ARPA, loopback not set\n  Keepalive set (10 sec)\n  Auto-duplex, Auto-speed, media type is 10/100BaseTX\n  input flow-control is off, output flow-control is unsupported\n  ARP type: ARPA, ARP Timeout 04:00:00\n  Last input never, output never, output hang never\n  Last clearing of \"show interface\" counters never\n  Input queue: 0/75/0/0 (size/max/drops/flushes); Total output drops: 0\n  Queueing strategy: fifo\n  Output queue: 0/40 (size/max)\n  5 minute input rate 0 bits/sec, 0 packets/sec\n  5 minute output rate 0 bits/sec, 0 packets/sec\n     0 packets input, 0 bytes, 0 no buffer\n     Received 0 broadcasts (0 multicasts)\n     0 runts, 0 giants, 0 throttles\n     0 input errors, 0 CRC, 0 frame, 0 overrun, 0 ignored\n     0 watchdog, 0 multicast, 0 pause input\n     0 input packets with dribble condition detected\n     0 packets output, 0 bytes, 0 underruns\n     0 output errors, 0 collisions, 1 interface resets\n     0 babbles, 0 late collision, 0 deferred\n     0 lost carrier, 0 no carrier, 0 PAUSE output\n     0 output buffer failures, 0 output buffers swapped out\nFastEthernet1/0/43 is down, line protocol is down (notconnect)\n  Hardware is Fast Ethernet, address is 0014.1c57.a4af (bia 0014.1c57.a4af)\n  MTU 1500 bytes, BW 100000 Kbit, DLY 100 usec,\n     reliability 255/255, txload 1/255, rxload 1/255\n  Encapsulation ARPA, loopback not set\n  Keepalive set (10 sec)\n  Auto-duplex, Auto-speed, media type is 10/100BaseTX\n  input flow-control is off, output flow-control is unsupported\n  ARP type: ARPA, ARP Timeout 04:00:00\n  Last input never, output 25w5d, output hang never\n  Last clearing of \"show interface\" counters never\n  Input queue: 0/75/0/0 (size/max/drops/flushes); Total output drops: 0\n  Queueing strategy: fifo\n  Output queue: 0/40 (size/max)\n  5 minute input rate 0 bits/sec, 0 packets/sec\n  5 minute output rate 0 bits/sec, 0 packets/sec\n     33944 packets input, 4980418 bytes, 0 no buffer\n     Received 2337 broadcasts (614 multicasts)\n     0 runts, 0 giants, 0 throttles\n     0 input errors, 0 CRC, 0 frame, 0 overrun, 0 ignored\n     0 watchdog, 614 multicast, 0 pause input\n     0 input packets with dribble condition detected\n     52215 packets output, 23364008 bytes, 0 underruns\n     0 output errors, 0 collisions, 1 interface resets\n     0 babbles, 0 late collision, 0 deferred\n     0 lost carrier, 0 no carrier, 0 PAUSE output\n     0 output buffer failures, 0 output buffers swapped out\nFastEthernet1/0/44 is down, line protocol is down (notconnect)\n  Hardware is Fast Ethernet, address is 0014.1c57.a4b0 (bia 0014.1c57.a4b0)\n  MTU 1500 bytes, BW 10000 Kbit, DLY 1000 usec,\n     reliability 255/255, txload 1/255, rxload 1/255\n  Encapsulation ARPA, loopback not set\n  Keepalive set (10 sec)\n  Auto-duplex, Auto-speed, media type is 10/100BaseTX\n  input flow-control is off, output flow-control is unsupported\n  ARP type: ARPA, ARP Timeout 04:00:00\n  Last input never, output never, output hang never\n  Last clearing of \"show interface\" counters never\n  Input queue: 0/75/0/0 (size/max/drops/flushes); Total output drops: 0\n  Queueing strategy: fifo\n  Output queue: 0/40 (size/max)\n  5 minute input rate 0 bits/sec, 0 packets/sec\n  5 minute output rate 0 bits/sec, 0 packets/sec\n     0 packets input, 0 bytes, 0 no buffer\n     Received 0 broadcasts (0 multicasts)\n     0 runts, 0 giants, 0 throttles\n     0 input errors, 0 CRC, 0 frame, 0 overrun, 0 ignored\n     0 watchdog, 0 multicast, 0 pause input\n     0 input packets with dribble condition detected\n     0 packets output, 0 bytes, 0 underruns\n     0 output errors, 0 collisions, 1 interface resets\n     0 babbles, 0 late collision, 0 deferred\n     0 lost carrier, 0 no carrier, 0 PAUSE output\n     0 output buffer failures, 0 output buffers swapped out\nFastEthernet1/0/45 is up, line protocol is up (connected)\n  Hardware is Fast Ethernet, address is 0014.1c57.a4b1 (bia 0014.1c57.a4b1)\n  MTU 1500 bytes, BW 100000 Kbit, DLY 100 usec,\n     reliability 255/255, txload 1/255, rxload 1/255\n  Encapsulation ARPA, loopback not set\n  Keepalive set (10 sec)\n  Full-duplex, 100Mb/s, media type is 10/100BaseTX\n  input flow-control is off, output flow-control is unsupported\n  ARP type: ARPA, ARP Timeout 04:00:00\n  Last input never, output 00:00:01, output hang never\n  Last clearing of \"show interface\" counters never\n  Input queue: 0/75/0/0 (size/max/drops/flushes); Total output drops: 0\n  Queueing strategy: fifo\n  Output queue: 0/40 (size/max)\n  5 minute input rate 0 bits/sec, 0 packets/sec\n  5 minute output rate 0 bits/sec, 0 packets/sec\n     1103 packets input, 70592 bytes, 0 no buffer\n     Received 16 broadcasts (0 multicasts)\n     0 runts, 0 giants, 0 throttles\n     0 input errors, 0 CRC, 0 frame, 0 overrun, 0 ignored\n     0 watchdog, 0 multicast, 0 pause input\n     0 input packets with dribble condition detected\n     10099477 packets output, 862020215 bytes, 0 underruns\n     0 output errors, 0 collisions, 1 interface resets\n     0 babbles, 0 late collision, 0 deferred\n     0 lost carrier, 0 no carrier, 0 PAUSE output\n     0 output buffer failures, 0 output buffers swapped out\nFastEthernet1/0/46 is down, line protocol is down (notconnect)\n  Hardware is Fast Ethernet, address is 0014.1c57.a4b2 (bia 0014.1c57.a4b2)\n  MTU 1500 bytes, BW 10000 Kbit, DLY 1000 usec,\n     reliability 255/255, txload 1/255, rxload 1/255\n  Encapsulation ARPA, loopback not set\n  Keepalive set (10 sec)\n  Auto-duplex, Auto-speed, media type is 10/100BaseTX\n  input flow-control is off, output flow-control is unsupported\n  ARP type: ARPA, ARP Timeout 04:00:00\n  Last input never, output never, output hang never\n  Last clearing of \"show interface\" counters never\n  Input queue: 0/75/0/0 (size/max/drops/flushes); Total output drops: 0\n  Queueing strategy: fifo\n  Output queue: 0/40 (size/max)\n  5 minute input rate 0 bits/sec, 0 packets/sec\n  5 minute output rate 0 bits/sec, 0 packets/sec\n     0 packets input, 0 bytes, 0 no buffer\n     Received 0 broadcasts (0 multicasts)\n     0 runts, 0 giants, 0 throttles\n     0 input errors, 0 CRC, 0 frame, 0 overrun, 0 ignored\n     0 watchdog, 0 multicast, 0 pause input\n     0 input packets with dribble condition detected\n     0 packets output, 0 bytes, 0 underruns\n     0 output errors, 0 collisions, 1 interface resets\n     0 babbles, 0 late collision, 0 deferred\n     0 lost carrier, 0 no carrier, 0 PAUSE output\n     0 output buffer failures, 0 output buffers swapped out\nFastEthernet1/0/47 is down, line protocol is down (notconnect)\n  Hardware is Fast Ethernet, address is 0014.1c57.a4b3 (bia 0014.1c57.a4b3)\n  MTU 1500 bytes, BW 10000 Kbit, DLY 1000 usec,\n     reliability 255/255, txload 1/255, rxload 1/255\n  Encapsulation ARPA, loopback not set\n  Keepalive set (10 sec)\n  Auto-duplex, Auto-speed, media type is 10/100BaseTX\n  input flow-control is off, output flow-control is unsupported\n  ARP type: ARPA, ARP Timeout 04:00:00\n  Last input never, output never, output hang never\n  Last clearing of \"show interface\" counters never\n  Input queue: 0/75/0/0 (size/max/drops/flushes); Total output drops: 0\n  Queueing strategy: fifo\n  Output queue: 0/40 (size/max)\n  5 minute input rate 0 bits/sec, 0 packets/sec\n  5 minute output rate 0 bits/sec, 0 packets/sec\n     0 packets input, 0 bytes, 0 no buffer\n     Received 0 broadcasts (0 multicasts)\n     0 runts, 0 giants, 0 throttles\n     0 input errors, 0 CRC, 0 frame, 0 overrun, 0 ignored\n     0 watchdog, 0 multicast, 0 pause input\n     0 input packets with dribble condition detected\n     0 packets output, 0 bytes, 0 underruns\n     0 output errors, 0 collisions, 1 interface resets\n     0 babbles, 0 late collision, 0 deferred\n     0 lost carrier, 0 no carrier, 0 PAUSE output\n     0 output buffer failures, 0 output buffers swapped out\nFastEthernet1/0/48 is up, line protocol is up (connected)\n  Hardware is Fast Ethernet, address is 0014.1c57.a4b4 (bia 0014.1c57.a4b4)\n  MTU 1500 bytes, BW 100000 Kbit, DLY 100 usec,\n     reliability 255/255, txload 99/255, rxload 1/255\n  Encapsulation ARPA, loopback not set\n  Keepalive set (10 sec)\n  Full-duplex, 100Mb/s, media type is 10/100BaseTX\n  input flow-control is off, output flow-control is unsupported\n  ARP type: ARPA, ARP Timeout 04:00:00\n  Last input never, output 00:00:00, output hang never\n  Last clearing of \"show interface\" counters never\n  Input queue: 0/75/0/0 (size/max/drops/flushes); Total output drops: 15775\n  Queueing strategy: fifo\n  Output queue: 0/40 (size/max)\n  5 minute input rate 180000 bits/sec, 332 packets/sec\n  5 minute output rate 38881000 bits/sec, 10093 packets/sec\n     8407299374 packets input, 603713995336 bytes, 0 no buffer\n     Received 42103 broadcasts (0 multicasts)\n     0 runts, 0 giants, 0 throttles\n     0 input errors, 0 CRC, 0 frame, 0 overrun, 0 ignored\n     0 watchdog, 0 multicast, 0 pause input\n     0 input packets with dribble condition detected\n     86731716396 packets output, 41366362101294 bytes, 0 underruns\n     0 output errors, 0 collisions, 1 interface resets\n     0 babbles, 0 late collision, 0 deferred\n     0 lost carrier, 0 no carrier, 0 PAUSE output\n     0 output buffer failures, 0 output buffers swapped out\nGigabitEthernet1/0/1 is down, line protocol is down (notconnect)\n  Hardware is Gigabit Ethernet, address is 0014.1c57.a481 (bia 0014.1c57.a481)\n  MTU 1500 bytes, BW 10000 Kbit, DLY 1000 usec,\n     reliability 255/255, txload 1/255, rxload 1/255\n  Encapsulation ARPA, loopback not set\n  Keepalive not set\n  Auto-duplex, Auto-speed, link type is auto, media type is Not Present\n  input flow-control is off, output flow-control is unsupported\n  ARP type: ARPA, ARP Timeout 04:00:00\n  Last input never, output never, output hang never\n  Last clearing of \"show interface\" counters never\n  Input queue: 0/75/0/0 (size/max/drops/flushes); Total output drops: 0\n  Queueing strategy: fifo\n  Output queue: 0/40 (size/max)\n  5 minute input rate 0 bits/sec, 0 packets/sec\n  5 minute output rate 0 bits/sec, 0 packets/sec\n     0 packets input, 0 bytes, 0 no buffer\n     Received 0 broadcasts (0 multicasts)\n     0 runts, 0 giants, 0 throttles\n     0 input errors, 0 CRC, 0 frame, 0 overrun, 0 ignored\n     0 watchdog, 0 multicast, 0 pause input\n     0 input packets with dribble condition detected\n     0 packets output, 0 bytes, 0 underruns\n     0 output errors, 0 collisions, 1 interface resets\n     0 babbles, 0 late collision, 0 deferred\n     0 lost carrier, 0 no carrier, 0 PAUSE output\n     0 output buffer failures, 0 output buffers swapped out\nGigabitEthernet1/0/2 is down, line protocol is down (notconnect)\n  Hardware is Gigabit Ethernet, address is 0014.1c57.a482 (bia 0014.1c57.a482)\n  MTU 1500 bytes, BW 10000 Kbit, DLY 1000 usec,\n     reliability 255/255, txload 1/255, rxload 1/255\n  Encapsulation ARPA, loopback not set\n  Keepalive not set\n  Auto-duplex, Auto-speed, link type is auto, media type is Not Present\n  input flow-control is off, output flow-control is unsupported\n  ARP type: ARPA, ARP Timeout 04:00:00\n  Last input never, output never, output hang never\n  Last clearing of \"show interface\" counters never\n  Input queue: 0/75/0/0 (size/max/drops/flushes); Total output drops: 0\n  Queueing strategy: fifo\n  Output queue: 0/40 (size/max)\n  5 minute input rate 0 bits/sec, 0 packets/sec\n  5 minute output rate 0 bits/sec, 0 packets/sec\n     0 packets input, 0 bytes, 0 no buffer\n     Received 0 broadcasts (0 multicasts)\n     0 runts, 0 giants, 0 throttles\n     0 input errors, 0 CRC, 0 frame, 0 overrun, 0 ignored\n     0 watchdog, 0 multicast, 0 pause input\n     0 input packets with dribble condition detected\n     0 packets output, 0 bytes, 0 underruns\n     0 output errors, 0 collisions, 1 interface resets\n     0 babbles, 0 late collision, 0 deferred\n     0 lost carrier, 0 no carrier, 0 PAUSE output\n     0 output buffer failures, 0 output buffers swapped out\nGigabitEthernet1/0/3 is down, line protocol is down (notconnect)\n  Hardware is Gigabit Ethernet, address is 0014.1c57.a49b (bia 0014.1c57.a49b)\n  MTU 1500 bytes, BW 10000 Kbit, DLY 1000 usec,\n     reliability 255/255, txload 1/255, rxload 1/255\n  Encapsulation ARPA, loopback not set\n  Keepalive not set\n  Auto-duplex, Auto-speed, link type is auto, media type is Not Present\n  input flow-control is off, output flow-control is unsupported\n  ARP type: ARPA, ARP Timeout 04:00:00\n  Last input never, output never, output hang never\n  Last clearing of \"show interface\" counters never\n  Input queue: 0/75/0/0 (size/max/drops/flushes); Total output drops: 0\n  Queueing strategy: fifo\n  Output queue: 0/40 (size/max)\n  5 minute input rate 0 bits/sec, 0 packets/sec\n  5 minute output rate 0 bits/sec, 0 packets/sec\n     0 packets input, 0 bytes, 0 no buffer\n     Received 0 broadcasts (0 multicasts)\n     0 runts, 0 giants, 0 throttles\n     0 input errors, 0 CRC, 0 frame, 0 overrun, 0 ignored\n     0 watchdog, 0 multicast, 0 pause input\n     0 input packets with dribble condition detected\n     0 packets output, 0 bytes, 0 underruns\n     0 output errors, 0 collisions, 1 interface resets\n     0 babbles, 0 late collision, 0 deferred\n     0 lost carrier, 0 no carrier, 0 PAUSE output\n     0 output buffer failures, 0 output buffers swapped out\nGigabitEthernet1/0/4 is down, line protocol is down (notconnect)\n  Hardware is Gigabit Ethernet, address is 0014.1c57.a49c (bia 0014.1c57.a49c)\n  MTU 1500 bytes, BW 10000 Kbit, DLY 1000 usec,\n     reliability 255/255, txload 1/255, rxload 1/255\n  Encapsulation ARPA, loopback not set\n  Keepalive not set\n  Auto-duplex, Auto-speed, link type is auto, media type is Not Present\n  input flow-control is off, output flow-control is unsupported\n  ARP type: ARPA, ARP Timeout 04:00:00\n  Last input never, output never, output hang never\n  Last clearing of \"show interface\" counters never\n  Input queue: 0/75/0/0 (size/max/drops/flushes); Total output drops: 0\n  Queueing strategy: fifo\n  Output queue: 0/40 (size/max)\n  5 minute input rate 0 bits/sec, 0 packets/sec\n  5 minute output rate 0 bits/sec, 0 packets/sec\n     0 packets input, 0 bytes, 0 no buffer\n     Received 0 broadcasts (0 multicasts)\n     0 runts, 0 giants, 0 throttles\n     0 input errors, 0 CRC, 0 frame, 0 overrun, 0 ignored\n     0 watchdog, 0 multicast, 0 pause input\n     0 input packets with dribble condition detected\n     0 packets output, 0 bytes, 0 underruns\n     0 output errors, 0 collisions, 1 interface resets\n     0 babbles, 0 late collision, 0 deferred\n     0 lost carrier, 0 no carrier, 0 PAUSE output\n     0 output buffer failures, 0 output buffers swapped out\n",
  "textfsm_template": "Value Required INTERFACE (\\S+)\nValue LINK_STATUS (.+?)\nValue PROTOCOL_STATUS (.+?)\nValue HARDWARE_TYPE ([\\w \\-]+)\nValue MAC_ADDRESS ([a-fA-F0-9]{4}\\.[a-fA-F0-9]{4}\\.[a-fA-F0-9]{4})\nValue BIA ([a-fA-F0-9]{4}\\.[a-fA-F0-9]{4}\\.[a-fA-F0-9]{4})\nValue DESCRIPTION (.+?)\nValue IP_ADDRESS (\\d+\\.\\d+\\.\\d+\\.\\d+)\nValue PREFIX_LENGTH (\\d+)\nValue MTU (\\d+)\nValue DUPLEX (([Ff]ull|[Aa]uto|[Hh]alf|[Aa]-).*?)\nValue SPEED (.*?)\nValue MEDIA_TYPE (\\S+.*)\nValue BANDWIDTH (\\d+\\s+\\w+)\nValue DELAY (\\d+\\s+\\S+)\nValue ENCAPSULATION (.+?)\nValue LAST_INPUT (.+?)\nValue LAST_OUTPUT (.+?)\nValue LAST_OUTPUT_HANG (.+?)\nValue QUEUE_STRATEGY (.+)\nValue INPUT_RATE (\\d+)\nValue OUTPUT_RATE (\\d+)\nValue INPUT_PPS (\\d+)\nValue OUTPUT_PPS (\\d+)\nValue INPUT_PACKETS (\\d+)\nValue OUTPUT_PACKETS (\\d+)\nValue RUNTS (\\d+)\nValue GIANTS (\\d+)\nValue INPUT_ERRORS (\\d+)\nValue CRC (\\d+)\nValue FRAME (\\d+)\nValue OVERRUN (\\d+)\nValue ABORT (\\d+)\nValue OUTPUT_ERRORS (\\d+)\nValue VLAN_ID (\\d+)\nValue VLAN_ID_INNER (\\d+)\nValue VLAN_ID_OUTER (\\d+)\n\nStart\n  ^\\S+\\s+is\\s+.+?,\\s+line\\s+protocol.*$$ -> Continue.Record\n  ^${INTERFACE}\\s+is\\s+${LINK_STATUS},\\s+line\\s+protocol\\s+is\\s+${PROTOCOL_STATUS}\\s*$$\n  ^\\s+Hardware\\s+is\\s+${HARDWARE_TYPE} -> Continue\n  ^.+address\\s+is\\s+${MAC_ADDRESS}\\s+\\(bia\\s+${BIA}\\)\\s*$$\n  ^\\s+Description:\\s+${DESCRIPTION}\\s*$$\n  ^\\s+Internet\\s+address\\s+is\\s+${IP_ADDRESS}\\/${PREFIX_LENGTH}\\s*$$\n  ^\\s+MTU\\s+${MTU}.*BW\\s+${BANDWIDTH}.*DLY\\s+${DELAY},\\s*$$\n  ^\\s+Encapsulation\\s+${ENCAPSULATION}, Vlan ID\\s+${VLAN_ID}.+$$\n  ^\\s+Encapsulation\\s+${ENCAPSULATION}, outer ID\\s+${VLAN_ID_OUTER}, inner ID\\s+${VLAN_ID_INNER}.+$$\n  ^\\s+Encapsulation\\s+${ENCAPSULATION},.+$$\n  ^\\s+Last\\s+input\\s+${LAST_INPUT},\\s+output\\s+${LAST_OUTPUT},\\s+output\\s+hang\\s+${LAST_OUTPUT_HANG}\\s*$$\n  ^\\s+Queueing\\s+strategy:\\s+${QUEUE_STRATEGY}\\s*$$\n  ^\\s+${DUPLEX},\\s+${SPEED},.+media\\stype\\sis\\s${MEDIA_TYPE}$$\n  ^\\s+${DUPLEX},\\s+${SPEED},.+TX/FX$$\n  ^\\s+${DUPLEX},\\s+${SPEED}$$\n  ^.*input\\s+rate\\s+${INPUT_RATE}\\s+\\w+/sec,\\s+${INPUT_PPS}\\s+packets.+$$\n  ^.*output\\s+rate\\s+${OUTPUT_RATE}\\s+\\w+/sec,\\s+${OUTPUT_PPS}\\s+packets.+$$\n  ^\\s+${INPUT_PACKETS}\\s+packets\\s+input,\\s+\\d+\\s+bytes,\\s+\\d+\\s+no\\s+buffer\\s*$$\n  ^\\s+${RUNTS}\\s+runts,\\s+${GIANTS}\\s+giants,\\s+\\d+\\s+throttles\\s*$$\n  ^\\s+${INPUT_ERRORS}\\s+input\\s+errors,\\s+${CRC}\\s+CRC,\\s+${FRAME}\\s+frame,\\s+${OVERRUN}\\s+overrun,\\s+\\d+\\s+ignored\\s*$$\n  ^\\s+${INPUT_ERRORS}\\s+input\\s+errors,\\s+${CRC}\\s+CRC,\\s+${FRAME}\\s+frame,\\s+${OVERRUN}\\s+overrun,\\s+\\d+\\s+ignored,\\s+${ABORT}\\s+abort\\s*$$\n  ^\\s+${OUTPUT_PACKETS}\\s+packets\\s+output,\\s+\\d+\\s+bytes,\\s+\\d+\\s+underruns\\s*$$\n  ^\\s+${OUTPUT_ERRORS}\\s+output\\s+errors,\\s+\\d+\\s+collisions,\\s+\\d+\\s+interface\\s+resets\\s*$$\n  # Capture time-stamp if vty line has command time-stamping turned on\n  ^Load\\s+for\\s+\n  ^Time\\s+source\\s+is\n"
}