{
  "command": "cisco_ios_show_interfaces_switchport",
  "source": "ntc",
  "status": "success",
  "match_ratio": 0.5,
  "textfsm_rows": 2,
  "ttp_rows": 1,
  "ttp_template": "<group name=\"access_vlan_admin_mode_interface_mode\">\nName: Gi0/{{NATIVE_VLAN | ORPHRASE}}/3\nSwitchport: {{SWITCHPORT | ORPHRASE}}\nAdministrative Mode: {{ADMIN_MODE | ORPHRASE}}\nNegotiation of Trunking: {{SWITCHPORT_NEGOTIATION | ORPHRASE}}\nVoice VLAN: {{VOICE_VLAN | ORPHRASE}}\nTrunking VLANs Enabled: {{TRUNKING_VLANS | ORPHRASE}}\nName: {{INTERFACE | ORPHRASE}}\nOperational Mode: {{MODE | ORPHRASE}}\nAccess Mode VLAN: {{ACCESS_VLAN | ORPHRASE}} (wirelessmgmt)\n</group>",
  "error": null,
  "textfsm_parsed": [
    {
      "INTERFACE": "Gi0/1/3",
      "SWITCHPORT": "Enabled",
      "SWITCHPORT_NEGOTIATION": "On",
      "MODE": "down",
      "ADMIN_MODE": "dynamic auto",
      "ACCESS_VLAN": "1",
      "NATIVE_VLAN": "1",
      "VOICE_VLAN": "none",
      "TRUNKING_VLANS": "ALL"
    },
    {
      "INTERFACE": "Wl0/1/4",
      "SWITCHPORT": "Enabled",
      "SWITCHPORT_NEGOTIATION": "On",
      "MODE": "static access",
      "ADMIN_MODE": "dynamic auto",
      "ACCESS_VLAN": "41",
      "NATIVE_VLAN": "1",
      "VOICE_VLAN": "none",
      "TRUNKING_VLANS": "ALL"
    }
  ],
  "ttp_parsed": [
    {
      "access_vlan_admin_mode_interface_mode": {
        "TRUNKING_VLANS": "ALL",
        "VOICE_VLAN": "none",
        "ACCESS_VLAN": "41",
        "SWITCHPORT_NEGOTIATION": "On",
        "MODE": "down",
        "ADMIN_MODE": "dynamic auto",
        "SWITCHPORT": "Enabled",
        "INTERFACE": "Wl0/1/4",
        "NATIVE_VLAN": "1"
      }
    }
  ],
  "cli_content": "Name: Gi0/1/3\nSwitchport: Enabled\nAdministrative Mode: dynamic auto\nOperational Mode: down\nAdministrative Trunking Encapsulation: dot1q\nNegotiation of Trunking: On\nAccess Mode VLAN: 1 (default)\nTrunking Native Mode VLAN: 1 (default)\nAdministrative Native VLAN tagging: disabled\nVoice VLAN: none\nAdministrative private-vlan host-association: none\nAdministrative private-vlan mapping: none\nAdministrative private-vlan trunk native VLAN: none\nAdministrative private-vlan trunk Native VLAN tagging: enabled\nAdministrative private-vlan trunk encapsulation: dot1q\nAdministrative private-vlan trunk normal VLANs: none\nAdministrative private-vlan trunk associations: none\nAdministrative private-vlan trunk mappings: none\nOperational private-vlan: none\nTrunking VLANs Enabled: ALL\nPruning VLANs Enabled: 2-1001\nCapture Mode Disabled\nCapture VLANs Allowed: ALL\n\nProtected: false\nUnknown unicast blocked: disabled\nUnknown multicast blocked: disabled\nPriority for untagged frame: 0\nOverride vlan tag priority: FALSE\nAppliance trust: none\n\nName: Wl0/1/4\nSwitchport: Enabled\nAdministrative Mode: dynamic auto\nOperational Mode: static access\nAdministrative Trunking Encapsulation: dot1q\nOperational Trunking Encapsulation: native\nNegotiation of Trunking: On\nAccess Mode VLAN: 41 (wirelessmgmt)\nTrunking Native Mode VLAN: 1 (default)\nAdministrative Native VLAN tagging: disabled\nVoice VLAN: none\nAdministrative private-vlan host-association: none\nAdministrative private-vlan mapping: none\nAdministrative private-vlan trunk native VLAN: none\nAdministrative private-vlan trunk Native VLAN tagging: enabled\nAdministrative private-vlan trunk encapsulation: dot1q\nAdministrative private-vlan trunk normal VLANs: none\nAdministrative private-vlan trunk associations: none\nAdministrative private-vlan trunk mappings: none\nOperational private-vlan: none\nTrunking VLANs Enabled: ALL\nPruning VLANs Enabled: 2-1001\nCapture Mode Disabled\nCapture VLANs Allowed: ALL\n\nProtected: false\nUnknown unicast blocked: disabled\nUnknown multicast blocked: disabled\nPriority for untagged frame: 0\nOverride vlan tag priority: FALSE\nAppliance trust: none",
  "textfsm_template": "Value Required INTERFACE (\\S+)\nValue SWITCHPORT (.+?)\nValue SWITCHPORT_MONITOR (.+?)\nValue SWITCHPORT_NEGOTIATION (.+?)\nValue MODE (.+?)\nValue ADMIN_MODE (.+?)\nValue ACCESS_VLAN (\\d+|unassigned)\nValue NATIVE_VLAN (\\d+)\nValue VOICE_VLAN (\\S+)\nValue List TRUNKING_VLANS (\\S+?)\n\nStart\n  ^Name: -> Continue.Record\n  ^Name:\\s+${INTERFACE}\n  ^\\s*Switchport:\\s+${SWITCHPORT}$$\n  ^\\s*Switchport\\s+Monitor:\\s+${SWITCHPORT_MONITOR}$$\n  ^\\s*Operational\\s+Mode:\\s+${MODE}$$\n  ^\\s*Negotiation\\s+of\\s+Trunking:\\s+${SWITCHPORT_NEGOTIATION}$$\n  ^\\s*Access\\s+Mode\\s+VLAN:\\s+${ACCESS_VLAN}\n  ^\\s*Trunking\\s+Native\\s+Mode\\s+VLAN:\\s+${NATIVE_VLAN}\n  ^\\s*Voice\\s+VLAN:\\s+${VOICE_VLAN}\n  ^\\s*Trunking\\s+VLANs\\s+Enabled:\\s+${TRUNKING_VLANS},\\s*$$ -> Trunk\n  ^\\s*Trunking\\s+VLANs\\s+Enabled:\\s+${TRUNKING_VLANS}$$\n  ^\\s*Trunking\\s+VLANs\\s+Active\n  ^\\s*Administrative\\s+Mode:\\s+${ADMIN_MODE}$$\n  ^\\s*(?:Operational|Administrative)\\s+(?:Trunking|Native\\s+VLAN|private-vlan)\n  ^\\s*Voice\\s+VLAN:\n  ^\\s*Pruning\\s+VLANs\n  ^\\s*Capture\\s+(?:Mode|VLANs)\n  ^\\s*Autostate\\s+mode\\s+exclude\n  ^\\s*Protected\n  ^\\s*Unknown\\s+(unicast|multicast)\n  ^\\s*Vepa\\s+Enabled\n  ^\\s*App\\s+Interface\n  ^\\s*Appliance\\s+trust\n  ^\\s*Operational\\s+Dot1q\\s+Ethertype\n  ^\\s*Priority\\s+for\\s+untagged\\s+frame\n  ^\\s*Override\\s+vlan\\s+tag\\s+priority\n  ^\\s*$$\n  # Capture time-stamp if vty line has command time-stamping turned on\n  ^Load\\s+for\\s+\n  ^Time\\s+source\\s+is\n  ^. -> Error\n\nTrunk\n  ^\\s+${TRUNKING_VLANS},\\s*$$\n  ^\\s+${TRUNKING_VLANS}\\s*$$ -> Start\n  ^. -> Error\n"
}