{
  "command": "cisco_nxos_show_lldp_neighbors_detail",
  "source": "ntc",
  "status": "success",
  "match_ratio": 2.0,
  "textfsm_rows": 4,
  "ttp_rows": 8,
  "ttp_template": "<group name=\"chassis_id\">\nChassis id: {{CHASSIS_ID | ORPHRASE}}\n</group>\n<group name=\"neighbor_description\">\nSystem Description: {{NEIGHBOR_DESCRIPTION | ORPHRASE}}\n</group>",
  "error": null,
  "textfsm_parsed": [
    {
      "NEIGHBOR_NAME": "Switch.cisco.com",
      "LOCAL_INTERFACE": "mgmt0",
      "NEIGHBOR_INTERFACE": "Fa1/0/9",
      "CHASSIS_ID": "0014.1c57.a48b",
      "MGMT_ADDRESS": "10.30.140.1",
      "NEIGHBOR_DESCRIPTION": "Cisco IOS Software, C3750 Software (C3750-IPBASEK9-M), Version 12.2(44)SE2, RELEASE SOFTWARE (fc2)",
      "CAPABILITIES": "B, R",
      "VLAN_ID": "100"
    },
    {
      "NEIGHBOR_NAME": "n9k2.company.com",
      "LOCAL_INTERFACE": "Eth1/1",
      "NEIGHBOR_INTERFACE": "Ethernet1/1",
      "CHASSIS_ID": "5087.89a1.d8d6",
      "MGMT_ADDRESS": "10.30.140.21",
      "NEIGHBOR_DESCRIPTION": "Cisco Nexus Operating System (NX-OS) Software 7.0(3)I4(1)",
      "CAPABILITIES": "B, R",
      "VLAN_ID": "1"
    },
    {
      "NEIGHBOR_NAME": "n9k2.company.com",
      "LOCAL_INTERFACE": "Eth1/2",
      "NEIGHBOR_INTERFACE": "Ethernet1/2",
      "CHASSIS_ID": "5087.89a1.d8d7",
      "MGMT_ADDRESS": "10.30.140.21",
      "NEIGHBOR_DESCRIPTION": "Cisco Nexus Operating System (NX-OS) Software 7.0(3)I4(1)",
      "CAPABILITIES": "B, R",
      "VLAN_ID": "1"
    },
    {
      "NEIGHBOR_NAME": "N3K.cisconxapi.com",
      "LOCAL_INTERFACE": "Eth2/2",
      "NEIGHBOR_INTERFACE": "Ethernet1/49",
      "CHASSIS_ID": "547f.eeaf.7818",
      "MGMT_ADDRESS": "10.30.140.30",
      "NEIGHBOR_DESCRIPTION": "Cisco Nexus Operating System (NX-OS) Software 6.0(2)U4(1)",
      "CAPABILITIES": "B, R",
      "VLAN_ID": "1"
    }
  ],
  "ttp_parsed": [
    {
      "chassis_id": [
        {
          "CHASSIS_ID": "0014.1c57.a48b"
        },
        {
          "CHASSIS_ID": "5087.89a1.d8d6"
        },
        {
          "CHASSIS_ID": "5087.89a1.d8d7"
        },
        {
          "CHASSIS_ID": "547f.eeaf.7818"
        }
      ],
      "neighbor_description": [
        {
          "NEIGHBOR_DESCRIPTION": "Cisco IOS Software, C3750 Software (C3750-IPBASEK9-M), Version 12.2(44)SE2, RELEASE SOFTWARE (fc2)"
        },
        {
          "NEIGHBOR_DESCRIPTION": "Cisco Nexus Operating System (NX-OS) Software 7.0(3)I4(1)"
        },
        {
          "NEIGHBOR_DESCRIPTION": "Cisco Nexus Operating System (NX-OS) Software 7.0(3)I4(1)"
        },
        {
          "NEIGHBOR_DESCRIPTION": "Cisco Nexus Operating System (NX-OS) Software 6.0(2)U4(1)"
        }
      ]
    }
  ],
  "cli_content": "Capability codes:\n  (R) Router, (B) Bridge, (T) Telephone, (C) DOCSIS Cable Device\n  (W) WLAN Access Point, (P) Repeater, (S) Station, (O) Other\nDevice ID            Local Intf      Hold-time  Capability  Port ID  \n\nChassis id: 0014.1c57.a48b\nPort id: Fa1/0/9\nLocal Port id: mgmt0\nPort Description: FastEthernet1/0/9\nSystem Name: Switch.cisco.com\nSystem Description: Cisco IOS Software, C3750 Software (C3750-IPBASEK9-M), Version 12.2(44)SE2, RELEASE SOFTWARE (fc2)\nCopyright (c) 1986-2008 by Cisco Systems, Inc.\nCompiled Thu 01-May-08 15:42 by antonino\nTime remaining: 91 seconds\nSystem Capabilities: B, R\nEnabled Capabilities: B, R\nManagement Address: 10.30.140.1\nVlan ID: 100\n\n\nChassis id: 5087.89a1.d8d6\nPort id: Ethernet1/1\nLocal Port id: Eth1/1\nPort Description: Ethernet1/1\nSystem Name: n9k2.company.com\nSystem Description: Cisco Nexus Operating System (NX-OS) Software 7.0(3)I4(1)\nTAC support: http://www.cisco.com/tac\nCopyright (c) 2002-2016, Cisco Systems, Inc. All rights reserved.\nTime remaining: 93 seconds\nSystem Capabilities: B, R\nEnabled Capabilities: B, R\nManagement Address: 10.30.140.21\nVlan ID: 1\n\n\nChassis id: 5087.89a1.d8d7\nPort id: Ethernet1/2\nLocal Port id: Eth1/2\nPort Description: Ethernet1/2\nSystem Name: n9k2.company.com\nSystem Description: Cisco Nexus Operating System (NX-OS) Software 7.0(3)I4(1)\nTAC support: http://www.cisco.com/tac\nCopyright (c) 2002-2016, Cisco Systems, Inc. All rights reserved.\nTime remaining: 93 seconds\nSystem Capabilities: B, R\nEnabled Capabilities: B, R\nManagement Address: 10.30.140.21\nVlan ID: 1\n\n\nChassis id: 547f.eeaf.7818\nPort id: Ethernet1/49\nLocal Port id: Eth2/2\nPort Description: Ethernet1/49\nSystem Name: N3K.cisconxapi.com\nSystem Description: Cisco Nexus Operating System (NX-OS) Software 6.0(2)U4(1)\nTAC support: http://www.cisco.com/tac\nCopyright (c) 2002-2014, Cisco Systems, Inc. All rights reserved.\nTime remaining: 93 seconds\nSystem Capabilities: B, R\nEnabled Capabilities: B, R\nManagement Address: 10.30.140.30\nVlan ID: 1\n\nTotal entries displayed: 4\n",
  "textfsm_template": "Value Required NEIGHBOR_NAME (\\S+)\nValue Required LOCAL_INTERFACE (\\S+)\nValue Required NEIGHBOR_INTERFACE (\\S+)\nValue CHASSIS_ID (\\w+?\\.\\w+?\\.\\w+?)\nValue MGMT_ADDRESS (\\d+?\\.\\d+?\\.\\d+?\\.\\d+?|\\w+?\\.\\w+?\\.\\w+?)\nValue NEIGHBOR_DESCRIPTION (.*)\nValue CAPABILITIES (.*)\nValue VLAN_ID ([0-9]+)\n\n\nStart\n  ^[Cc]hassis\\s[idID]{2}\\:\\s${CHASSIS_ID}$$\n  ^[Pp]ort\\s[idID]{2}\\:\\s${NEIGHBOR_INTERFACE}$$\n  ^[Ll]ocal\\s[Pp]ort\\s[idID]{2}\\:\\s${LOCAL_INTERFACE}$$\n  ^[Ss]ystem\\s[Nn]ame\\:\\s${NEIGHBOR_NAME}$$\n  ^[Ss]ystem\\s[Dd]escription\\:\\s${NEIGHBOR_DESCRIPTION}$$\n  ^[Ee]nabled\\s[Cc]apabilities\\:\\s${CAPABILITIES}$$\n  ^[Mm]anagement\\s[Aa]ddress\\:\\s${MGMT_ADDRESS}$$\n  ^[Vv]lan\\s[idID]{2}\\:\\s${VLAN_ID}$$ -> Record\n  ^[Vv]lan\\s[idID]{2}\\:\\snot advertised -> Record\n"
}