{
  "command": "cisco_asa_show_interface_detail",
  "source": "ntc",
  "status": "success",
  "match_ratio": 3.4166666666666665,
  "textfsm_rows": 24,
  "ttp_rows": 82,
  "ttp_template": "<group name=\"hardware_type_bandwidth_delay\">\n  Hardware is {{HARDWARE_TYPE | ORPHRASE}}, BW {{BANDWIDTH | ORPHRASE}}, DLY {{DELAY | ORPHRASE}}\n</group>\n<group name=\"link_status_duplex_protocol_status_bandwidth\">\n        Auto-D{{LINK_STATUS | ORPHRASE}}lex({{DUPLEX}}-d{{PROTOCOL_STATUS | ORPHRASE}}lex), Auto-Speed({{BANDWIDTH | ORPHRASE}})\n</group>\n<group name=\"duplex_link_status_bandwidth\">\n        ({{DUPLEX}}-d{{LINK_STATUS | ORPHRASE}}lex), ({{BANDWIDTH | ORPHRASE}})\n</group>\n<group name=\"flowcontrol_in_flowcontrol_out\">\n        Input flow control is {{FLOWCONTROL_IN}}, output flow control is {{FLOWCONTROL_OUT | ORPHRASE}}\n</group>\n<group name=\"interface_link_status_protocol_status\">\nInterface {{INTERFACE}} \"\", is {{LINK_STATUS | ORPHRASE}}, line protocol is {{PROTOCOL_STATUS | ORPHRASE}}\n</group>",
  "error": null,
  "textfsm_parsed": [
    {
      "INTERFACE": "GigabitEthernet0/0",
      "INTERFACE_NAME": "folink",
      "LINK_STATUS": "up",
      "PROTOCOL_STATUS": "up",
      "HARDWARE_TYPE": "bcm56800 rev 01",
      "BANDWIDTH": "1000 Mbps",
      "DELAY": "10 usec",
      "DUPLEX": "Full",
      "SPEED": "1000 Mbps",
      "FLOWCONTROL_IN": "unsupported",
      "FLOWCONTROL_OUT": "off",
      "DESCRIPTION": "LAN Failover Interface",
      "MAC_ADDRESS": "f0f7.5543.a522",
      "MTU": "1500",
      "IP_ADDRESS": "11.1.1.1",
      "NETMASK": "255.255.255.252",
      "IN_PACKETS": "200840360",
      "IN_BYTES": "26646683366",
      "NO_BUFFER": "0",
      "BROADCASTS": "18",
      "RUNTS": "0",
      "GIANTS": "0",
      "IN_ERRORS": "0",
      "CRC": "0",
      "FRAME": "0",
      "OVERRUN": "0",
      "IGNORED": "0",
      "ABORT": "0",
      "IN_PAUSE_RESUME": "0",
      "L2_DECODE_DROPS": "0",
      "SWITCH_INGRESS_POLICY_DROPS": "0",
      "OUT_PACKETS": "164279548",
      "OUT_BYTES": "23362268244",
      "UNDERRUNS": "0",
      "OUT_PAUSE_RESUME": "0",
      "OUT_ERRORS": "0",
      "COLLISIONS": "0",
      "INTERFACE_RESETS": "0",
      "LATE_COLLISIONS": "0",
      "DEFERRED": "0",
      "RATE_LIMIT_DROPS": "0",
      "SWITCH_EGRESS_POLICY_DROPS": "0",
      "IN_RESET_DROPS": "0",
      "OUT_RESET_DROPS": "0",
      "CONTROL_INTERFACE_NUMBER": "8",
      "CONTROL_INTERFACE_CONFIG_STATUS": "active",
      "CONTROL_INTERFACE_STATE": "active"
    },
    {
      "INTERFACE": "GigabitEthernet0/1",
      "INTERFACE_NAME": "statelink",
      "LINK_STATUS": "up",
      "PROTOCOL_STATUS": "up",
      "HARDWARE_TYPE": "bcm56800 rev 01",
      "BANDWIDTH": "1000 Mbps",
      "DELAY": "10 usec",
      "DUPLEX": "Full",
      "SPEED": "1000 Mbps",
      "FLOWCONTROL_IN": "unsupported",
      "FLOWCONTROL_OUT": "off",
      "DESCRIPTION": "STATE Failover Interface",
      "MAC_ADDRESS": "f0f7.5543.a523",
      "MTU": "1500",
      "IP_ADDRESS": "12.1.1.1",
      "NETMASK": "255.255.255.252",
      "IN_PACKETS": "96629806",
      "IN_BYTES": "11507372449",
      "NO_BUFFER": "0",
      "BROADCASTS": "2",
      "RUNTS": "0",
      "GIANTS": "0",
      "IN_ERRORS": "0",
      "CRC": "0",
      "FRAME": "0",
      "OVERRUN": "0",
      "IGNORED": "0",
      "ABORT": "0",
      "IN_PAUSE_RESUME": "0",
      "L2_DECODE_DROPS": "0",
      "SWITCH_INGRESS_POLICY_DROPS": "0",
      "OUT_PACKETS": "758965289",
      "OUT_BYTES": "834717617298",
      "UNDERRUNS": "0",
      "OUT_PAUSE_RESUME": "0",
      "OUT_ERRORS": "0",
      "COLLISIONS": "0",
      "INTERFACE_RESETS": "0",
      "LATE_COLLISIONS": "0",
      "DEFERRED": "0",
      "RATE_LIMIT_DROPS": "0",
      "SWITCH_EGRESS_POLICY_DROPS": "0",
      "IN_RESET_DROPS": "0",
      "OUT_RESET_DROPS": "0",
      "CONTROL_INTERFACE_NUMBER": "9",
      "CONTROL_INTERFACE_CONFIG_STATUS": "active",
      "CONTROL_INTERFACE_STATE": "active"
    },
    {
      "INTERFACE": "GigabitEthernet0/2",
      "LINK_STATUS": "administratively down",
      "PROTOCOL_STATUS": "down",
      "HARDWARE_TYPE": "bcm56800 rev 01",
      "BANDWIDTH": "1000 Mbps",
      "DELAY": "10 usec",
      "DUPLEX": "Auto",
      "SPEED": "Auto",
      "FLOWCONTROL_IN": "unsupported",
      "FLOWCONTROL_OUT": "off",
      "MAC_ADDRESS": "f0f7.5543.a524",
      "MTU": "not set",
      "IP_ADDRESS": "unassigned",
      "IN_PACKETS": "0",
      "IN_BYTES": "0",
      "NO_BUFFER": "0",
      "BROADCASTS": "0",
      "RUNTS": "0",
      "GIANTS": "0",
      "IN_ERRORS": "0",
      "CRC": "0",
      "FRAME": "0",
      "OVERRUN": "0",
      "IGNORED": "0",
      "ABORT": "0",
      "IN_PAUSE_RESUME": "0",
      "L2_DECODE_DROPS": "0",
      "SWITCH_INGRESS_POLICY_DROPS": "0",
      "OUT_PACKETS": "0",
      "OUT_BYTES": "0",
      "UNDERRUNS": "0",
      "OUT_PAUSE_RESUME": "0",
      "OUT_ERRORS": "0",
      "COLLISIONS": "0",
      "INTERFACE_RESETS": "0",
      "LATE_COLLISIONS": "0",
      "DEFERRED": "0",
      "RATE_LIMIT_DROPS": "0",
      "SWITCH_EGRESS_POLICY_DROPS": "0",
      "IN_RESET_DROPS": "0",
      "OUT_RESET_DROPS": "0",
      "CONTROL_INTERFACE_NUMBER": "10",
      "CONTROL_INTERFACE_CONFIG_STATUS": "not active",
      "CONTROL_INTERFACE_STATE": "not active"
    },
    {
      "INTERFACE": "GigabitEthernet0/3",
      "LINK_STATUS": "administratively down",
      "PROTOCOL_STATUS": "down",
      "HARDWARE_TYPE": "bcm56800 rev 01",
      "BANDWIDTH": "1000 Mbps",
      "DELAY": "10 usec",
      "DUPLEX": "Auto",
      "SPEED": "Auto",
      "FLOWCONTROL_IN": "unsupported",
      "FLOWCONTROL_OUT": "off",
      "MAC_ADDRESS": "f0f7.5543.a525",
      "MTU": "not set",
      "IP_ADDRESS": "unassigned",
      "IN_PACKETS": "0",
      "IN_BYTES": "0",
      "NO_BUFFER": "0",
      "BROADCASTS": "0",
      "RUNTS": "0",
      "GIANTS": "0",
      "IN_ERRORS": "0",
      "CRC": "0",
      "FRAME": "0",
      "OVERRUN": "0",
      "IGNORED": "0",
      "ABORT": "0",
      "IN_PAUSE_RESUME": "0",
      "L2_DECODE_DROPS": "0",
      "SWITCH_INGRESS_POLICY_DROPS": "0",
      "OUT_PACKETS": "0",
      "OUT_BYTES": "0",
      "UNDERRUNS": "0",
      "OUT_PAUSE_RESUME": "0",
      "OUT_ERRORS": "0",
      "COLLISIONS": "0",
      "INTERFACE_RESETS": "0",
      "LATE_COLLISIONS": "0",
      "DEFERRED": "0",
      "RATE_LIMIT_DROPS": "0",
      "SWITCH_EGRESS_POLICY_DROPS": "0",
      "IN_RESET_DROPS": "0",
      "OUT_RESET_DROPS": "0",
      "CONTROL_INTERFACE_NUMBER": "11",
      "CONTROL_INTERFACE_CONFIG_STATUS": "not active",
      "CONTROL_INTERFACE_STATE": "not active"
    },
    {
      "INTERFACE": "GigabitEthernet0/4",
      "LINK_STATUS": "administratively down",
      "PROTOCOL_STATUS": "down",
      "HARDWARE_TYPE": "bcm56800 rev 01",
      "BANDWIDTH": "1000 Mbps",
      "DELAY": "10 usec",
      "DUPLEX": "Auto",
      "SPEED": "Auto",
      "FLOWCONTROL_IN": "unsupported",
      "FLOWCONTROL_OUT": "off",
      "MAC_ADDRESS": "f0f7.5543.a526",
      "MTU": "not set",
      "IP_ADDRESS": "unassigned",
      "IN_PACKETS": "0",
      "IN_BYTES": "0",
      "NO_BUFFER": "0",
      "BROADCASTS": "0",
      "RUNTS": "0",
      "GIANTS": "0",
      "IN_ERRORS": "0",
      "CRC": "0",
      "FRAME": "0",
      "OVERRUN": "0",
      "IGNORED": "0",
      "ABORT": "0",
      "IN_PAUSE_RESUME": "0",
      "L2_DECODE_DROPS": "0",
      "SWITCH_INGRESS_POLICY_DROPS": "0",
      "OUT_PACKETS": "0",
      "OUT_BYTES": "0",
      "UNDERRUNS": "0",
      "OUT_PAUSE_RESUME": "0",
      "OUT_ERRORS": "0",
      "COLLISIONS": "0",
      "INTERFACE_RESETS": "0",
      "LATE_COLLISIONS": "0",
      "DEFERRED": "0",
      "RATE_LIMIT_DROPS": "0",
      "SWITCH_EGRESS_POLICY_DROPS": "0",
      "IN_RESET_DROPS": "0",
      "OUT_RESET_DROPS": "0",
      "CONTROL_INTERFACE_NUMBER": "12",
      "CONTROL_INTERFACE_CONFIG_STATUS": "not active",
      "CONTROL_INTERFACE_STATE": "not active"
    },
    {
      "INTERFACE": "GigabitEthernet0/5",
      "LINK_STATUS": "administratively down",
      "PROTOCOL_STATUS": "down",
      "HARDWARE_TYPE": "bcm56800 rev 01",
      "BANDWIDTH": "1000 Mbps",
      "DELAY": "10 usec",
      "DUPLEX": "Auto",
      "SPEED": "Auto",
      "FLOWCONTROL_IN": "unsupported",
      "FLOWCONTROL_OUT": "off",
      "MAC_ADDRESS": "f0f7.5543.a527",
      "MTU": "not set",
      "IP_ADDRESS": "unassigned",
      "IN_PACKETS": "0",
      "IN_BYTES": "0",
      "NO_BUFFER": "0",
      "BROADCASTS": "0",
      "RUNTS": "0",
      "GIANTS": "0",
      "IN_ERRORS": "0",
      "CRC": "0",
      "FRAME": "0",
      "OVERRUN": "0",
      "IGNORED": "0",
      "ABORT": "0",
      "IN_PAUSE_RESUME": "0",
      "L2_DECODE_DROPS": "0",
      "SWITCH_INGRESS_POLICY_DROPS": "0",
      "OUT_PACKETS": "0",
      "OUT_BYTES": "0",
      "UNDERRUNS": "0",
      "OUT_PAUSE_RESUME": "0",
      "OUT_ERRORS": "0",
      "COLLISIONS": "0",
      "INTERFACE_RESETS": "0",
      "LATE_COLLISIONS": "0",
      "DEFERRED": "0",
      "RATE_LIMIT_DROPS": "0",
      "SWITCH_EGRESS_POLICY_DROPS": "0",
      "IN_RESET_DROPS": "0",
      "OUT_RESET_DROPS": "0",
      "CONTROL_INTERFACE_NUMBER": "13",
      "CONTROL_INTERFACE_CONFIG_STATUS": "not active",
      "CONTROL_INTERFACE_STATE": "not active"
    },
    {
      "INTERFACE": "Internal-Data0/0",
      "LINK_STATUS": "up",
      "PROTOCOL_STATUS": "up",
      "HARDWARE_TYPE": "i82599_xaui rev02",
      "BANDWIDTH": "10000 Mbps",
      "DELAY": "10 usec",
      "DUPLEX": "Full",
      "SPEED": "10000 Mbps",
      "FLOWCONTROL_IN": "on",
      "FLOWCONTROL_OUT": "off",
      "MAC_ADDRESS": "0000.0001.0001",
      "MTU": "not set",
      "IP_ADDRESS": "unassigned",
      "IN_PACKETS": "40694905620",
      "IN_BYTES": "27999317462474",
      "NO_BUFFER": "0",
      "BROADCASTS": "193961",
      "RUNTS": "0",
      "GIANTS": "0",
      "IN_ERRORS": "50017",
      "CRC": "0",
      "FRAME": "0",
      "OVERRUN": "50017",
      "IGNORED": "0",
      "ABORT": "0",
      "IN_PAUSE": "0",
      "IN_RESUME": "0",
      "L2_DECODE_DROPS": "0",
      "OUT_PACKETS": "22840594539",
      "OUT_BYTES": "19710792216623",
      "UNDERRUNS": "0",
      "OUT_PAUSE": "0",
      "OUT_RESUME": "0",
      "OUT_ERRORS": "0",
      "COLLISIONS": "0",
      "INTERFACE_RESETS": "1",
      "LATE_COLLISIONS": "0",
      "DEFERRED": "0",
      "OUT_DECODE_DROPS": "0",
      "IN_RESET_DROPS": "0",
      "OUT_RESET_DROPS": "0",
      "CONTROL_INTERFACE_NUMBER": "2",
      "CONTROL_INTERFACE_CONFIG_STATUS": "active",
      "CONTROL_INTERFACE_STATE": "active",
      "RXRING_NUMBER": "00, 01, 02, 03, 04",
      "RXRING_PACKETS": "11928867434, 9936555115, 8885121010, 9774040102, 170322028",
      "RXRING_BYTES": "8613178051164, 6924744308770, 5930247361074, 6508202351390, 22945468790",
      "RXRING_OVERRUN": "33671, 3892, 5983, 6471, 0",
      "RXRING_BLOCKS_FREE_CURR": "511, 511, 511, 511, 511",
      "RXRING_BLOCKS_FREE_LOW": "311, 311, 339, 369, 507",
      "TXRING_NUMBER": "00, 01, 02, 03, 04, 05",
      "TXRING_PACKETS": "7034786488, 5193693399, 4620598548, 5068271291, 164279550, 758965324",
      "TXRING_BYTES": "6276748798963, 4562626128086, 3813812735685, 4195831926616, 24019250372, 837753453654",
      "TXRING_UNDERRUN": "0, 0, 0, 0, 0, 0",
      "TXRING_BLOCKS_FREE_CURR": "511, 511, 511, 511, 511, 511",
      "TXRING_BLOCKS_FREE_LOW": "349, 350, 350, 350, 507, 486",
      "TXRING_INTERFACE": "GigabitEthernet0/0, GigabitEthernet0/1"
    },
    {
      "INTERFACE": "Internal-Data0/1",
      "LINK_STATUS": "up",
      "PROTOCOL_STATUS": "up",
      "HARDWARE_TYPE": "i82599_xaui rev02",
      "BANDWIDTH": "10000 Mbps",
      "DELAY": "10 usec",
      "DUPLEX": "Full",
      "SPEED": "10000 Mbps",
      "FLOWCONTROL_IN": "on",
      "FLOWCONTROL_OUT": "off",
      "MAC_ADDRESS": "0000.0001.0002",
      "MTU": "not set",
      "IP_ADDRESS": "unassigned",
      "IN_PACKETS": "53468958544",
      "IN_BYTES": "34934209914110",
      "NO_BUFFER": "0",
      "BROADCASTS": "237991",
      "RUNTS": "0",
      "GIANTS": "0",
      "IN_ERRORS": "5073",
      "CRC": "0",
      "FRAME": "0",
      "OVERRUN": "5073",
      "IGNORED": "0",
      "ABORT": "0",
      "IN_PAUSE": "0",
      "IN_RESUME": "0",
      "L2_DECODE_DROPS": "0",
      "OUT_PACKETS": "29187689876",
      "OUT_BYTES": "20171793812896",
      "UNDERRUNS": "0",
      "OUT_PAUSE": "0",
      "OUT_RESUME": "0",
      "OUT_ERRORS": "0",
      "COLLISIONS": "0",
      "INTERFACE_RESETS": "1",
      "LATE_COLLISIONS": "0",
      "DEFERRED": "0",
      "OUT_DECODE_DROPS": "0",
      "IN_RESET_DROPS": "0",
      "OUT_RESET_DROPS": "0",
      "CONTROL_INTERFACE_NUMBER": "3",
      "CONTROL_INTERFACE_CONFIG_STATUS": "active",
      "CONTROL_INTERFACE_STATE": "active",
      "RXRING_NUMBER": "00, 01, 02, 03",
      "RXRING_PACKETS": "15538406285, 9970135924, 17849754640, 10110661702",
      "RXRING_BYTES": "12717109454320, 6735149484197, 8351432550533, 7130518429589",
      "RXRING_OVERRUN": "1026, 2704, 801, 542",
      "RXRING_BLOCKS_FREE_CURR": "511, 511, 511, 511",
      "RXRING_BLOCKS_FREE_LOW": "358, 394, 359, 389",
      "TXRING_NUMBER": "00, 01, 02, 03, 04, 05, 06",
      "TXRING_PACKETS": "5792237421, 4768859986, 12970769201, 5655823274, 0, 0, 0",
      "TXRING_BYTES": "4975556841210, 4268946532826, 6045848459484, 4881441983697, 0, 0, 0",
      "TXRING_UNDERRUN": "0, 0, 0, 0, 0, 0, 0",
      "TXRING_BLOCKS_FREE_CURR": "511, 511, 511, 511, 511, 511, 511",
      "TXRING_BLOCKS_FREE_LOW": "349, 351, 345, 342, 511, 511, 511",
      "TXRING_INTERFACE": "GigabitEthernet0/2, GigabitEthernet0/3, GigabitEthernet0/4"
    },
    {
      "INTERFACE": "Internal-Data0/2",
      "LINK_STATUS": "up",
      "PROTOCOL_STATUS": "up",
      "HARDWARE_TYPE": "i82599_xaui rev02",
      "BANDWIDTH": "10000 Mbps",
      "DELAY": "10 usec",
      "DUPLEX": "Full",
      "SPEED": "10000 Mbps",
      "FLOWCONTROL_IN": "on",
      "FLOWCONTROL_OUT": "off",
      "MAC_ADDRESS": "0000.0001.0004",
      "MTU": "not set",
      "IP_ADDRESS": "unassigned",
      "IN_PACKETS": "58606970185",
      "IN_BYTES": "39482314595060",
      "NO_BUFFER": "0",
      "BROADCASTS": "98334",
      "RUNTS": "0",
      "GIANTS": "0",
      "IN_ERRORS": "10907",
      "CRC": "0",
      "FRAME": "0",
      "OVERRUN": "10907",
      "IGNORED": "0",
      "ABORT": "0",
      "IN_PAUSE": "523",
      "IN_RESUME": "523",
      "L2_DECODE_DROPS": "0",
      "OUT_PACKETS": "472460832718",
      "OUT_BYTES": "173237932025004",
      "UNDERRUNS": "2905646",
      "OUT_PAUSE": "0",
      "OUT_RESUME": "0",
      "OUT_ERRORS": "0",
      "COLLISIONS": "0",
      "INTERFACE_RESETS": "1",
      "LATE_COLLISIONS": "0",
      "DEFERRED": "0",
      "OUT_DECODE_DROPS": "0",
      "IN_RESET_DROPS": "0",
      "OUT_RESET_DROPS": "0",
      "CONTROL_INTERFACE_NUMBER": "4",
      "CONTROL_INTERFACE_CONFIG_STATUS": "active",
      "CONTROL_INTERFACE_STATE": "active",
      "RXRING_NUMBER": "00, 01, 02, 03",
      "RXRING_PACKETS": "13231072890, 20193376457, 12027933127, 13154587757",
      "RXRING_BYTES": "8861585758086, 14845677833920, 7489829408483, 8285221609828",
      "RXRING_OVERRUN": "5515, 3134, 858, 1400",
      "RXRING_BLOCKS_FREE_CURR": "511, 511, 511, 511",
      "RXRING_BLOCKS_FREE_LOW": "384, 396, 384, 394",
      "TXRING_NUMBER": "00, 01, 02, 03, 04, 05, 06",
      "TXRING_PACKETS": "7589052992, 15755071022, 6680981379, 6484398780, 0, 415140458466, 20810870169",
      "TXRING_BYTES": "6472090504001, 12645630943922, 5085252075635, 4988646702498, 0, 127322520663605, 16723791170491",
      "TXRING_UNDERRUN": "0, 0, 0, 0, 0, 2905646, 0",
      "TXRING_BLOCKS_FREE_CURR": "511, 510, 511, 505, 511, 508, 511",
      "TXRING_BLOCKS_FREE_LOW": "349, 349, 342, 311, 511, 0, 170",
      "TXRING_INTERFACE": "TenGigabitEthernet0/6, TenGigabitEthernet0/9, TenGigabitEthernet0/8"
    },
    {
      "INTERFACE": "Internal-Data0/3",
      "LINK_STATUS": "up",
      "PROTOCOL_STATUS": "up",
      "HARDWARE_TYPE": "i82599_xaui rev02",
      "BANDWIDTH": "10000 Mbps",
      "DELAY": "10 usec",
      "DUPLEX": "Full",
      "SPEED": "10000 Mbps",
      "FLOWCONTROL_IN": "on",
      "FLOWCONTROL_OUT": "off",
      "MAC_ADDRESS": "0000.0001.0003",
      "MTU": "not set",
      "IP_ADDRESS": "unassigned",
      "IN_PACKETS": "851725855606",
      "IN_BYTES": "549651226348272",
      "NO_BUFFER": "0",
      "BROADCASTS": "53915",
      "RUNTS": "0",
      "GIANTS": "0",
      "IN_ERRORS": "457910371",
      "CRC": "0",
      "FRAME": "0",
      "OVERRUN": "457910371",
      "IGNORED": "0",
      "ABORT": "0",
      "IN_PAUSE": "0",
      "IN_RESUME": "0",
      "L2_DECODE_DROPS": "0",
      "OUT_PACKETS": "479068686555",
      "OUT_BYTES": "439462480886576",
      "UNDERRUNS": "0",
      "OUT_PAUSE": "0",
      "OUT_RESUME": "0",
      "OUT_ERRORS": "0",
      "COLLISIONS": "0",
      "INTERFACE_RESETS": "1",
      "LATE_COLLISIONS": "0",
      "DEFERRED": "0",
      "OUT_DECODE_DROPS": "0",
      "IN_RESET_DROPS": "0",
      "OUT_RESET_DROPS": "0",
      "CONTROL_INTERFACE_NUMBER": "5",
      "CONTROL_INTERFACE_CONFIG_STATUS": "active",
      "CONTROL_INTERFACE_STATE": "active",
      "RXRING_NUMBER": "00, 01, 02, 03",
      "RXRING_PACKETS": "9317849354, 12456612163, 818537242486, 11414151630",
      "RXRING_BYTES": "6455848237095, 7108517208857, 528392087186847, 7694773726910",
      "RXRING_OVERRUN": "11242, 8535, 457881225, 9369",
      "RXRING_BLOCKS_FREE_CURR": "511, 511, 511, 511",
      "RXRING_BLOCKS_FREE_LOW": "377, 340, 152, 362",
      "TXRING_NUMBER": "00, 01, 02, 03, 04, 05",
      "TXRING_PACKETS": "4776785546, 6150915656, 460988499302, 7152486058, 0, 0",
      "TXRING_BYTES": "4204729002116, 4487948642586, 425299352333798, 5470450911421, 0, 0",
      "TXRING_UNDERRUN": "0, 0, 0, 0, 0, 0",
      "TXRING_BLOCKS_FREE_CURR": "511, 511, 511, 511, 511, 511",
      "TXRING_BLOCKS_FREE_LOW": "349, 349, 282, 313, 511, 511",
      "TXRING_INTERFACE": "GigabitEthernet0/5, TenGigabitEthernet0/7"
    },
    {
      "INTERFACE": "Internal-Data0/4",
      "LINK_STATUS": "up",
      "PROTOCOL_STATUS": "up",
      "HARDWARE_TYPE": "bcm56800 rev 01",
      "BANDWIDTH": "10000 Mbps",
      "DELAY": "10 usec",
      "DUPLEX": "Full",
      "SPEED": "10000 Mbps",
      "FLOWCONTROL_IN": "on",
      "FLOWCONTROL_OUT": "on",
      "MAC_ADDRESS": "0000.0100.001d",
      "MTU": "not set",
      "IP_ADDRESS": "unassigned",
      "IN_PACKETS": "22840589872",
      "IN_BYTES": "19710795908904",
      "NO_BUFFER": "0",
      "BROADCASTS": "5014",
      "RUNTS": "0",
      "GIANTS": "0",
      "IN_ERRORS": "0",
      "CRC": "0",
      "FRAME": "0",
      "OVERRUN": "0",
      "IGNORED": "0",
      "ABORT": "0",
      "IN_PAUSE_RESUME": "0",
      "SWITCH_INGRESS_POLICY_DROPS": "0",
      "OUT_PACKETS": "40694946838",
      "OUT_BYTES": "27999352911090",
      "UNDERRUNS": "0",
      "OUT_PAUSE_RESUME": "0",
      "OUT_ERRORS": "0",
      "COLLISIONS": "0",
      "INTERFACE_RESETS": "0",
      "LATE_COLLISIONS": "0",
      "DEFERRED": "0",
      "SWITCH_EGRESS_POLICY_DROPS": "0",
      "IN_RESET_DROPS": "0",
      "OUT_RESET_DROPS": "0",
      "CONTROL_INTERFACE_NUMBER": "18",
      "CONTROL_INTERFACE_CONFIG_STATUS": "active",
      "CONTROL_INTERFACE_STATE": "active"
    },
    {
      "INTERFACE": "Internal-Data0/5",
      "LINK_STATUS": "up",
      "PROTOCOL_STATUS": "up",
      "HARDWARE_TYPE": "bcm56800 rev 01",
      "BANDWIDTH": "10000 Mbps",
      "DELAY": "10 usec",
      "DUPLEX": "Full",
      "SPEED": "10000 Mbps",
      "FLOWCONTROL_IN": "on",
      "FLOWCONTROL_OUT": "on",
      "MAC_ADDRESS": "0000.0100.001e",
      "MTU": "not set",
      "IP_ADDRESS": "unassigned",
      "IN_PACKETS": "29187686478",
      "IN_BYTES": "20171797966300",
      "NO_BUFFER": "0",
      "BROADCASTS": "4",
      "RUNTS": "0",
      "GIANTS": "0",
      "IN_ERRORS": "0",
      "CRC": "0",
      "FRAME": "0",
      "OVERRUN": "0",
      "IGNORED": "0",
      "ABORT": "0",
      "IN_PAUSE_RESUME": "0",
      "SWITCH_INGRESS_POLICY_DROPS": "0",
      "OUT_PACKETS": "53468957755",
      "OUT_BYTES": "34934208273981",
      "UNDERRUNS": "0",
      "OUT_PAUSE_RESUME": "0",
      "OUT_ERRORS": "0",
      "COLLISIONS": "0",
      "INTERFACE_RESETS": "0",
      "LATE_COLLISIONS": "0",
      "DEFERRED": "0",
      "SWITCH_EGRESS_POLICY_DROPS": "0",
      "IN_RESET_DROPS": "0",
      "OUT_RESET_DROPS": "0",
      "CONTROL_INTERFACE_NUMBER": "19",
      "CONTROL_INTERFACE_CONFIG_STATUS": "active",
      "CONTROL_INTERFACE_STATE": "active"
    },
    {
      "INTERFACE": "Internal-Data0/6",
      "LINK_STATUS": "up",
      "PROTOCOL_STATUS": "up",
      "HARDWARE_TYPE": "bcm56800 rev 01",
      "BANDWIDTH": "10000 Mbps",
      "DELAY": "10 usec",
      "DUPLEX": "Full",
      "SPEED": "10000 Mbps",
      "FLOWCONTROL_IN": "on",
      "FLOWCONTROL_OUT": "on",
      "MAC_ADDRESS": "0000.0100.001f",
      "MTU": "not set",
      "IP_ADDRESS": "unassigned",
      "IN_PACKETS": "472460814095",
      "IN_BYTES": "173237935490747",
      "NO_BUFFER": "0",
      "BROADCASTS": "22",
      "RUNTS": "0",
      "GIANTS": "0",
      "IN_ERRORS": "0",
      "CRC": "0",
      "FRAME": "0",
      "OVERRUN": "0",
      "IGNORED": "0",
      "ABORT": "0",
      "IN_PAUSE_RESUME": "0",
      "SWITCH_INGRESS_POLICY_DROPS": "0",
      "OUT_PACKETS": "58606973721",
      "OUT_BYTES": "39482316159290",
      "UNDERRUNS": "0",
      "OUT_PAUSE_RESUME": "1046",
      "OUT_ERRORS": "0",
      "COLLISIONS": "0",
      "INTERFACE_RESETS": "0",
      "LATE_COLLISIONS": "0",
      "DEFERRED": "0",
      "SWITCH_EGRESS_POLICY_DROPS": "0",
      "IN_RESET_DROPS": "0",
      "OUT_RESET_DROPS": "0",
      "CONTROL_INTERFACE_NUMBER": "20",
      "CONTROL_INTERFACE_CONFIG_STATUS": "active",
      "CONTROL_INTERFACE_STATE": "active"
    },
    {
      "INTERFACE": "Internal-Data0/7",
      "LINK_STATUS": "up",
      "PROTOCOL_STATUS": "up",
      "HARDWARE_TYPE": "bcm56800 rev 01",
      "BANDWIDTH": "10000 Mbps",
      "DELAY": "10 usec",
      "DUPLEX": "Full",
      "SPEED": "10000 Mbps",
      "FLOWCONTROL_IN": "on",
      "FLOWCONTROL_OUT": "on",
      "MAC_ADDRESS": "0000.0100.0020",
      "MTU": "not set",
      "IP_ADDRESS": "unassigned",
      "IN_PACKETS": "479068680668",
      "IN_BYTES": "439462480942505",
      "NO_BUFFER": "0",
      "BROADCASTS": "5",
      "RUNTS": "0",
      "GIANTS": "0",
      "IN_ERRORS": "0",
      "CRC": "0",
      "FRAME": "0",
      "OVERRUN": "0",
      "IGNORED": "0",
      "ABORT": "0",
      "IN_PAUSE_RESUME": "0",
      "SWITCH_INGRESS_POLICY_DROPS": "0",
      "OUT_PACKETS": "852183755510",
      "OUT_BYTES": "549964199797166",
      "UNDERRUNS": "0",
      "OUT_PAUSE_RESUME": "0",
      "OUT_ERRORS": "0",
      "COLLISIONS": "0",
      "INTERFACE_RESETS": "0",
      "LATE_COLLISIONS": "0",
      "DEFERRED": "0",
      "SWITCH_EGRESS_POLICY_DROPS": "0",
      "IN_RESET_DROPS": "0",
      "OUT_RESET_DROPS": "0",
      "CONTROL_INTERFACE_NUMBER": "21",
      "CONTROL_INTERFACE_CONFIG_STATUS": "active",
      "CONTROL_INTERFACE_STATE": "active"
    },
    {
      "INTERFACE": "Management0/0",
      "LINK_STATUS": "up",
      "PROTOCOL_STATUS": "up",
      "HARDWARE_TYPE": "i82574L rev00",
      "BANDWIDTH": "1000 Mbps",
      "DELAY": "10 usec",
      "DUPLEX": "Full",
      "SPEED": "1000 Mbps",
      "FLOWCONTROL_IN": "unsupported",
      "FLOWCONTROL_OUT": "off",
      "MAC_ADDRESS": "f0f7.5543.a520",
      "MTU": "not set",
      "IP_ADDRESS": "unassigned",
      "IN_PACKETS": "187312178",
      "IN_BYTES": "18346216501",
      "NO_BUFFER": "0",
      "BROADCASTS": "33364282",
      "RUNTS": "0",
      "GIANTS": "0",
      "IN_ERRORS": "0",
      "CRC": "0",
      "FRAME": "0",
      "OVERRUN": "0",
      "IGNORED": "0",
      "ABORT": "0",
      "IN_PAUSE": "0",
      "IN_RESUME": "0",
      "L2_DECODE_DROPS": "0",
      "OUT_PACKETS": "365077501",
      "OUT_BYTES": "69865717975",
      "UNDERRUNS": "0",
      "OUT_PAUSE": "0",
      "OUT_RESUME": "0",
      "OUT_ERRORS": "0",
      "COLLISIONS": "0",
      "INTERFACE_RESETS": "2",
      "LATE_COLLISIONS": "0",
      "DEFERRED": "0",
      "IN_RESET_DROPS": "3",
      "OUT_RESET_DROPS": "0",
      "CONTROL_INTERFACE_NUMBER": "6",
      "CONTROL_INTERFACE_CONFIG_STATUS": "active",
      "CONTROL_INTERFACE_STATE": "active"
    },
    {
      "INTERFACE": "Management0/1",
      "LINK_STATUS": "administratively down",
      "PROTOCOL_STATUS": "down",
      "HARDWARE_TYPE": "i82574L rev00",
      "BANDWIDTH": "1000 Mbps",
      "DELAY": "10 usec",
      "DUPLEX": "Auto",
      "SPEED": "Auto",
      "FLOWCONTROL_IN": "unsupported",
      "FLOWCONTROL_OUT": "off",
      "MAC_ADDRESS": "f0f7.5543.a521",
      "MTU": "not set",
      "IP_ADDRESS": "unassigned",
      "IN_PACKETS": "0",
      "IN_BYTES": "0",
      "NO_BUFFER": "0",
      "BROADCASTS": "0",
      "RUNTS": "0",
      "GIANTS": "0",
      "IN_ERRORS": "0",
      "CRC": "0",
      "FRAME": "0",
      "OVERRUN": "0",
      "IGNORED": "0",
      "ABORT": "0",
      "IN_PAUSE": "0",
      "IN_RESUME": "0",
      "L2_DECODE_DROPS": "0",
      "OUT_PACKETS": "0",
      "OUT_BYTES": "0",
      "UNDERRUNS": "0",
      "OUT_PAUSE": "0",
      "OUT_RESUME": "0",
      "OUT_ERRORS": "0",
      "COLLISIONS": "0",
      "INTERFACE_RESETS": "2",
      "LATE_COLLISIONS": "0",
      "DEFERRED": "0",
      "IN_RESET_DROPS": "0",
      "OUT_RESET_DROPS": "0",
      "CONTROL_INTERFACE_NUMBER": "7",
      "CONTROL_INTERFACE_CONFIG_STATUS": "not active",
      "CONTROL_INTERFACE_STATE": "not active"
    },
    {
      "INTERFACE": "TenGigabitEthernet0/6",
      "LINK_STATUS": "up",
      "PROTOCOL_STATUS": "up",
      "HARDWARE_TYPE": "bcm56800 rev 01",
      "BANDWIDTH": "10000 Mbps",
      "DELAY": "10 usec",
      "DUPLEX": "Full",
      "SPEED": "10000 Mbps",
      "FLOWCONTROL_IN": "unsupported",
      "FLOWCONTROL_OUT": "off",
      "BONDED_PORT": "Port-channel1",
      "MAC_ADDRESS": "f0f7.5543.a528",
      "MTU": "not set",
      "IP_ADDRESS": "unassigned",
      "IN_PACKETS": "399819592361",
      "IN_BYTES": "124398034640232",
      "NO_BUFFER": "0",
      "BROADCASTS": "16",
      "RUNTS": "0",
      "GIANTS": "0",
      "IN_ERRORS": "0",
      "CRC": "0",
      "FRAME": "0",
      "OVERRUN": "0",
      "IGNORED": "0",
      "ABORT": "0",
      "IN_PAUSE_RESUME": "0",
      "L2_DECODE_DROPS": "0",
      "SWITCH_INGRESS_POLICY_DROPS": "0",
      "OUT_PACKETS": "540331320890",
      "OUT_BYTES": "491562768018165",
      "UNDERRUNS": "0",
      "OUT_PAUSE_RESUME": "0",
      "OUT_ERRORS": "0",
      "COLLISIONS": "0",
      "INTERFACE_RESETS": "0",
      "LATE_COLLISIONS": "0",
      "DEFERRED": "0",
      "RATE_LIMIT_DROPS": "0",
      "SWITCH_EGRESS_POLICY_DROPS": "0",
      "IN_RESET_DROPS": "0",
      "OUT_RESET_DROPS": "0",
      "CONTROL_INTERFACE_NUMBER": "14",
      "CONTROL_INTERFACE_CONFIG_STATUS": "active",
      "CONTROL_INTERFACE_STATE": "active"
    },
    {
      "INTERFACE": "TenGigabitEthernet0/7",
      "LINK_STATUS": "up",
      "PROTOCOL_STATUS": "up",
      "HARDWARE_TYPE": "bcm56800 rev 01",
      "BANDWIDTH": "10000 Mbps",
      "DELAY": "10 usec",
      "DUPLEX": "Full",
      "SPEED": "10000 Mbps",
      "FLOWCONTROL_IN": "unsupported",
      "FLOWCONTROL_OUT": "off",
      "BONDED_PORT": "Port-channel1",
      "MAC_ADDRESS": "f0f7.5543.a529",
      "MTU": "not set",
      "IP_ADDRESS": "unassigned",
      "IN_PACKETS": "37959565021",
      "IN_BYTES": "18199845951648",
      "NO_BUFFER": "0",
      "BROADCASTS": "2097",
      "RUNTS": "0",
      "GIANTS": "0",
      "IN_ERRORS": "0",
      "CRC": "0",
      "FRAME": "0",
      "OVERRUN": "0",
      "IGNORED": "0",
      "ABORT": "0",
      "IN_PAUSE_RESUME": "0",
      "L2_DECODE_DROPS": "0",
      "SWITCH_INGRESS_POLICY_DROPS": "0",
      "OUT_PACKETS": "26351891151",
      "OUT_BYTES": "13846109908639",
      "UNDERRUNS": "0",
      "OUT_PAUSE_RESUME": "0",
      "OUT_ERRORS": "0",
      "COLLISIONS": "0",
      "INTERFACE_RESETS": "0",
      "LATE_COLLISIONS": "0",
      "DEFERRED": "0",
      "RATE_LIMIT_DROPS": "0",
      "SWITCH_EGRESS_POLICY_DROPS": "0",
      "IN_RESET_DROPS": "0",
      "OUT_RESET_DROPS": "0",
      "CONTROL_INTERFACE_NUMBER": "15",
      "CONTROL_INTERFACE_CONFIG_STATUS": "active",
      "CONTROL_INTERFACE_STATE": "active"
    },
    {
      "INTERFACE": "TenGigabitEthernet0/8",
      "LINK_STATUS": "up",
      "PROTOCOL_STATUS": "up",
      "HARDWARE_TYPE": "bcm56800 rev 01",
      "BANDWIDTH": "1000 Mbps",
      "DELAY": "1000 usec",
      "DUPLEX": "Full",
      "SPEED": "1000 Mbps",
      "FLOWCONTROL_IN": "unsupported",
      "FLOWCONTROL_OUT": "off",
      "BONDED_PORT": "Port-channel2",
      "MAC_ADDRESS": "f0f7.5543.a52a",
      "MTU": "not set",
      "IP_ADDRESS": "unassigned",
      "IN_PACKETS": "43937607828",
      "IN_BYTES": "34610285463141",
      "NO_BUFFER": "0",
      "BROADCASTS": "245856",
      "RUNTS": "0",
      "GIANTS": "0",
      "IN_ERRORS": "0",
      "CRC": "0",
      "FRAME": "0",
      "OVERRUN": "0",
      "IGNORED": "0",
      "ABORT": "0",
      "IN_PAUSE_RESUME": "0",
      "L2_DECODE_DROPS": "0",
      "SWITCH_INGRESS_POLICY_DROPS": "0",
      "OUT_PACKETS": "20810869221",
      "OUT_BYTES": "16640841970890",
      "UNDERRUNS": "0",
      "OUT_PAUSE_RESUME": "0",
      "OUT_ERRORS": "0",
      "COLLISIONS": "0",
      "INTERFACE_RESETS": "0",
      "LATE_COLLISIONS": "0",
      "DEFERRED": "0",
      "RATE_LIMIT_DROPS": "0",
      "SWITCH_EGRESS_POLICY_DROPS": "0",
      "IN_RESET_DROPS": "0",
      "OUT_RESET_DROPS": "0",
      "CONTROL_INTERFACE_NUMBER": "16",
      "CONTROL_INTERFACE_CONFIG_STATUS": "active",
      "CONTROL_INTERFACE_STATE": "active"
    },
    {
      "INTERFACE": "TenGigabitEthernet0/9",
      "LINK_STATUS": "up",
      "PROTOCOL_STATUS": "up",
      "HARDWARE_TYPE": "bcm56800 rev 01",
      "BANDWIDTH": "1000 Mbps",
      "DELAY": "1000 usec",
      "DUPLEX": "Full",
      "SPEED": "1000 Mbps",
      "FLOWCONTROL_IN": "unsupported",
      "FLOWCONTROL_OUT": "off",
      "BONDED_PORT": "Port-channel2",
      "MAC_ADDRESS": "f0f7.5543.a52b",
      "MTU": "not set",
      "IP_ADDRESS": "unassigned",
      "IN_PACKETS": "523013521132",
      "IN_BYTES": "471124372993133",
      "NO_BUFFER": "0",
      "BROADCASTS": "336212",
      "RUNTS": "0",
      "GIANTS": "0",
      "IN_ERRORS": "0",
      "CRC": "0",
      "FRAME": "0",
      "OVERRUN": "0",
      "IGNORED": "0",
      "ABORT": "0",
      "IN_PAUSE_RESUME": "0",
      "L2_DECODE_DROPS": "0",
      "SWITCH_INGRESS_POLICY_DROPS": "0",
      "OUT_PACKETS": "415140444956",
      "OUT_BYTES": "125662363017538",
      "UNDERRUNS": "0",
      "OUT_PAUSE_RESUME": "0",
      "OUT_ERRORS": "0",
      "COLLISIONS": "0",
      "INTERFACE_RESETS": "0",
      "LATE_COLLISIONS": "0",
      "DEFERRED": "0",
      "RATE_LIMIT_DROPS": "0",
      "SWITCH_EGRESS_POLICY_DROPS": "0",
      "IN_RESET_DROPS": "0",
      "OUT_RESET_DROPS": "0",
      "CONTROL_INTERFACE_NUMBER": "17",
      "CONTROL_INTERFACE_CONFIG_STATUS": "active",
      "CONTROL_INTERFACE_STATE": "active"
    },
    {
      "INTERFACE": "Port-channel1",
      "LINK_STATUS": "up",
      "PROTOCOL_STATUS": "up",
      "HARDWARE_TYPE": "EtherChannel",
      "BANDWIDTH": "20000 Mbps",
      "DELAY": "10 usec",
      "DUPLEX": "Full",
      "SPEED": "10000 Mbps",
      "FLOWCONTROL_IN": "unsupported",
      "FLOWCONTROL_OUT": "off",
      "DESCRIPTION": "ext",
      "MAC_ADDRESS": "f0f7.5543.a528",
      "MTU": "not set",
      "IP_ADDRESS": "unassigned",
      "CONTROL_INTERFACE_NUMBER": "23",
      "CONTROL_INTERFACE_CONFIG_STATUS": "active",
      "CONTROL_INTERFACE_STATE": "active"
    },
    {
      "INTERFACE": "Port-channel1.355",
      "LINK_STATUS": "up",
      "PROTOCOL_STATUS": "up",
      "HARDWARE_TYPE": "EtherChannel",
      "BANDWIDTH": "20000 Mbps",
      "DELAY": "10 usec",
      "DESCRIPTION": "data-inside",
      "VLAN_ID": "355"
    },
    {
      "INTERFACE": "Port-channel2",
      "LINK_STATUS": "up",
      "PROTOCOL_STATUS": "up",
      "HARDWARE_TYPE": "EtherChannel",
      "BANDWIDTH": "2000 Mbps",
      "DELAY": "1000 usec",
      "DUPLEX": "Full",
      "SPEED": "1000 Mbps",
      "FLOWCONTROL_IN": "unsupported",
      "FLOWCONTROL_OUT": "off",
      "DESCRIPTION": "techlan",
      "MAC_ADDRESS": "f0f7.5543.a52a",
      "MTU": "not set",
      "IP_ADDRESS": "unassigned",
      "CONTROL_INTERFACE_NUMBER": "24",
      "CONTROL_INTERFACE_CONFIG_STATUS": "active",
      "CONTROL_INTERFACE_STATE": "active"
    },
    {
      "INTERFACE": "Port-channel2.283",
      "LINK_STATUS": "up",
      "PROTOCOL_STATUS": "up",
      "HARDWARE_TYPE": "EtherChannel",
      "BANDWIDTH": "2000 Mbps",
      "DELAY": "1000 usec",
      "DESCRIPTION": "data-outside",
      "VLAN_ID": "283"
    }
  ],
  "ttp_parsed": [
    {
      "hardware_type_bandwidth_delay": [
        {
          "HARDWARE_TYPE": "bcm56800 rev 01",
          "BANDWIDTH": "1000 Mbps",
          "DELAY": "10 usec"
        },
        {
          "HARDWARE_TYPE": "bcm56800 rev 01",
          "BANDWIDTH": "1000 Mbps",
          "DELAY": "10 usec"
        },
        {
          "HARDWARE_TYPE": "bcm56800 rev 01",
          "BANDWIDTH": "1000 Mbps",
          "DELAY": "10 usec"
        },
        {
          "HARDWARE_TYPE": "bcm56800 rev 01",
          "BANDWIDTH": "1000 Mbps",
          "DELAY": "10 usec"
        },
        {
          "HARDWARE_TYPE": "bcm56800 rev 01",
          "BANDWIDTH": "1000 Mbps",
          "DELAY": "10 usec"
        },
        {
          "HARDWARE_TYPE": "bcm56800 rev 01",
          "BANDWIDTH": "1000 Mbps",
          "DELAY": "10 usec"
        },
        {
          "HARDWARE_TYPE": "i82599_xaui rev02",
          "BANDWIDTH": "10000 Mbps",
          "DELAY": "10 usec"
        },
        {
          "HARDWARE_TYPE": "i82599_xaui rev02",
          "BANDWIDTH": "10000 Mbps",
          "DELAY": "10 usec"
        },
        {
          "HARDWARE_TYPE": "i82599_xaui rev02",
          "BANDWIDTH": "10000 Mbps",
          "DELAY": "10 usec"
        },
        {
          "HARDWARE_TYPE": "i82599_xaui rev02",
          "BANDWIDTH": "10000 Mbps",
          "DELAY": "10 usec"
        },
        {
          "HARDWARE_TYPE": "bcm56800 rev 01",
          "BANDWIDTH": "10000 Mbps",
          "DELAY": "10 usec"
        },
        {
          "HARDWARE_TYPE": "bcm56800 rev 01",
          "BANDWIDTH": "10000 Mbps",
          "DELAY": "10 usec"
        },
        {
          "HARDWARE_TYPE": "bcm56800 rev 01",
          "BANDWIDTH": "10000 Mbps",
          "DELAY": "10 usec"
        },
        {
          "HARDWARE_TYPE": "bcm56800 rev 01",
          "BANDWIDTH": "10000 Mbps",
          "DELAY": "10 usec"
        },
        {
          "HARDWARE_TYPE": "i82574L rev00",
          "BANDWIDTH": "1000 Mbps",
          "DELAY": "10 usec"
        },
        {
          "HARDWARE_TYPE": "i82574L rev00",
          "BANDWIDTH": "1000 Mbps",
          "DELAY": "10 usec"
        },
        {
          "HARDWARE_TYPE": "bcm56800 rev 01",
          "BANDWIDTH": "10000 Mbps",
          "DELAY": "10 usec"
        },
        {
          "HARDWARE_TYPE": "bcm56800 rev 01",
          "BANDWIDTH": "10000 Mbps",
          "DELAY": "10 usec"
        },
        {
          "HARDWARE_TYPE": "bcm56800 rev 01",
          "BANDWIDTH": "1000 Mbps",
          "DELAY": "1000 usec"
        },
        {
          "HARDWARE_TYPE": "bcm56800 rev 01",
          "BANDWIDTH": "1000 Mbps",
          "DELAY": "1000 usec"
        },
        {
          "HARDWARE_TYPE": "EtherChannel/LACP",
          "BANDWIDTH": "20000 Mbps",
          "DELAY": "10 usec"
        },
        {
          "HARDWARE_TYPE": "EtherChannel/LACP",
          "BANDWIDTH": "20000 Mbps",
          "DELAY": "10 usec"
        },
        {
          "HARDWARE_TYPE": "EtherChannel/LACP",
          "BANDWIDTH": "2000 Mbps",
          "DELAY": "1000 usec"
        },
        {
          "HARDWARE_TYPE": "EtherChannel/LACP",
          "BANDWIDTH": "2000 Mbps",
          "DELAY": "1000 usec"
        }
      ],
      "link_status_duplex_protocol_status_bandwidth": [
        {
          "LINK_STATUS": "up",
          "DUPLEX": "Full",
          "PROTOCOL_STATUS": "up",
          "BANDWIDTH": "1000 Mbps"
        },
        {
          "LINK_STATUS": "up",
          "DUPLEX": "Full",
          "PROTOCOL_STATUS": "up",
          "BANDWIDTH": "1000 Mbps"
        },
        {
          "LINK_STATUS": "up",
          "DUPLEX": "Full",
          "PROTOCOL_STATUS": "up",
          "BANDWIDTH": "1000 Mbps"
        }
      ],
      "duplex_link_status_bandwidth": [
        {
          "DUPLEX": "Full",
          "LINK_STATUS": "up",
          "BANDWIDTH": "10000 Mbps"
        },
        {
          "DUPLEX": "Full",
          "LINK_STATUS": "up",
          "BANDWIDTH": "10000 Mbps"
        },
        {
          "DUPLEX": "Full",
          "LINK_STATUS": "up",
          "BANDWIDTH": "10000 Mbps"
        },
        {
          "DUPLEX": "Full",
          "LINK_STATUS": "up",
          "BANDWIDTH": "10000 Mbps"
        },
        {
          "DUPLEX": "Full",
          "LINK_STATUS": "up",
          "BANDWIDTH": "10000 Mbps"
        },
        {
          "DUPLEX": "Full",
          "LINK_STATUS": "up",
          "BANDWIDTH": "10000 Mbps"
        },
        {
          "DUPLEX": "Full",
          "LINK_STATUS": "up",
          "BANDWIDTH": "10000 Mbps"
        },
        {
          "DUPLEX": "Full",
          "LINK_STATUS": "up",
          "BANDWIDTH": "10000 Mbps"
        },
        {
          "DUPLEX": "Full",
          "LINK_STATUS": "up",
          "BANDWIDTH": "10000 Mbps"
        },
        {
          "DUPLEX": "Full",
          "LINK_STATUS": "up",
          "BANDWIDTH": "10000 Mbps"
        },
        {
          "DUPLEX": "Full",
          "LINK_STATUS": "up",
          "BANDWIDTH": "10000 Mbps"
        }
      ],
      "flowcontrol_in_flowcontrol_out": [
        {
          "FLOWCONTROL_IN": "unsupported",
          "FLOWCONTROL_OUT": "off"
        },
        {
          "FLOWCONTROL_IN": "unsupported",
          "FLOWCONTROL_OUT": "off"
        },
        {
          "FLOWCONTROL_IN": "unsupported",
          "FLOWCONTROL_OUT": "off"
        },
        {
          "FLOWCONTROL_IN": "unsupported",
          "FLOWCONTROL_OUT": "off"
        },
        {
          "FLOWCONTROL_IN": "unsupported",
          "FLOWCONTROL_OUT": "off"
        },
        {
          "FLOWCONTROL_IN": "unsupported",
          "FLOWCONTROL_OUT": "off"
        },
        {
          "FLOWCONTROL_IN": "on",
          "FLOWCONTROL_OUT": "off"
        },
        {
          "FLOWCONTROL_IN": "on",
          "FLOWCONTROL_OUT": "off"
        },
        {
          "FLOWCONTROL_IN": "on",
          "FLOWCONTROL_OUT": "off"
        },
        {
          "FLOWCONTROL_IN": "on",
          "FLOWCONTROL_OUT": "off"
        },
        {
          "FLOWCONTROL_IN": "on",
          "FLOWCONTROL_OUT": "on"
        },
        {
          "FLOWCONTROL_IN": "on",
          "FLOWCONTROL_OUT": "on"
        },
        {
          "FLOWCONTROL_IN": "on",
          "FLOWCONTROL_OUT": "on"
        },
        {
          "FLOWCONTROL_IN": "on",
          "FLOWCONTROL_OUT": "on"
        },
        {
          "FLOWCONTROL_IN": "unsupported",
          "FLOWCONTROL_OUT": "off"
        },
        {
          "FLOWCONTROL_IN": "unsupported",
          "FLOWCONTROL_OUT": "off"
        },
        {
          "FLOWCONTROL_IN": "unsupported",
          "FLOWCONTROL_OUT": "off"
        },
        {
          "FLOWCONTROL_IN": "unsupported",
          "FLOWCONTROL_OUT": "off"
        },
        {
          "FLOWCONTROL_IN": "unsupported",
          "FLOWCONTROL_OUT": "off"
        },
        {
          "FLOWCONTROL_IN": "unsupported",
          "FLOWCONTROL_OUT": "off"
        },
        {
          "FLOWCONTROL_IN": "unsupported",
          "FLOWCONTROL_OUT": "off"
        },
        {
          "FLOWCONTROL_IN": "unsupported",
          "FLOWCONTROL_OUT": "off"
        }
      ],
      "interface_link_status_protocol_status": [
        {
          "INTERFACE": "GigabitEthernet0/2",
          "LINK_STATUS": "administratively down",
          "PROTOCOL_STATUS": "down"
        },
        {
          "INTERFACE": "GigabitEthernet0/3",
          "LINK_STATUS": "administratively down",
          "PROTOCOL_STATUS": "down"
        },
        {
          "INTERFACE": "GigabitEthernet0/4",
          "LINK_STATUS": "administratively down",
          "PROTOCOL_STATUS": "down"
        },
        {
          "INTERFACE": "GigabitEthernet0/5",
          "LINK_STATUS": "administratively down",
          "PROTOCOL_STATUS": "down"
        },
        {
          "INTERFACE": "Internal-Data0/0",
          "LINK_STATUS": "up",
          "PROTOCOL_STATUS": "up"
        },
        {
          "INTERFACE": "Internal-Data0/1",
          "LINK_STATUS": "up",
          "PROTOCOL_STATUS": "up"
        },
        {
          "INTERFACE": "Internal-Data0/2",
          "LINK_STATUS": "up",
          "PROTOCOL_STATUS": "up"
        },
        {
          "INTERFACE": "Internal-Data0/3",
          "LINK_STATUS": "up",
          "PROTOCOL_STATUS": "up"
        },
        {
          "INTERFACE": "Internal-Data0/4",
          "LINK_STATUS": "up",
          "PROTOCOL_STATUS": "up"
        },
        {
          "INTERFACE": "Internal-Data0/5",
          "LINK_STATUS": "up",
          "PROTOCOL_STATUS": "up"
        },
        {
          "INTERFACE": "Internal-Data0/6",
          "LINK_STATUS": "up",
          "PROTOCOL_STATUS": "up"
        },
        {
          "INTERFACE": "Internal-Data0/7",
          "LINK_STATUS": "up",
          "PROTOCOL_STATUS": "up"
        },
        {
          "INTERFACE": "Management0/0",
          "LINK_STATUS": "up",
          "PROTOCOL_STATUS": "up"
        },
        {
          "INTERFACE": "Management0/1",
          "LINK_STATUS": "administratively down",
          "PROTOCOL_STATUS": "down"
        },
        {
          "INTERFACE": "TenGigabitEthernet0/6",
          "LINK_STATUS": "up",
          "PROTOCOL_STATUS": "up"
        },
        {
          "INTERFACE": "TenGigabitEthernet0/7",
          "LINK_STATUS": "up",
          "PROTOCOL_STATUS": "up"
        },
        {
          "INTERFACE": "TenGigabitEthernet0/8",
          "LINK_STATUS": "up",
          "PROTOCOL_STATUS": "up"
        },
        {
          "INTERFACE": "TenGigabitEthernet0/9",
          "LINK_STATUS": "up",
          "PROTOCOL_STATUS": "up"
        },
        {
          "INTERFACE": "Port-channel1",
          "LINK_STATUS": "up",
          "PROTOCOL_STATUS": "up"
        },
        {
          "INTERFACE": "Port-channel1.355",
          "LINK_STATUS": "up",
          "PROTOCOL_STATUS": "up"
        },
        {
          "INTERFACE": "Port-channel2",
          "LINK_STATUS": "up",
          "PROTOCOL_STATUS": "up"
        },
        {
          "INTERFACE": "Port-channel2.283",
          "LINK_STATUS": "up",
          "PROTOCOL_STATUS": "up"
        }
      ]
    }
  ],
  "cli_content": "Interface GigabitEthernet0/0 \"folink\", is up, line protocol is up\n  Hardware is bcm56800 rev 01, BW 1000 Mbps, DLY 10 usec\n        Auto-Duplex(Full-duplex), Auto-Speed(1000 Mbps)\n        Input flow control is unsupported, output flow control is off\n        Description: LAN Failover Interface\n        MAC address f0f7.5543.a522, MTU 1500\n        IP address 11.1.1.1, subnet mask 255.255.255.252\n        200840360 packets input, 26646683366 bytes, 0 no buffer\n        Received 18 broadcasts, 0 runts, 0 giants\n        0 input errors, 0 CRC, 0 frame, 0 overrun, 0 ignored, 0 abort\n        0 pause/resume input\n        0 L2 decode drops\n        0 switch ingress policy drops\n        164279548 packets output, 23362268244 bytes, 0 underruns\n        0 pause/resume output\n        0 output errors, 0 collisions, 0 interface resets\n        0 late collisions, 0 deferred\n        0 rate limit drops\n        0 switch egress policy drops\n        0 input reset drops, 0 output reset drops\n  Control Point Interface States:\n        Interface number is 8\n        Interface config status is active\n        Interface state is active\nInterface GigabitEthernet0/1 \"statelink\", is up, line protocol is up\n  Hardware is bcm56800 rev 01, BW 1000 Mbps, DLY 10 usec\n        Auto-Duplex(Full-duplex), Auto-Speed(1000 Mbps)\n        Input flow control is unsupported, output flow control is off\n        Description: STATE Failover Interface\n        MAC address f0f7.5543.a523, MTU 1500\n        IP address 12.1.1.1, subnet mask 255.255.255.252\n        96629806 packets input, 11507372449 bytes, 0 no buffer\n        Received 2 broadcasts, 0 runts, 0 giants\n        0 input errors, 0 CRC, 0 frame, 0 overrun, 0 ignored, 0 abort\n        0 pause/resume input\n        0 L2 decode drops\n        0 switch ingress policy drops\n        758965289 packets output, 834717617298 bytes, 0 underruns\n        0 pause/resume output\n        0 output errors, 0 collisions, 0 interface resets\n        0 late collisions, 0 deferred\n        0 rate limit drops\n        0 switch egress policy drops\n        0 input reset drops, 0 output reset drops\n  Control Point Interface States:\n        Interface number is 9\n        Interface config status is active\n        Interface state is active\nInterface GigabitEthernet0/2 \"\", is administratively down, line protocol is down\n  Hardware is bcm56800 rev 01, BW 1000 Mbps, DLY 10 usec\n        Auto-Duplex, Auto-Speed\n        Input flow control is unsupported, output flow control is off\n        Available for allocation to a context\n        MAC address f0f7.5543.a524, MTU not set\n        IP address unassigned\n        0 packets input, 0 bytes, 0 no buffer\n        Received 0 broadcasts, 0 runts, 0 giants\n        0 input errors, 0 CRC, 0 frame, 0 overrun, 0 ignored, 0 abort\n        0 pause/resume input\n        0 L2 decode drops\n        0 switch ingress policy drops\n        0 packets output, 0 bytes, 0 underruns\n        0 pause/resume output\n        0 output errors, 0 collisions, 0 interface resets\n        0 late collisions, 0 deferred\n        0 rate limit drops\n        0 switch egress policy drops\n        0 input reset drops, 0 output reset drops\n  Control Point Interface States:\n        Interface number is 10\n        Interface config status is not active\n        Interface state is not active\nInterface GigabitEthernet0/3 \"\", is administratively down, line protocol is down\n  Hardware is bcm56800 rev 01, BW 1000 Mbps, DLY 10 usec\n        Auto-Duplex, Auto-Speed\n        Input flow control is unsupported, output flow control is off\n        Available for allocation to a context\n        MAC address f0f7.5543.a525, MTU not set\n        IP address unassigned\n        0 packets input, 0 bytes, 0 no buffer\n        Received 0 broadcasts, 0 runts, 0 giants\n        0 input errors, 0 CRC, 0 frame, 0 overrun, 0 ignored, 0 abort\n        0 pause/resume input\n        0 L2 decode drops\n        0 switch ingress policy drops\n        0 packets output, 0 bytes, 0 underruns\n        0 pause/resume output\n        0 output errors, 0 collisions, 0 interface resets\n        0 late collisions, 0 deferred\n        0 rate limit drops\n        0 switch egress policy drops\n        0 input reset drops, 0 output reset drops\n  Control Point Interface States:\n        Interface number is 11\n        Interface config status is not active\n        Interface state is not active\nInterface GigabitEthernet0/4 \"\", is administratively down, line protocol is down\n  Hardware is bcm56800 rev 01, BW 1000 Mbps, DLY 10 usec\n        Auto-Duplex, Auto-Speed\n        Input flow control is unsupported, output flow control is off\n        Available for allocation to a context\n        MAC address f0f7.5543.a526, MTU not set\n        IP address unassigned\n        0 packets input, 0 bytes, 0 no buffer\n        Received 0 broadcasts, 0 runts, 0 giants\n        0 input errors, 0 CRC, 0 frame, 0 overrun, 0 ignored, 0 abort\n        0 pause/resume input\n        0 L2 decode drops\n        0 switch ingress policy drops\n        0 packets output, 0 bytes, 0 underruns\n        0 pause/resume output\n        0 output errors, 0 collisions, 0 interface resets\n        0 late collisions, 0 deferred\n        0 rate limit drops\n        0 switch egress policy drops\n        0 input reset drops, 0 output reset drops\n  Control Point Interface States:\n        Interface number is 12\n        Interface config status is not active\n        Interface state is not active\nInterface GigabitEthernet0/5 \"\", is administratively down, line protocol is down\n  Hardware is bcm56800 rev 01, BW 1000 Mbps, DLY 10 usec\n        Auto-Duplex, Auto-Speed\n        Input flow control is unsupported, output flow control is off\n        Available for allocation to a context\n        MAC address f0f7.5543.a527, MTU not set\n        IP address unassigned\n        0 packets input, 0 bytes, 0 no buffer\n        Received 0 broadcasts, 0 runts, 0 giants\n        0 input errors, 0 CRC, 0 frame, 0 overrun, 0 ignored, 0 abort\n        0 pause/resume input\n        0 L2 decode drops\n        0 switch ingress policy drops\n        0 packets output, 0 bytes, 0 underruns\n        0 pause/resume output\n        0 output errors, 0 collisions, 0 interface resets\n        0 late collisions, 0 deferred\n        0 rate limit drops\n        0 switch egress policy drops\n        0 input reset drops, 0 output reset drops\n  Control Point Interface States:\n        Interface number is 13\n        Interface config status is not active\n        Interface state is not active\nInterface Internal-Data0/0 \"\", is up, line protocol is up\n  Hardware is i82599_xaui rev02, BW 10000 Mbps, DLY 10 usec\n        (Full-duplex), (10000 Mbps)\n        Input flow control is on, output flow control is off\n        MAC address 0000.0001.0001, MTU not set\n        IP address unassigned\n        40694905620 packets input, 27999317462474 bytes, 0 no buffer\n        Received 193961 broadcasts, 0 runts, 0 giants\n        50017 input errors, 0 CRC, 0 frame, 50017 overrun, 0 ignored, 0 abort\n        0 pause input, 0 resume input\n        0 L2 decode drops, 0 demux drops\n        22840594539 packets output, 19710792216623 bytes, 0 underruns\n        0 pause output, 0 resume output\n        0 output errors, 0 collisions, 1 interface resets\n        0 late collisions, 0 deferred\n        0 output decode drops\n        0 input reset drops, 0 output reset drops\n        Queue Stats:\n          RX[00]: 11928867434 packets, 8613178051164 bytes, 33671 overrun\n                  Blocks free curr/low: 511/311\n          RX[01]: 9936555115 packets, 6924744308770 bytes, 3892 overrun\n                  Blocks free curr/low: 511/311\n          RX[02]: 8885121010 packets, 5930247361074 bytes, 5983 overrun\n                  Blocks free curr/low: 511/339\n          RX[03]: 9774040102 packets, 6508202351390 bytes, 6471 overrun\n                  Blocks free curr/low: 511/369\n          RX[04]: 170322028 packets, 22945468790 bytes, 0 overrun\n                  Blocks free curr/low: 511/507\n          TX[00]: 7034786488 packets, 6276748798963 bytes, 0 underruns\n                  Blocks free curr/low: 511/349\n          TX[01]: 5193693399 packets, 4562626128086 bytes, 0 underruns\n                  Blocks free curr/low: 511/350\n          TX[02]: 4620598548 packets, 3813812735685 bytes, 0 underruns\n                  Blocks free curr/low: 511/350\n          TX[03]: 5068271291 packets, 4195831926616 bytes, 0 underruns\n                  Blocks free curr/low: 511/350\n          TX[04]: 164279550 packets, 24019250372 bytes, 0 underruns\n                  Blocks free curr/low: 511/507\n                  Used by GigabitEthernet0/0\n          TX[05]: 758965324 packets, 837753453654 bytes, 0 underruns\n                  Blocks free curr/low: 511/486\n                  Used by GigabitEthernet0/1\n  Topology Information:\n        This interface, a SSP Embedded NIC Port, is connected\n        with Internal-Data0/4, a SSP Switch Uplink Port.\n  Control Point Interface States:\n        Interface number is 2\n        Interface config status is active\n        Interface state is active\nInterface Internal-Data0/1 \"\", is up, line protocol is up\n  Hardware is i82599_xaui rev02, BW 10000 Mbps, DLY 10 usec\n        (Full-duplex), (10000 Mbps)\n        Input flow control is on, output flow control is off\n        MAC address 0000.0001.0002, MTU not set\n        IP address unassigned\n        53468958544 packets input, 34934209914110 bytes, 0 no buffer\n        Received 237991 broadcasts, 0 runts, 0 giants\n        5073 input errors, 0 CRC, 0 frame, 5073 overrun, 0 ignored, 0 abort\n        0 pause input, 0 resume input\n        0 L2 decode drops, 0 demux drops\n        29187689876 packets output, 20171793812896 bytes, 0 underruns\n        0 pause output, 0 resume output\n        0 output errors, 0 collisions, 1 interface resets\n        0 late collisions, 0 deferred\n        0 output decode drops\n        0 input reset drops, 0 output reset drops\n        Queue Stats:\n          RX[00]: 15538406285 packets, 12717109454320 bytes, 1026 overrun\n                  Blocks free curr/low: 511/358\n          RX[01]: 9970135924 packets, 6735149484197 bytes, 2704 overrun\n                  Blocks free curr/low: 511/394\n          RX[02]: 17849754640 packets, 8351432550533 bytes, 801 overrun\n                  Blocks free curr/low: 511/359\n          RX[03]: 10110661702 packets, 7130518429589 bytes, 542 overrun\n                  Blocks free curr/low: 511/389\n          TX[00]: 5792237421 packets, 4975556841210 bytes, 0 underruns\n                  Blocks free curr/low: 511/349\n          TX[01]: 4768859986 packets, 4268946532826 bytes, 0 underruns\n                  Blocks free curr/low: 511/351\n          TX[02]: 12970769201 packets, 6045848459484 bytes, 0 underruns\n                  Blocks free curr/low: 511/345\n          TX[03]: 5655823274 packets, 4881441983697 bytes, 0 underruns\n                  Blocks free curr/low: 511/342\n          TX[04]: 0 packets, 0 bytes, 0 underruns\n                  Blocks free curr/low: 511/511\n                  Used by GigabitEthernet0/2\n          TX[05]: 0 packets, 0 bytes, 0 underruns\n                  Blocks free curr/low: 511/511\n                  Used by GigabitEthernet0/3\n          TX[06]: 0 packets, 0 bytes, 0 underruns\n                  Blocks free curr/low: 511/511\n                  Used by GigabitEthernet0/4\n  Topology Information:\n        This interface, a SSP Embedded NIC Port, is connected\n        with Internal-Data0/5, a SSP Switch Uplink Port.\n  Control Point Interface States:\n        Interface number is 3\n        Interface config status is active\n        Interface state is active\nInterface Internal-Data0/2 \"\", is up, line protocol is up\n  Hardware is i82599_xaui rev02, BW 10000 Mbps, DLY 10 usec\n        (Full-duplex), (10000 Mbps)\n        Input flow control is on, output flow control is off\n        MAC address 0000.0001.0004, MTU not set\n        IP address unassigned\n        58606970185 packets input, 39482314595060 bytes, 0 no buffer\n        Received 98334 broadcasts, 0 runts, 0 giants\n        10907 input errors, 0 CRC, 0 frame, 10907 overrun, 0 ignored, 0 abort\n        523 pause input, 523 resume input\n        0 L2 decode drops, 0 demux drops\n        472460832718 packets output, 173237932025004 bytes, 2905646 underruns\n        0 pause output, 0 resume output\n        0 output errors, 0 collisions, 1 interface resets\n        0 late collisions, 0 deferred\n        0 output decode drops\n        0 input reset drops, 0 output reset drops\n        Queue Stats:\n          RX[00]: 13231072890 packets, 8861585758086 bytes, 5515 overrun\n                  Blocks free curr/low: 511/384\n          RX[01]: 20193376457 packets, 14845677833920 bytes, 3134 overrun\n                  Blocks free curr/low: 511/396\n          RX[02]: 12027933127 packets, 7489829408483 bytes, 858 overrun\n                  Blocks free curr/low: 511/384\n          RX[03]: 13154587757 packets, 8285221609828 bytes, 1400 overrun\n                  Blocks free curr/low: 511/394\n          TX[00]: 7589052992 packets, 6472090504001 bytes, 0 underruns\n                  Blocks free curr/low: 511/349\n          TX[01]: 15755071022 packets, 12645630943922 bytes, 0 underruns\n                  Blocks free curr/low: 510/349\n          TX[02]: 6680981379 packets, 5085252075635 bytes, 0 underruns\n                  Blocks free curr/low: 511/342\n          TX[03]: 6484398780 packets, 4988646702498 bytes, 0 underruns\n                  Blocks free curr/low: 505/311\n          TX[04]: 0 packets, 0 bytes, 0 underruns\n                  Blocks free curr/low: 511/511\n                  Used by TenGigabitEthernet0/6\n          TX[05]: 415140458466 packets, 127322520663605 bytes, 2905646 underruns\n                  Blocks free curr/low: 508/0\n                  Used by TenGigabitEthernet0/9\n          TX[06]: 20810870169 packets, 16723791170491 bytes, 0 underruns\n                  Blocks free curr/low: 511/170\n                  Used by TenGigabitEthernet0/8\n  Topology Information:\n        This interface, a SSP Embedded NIC Port, is connected\n        with Internal-Data0/6, a SSP Switch Uplink Port.\n  Control Point Interface States:\n        Interface number is 4\n        Interface config status is active\n        Interface state is active\nInterface Internal-Data0/3 \"\", is up, line protocol is up\n  Hardware is i82599_xaui rev02, BW 10000 Mbps, DLY 10 usec\n        (Full-duplex), (10000 Mbps)\n        Input flow control is on, output flow control is off\n        MAC address 0000.0001.0003, MTU not set\n        IP address unassigned\n        851725855606 packets input, 549651226348272 bytes, 0 no buffer\n        Received 53915 broadcasts, 0 runts, 0 giants\n        457910371 input errors, 0 CRC, 0 frame, 457910371 overrun, 0 ignored, 0 abort\n        0 pause input, 0 resume input\n        0 L2 decode drops, 0 demux drops\n        479068686555 packets output, 439462480886576 bytes, 0 underruns\n        0 pause output, 0 resume output\n        0 output errors, 0 collisions, 1 interface resets\n        0 late collisions, 0 deferred\n        0 output decode drops\n        0 input reset drops, 0 output reset drops\n        Queue Stats:\n          RX[00]: 9317849354 packets, 6455848237095 bytes, 11242 overrun\n                  Blocks free curr/low: 511/377\n          RX[01]: 12456612163 packets, 7108517208857 bytes, 8535 overrun\n                  Blocks free curr/low: 511/340\n          RX[02]: 818537242486 packets, 528392087186847 bytes, 457881225 overrun\n                  Blocks free curr/low: 511/152\n          RX[03]: 11414151630 packets, 7694773726910 bytes, 9369 overrun\n                  Blocks free curr/low: 511/362\n          TX[00]: 4776785546 packets, 4204729002116 bytes, 0 underruns\n                  Blocks free curr/low: 511/349\n          TX[01]: 6150915656 packets, 4487948642586 bytes, 0 underruns\n                  Blocks free curr/low: 511/349\n          TX[02]: 460988499302 packets, 425299352333798 bytes, 0 underruns\n                  Blocks free curr/low: 511/282\n          TX[03]: 7152486058 packets, 5470450911421 bytes, 0 underruns\n                  Blocks free curr/low: 511/313\n          TX[04]: 0 packets, 0 bytes, 0 underruns\n                  Blocks free curr/low: 511/511\n                  Used by GigabitEthernet0/5\n          TX[05]: 0 packets, 0 bytes, 0 underruns\n                  Blocks free curr/low: 511/511\n                  Used by TenGigabitEthernet0/7\n  Topology Information:\n        This interface, a SSP Embedded NIC Port, is connected\n        with Internal-Data0/7, a SSP Switch Uplink Port.\n  Control Point Interface States:\n        Interface number is 5\n        Interface config status is active\n        Interface state is active\nInterface Internal-Data0/4 \"\", is up, line protocol is up\n  Hardware is bcm56800 rev 01, BW 10000 Mbps, DLY 10 usec\n        (Full-duplex), (10000 Mbps)\n        Input flow control is on, output flow control is on\n        MAC address 0000.0100.001d, MTU not set\n        IP address unassigned\n        22840589872 packets input, 19710795908904 bytes, 0 no buffer\n        Received 5014 broadcasts, 0 runts, 0 giants\n        0 input errors, 0 CRC, 0 frame, 0 overrun, 0 ignored, 0 abort\n        0 pause/resume input\n        0 switch ingress policy drops\n        40694946838 packets output, 27999352911090 bytes, 0 underruns\n        0 pause/resume output\n        0 output errors, 0 collisions, 0 interface resets\n        0 late collisions, 0 deferred\n        0 switch egress policy drops\n        0 input reset drops, 0 output reset drops\n  Topology Information:\n        This interface, a SSP Switch Uplink Port, is connected\n        with Internal-Data0/0, a SSP Embedded NIC Port.\n  Control Point Interface States:\n        Interface number is 18\n        Interface config status is active\n        Interface state is active\nInterface Internal-Data0/5 \"\", is up, line protocol is up\n  Hardware is bcm56800 rev 01, BW 10000 Mbps, DLY 10 usec\n        (Full-duplex), (10000 Mbps)\n        Input flow control is on, output flow control is on\n        MAC address 0000.0100.001e, MTU not set\n        IP address unassigned\n        29187686478 packets input, 20171797966300 bytes, 0 no buffer\n        Received 4 broadcasts, 0 runts, 0 giants\n        0 input errors, 0 CRC, 0 frame, 0 overrun, 0 ignored, 0 abort\n        0 pause/resume input\n        0 switch ingress policy drops\n        53468957755 packets output, 34934208273981 bytes, 0 underruns\n        0 pause/resume output\n        0 output errors, 0 collisions, 0 interface resets\n        0 late collisions, 0 deferred\n        0 switch egress policy drops\n        0 input reset drops, 0 output reset drops\n  Topology Information:\n        This interface, a SSP Switch Uplink Port, is connected\n        with Internal-Data0/1, a SSP Embedded NIC Port.\n  Control Point Interface States:\n        Interface number is 19\n        Interface config status is active\n        Interface state is active\nInterface Internal-Data0/6 \"\", is up, line protocol is up\n  Hardware is bcm56800 rev 01, BW 10000 Mbps, DLY 10 usec\n        (Full-duplex), (10000 Mbps)\n        Input flow control is on, output flow control is on\n        MAC address 0000.0100.001f, MTU not set\n        IP address unassigned\n        472460814095 packets input, 173237935490747 bytes, 0 no buffer\n        Received 22 broadcasts, 0 runts, 0 giants\n        0 input errors, 0 CRC, 0 frame, 0 overrun, 0 ignored, 0 abort\n        0 pause/resume input\n        0 switch ingress policy drops\n        58606973721 packets output, 39482316159290 bytes, 0 underruns\n        1046 pause/resume output\n        0 output errors, 0 collisions, 0 interface resets\n        0 late collisions, 0 deferred\n        0 switch egress policy drops\n        0 input reset drops, 0 output reset drops\n  Topology Information:\n        This interface, a SSP Switch Uplink Port, is connected\n        with Internal-Data0/2, a SSP Embedded NIC Port.\n  Control Point Interface States:\n        Interface number is 20\n        Interface config status is active\n        Interface state is active\nInterface Internal-Data0/7 \"\", is up, line protocol is up\n  Hardware is bcm56800 rev 01, BW 10000 Mbps, DLY 10 usec\n        (Full-duplex), (10000 Mbps)\n        Input flow control is on, output flow control is on\n        MAC address 0000.0100.0020, MTU not set\n        IP address unassigned\n        479068680668 packets input, 439462480942505 bytes, 0 no buffer\n        Received 5 broadcasts, 0 runts, 0 giants\n        0 input errors, 0 CRC, 0 frame, 0 overrun, 0 ignored, 0 abort\n        0 pause/resume input\n        0 switch ingress policy drops\n        852183755510 packets output, 549964199797166 bytes, 0 underruns\n        0 pause/resume output\n        0 output errors, 0 collisions, 0 interface resets\n        0 late collisions, 0 deferred\n        0 switch egress policy drops\n        0 input reset drops, 0 output reset drops\n  Topology Information:\n        This interface, a SSP Switch Uplink Port, is connected\n        with Internal-Data0/3, a SSP Embedded NIC Port.\n  Control Point Interface States:\n        Interface number is 21\n        Interface config status is active\n        Interface state is active\nInterface Management0/0 \"\", is up, line protocol is up\n  Hardware is i82574L rev00, BW 1000 Mbps, DLY 10 usec\n        Auto-Duplex(Full-duplex), Auto-Speed(1000 Mbps)\n        Input flow control is unsupported, output flow control is off\n        Available for allocation to a context\n        MAC address f0f7.5543.a520, MTU not set\n        IP address unassigned\n        187312178 packets input, 18346216501 bytes, 0 no buffer\n        Received 33364282 broadcasts, 0 runts, 0 giants\n        0 input errors, 0 CRC, 0 frame, 0 overrun, 0 ignored, 0 abort\n        0 pause input, 0 resume input\n        0 L2 decode drops\n        365077501 packets output, 69865717975 bytes, 0 underruns\n        0 pause output, 0 resume output\n        0 output errors, 0 collisions, 2 interface resets\n        0 late collisions, 0 deferred\n        3 input reset drops, 0 output reset drops\n        input queue (blocks free curr/low): hardware (240/189)\n        output queue (blocks free curr/low): hardware (255/220)\n  Control Point Interface States:\n        Interface number is 6\n        Interface config status is active\n        Interface state is active\nInterface Management0/1 \"\", is administratively down, line protocol is down\n  Hardware is i82574L rev00, BW 1000 Mbps, DLY 10 usec\n        Auto-Duplex, Auto-Speed\n        Input flow control is unsupported, output flow control is off\n        Available for allocation to a context\n        MAC address f0f7.5543.a521, MTU not set\n        IP address unassigned\n        0 packets input, 0 bytes, 0 no buffer\n        Received 0 broadcasts, 0 runts, 0 giants\n        0 input errors, 0 CRC, 0 frame, 0 overrun, 0 ignored, 0 abort\n        0 pause input, 0 resume input\n        0 L2 decode drops\n        0 packets output, 0 bytes, 0 underruns\n        0 pause output, 0 resume output\n        0 output errors, 0 collisions, 2 interface resets\n        0 late collisions, 0 deferred\n        0 input reset drops, 0 output reset drops\n        input queue (blocks free curr/low): hardware (255/255)\n        output queue (blocks free curr/low): hardware (255/255)\n  Control Point Interface States:\n        Interface number is 7\n        Interface config status is not active\n        Interface state is not active\nInterface TenGigabitEthernet0/6 \"\", is up, line protocol is up\n  Hardware is bcm56800 rev 01, BW 10000 Mbps, DLY 10 usec\n        (Full-duplex), (10000 Mbps)\n        Input flow control is unsupported, output flow control is off\n        Active member of Port-channel1\n        MAC address f0f7.5543.a528, MTU not set\n        IP address unassigned\n        399819592361 packets input, 124398034640232 bytes, 0 no buffer\n        Received 16 broadcasts, 0 runts, 0 giants\n        0 input errors, 0 CRC, 0 frame, 0 overrun, 0 ignored, 0 abort\n        0 pause/resume input\n        0 L2 decode drops\n        0 switch ingress policy drops\n        540331320890 packets output, 491562768018165 bytes, 0 underruns\n        0 pause/resume output\n        0 output errors, 0 collisions, 0 interface resets\n        0 late collisions, 0 deferred\n        0 rate limit drops\n        0 switch egress policy drops\n        0 input reset drops, 0 output reset drops\n  Control Point Interface States:\n        Interface number is 14\n        Interface config status is active\n        Interface state is active\nInterface TenGigabitEthernet0/7 \"\", is up, line protocol is up\n  Hardware is bcm56800 rev 01, BW 10000 Mbps, DLY 10 usec\n        (Full-duplex), (10000 Mbps)\n        Input flow control is unsupported, output flow control is off\n        Active member of Port-channel1\n        MAC address f0f7.5543.a529, MTU not set\n        IP address unassigned\n        37959565021 packets input, 18199845951648 bytes, 0 no buffer\n        Received 2097 broadcasts, 0 runts, 0 giants\n        0 input errors, 0 CRC, 0 frame, 0 overrun, 0 ignored, 0 abort\n        0 pause/resume input\n        0 L2 decode drops\n        0 switch ingress policy drops\n        26351891151 packets output, 13846109908639 bytes, 0 underruns\n        0 pause/resume output\n        0 output errors, 0 collisions, 0 interface resets\n        0 late collisions, 0 deferred\n        0 rate limit drops\n        0 switch egress policy drops\n        0 input reset drops, 0 output reset drops\n  Control Point Interface States:\n        Interface number is 15\n        Interface config status is active\n        Interface state is active\nInterface TenGigabitEthernet0/8 \"\", is up, line protocol is up\n  Hardware is bcm56800 rev 01, BW 1000 Mbps, DLY 1000 usec\n        (Full-duplex), Auto-Speed(1000 Mbps)\n        Input flow control is unsupported, output flow control is off\n        Active member of Port-channel2\n        MAC address f0f7.5543.a52a, MTU not set\n        IP address unassigned\n        43937607828 packets input, 34610285463141 bytes, 0 no buffer\n        Received 245856 broadcasts, 0 runts, 0 giants\n        0 input errors, 0 CRC, 0 frame, 0 overrun, 0 ignored, 0 abort\n        0 pause/resume input\n        0 L2 decode drops\n        0 switch ingress policy drops\n        20810869221 packets output, 16640841970890 bytes, 0 underruns\n        0 pause/resume output\n        0 output errors, 0 collisions, 0 interface resets\n        0 late collisions, 0 deferred\n        0 rate limit drops\n        0 switch egress policy drops\n        0 input reset drops, 0 output reset drops\n  Control Point Interface States:\n        Interface number is 16\n        Interface config status is active\n        Interface state is active\nInterface TenGigabitEthernet0/9 \"\", is up, line protocol is up\n  Hardware is bcm56800 rev 01, BW 1000 Mbps, DLY 1000 usec\n        (Full-duplex), Auto-Speed(1000 Mbps)\n        Input flow control is unsupported, output flow control is off\n        Active member of Port-channel2\n        MAC address f0f7.5543.a52b, MTU not set\n        IP address unassigned\n        523013521132 packets input, 471124372993133 bytes, 0 no buffer\n        Received 336212 broadcasts, 0 runts, 0 giants\n        0 input errors, 0 CRC, 0 frame, 0 overrun, 0 ignored, 0 abort\n        0 pause/resume input\n        0 L2 decode drops\n        0 switch ingress policy drops\n        415140444956 packets output, 125662363017538 bytes, 0 underruns\n        0 pause/resume output\n        0 output errors, 0 collisions, 0 interface resets\n        0 late collisions, 0 deferred\n        0 rate limit drops\n        0 switch egress policy drops\n        0 input reset drops, 0 output reset drops\n  Control Point Interface States:\n        Interface number is 17\n        Interface config status is active\n        Interface state is active\nInterface Port-channel1 \"\", is up, line protocol is up\n  Hardware is EtherChannel/LACP, BW 20000 Mbps, DLY 10 usec\n        (Full-duplex), (10000 Mbps)\n        Input flow control is unsupported, output flow control is off\n        Description: ext\n        Available for allocation to a context\n        MAC address f0f7.5543.a528, MTU not set\n        IP address unassigned\n  Control Point Interface States:\n        Interface number is 23\n        Interface config status is active\n        Interface state is active\n  Members in this channel:\n      Active:   Te0/6 Te0/7\nInterface Port-channel1.355 \"\", is up, line protocol is up\n  Hardware is EtherChannel/LACP, BW 20000 Mbps, DLY 10 usec\n        VLAN identifier 355\n        Description: data-inside\n        Available for allocation to a context\nInterface Port-channel2 \"\", is up, line protocol is up\n  Hardware is EtherChannel/LACP, BW 2000 Mbps, DLY 1000 usec\n        (Full-duplex), Auto-Speed(1000 Mbps)\n        Input flow control is unsupported, output flow control is off\n        Description: techlan\n        Available for allocation to a context\n        MAC address f0f7.5543.a52a, MTU not set\n        IP address unassigned\n  Control Point Interface States:\n        Interface number is 24\n        Interface config status is active\n        Interface state is active\n  Members in this channel:\n      Active:   Te0/8 Te0/9\nInterface Port-channel2.283 \"\", is up, line protocol is up\n  Hardware is EtherChannel/LACP, BW 2000 Mbps, DLY 1000 usec\n        VLAN identifier 283\n        Description: data-outside\n        Available for allocation to a context",
  "textfsm_template": "Value Required INTERFACE (\\S+)\nValue INTERFACE_NAME (.*)\nValue LINK_STATUS (.*)\nValue PROTOCOL_STATUS (.*)\nValue HARDWARE_TYPE ([\\w ]+)\nValue BANDWIDTH (\\d+\\s+\\w+)\nValue DELAY (\\d+\\s+\\w+)\nValue DUPLEX ([Ff][Uu][Ll]{2}|[Hh][Aa][Ll][Ff]|[Aa][Uu][Tt][Oo])\nValue SPEED (\\d+\\s*\\S+|[Aa][Uu][Tt][Oo])\nValue FLOWCONTROL_IN (\\w+)\nValue FLOWCONTROL_OUT (\\w+)\nValue BONDED_PORT (.+?)\nValue DESCRIPTION (.*)\nValue MAC_ADDRESS ([a-zA-Z0-9]+\\.[a-zA-Z0-9]+\\.[a-zA-Z0-9]+)\nValue MTU (.+)\nValue IP_ADDRESS (.+?)\nValue NETMASK (.+?)\nValue IN_PACKETS (\\d+)\nValue IN_BYTES (\\d+)\nValue NO_BUFFER (\\d+)\nValue BROADCASTS (\\d+)\nValue RUNTS (\\d+)\nValue GIANTS (\\d+)\nValue IN_ERRORS (\\d+)\nValue CRC (\\d+)\nValue FRAME (\\d+)\nValue OVERRUN (\\d+)\nValue IGNORED (\\d+)\nValue ABORT (\\d+)\nValue IN_PAUSE_RESUME (\\d+)\nValue IN_PAUSE (\\d+)\nValue IN_RESUME (\\d+)\nValue L2_DECODE_DROPS (\\d+)\nValue SWITCH_INGRESS_POLICY_DROPS (\\d+)\nValue OUT_PACKETS (\\d+)\nValue OUT_BYTES (\\d+)\nValue UNDERRUNS (\\d+)\nValue OUT_PAUSE_RESUME (\\d+)\nValue OUT_PAUSE (\\d+)\nValue OUT_RESUME (\\d+)\nValue OUT_ERRORS (\\d+)\nValue COLLISIONS (\\d+)\nValue INTERFACE_RESETS (\\d+)\nValue LATE_COLLISIONS (\\d+)\nValue DEFERRED (\\d+)\nValue OUT_DECODE_DROPS (\\d+)\nValue RATE_LIMIT_DROPS (\\d+)\nValue SWITCH_EGRESS_POLICY_DROPS (\\d+)\nValue IN_RESET_DROPS (\\d+)\nValue OUT_RESET_DROPS (\\d+)\nValue VLAN_ID (\\d+)\n#\n# Control Point Interface States\n#\nValue CONTROL_INTERFACE_NUMBER (\\d+)\nValue CONTROL_INTERFACE_CONFIG_STATUS (.+)\nValue CONTROL_INTERFACE_STATE (.+)\n#\n# Queue Stats\n#\n# RXRING\nValue List RXRING_NUMBER (\\d+)\nValue List RXRING_PACKETS (\\d+)\nValue List RXRING_BYTES (\\d+)\nValue List RXRING_OVERRUN (\\d+)\nValue List RXRING_BLOCKS_FREE_CURR (\\d+)\nValue List RXRING_BLOCKS_FREE_LOW (\\d+)\nValue List RXRING_INTERFACE (.+?)\n#\n# TXRING\nValue List TXRING_NUMBER (\\d+)\nValue List TXRING_PACKETS (\\d+)\nValue List TXRING_BYTES (\\d+)\nValue List TXRING_UNDERRUN (\\d+)\nValue List TXRING_BLOCKS_FREE_CURR (\\d+)\nValue List TXRING_BLOCKS_FREE_LOW (\\d+)\nValue List TXRING_INTERFACE (.+?)\n\n\nStart\n  ^Interface -> Continue.Record\n  ^Interface\\s+${INTERFACE}\\s+\"${INTERFACE_NAME}\",\\s+is\\s+${LINK_STATUS},\\s+line\\s+protocol\\s+is\\s+${PROTOCOL_STATUS}\n  ^\\s+Hardware\\s+is\\s+${HARDWARE_TYPE}.*BW\\s+${BANDWIDTH}.*DLY\\s+${DELAY}\n  ^\\s+Hardware\\s+is\\s+${HARDWARE_TYPE}.*MAC\\s+address\\s+${MAC_ADDRESS},\\s+MTU\\s+${MTU}\n  ^\\s+\\S*${DUPLEX}\\S*,\\s+\\S*?${SPEED}(?:\\)|\\S+)\\s*$$\n  ^\\s+Input\\s+flow\\s+control\\s+is\\s+${FLOWCONTROL_IN},\\s+output\\s+flow\\s+control\\s+is\\s+${FLOWCONTROL_OUT}\n  ^\\s+Active\\s+member\\s+of\\s+${BONDED_PORT}\\s*$$\n  ^\\s+Description:\\s+${DESCRIPTION}\n  ^\\s+MAC\\s+address\\s+${MAC_ADDRESS}.*MTU\\s+${MTU}\\s*$$\n  ^\\s+IP\\s+[Aa]ddress\\s+${IP_ADDRESS}(?:,\\s+[Ss]ubnet\\s+[Mm]ask\\s+${NETMASK})?\\s*$$\n  ^\\s+${IN_PACKETS}\\s+packets\\s+input,\\s+${IN_BYTES}\\s+bytes,\\s+${NO_BUFFER}\\s+no\\s+buffer\n  ^\\s+${IN_PACKETS}\\s+packets\\s+input,\\s+${IN_BYTES}\\s+bytes\n  ^\\s+Received\\s+${BROADCASTS}\\s+broadcasts,\\s+${RUNTS}\\s+runts,\\s+${GIANTS}\\s+giants\n  ^\\s+${IN_ERRORS}\\s+input\\s+errors,\\s+${CRC}\\s+CRC,\\s+${FRAME}\\s+frame,\\s+${OVERRUN}\\s+overrun,\\s+${IGNORED}\\s+ignored,\\s+${ABORT}\\s+abort\n  ^\\s+${IN_PAUSE_RESUME}\\s+pause/resume\\s+input\n  ^\\s+${IN_PAUSE}\\s+pause\\s+input,\\s+${IN_RESUME}\\s+resume\\s+input\n  ^\\s+${L2_DECODE_DROPS}\\s+L2\\s+decode\\s+drops\n  ^\\s+${SWITCH_INGRESS_POLICY_DROPS}\\s+switch\\s+ingress\\s+policy\\s+drops\n  ^\\s+${OUT_PACKETS}\\s+packets\\s+output,\\s+${OUT_BYTES}\\s+bytes,\\s+${UNDERRUNS}\\s+underruns\n  ^\\s+${OUT_PACKETS}\\s+packets\\s+output,\\s+${OUT_BYTES}\\s+bytes\n  ^\\s+${OUT_PAUSE_RESUME}\\s+pause/resume\\s+output\n  ^\\s+${OUT_PAUSE}\\s+pause\\s+output,\\s+${OUT_RESUME}\\s+resume\\s+output\n  ^\\s+${OUT_ERRORS}\\s+output\\s+errors,\\s+${COLLISIONS}\\s+collisions,\\s+${INTERFACE_RESETS}\\s+interface\\s+resets\n  ^\\s+${LATE_COLLISIONS}\\s+late\\s+collisions,\\s+${DEFERRED}\\s+deferred\n  ^\\s+${OUT_DECODE_DROPS}\\s+output\\s+decode\\s+drops\n  ^\\s+${RATE_LIMIT_DROPS}\\s+rate\\s+limit\\s+drops\n  ^\\s+${SWITCH_EGRESS_POLICY_DROPS}\\s+switch\\s+egress\\s+policy\\s+drops\n  ^\\s+${IN_RESET_DROPS}\\s+input\\s+reset\\s+drops,\\s+${OUT_RESET_DROPS}\\s+output\\s+reset\\s+drops\n  ^\\s+input\\s+queue\n  ^\\s+output\\s+queue\n  ^\\s+Queue\\s+Stats:\n  ^\\s+Traffic\\s+Statistics\n  ^\\s+\\d+\\s+packets\\s+dropped\n  ^\\s+\\d+\\s+minute\\s+\\w+\\s+rate\n  ^\\s+VLAN\\s+identifier\\s+${VLAN_ID}\n  ^\\s+Control\\s+Point\\s+Interface\\s+States -> ControlPoint\n  ^\\s+RX\\[${RXRING_NUMBER}\\]:\\s+${RXRING_PACKETS}\\s+packets,\\s+${RXRING_BYTES}\\s+bytes,\\s+${RXRING_OVERRUN}\\s+overrun -> RXRingBlocks\n  ^\\s+TX\\[${TXRING_NUMBER}\\]:\\s+${TXRING_PACKETS}\\s+packets,\\s+${TXRING_BYTES}\\s+bytes,\\s+${TXRING_UNDERRUN}\\s+underruns -> TXRingBlocks\n  ^\\s+Available\\s+for\\s+allocation\\s+to\\s+a\\s+context\n  ^Interface -> Continue.Record\n  ^Interface\\s+${INTERFACE}\\s+\"${INTERFACE_NAME}\",\\s+is\\s+${LINK_STATUS},\\s+line\\s+protocol\\s+is\\s+${PROTOCOL_STATUS}\n  ^\\s+Topology\\s+Information: -> Topology\n  ^\\s*$$\n  ^. -> Error\n\nControlPoint\n  ^\\s+Interface\\s+number\\s+is\\s+${CONTROL_INTERFACE_NUMBER}\n  ^\\s+Interface\\s+config\\s+status\\s+is\\s+${CONTROL_INTERFACE_CONFIG_STATUS}\n  ^\\s+Interface\\s+state\\s+is\\s+${CONTROL_INTERFACE_STATE}\n  ^Interface -> Continue.Record\n  ^Interface\\s+${INTERFACE}\\s+\"${INTERFACE_NAME}\",\\s+is\\s+${LINK_STATUS},\\s+line\\s+protocol\\s+is\\s+${PROTOCOL_STATUS} -> Start\n  ^\\s+Queue\\s+Stats:\n  ^\\s+RX\\[${RXRING_NUMBER}\\]:\\s+${RXRING_PACKETS}\\s+packets,\\s+${RXRING_BYTES}\\s+bytes,\\s+${RXRING_OVERRUN}\\s+overrun -> RXRingBlocks\n  ^\\s+TX\\[${TXRING_NUMBER}\\]:\\s+${TXRING_PACKETS}\\s+packets,\\s+${TXRING_BYTES}\\s+bytes,\\s+${TXRING_UNDERRUN}\\s+underruns -> TXRingBlocks\n\nRXRingBlocks\n  ^\\s+RX\\[${RXRING_NUMBER}\\]:\\s+${RXRING_PACKETS}\\s+packets,\\s+${RXRING_BYTES}\\s+bytes,\\s+${RXRING_OVERRUN}\\s+overrun\n  ^\\s+Blocks\\s+free\\s+curr/low:\\s+${RXRING_BLOCKS_FREE_CURR}/${RXRING_BLOCKS_FREE_LOW}\n  ^\\s+Used\\s+by\\s+${RXRING_INTERFACE}\\s*$$\n  ^\\s+TX\\[${TXRING_NUMBER}\\]:\\s+${TXRING_PACKETS}\\s+packets,\\s+${TXRING_BYTES}\\s+bytes,\\s+${TXRING_UNDERRUN}\\s+underruns -> TXRingBlocks\n  ^\\s+Topology\\s+Information: -> Topology\n  ^\\s+Control\\s+Point\\s+Interface\\s+States -> ControlPoint\n  ^Interface -> Continue.Record\n  ^Interface\\s+${INTERFACE}\\s+\"${INTERFACE_NAME}\",\\s+is\\s+${LINK_STATUS},\\s+line\\s+protocol\\s+is\\s+${PROTOCOL_STATUS} -> Start\n  ^\\s*$$\n  ^. -> Error\n\nTXRingBlocks\n  ^\\s+TX\\[${TXRING_NUMBER}\\]:\\s+${TXRING_PACKETS}\\s+packets,\\s+${TXRING_BYTES}\\s+bytes,\\s+${TXRING_UNDERRUN}\\s+underruns\n  ^\\s+Blocks\\s+free\\s+curr/low:\\s+${TXRING_BLOCKS_FREE_CURR}/${TXRING_BLOCKS_FREE_LOW}\n  ^\\s+Used\\s+by\\s+${TXRING_INTERFACE}\\s*$$\n  ^\\s+Topology\\s+Information: -> Topology\n  ^\\s+RX\\[${RXRING_NUMBER}\\]:\\s+${RXRING_PACKETS}\\s+packets,\\s+${RXRING_BYTES}\\s+bytes,\\s+${RXRING_OVERRUN}\\s+overrun -> RXRingBlocks\n  ^\\s+Control\\s+Point\\s+Interface\\s+States -> ControlPoint\n  ^Interface -> Continue.Record\n  ^Interface\\s+${INTERFACE}\\s+\"${INTERFACE_NAME}\",\\s+is\\s+${LINK_STATUS},\\s+line\\s+protocol\\s+is\\s+${PROTOCOL_STATUS} -> Start\n  ^\\s*$$\n  ^. -> Error\n\nTopology\n  ^\\s{4,}\\S+\n  ^\\s+Control\\s+Point\\s+Interface\\s+States -> ControlPoint\n  ^Interface -> Continue.Record\n  ^Interface\\s+${INTERFACE}\\s+\"${INTERFACE_NAME}\",\\s+is\\s+${LINK_STATUS},\\s+line\\s+protocol\\s+is\\s+${PROTOCOL_STATUS} -> Start\n  ^\\s+RX\\[${RXRING_NUMBER}\\]:\\s+${RXRING_PACKETS}\\s+packets,\\s+${RXRING_BYTES}\\s+bytes,\\s+${RXRING_OVERRUN}\\s+overrun -> RXRingBlocks\n  ^\\s+TX\\[${TXRING_NUMBER}\\]:\\s+${TXRING_PACKETS}\\s+packets,\\s+${TXRING_BYTES}\\s+bytes,\\s+${TXRING_UNDERRUN}\\s+underruns -> TXRingBlocks\n  ^\\s*$$\n  ^. -> Error\n"
}