{
  "command": "cisco_ios_show_ip_ospf_database_router",
  "source": "ntc",
  "status": "success",
  "match_ratio": 0.35714285714285715,
  "textfsm_rows": 14,
  "ttp_rows": 5,
  "ttp_template": "<group name=\"router_id_process_id\">\n            OSPF Router with ID ({{ROUTER_ID | ORPHRASE}}) (Process ID {{PROCESS_ID | re(\"\\\\d+\")}})\n</group>\n<group name=\"lsa_id\">\n  Link State ID: {{LSA_ID | ORPHRASE}}\n</group>",
  "error": null,
  "textfsm_parsed": [
    {
      "ROUTER_ID": "100.1.1.1",
      "PROCESS_ID": "1",
      "AREA": "0",
      "LSA_AGE": "14",
      "LSA_OPTIONS": "No TOS-capability, DC",
      "LSA_TYPE": "Router Links",
      "LSA_ID": "100.1.1.1",
      "LSA_ADV_ROUTER": "100.1.1.1",
      "LSA_SEQ_NUMBER": "80000206",
      "LSA_CHECKSUM": "0x8A21",
      "LSA_LENGTH": "72",
      "LSA_NUM_LINKS": "4",
      "LS_LINK_TYPE": "a Stub Network",
      "LS_LINK_ID": "100.1.1.1",
      "LS_LINK_DATA": "255.255.255.255",
      "LS_MTID_METRICS": "0",
      "LS_TOS_0_METRICS": "1"
    },
    {
      "ROUTER_ID": "100.1.1.1",
      "PROCESS_ID": "1",
      "AREA": "0",
      "LSA_AGE": "14",
      "LSA_OPTIONS": "No TOS-capability, DC",
      "LSA_TYPE": "Router Links",
      "LSA_ID": "100.1.1.1",
      "LSA_ADV_ROUTER": "100.1.1.1",
      "LSA_SEQ_NUMBER": "80000206",
      "LSA_CHECKSUM": "0x8A21",
      "LSA_LENGTH": "72",
      "LSA_NUM_LINKS": "4",
      "LS_LINK_TYPE": "a Transit Network",
      "LS_LINK_ID": "192.168.2.1",
      "LS_LINK_DATA": "192.168.2.1",
      "LS_MTID_METRICS": "0",
      "LS_TOS_0_METRICS": "1"
    },
    {
      "ROUTER_ID": "100.1.1.1",
      "PROCESS_ID": "1",
      "AREA": "0",
      "LSA_AGE": "14",
      "LSA_OPTIONS": "No TOS-capability, DC",
      "LSA_TYPE": "Router Links",
      "LSA_ID": "100.1.1.1",
      "LSA_ADV_ROUTER": "100.1.1.1",
      "LSA_SEQ_NUMBER": "80000206",
      "LSA_CHECKSUM": "0x8A21",
      "LSA_LENGTH": "72",
      "LSA_NUM_LINKS": "4",
      "LS_LINK_TYPE": "another Router (point-to-point)",
      "LS_LINK_ID": "100.3.3.3",
      "LS_LINK_DATA": "192.168.1.1",
      "LS_MTID_METRICS": "0",
      "LS_TOS_0_METRICS": "1"
    },
    {
      "ROUTER_ID": "100.1.1.1",
      "PROCESS_ID": "1",
      "AREA": "0",
      "LSA_AGE": "14",
      "LSA_OPTIONS": "No TOS-capability, DC",
      "LSA_TYPE": "Router Links",
      "LSA_ID": "100.1.1.1",
      "LSA_ADV_ROUTER": "100.1.1.1",
      "LSA_SEQ_NUMBER": "80000206",
      "LSA_CHECKSUM": "0x8A21",
      "LSA_LENGTH": "72",
      "LSA_NUM_LINKS": "4",
      "LS_LINK_TYPE": "a Stub Network",
      "LS_LINK_ID": "192.168.1.0",
      "LS_LINK_DATA": "255.255.255.252",
      "LS_MTID_METRICS": "0",
      "LS_TOS_0_METRICS": "1"
    },
    {
      "ROUTER_ID": "100.1.1.1",
      "PROCESS_ID": "1",
      "AREA": "0",
      "LSA_AGE": "1694",
      "LSA_OPTIONS": "No TOS-capability, DC",
      "LSA_TYPE": "Router Links",
      "LSA_ID": "100.2.2.2",
      "LSA_ADV_ROUTER": "100.2.2.2",
      "LSA_SEQ_NUMBER": "80000202",
      "LSA_CHECKSUM": "0xCA4F",
      "LSA_LENGTH": "60",
      "LSA_NUM_LINKS": "3",
      "LS_LINK_TYPE": "a Stub Network",
      "LS_LINK_ID": "100.2.2.2",
      "LS_LINK_DATA": "255.255.255.255",
      "LS_MTID_METRICS": "0",
      "LS_TOS_0_METRICS": "1"
    },
    {
      "ROUTER_ID": "100.1.1.1",
      "PROCESS_ID": "1",
      "AREA": "0",
      "LSA_AGE": "1694",
      "LSA_OPTIONS": "No TOS-capability, DC",
      "LSA_TYPE": "Router Links",
      "LSA_ID": "100.2.2.2",
      "LSA_ADV_ROUTER": "100.2.2.2",
      "LSA_SEQ_NUMBER": "80000202",
      "LSA_CHECKSUM": "0xCA4F",
      "LSA_LENGTH": "60",
      "LSA_NUM_LINKS": "3",
      "LS_LINK_TYPE": "a Transit Network",
      "LS_LINK_ID": "192.168.3.2",
      "LS_LINK_DATA": "192.168.3.1",
      "LS_MTID_METRICS": "0",
      "LS_TOS_0_METRICS": "1"
    },
    {
      "ROUTER_ID": "100.1.1.1",
      "PROCESS_ID": "1",
      "AREA": "0",
      "LSA_AGE": "1694",
      "LSA_OPTIONS": "No TOS-capability, DC",
      "LSA_TYPE": "Router Links",
      "LSA_ID": "100.2.2.2",
      "LSA_ADV_ROUTER": "100.2.2.2",
      "LSA_SEQ_NUMBER": "80000202",
      "LSA_CHECKSUM": "0xCA4F",
      "LSA_LENGTH": "60",
      "LSA_NUM_LINKS": "3",
      "LS_LINK_TYPE": "a Transit Network",
      "LS_LINK_ID": "192.168.2.1",
      "LS_LINK_DATA": "192.168.2.2",
      "LS_MTID_METRICS": "0",
      "LS_TOS_0_METRICS": "1"
    },
    {
      "ROUTER_ID": "100.1.1.1",
      "PROCESS_ID": "1",
      "AREA": "0",
      "LSA_AGE": "15",
      "LSA_OPTIONS": "No TOS-capability, DC",
      "LSA_TYPE": "Router Links",
      "LSA_ID": "100.3.3.3",
      "LSA_ADV_ROUTER": "100.3.3.3",
      "LSA_SEQ_NUMBER": "800001FD",
      "LSA_CHECKSUM": "0x3969",
      "LSA_LENGTH": "72",
      "LSA_NUM_LINKS": "4",
      "LS_LINK_TYPE": "a Stub Network",
      "LS_LINK_ID": "100.3.3.3",
      "LS_LINK_DATA": "255.255.255.255",
      "LS_MTID_METRICS": "0",
      "LS_TOS_0_METRICS": "1"
    },
    {
      "ROUTER_ID": "100.1.1.1",
      "PROCESS_ID": "1",
      "AREA": "0",
      "LSA_AGE": "15",
      "LSA_OPTIONS": "No TOS-capability, DC",
      "LSA_TYPE": "Router Links",
      "LSA_ID": "100.3.3.3",
      "LSA_ADV_ROUTER": "100.3.3.3",
      "LSA_SEQ_NUMBER": "800001FD",
      "LSA_CHECKSUM": "0x3969",
      "LSA_LENGTH": "72",
      "LSA_NUM_LINKS": "4",
      "LS_LINK_TYPE": "a Transit Network",
      "LS_LINK_ID": "192.168.4.2",
      "LS_LINK_DATA": "192.168.4.1",
      "LS_MTID_METRICS": "0",
      "LS_TOS_0_METRICS": "1"
    },
    {
      "ROUTER_ID": "100.1.1.1",
      "PROCESS_ID": "1",
      "AREA": "0",
      "LSA_AGE": "15",
      "LSA_OPTIONS": "No TOS-capability, DC",
      "LSA_TYPE": "Router Links",
      "LSA_ID": "100.3.3.3",
      "LSA_ADV_ROUTER": "100.3.3.3",
      "LSA_SEQ_NUMBER": "800001FD",
      "LSA_CHECKSUM": "0x3969",
      "LSA_LENGTH": "72",
      "LSA_NUM_LINKS": "4",
      "LS_LINK_TYPE": "another Router (point-to-point)",
      "LS_LINK_ID": "100.1.1.1",
      "LS_LINK_DATA": "192.168.1.2",
      "LS_MTID_METRICS": "0",
      "LS_TOS_0_METRICS": "1"
    },
    {
      "ROUTER_ID": "100.1.1.1",
      "PROCESS_ID": "1",
      "AREA": "0",
      "LSA_AGE": "15",
      "LSA_OPTIONS": "No TOS-capability, DC",
      "LSA_TYPE": "Router Links",
      "LSA_ID": "100.3.3.3",
      "LSA_ADV_ROUTER": "100.3.3.3",
      "LSA_SEQ_NUMBER": "800001FD",
      "LSA_CHECKSUM": "0x3969",
      "LSA_LENGTH": "72",
      "LSA_NUM_LINKS": "4",
      "LS_LINK_TYPE": "a Stub Network",
      "LS_LINK_ID": "192.168.1.0",
      "LS_LINK_DATA": "255.255.255.252",
      "LS_MTID_METRICS": "0",
      "LS_TOS_0_METRICS": "1"
    },
    {
      "ROUTER_ID": "100.1.1.1",
      "PROCESS_ID": "1",
      "AREA": "0",
      "LSA_AGE": "1752",
      "LSA_OPTIONS": "No TOS-capability, DC",
      "LSA_TYPE": "Router Links",
      "LSA_ID": "100.4.4.4",
      "LSA_ADV_ROUTER": "100.4.4.4",
      "LSA_SEQ_NUMBER": "800001F7",
      "LSA_CHECKSUM": "0x5CB0",
      "LSA_LENGTH": "60",
      "LSA_NUM_LINKS": "3",
      "LS_LINK_TYPE": "a Stub Network",
      "LS_LINK_ID": "100.4.4.4",
      "LS_LINK_DATA": "255.255.255.255",
      "LS_MTID_METRICS": "0",
      "LS_TOS_0_METRICS": "1"
    },
    {
      "ROUTER_ID": "100.1.1.1",
      "PROCESS_ID": "1",
      "AREA": "0",
      "LSA_AGE": "1752",
      "LSA_OPTIONS": "No TOS-capability, DC",
      "LSA_TYPE": "Router Links",
      "LSA_ID": "100.4.4.4",
      "LSA_ADV_ROUTER": "100.4.4.4",
      "LSA_SEQ_NUMBER": "800001F7",
      "LSA_CHECKSUM": "0x5CB0",
      "LSA_LENGTH": "60",
      "LSA_NUM_LINKS": "3",
      "LS_LINK_TYPE": "a Transit Network",
      "LS_LINK_ID": "192.168.4.2",
      "LS_LINK_DATA": "192.168.4.2",
      "LS_MTID_METRICS": "0",
      "LS_TOS_0_METRICS": "1"
    },
    {
      "ROUTER_ID": "100.1.1.1",
      "PROCESS_ID": "1",
      "AREA": "0",
      "LSA_AGE": "1752",
      "LSA_OPTIONS": "No TOS-capability, DC",
      "LSA_TYPE": "Router Links",
      "LSA_ID": "100.4.4.4",
      "LSA_ADV_ROUTER": "100.4.4.4",
      "LSA_SEQ_NUMBER": "800001F7",
      "LSA_CHECKSUM": "0x5CB0",
      "LSA_LENGTH": "60",
      "LSA_NUM_LINKS": "3",
      "LS_LINK_TYPE": "a Transit Network",
      "LS_LINK_ID": "192.168.3.2",
      "LS_LINK_DATA": "192.168.3.2",
      "LS_MTID_METRICS": "0",
      "LS_TOS_0_METRICS": "1"
    }
  ],
  "ttp_parsed": [
    {
      "router_id_process_id": {
        "ROUTER_ID": "100.1.1.1",
        "PROCESS_ID": "1"
      },
      "lsa_id": [
        {
          "LSA_ID": "100.1.1.1"
        },
        {
          "LSA_ID": "100.2.2.2"
        },
        {
          "LSA_ID": "100.3.3.3"
        },
        {
          "LSA_ID": "100.4.4.4"
        }
      ]
    }
  ],
  "cli_content": "            OSPF Router with ID (100.1.1.1) (Process ID 1)\n\n                Router Link States (Area 0)\n\n  LS age: 14\n  Options: (No TOS-capability, DC)\n  LS Type: Router Links\n  Link State ID: 100.1.1.1\n  Advertising Router: 100.1.1.1\n  LS Seq Number: 80000206\n  Checksum: 0x8A21\n  Length: 72\n  Number of Links: 4\n\n    Link connected to: a Stub Network\n     (Link ID) Network/subnet number: 100.1.1.1\n     (Link Data) Network Mask: 255.255.255.255\n      Number of MTID metrics: 0\n       TOS 0 Metrics: 1\n\n    Link connected to: a Transit Network\n     (Link ID) Designated Router address: 192.168.2.1\n     (Link Data) Router Interface address: 192.168.2.1\n      Number of MTID metrics: 0\n       TOS 0 Metrics: 1\n\n    Link connected to: another Router (point-to-point)\n     (Link ID) Neighboring Router ID: 100.3.3.3\n     (Link Data) Router Interface address: 192.168.1.1\n      Number of MTID metrics: 0\n       TOS 0 Metrics: 1\n\n    Link connected to: a Stub Network\n     (Link ID) Network/subnet number: 192.168.1.0\n     (Link Data) Network Mask: 255.255.255.252\n      Number of MTID metrics: 0\n       TOS 0 Metrics: 1\n\n\n  LS age: 1694\n  Options: (No TOS-capability, DC)\n  LS Type: Router Links\n  Link State ID: 100.2.2.2\n  Advertising Router: 100.2.2.2\n  LS Seq Number: 80000202\n  Checksum: 0xCA4F\n  Length: 60\n  Number of Links: 3\n\n    Link connected to: a Stub Network\n     (Link ID) Network/subnet number: 100.2.2.2\n     (Link Data) Network Mask: 255.255.255.255\n      Number of MTID metrics: 0\n       TOS 0 Metrics: 1\n\n    Link connected to: a Transit Network\n     (Link ID) Designated Router address: 192.168.3.2\n     (Link Data) Router Interface address: 192.168.3.1\n      Number of MTID metrics: 0\n       TOS 0 Metrics: 1\n\n    Link connected to: a Transit Network\n     (Link ID) Designated Router address: 192.168.2.1\n     (Link Data) Router Interface address: 192.168.2.2\n      Number of MTID metrics: 0\n       TOS 0 Metrics: 1\n\n\n  LS age: 15\n  Options: (No TOS-capability, DC)\n  LS Type: Router Links\n  Link State ID: 100.3.3.3\n  Advertising Router: 100.3.3.3\n  LS Seq Number: 800001FD\n  Checksum: 0x3969\n  Length: 72\n  Number of Links: 4\n\n    Link connected to: a Stub Network\n     (Link ID) Network/subnet number: 100.3.3.3\n     (Link Data) Network Mask: 255.255.255.255\n      Number of MTID metrics: 0\n       TOS 0 Metrics: 1\n\n    Link connected to: a Transit Network\n     (Link ID) Designated Router address: 192.168.4.2\n     (Link Data) Router Interface address: 192.168.4.1\n      Number of MTID metrics: 0\n       TOS 0 Metrics: 1\n\n    Link connected to: another Router (point-to-point)\n     (Link ID) Neighboring Router ID: 100.1.1.1\n     (Link Data) Router Interface address: 192.168.1.2\n      Number of MTID metrics: 0\n       TOS 0 Metrics: 1\n\n    Link connected to: a Stub Network\n     (Link ID) Network/subnet number: 192.168.1.0\n     (Link Data) Network Mask: 255.255.255.252\n      Number of MTID metrics: 0\n       TOS 0 Metrics: 1\n\n\n  LS age: 1752\n  Options: (No TOS-capability, DC)\n  LS Type: Router Links\n  Link State ID: 100.4.4.4\n  Advertising Router: 100.4.4.4\n  LS Seq Number: 800001F7\n  Checksum: 0x5CB0\n  Length: 60\n  Number of Links: 3\n\n    Link connected to: a Stub Network\n     (Link ID) Network/subnet number: 100.4.4.4\n     (Link Data) Network Mask: 255.255.255.255\n      Number of MTID metrics: 0\n       TOS 0 Metrics: 1\n\n    Link connected to: a Transit Network\n     (Link ID) Designated Router address: 192.168.4.2\n     (Link Data) Router Interface address: 192.168.4.2\n      Number of MTID metrics: 0\n       TOS 0 Metrics: 1\n\n    Link connected to: a Transit Network\n     (Link ID) Designated Router address: 192.168.3.2\n     (Link Data) Router Interface address: 192.168.3.2\n      Number of MTID metrics: 0\n       TOS 0 Metrics: 1\n",
  "textfsm_template": "Value Filldown ROUTER_ID (\\d+\\.\\d+\\.\\d+\\.\\d+)\nValue Filldown PROCESS_ID (\\d+)\nValue Filldown AREA (\\d+\\.\\d+\\.\\d+\\.\\d+|\\d+)\nValue Filldown LSA_AGE (\\d+)\nValue Filldown LSA_OPTIONS (.+)\nValue Filldown LSA_TYPE (.+)\nValue Filldown LSA_ID (\\d+\\.\\d+\\.\\d+\\.\\d+)\nValue Filldown LSA_ADV_ROUTER (\\d+\\.\\d+\\.\\d+\\.\\d+)\nValue Filldown LSA_SEQ_NUMBER (\\S+)\nValue Filldown LSA_CHECKSUM (\\S+)\nValue Filldown LSA_LENGTH (\\d+)\nValue Filldown LSA_NUM_LINKS (\\d+)\nValue Filldown LSA_ABR (Area\\s+Border\\s+Router)\nValue Filldown LSA_ASBR (AS\\s+Boundary\\s+Router)\nValue LS_LINK_TYPE (.+?)\nValue LS_LINK_ID (\\d+\\.\\d+\\.\\d+\\.\\d+)\nValue LS_LINK_DATA (\\d+\\.\\d+\\.\\d+\\.\\d+)\nValue LS_MTID_METRICS (\\d+)\nValue LS_TOS_0_METRICS (\\d+)\n\nStart\n  ^\\s*OSPF\\s+Router\\s+with\\s+ID\\s+\\(${ROUTER_ID}\\)\\s+\\(Process\\s+ID\\s+${PROCESS_ID}\\)\n  ^\\s+Router\\s+Link\\s+States\\s+\\(Area ${AREA}\\) -> LSAInfo\n  ^\\s*$$\n  ^. -> Error\n\nLSAInfo\n  ^\\s+LS\\s+age:\\s+${LSA_AGE}\n  ^\\s+Options:\\s+\\(${LSA_OPTIONS}\\)\n  ^\\s+LS\\s+Type:\\s+${LSA_TYPE}\n  ^\\s+Link\\s+State\\s+ID:\\s+${LSA_ID}\n  ^\\s+Advertising\\s+Router:\\s+${LSA_ADV_ROUTER}\n  ^\\s+LS\\s+Seq\\s+Number:\\s+${LSA_SEQ_NUMBER}\n  ^\\s+Checksum:\\s+${LSA_CHECKSUM}\n  ^\\s+Length:\\s+${LSA_LENGTH}\n  ^\\s+${LSA_ABR}$$\n  ^\\s+${LSA_ASBR}$$\n  ^\\s+Number\\s+of\\s+Links:\\s+${LSA_NUM_LINKS} -> LSAs\n  ^\\s*$$\n  ^. -> Error\n\nLSAs\n  ^\\s+Link\\s+connected\\s+to:\\s+${LS_LINK_TYPE}$$\n  ^\\s+\\(Link ID\\)\\s+((Network\\/subnet\\s+number)|(Designated\\s+Router\\s+address)|(Neighboring\\s+Router ID)):\\s+${LS_LINK_ID}\n  ^\\s+\\(Link Data\\)\\s+((Network\\s+Mask)|(Router\\s+Interface\\s+address)):\\s+${LS_LINK_DATA}\n  ^\\s+Number\\s+of\\s+MTID\\s+metrics:\\s+${LS_MTID_METRICS}\n  ^\\s+TOS\\s+0\\s+Metrics:\\s+${LS_TOS_0_METRICS} -> Next.Record\n  ^\\s+LS\\s+age:\\s+${LSA_AGE} -> LSAInfo\n  ^\\s+Router\\s+Link\\s+States\\s+\\(Area ${AREA}\\) -> LSAInfo\n  ^\\s*$$\n  ^. -> Error\n\nEOF\n"
}