{
  "command": "edgecore_show_interfaces_switchport",
  "source": "ntc",
  "status": "success",
  "match_ratio": 1.0,
  "textfsm_rows": 10,
  "ttp_rows": 10,
  "ttp_template": "<group name=\"ingress_rate_limit\">\n Ingress Rate Limit: {{INGRESS_RATE_LIMIT | ORPHRASE}}\n</group>",
  "error": null,
  "textfsm_parsed": [
    {
      "INTERFACE": "Eth 1/1",
      "BROADCAST_THRESHOLD": "Enabled, scale:80K level:5 bits/second",
      "MULTICAST_THRESHOLD": "Disabled",
      "UNICAST_THRESHOLD": "Disabled",
      "LACP_STATUS": "Disabled",
      "INGRESS_RATE_LIMIT": "Disabled, scale:8M level:10",
      "EGRESS_RATE_LIMIT": "Disabled, scale:8M level:10",
      "VLAN_MEMBERSHIP_MODE": "Hybrid",
      "INGRESS_RULE": "Enabled",
      "ACCEPTABLE_FRAME_TYPE": "All frames",
      "NATIVE_VLAN": "1",
      "PRIORITY_FOR_UNTAGGED_TRAFFIC": "0",
      "GVRP_STATUS": "Disabled",
      "ALLOWED_VLAN": "1, 692, 695, 698",
      "ALLOWED_VLAN_TAG": "u, t, t, t",
      "PRIVATE_VLAN_MODE": "NONE",
      "PRIVATE_VLAN_MAPPING": "NONE",
      "TUNNEL_STATUS_802_1Q": "Disable",
      "TUNNEL_MODE_802_1Q": "NORMAL",
      "TUNNEL_TPID_802_1Q": "8100(Hex)"
    },
    {
      "INTERFACE": "Eth 1/2",
      "BROADCAST_THRESHOLD": "Enabled, scale:80K level:5 bits/second",
      "MULTICAST_THRESHOLD": "Disabled",
      "UNICAST_THRESHOLD": "Disabled",
      "LACP_STATUS": "Disabled",
      "INGRESS_RATE_LIMIT": "Disabled, scale:8M level:10",
      "EGRESS_RATE_LIMIT": "Disabled, scale:8M level:10",
      "VLAN_MEMBERSHIP_MODE": "Hybrid",
      "INGRESS_RULE": "Enabled",
      "ACCEPTABLE_FRAME_TYPE": "All frames",
      "NATIVE_VLAN": "692",
      "PRIORITY_FOR_UNTAGGED_TRAFFIC": "0",
      "GVRP_STATUS": "Disabled",
      "ALLOWED_VLAN": "692",
      "ALLOWED_VLAN_TAG": "u",
      "PRIVATE_VLAN_MODE": "NONE",
      "PRIVATE_VLAN_MAPPING": "NONE",
      "TUNNEL_STATUS_802_1Q": "Disable",
      "TUNNEL_MODE_802_1Q": "NORMAL",
      "TUNNEL_TPID_802_1Q": "8100(Hex)"
    },
    {
      "INTERFACE": "Eth 1/3",
      "BROADCAST_THRESHOLD": "Enabled, scale:80K level:5 bits/second",
      "MULTICAST_THRESHOLD": "Disabled",
      "UNICAST_THRESHOLD": "Disabled",
      "LACP_STATUS": "Disabled",
      "INGRESS_RATE_LIMIT": "Disabled, scale:8M level:10",
      "EGRESS_RATE_LIMIT": "Disabled, scale:8M level:10",
      "VLAN_MEMBERSHIP_MODE": "Hybrid",
      "INGRESS_RULE": "Enabled",
      "ACCEPTABLE_FRAME_TYPE": "All frames",
      "NATIVE_VLAN": "692",
      "PRIORITY_FOR_UNTAGGED_TRAFFIC": "0",
      "GVRP_STATUS": "Disabled",
      "ALLOWED_VLAN": "692",
      "ALLOWED_VLAN_TAG": "u",
      "PRIVATE_VLAN_MODE": "NONE",
      "PRIVATE_VLAN_MAPPING": "NONE",
      "TUNNEL_STATUS_802_1Q": "Disable",
      "TUNNEL_MODE_802_1Q": "NORMAL",
      "TUNNEL_TPID_802_1Q": "8100(Hex)"
    },
    {
      "INTERFACE": "Eth 1/4",
      "BROADCAST_THRESHOLD": "Enabled, scale:80K level:5 bits/second",
      "MULTICAST_THRESHOLD": "Disabled",
      "UNICAST_THRESHOLD": "Disabled",
      "LACP_STATUS": "Disabled",
      "INGRESS_RATE_LIMIT": "Disabled, scale:8M level:10",
      "EGRESS_RATE_LIMIT": "Disabled, scale:8M level:10",
      "VLAN_MEMBERSHIP_MODE": "Hybrid",
      "INGRESS_RULE": "Enabled",
      "ACCEPTABLE_FRAME_TYPE": "All frames",
      "NATIVE_VLAN": "692",
      "PRIORITY_FOR_UNTAGGED_TRAFFIC": "0",
      "GVRP_STATUS": "Disabled",
      "ALLOWED_VLAN": "692",
      "ALLOWED_VLAN_TAG": "u",
      "PRIVATE_VLAN_MODE": "NONE",
      "PRIVATE_VLAN_MAPPING": "NONE",
      "TUNNEL_STATUS_802_1Q": "Disable",
      "TUNNEL_MODE_802_1Q": "NORMAL",
      "TUNNEL_TPID_802_1Q": "8100(Hex)"
    },
    {
      "INTERFACE": "Eth 1/5",
      "BROADCAST_THRESHOLD": "Enabled, scale:80K level:5 bits/second",
      "MULTICAST_THRESHOLD": "Disabled",
      "UNICAST_THRESHOLD": "Disabled",
      "LACP_STATUS": "Disabled",
      "INGRESS_RATE_LIMIT": "Disabled, scale:8M level:10",
      "EGRESS_RATE_LIMIT": "Disabled, scale:8M level:10",
      "VLAN_MEMBERSHIP_MODE": "Access",
      "INGRESS_RULE": "Enabled",
      "ACCEPTABLE_FRAME_TYPE": "All frames",
      "NATIVE_VLAN": "692",
      "PRIORITY_FOR_UNTAGGED_TRAFFIC": "0",
      "GVRP_STATUS": "Disabled",
      "ALLOWED_VLAN": "692",
      "ALLOWED_VLAN_TAG": "u",
      "PRIVATE_VLAN_MODE": "NONE",
      "PRIVATE_VLAN_MAPPING": "NONE",
      "TUNNEL_STATUS_802_1Q": "Disable",
      "TUNNEL_MODE_802_1Q": "NORMAL",
      "TUNNEL_TPID_802_1Q": "8100(Hex)"
    },
    {
      "INTERFACE": "Eth 1/6",
      "BROADCAST_THRESHOLD": "Enabled, scale:80K level:5 bits/second",
      "MULTICAST_THRESHOLD": "Disabled",
      "UNICAST_THRESHOLD": "Disabled",
      "LACP_STATUS": "Disabled",
      "INGRESS_RATE_LIMIT": "Disabled, scale:8M level:10",
      "EGRESS_RATE_LIMIT": "Disabled, scale:8M level:10",
      "VLAN_MEMBERSHIP_MODE": "Trunk",
      "INGRESS_RULE": "Enabled",
      "ACCEPTABLE_FRAME_TYPE": "All frames",
      "NATIVE_VLAN": "1",
      "PRIORITY_FOR_UNTAGGED_TRAFFIC": "0",
      "GVRP_STATUS": "Disabled",
      "ALLOWED_VLAN": "1, 692, 698",
      "ALLOWED_VLAN_TAG": "t, t, t",
      "PRIVATE_VLAN_MODE": "NONE",
      "PRIVATE_VLAN_MAPPING": "NONE",
      "TUNNEL_STATUS_802_1Q": "Disable",
      "TUNNEL_MODE_802_1Q": "NORMAL",
      "TUNNEL_TPID_802_1Q": "8100(Hex)"
    },
    {
      "INTERFACE": "Eth 1/7",
      "BROADCAST_THRESHOLD": "Enabled, scale:80K level:5 bits/second",
      "MULTICAST_THRESHOLD": "Disabled",
      "UNICAST_THRESHOLD": "Disabled",
      "LACP_STATUS": "Disabled",
      "INGRESS_RATE_LIMIT": "Disabled, scale:8M level:10",
      "EGRESS_RATE_LIMIT": "Disabled, scale:8M level:10",
      "VLAN_MEMBERSHIP_MODE": "Access",
      "INGRESS_RULE": "Enabled",
      "ACCEPTABLE_FRAME_TYPE": "All frames",
      "NATIVE_VLAN": "692",
      "PRIORITY_FOR_UNTAGGED_TRAFFIC": "0",
      "GVRP_STATUS": "Disabled",
      "ALLOWED_VLAN": "692",
      "ALLOWED_VLAN_TAG": "u",
      "PRIVATE_VLAN_MODE": "NONE",
      "PRIVATE_VLAN_MAPPING": "NONE",
      "TUNNEL_STATUS_802_1Q": "Disable",
      "TUNNEL_MODE_802_1Q": "NORMAL",
      "TUNNEL_TPID_802_1Q": "8100(Hex)"
    },
    {
      "INTERFACE": "Eth 1/8",
      "BROADCAST_THRESHOLD": "Enabled, scale:80K level:5 bits/second",
      "MULTICAST_THRESHOLD": "Disabled",
      "UNICAST_THRESHOLD": "Disabled",
      "LACP_STATUS": "Disabled",
      "INGRESS_RATE_LIMIT": "Disabled, scale:8M level:10",
      "EGRESS_RATE_LIMIT": "Disabled, scale:8M level:10",
      "VLAN_MEMBERSHIP_MODE": "Hybrid",
      "INGRESS_RULE": "Enabled",
      "ACCEPTABLE_FRAME_TYPE": "All frames",
      "NATIVE_VLAN": "692",
      "PRIORITY_FOR_UNTAGGED_TRAFFIC": "0",
      "GVRP_STATUS": "Disabled",
      "ALLOWED_VLAN": "692",
      "ALLOWED_VLAN_TAG": "u",
      "PRIVATE_VLAN_MODE": "NONE",
      "PRIVATE_VLAN_MAPPING": "NONE",
      "TUNNEL_STATUS_802_1Q": "Disable",
      "TUNNEL_MODE_802_1Q": "NORMAL",
      "TUNNEL_TPID_802_1Q": "8100(Hex)"
    },
    {
      "INTERFACE": "Eth 1/9",
      "BROADCAST_THRESHOLD": "Enabled, scale:80K level:5 bits/second",
      "MULTICAST_THRESHOLD": "Disabled",
      "UNICAST_THRESHOLD": "Disabled",
      "LACP_STATUS": "Disabled",
      "INGRESS_RATE_LIMIT": "Disabled, scale:8M level:10",
      "EGRESS_RATE_LIMIT": "Disabled, scale:8M level:10",
      "VLAN_MEMBERSHIP_MODE": "Hybrid",
      "INGRESS_RULE": "Enabled",
      "ACCEPTABLE_FRAME_TYPE": "All frames",
      "NATIVE_VLAN": "692",
      "PRIORITY_FOR_UNTAGGED_TRAFFIC": "0",
      "GVRP_STATUS": "Disabled",
      "ALLOWED_VLAN": "692",
      "ALLOWED_VLAN_TAG": "u",
      "PRIVATE_VLAN_MODE": "NONE",
      "PRIVATE_VLAN_MAPPING": "NONE",
      "TUNNEL_STATUS_802_1Q": "Disable",
      "TUNNEL_MODE_802_1Q": "NORMAL",
      "TUNNEL_TPID_802_1Q": "8100(Hex)"
    },
    {
      "INTERFACE": "Eth 1/10",
      "BROADCAST_THRESHOLD": "Enabled, scale:80K level:5 bits/second",
      "MULTICAST_THRESHOLD": "Disabled",
      "UNICAST_THRESHOLD": "Disabled",
      "LACP_STATUS": "Disabled",
      "INGRESS_RATE_LIMIT": "Disabled, scale:8M level:10",
      "EGRESS_RATE_LIMIT": "Disabled, scale:8M level:10",
      "VLAN_MEMBERSHIP_MODE": "Hybrid",
      "INGRESS_RULE": "Enabled",
      "ACCEPTABLE_FRAME_TYPE": "All frames",
      "NATIVE_VLAN": "692",
      "PRIORITY_FOR_UNTAGGED_TRAFFIC": "0",
      "GVRP_STATUS": "Disabled",
      "ALLOWED_VLAN": "692",
      "ALLOWED_VLAN_TAG": "u",
      "PRIVATE_VLAN_MODE": "NONE",
      "PRIVATE_VLAN_MAPPING": "NONE",
      "TUNNEL_STATUS_802_1Q": "Disable",
      "TUNNEL_MODE_802_1Q": "NORMAL",
      "TUNNEL_TPID_802_1Q": "8100(Hex)"
    }
  ],
  "ttp_parsed": [
    {
      "ingress_rate_limit": [
        {
          "INGRESS_RATE_LIMIT": "Disabled, scale:8M level:10"
        },
        {
          "INGRESS_RATE_LIMIT": "Disabled, scale:8M level:10"
        },
        {
          "INGRESS_RATE_LIMIT": "Disabled, scale:8M level:10"
        },
        {
          "INGRESS_RATE_LIMIT": "Disabled, scale:8M level:10"
        },
        {
          "INGRESS_RATE_LIMIT": "Disabled, scale:8M level:10"
        },
        {
          "INGRESS_RATE_LIMIT": "Disabled, scale:8M level:10"
        },
        {
          "INGRESS_RATE_LIMIT": "Disabled, scale:8M level:10"
        },
        {
          "INGRESS_RATE_LIMIT": "Disabled, scale:8M level:10"
        },
        {
          "INGRESS_RATE_LIMIT": "Disabled, scale:8M level:10"
        },
        {
          "INGRESS_RATE_LIMIT": "Disabled, scale:8M level:10"
        }
      ]
    }
  ],
  "cli_content": "Information of Eth 1/1\n Broadcast Threshold:           Enabled, scale:80K level:5 bits/second\n Multicast Threshold:           Disabled\n Unicast Threshold:             Disabled\n LACP Status:                   Disabled\n Ingress Rate Limit:            Disabled, scale:8M level:10\n  Egress Rate Limit:            Disabled, scale:8M level:10\n VLAN Membership Mode:          Hybrid\n Ingress Rule:                  Enabled\n Acceptable Frame Type:         All frames\n Native VLAN:                   1\n Priority for Untagged Traffic: 0\n GVRP Status:                   Disabled\n Allowed VLAN:                    1(u), 692(t), 695(t), 698(t),\n Forbidden VLAN:\n Private-VLAN Mode:             NONE\n Private-VLAN Mapping:          NONE\n 802.1Q-tunnel Status:          Disable\n 802.1Q-tunnel Mode:            NORMAL\n 802.1Q-tunnel TPID:            8100(Hex)\n\nInformation of Eth 1/2\n Broadcast Threshold:           Enabled, scale:80K level:5 bits/second\n Multicast Threshold:           Disabled\n Unicast Threshold:             Disabled\n LACP Status:                   Disabled\n Ingress Rate Limit:            Disabled, scale:8M level:10\n  Egress Rate Limit:            Disabled, scale:8M level:10\n VLAN Membership Mode:          Hybrid\n Ingress Rule:                  Enabled\n Acceptable Frame Type:         All frames\n Native VLAN:                   692\n Priority for Untagged Traffic: 0\n GVRP Status:                   Disabled\n Allowed VLAN:                  692(u),\n Forbidden VLAN:\n Private-VLAN Mode:             NONE\n Private-VLAN Mapping:          NONE\n 802.1Q-tunnel Status:          Disable\n 802.1Q-tunnel Mode:            NORMAL\n 802.1Q-tunnel TPID:            8100(Hex)\n\nInformation of Eth 1/3\n Broadcast Threshold:           Enabled, scale:80K level:5 bits/second\n Multicast Threshold:           Disabled\n Unicast Threshold:             Disabled\n LACP Status:                   Disabled\n Ingress Rate Limit:            Disabled, scale:8M level:10\n  Egress Rate Limit:            Disabled, scale:8M level:10\n VLAN Membership Mode:          Hybrid\n Ingress Rule:                  Enabled\n Acceptable Frame Type:         All frames\n Native VLAN:                   692\n Priority for Untagged Traffic: 0\n GVRP Status:                   Disabled\n Allowed VLAN:                  692(u),\n Forbidden VLAN:\n Private-VLAN Mode:             NONE\n Private-VLAN Mapping:          NONE\n 802.1Q-tunnel Status:          Disable\n 802.1Q-tunnel Mode:            NORMAL\n 802.1Q-tunnel TPID:            8100(Hex)\n\nInformation of Eth 1/4\n Broadcast Threshold:           Enabled, scale:80K level:5 bits/second\n Multicast Threshold:           Disabled\n Unicast Threshold:             Disabled\n LACP Status:                   Disabled\n Ingress Rate Limit:            Disabled, scale:8M level:10\n  Egress Rate Limit:            Disabled, scale:8M level:10\n VLAN Membership Mode:          Hybrid\n Ingress Rule:                  Enabled\n Acceptable Frame Type:         All frames\n Native VLAN:                   692\n Priority for Untagged Traffic: 0\n GVRP Status:                   Disabled\n Allowed VLAN:                  692(u),\n Forbidden VLAN:\n Private-VLAN Mode:             NONE\n Private-VLAN Mapping:          NONE\n 802.1Q-tunnel Status:          Disable\n 802.1Q-tunnel Mode:            NORMAL\n 802.1Q-tunnel TPID:            8100(Hex)\n\nInformation of Eth 1/5\n Broadcast Threshold:           Enabled, scale:80K level:5 bits/second\n Multicast Threshold:           Disabled\n Unicast Threshold:             Disabled\n LACP Status:                   Disabled\n Ingress Rate Limit:            Disabled, scale:8M level:10\n  Egress Rate Limit:            Disabled, scale:8M level:10\n VLAN Membership Mode:          Access\n Ingress Rule:                  Enabled\n Acceptable Frame Type:         All frames\n Native VLAN:                   692\n Priority for Untagged Traffic: 0\n GVRP Status:                   Disabled\n Allowed VLAN:                  692(u),\n Forbidden VLAN:\n Private-VLAN Mode:             NONE\n Private-VLAN Mapping:          NONE\n 802.1Q-tunnel Status:          Disable\n 802.1Q-tunnel Mode:            NORMAL\n 802.1Q-tunnel TPID:            8100(Hex)\n\nInformation of Eth 1/6\n Broadcast Threshold:           Enabled, scale:80K level:5 bits/second\n Multicast Threshold:           Disabled\n Unicast Threshold:             Disabled\n LACP Status:                   Disabled\n Ingress Rate Limit:            Disabled, scale:8M level:10\n  Egress Rate Limit:            Disabled, scale:8M level:10\n VLAN Membership Mode:          Trunk\n Ingress Rule:                  Enabled\n Acceptable Frame Type:         All frames\n Native VLAN:                   1\n Priority for Untagged Traffic: 0\n GVRP Status:                   Disabled\n Allowed VLAN:                    1(t), 692(t), 698(t),\n Forbidden VLAN:\n Private-VLAN Mode:             NONE\n Private-VLAN Mapping:          NONE\n 802.1Q-tunnel Status:          Disable\n 802.1Q-tunnel Mode:            NORMAL\n 802.1Q-tunnel TPID:            8100(Hex)\n\nInformation of Eth 1/7\n Broadcast Threshold:           Enabled, scale:80K level:5 bits/second\n Multicast Threshold:           Disabled\n Unicast Threshold:             Disabled\n LACP Status:                   Disabled\n Ingress Rate Limit:            Disabled, scale:8M level:10\n  Egress Rate Limit:            Disabled, scale:8M level:10\n VLAN Membership Mode:          Access\n Ingress Rule:                  Enabled\n Acceptable Frame Type:         All frames\n Native VLAN:                   692\n Priority for Untagged Traffic: 0\n GVRP Status:                   Disabled\n Allowed VLAN:                  692(u),\n Forbidden VLAN:\n Private-VLAN Mode:             NONE\n Private-VLAN Mapping:          NONE\n 802.1Q-tunnel Status:          Disable\n 802.1Q-tunnel Mode:            NORMAL\n 802.1Q-tunnel TPID:            8100(Hex)\n\nInformation of Eth 1/8\n Broadcast Threshold:           Enabled, scale:80K level:5 bits/second\n Multicast Threshold:           Disabled\n Unicast Threshold:             Disabled\n LACP Status:                   Disabled\n Ingress Rate Limit:            Disabled, scale:8M level:10\n  Egress Rate Limit:            Disabled, scale:8M level:10\n VLAN Membership Mode:          Hybrid\n Ingress Rule:                  Enabled\n Acceptable Frame Type:         All frames\n Native VLAN:                   692\n Priority for Untagged Traffic: 0\n GVRP Status:                   Disabled\n Allowed VLAN:                  692(u),\n Forbidden VLAN:\n Private-VLAN Mode:             NONE\n Private-VLAN Mapping:          NONE\n 802.1Q-tunnel Status:          Disable\n 802.1Q-tunnel Mode:            NORMAL\n 802.1Q-tunnel TPID:            8100(Hex)\n\nInformation of Eth 1/9\n Broadcast Threshold:           Enabled, scale:80K level:5 bits/second\n Multicast Threshold:           Disabled\n Unicast Threshold:             Disabled\n LACP Status:                   Disabled\n Ingress Rate Limit:            Disabled, scale:8M level:10\n  Egress Rate Limit:            Disabled, scale:8M level:10\n VLAN Membership Mode:          Hybrid\n Ingress Rule:                  Enabled\n Acceptable Frame Type:         All frames\n Native VLAN:                   692\n Priority for Untagged Traffic: 0\n GVRP Status:                   Disabled\n Allowed VLAN:                  692(u),\n Forbidden VLAN:\n Private-VLAN Mode:             NONE\n Private-VLAN Mapping:          NONE\n 802.1Q-tunnel Status:          Disable\n 802.1Q-tunnel Mode:            NORMAL\n 802.1Q-tunnel TPID:            8100(Hex)\n\nInformation of Eth 1/10\n Broadcast Threshold:           Enabled, scale:80K level:5 bits/second\n Multicast Threshold:           Disabled\n Unicast Threshold:             Disabled\n LACP Status:                   Disabled\n Ingress Rate Limit:            Disabled, scale:8M level:10\n  Egress Rate Limit:            Disabled, scale:8M level:10\n VLAN Membership Mode:          Hybrid\n Ingress Rule:                  Enabled\n Acceptable Frame Type:         All frames\n Native VLAN:                   692\n Priority for Untagged Traffic: 0\n GVRP Status:                   Disabled\n Allowed VLAN:                  692(u),\n Forbidden VLAN:\n Private-VLAN Mode:             NONE\n Private-VLAN Mapping:          NONE\n 802.1Q-tunnel Status:          Disable\n 802.1Q-tunnel Mode:            NORMAL\n 802.1Q-tunnel TPID:            8100(Hex)\n",
  "textfsm_template": "Value INTERFACE (.*)\nValue BROADCAST_THRESHOLD (.*)\nValue MULTICAST_THRESHOLD (.*)\nValue UNICAST_THRESHOLD (.*)\nValue UNKNOWN_UNICAST_THRESHOLD (.*)\nValue LACP_STATUS (.*)\nValue INGRESS_RATE_LIMIT (.*)\nValue EGRESS_RATE_LIMIT (.*)\nValue VLAN_MEMBERSHIP_MODE (.*)\nValue INGRESS_RULE (.*)\nValue ACCEPTABLE_FRAME_TYPE (.*)\nValue NATIVE_VLAN (.*)\nValue PRIORITY_FOR_UNTAGGED_TRAFFIC (.*)\nValue GVRP_STATUS (.*)\nValue List ALLOWED_VLAN (\\d+)\nValue List ALLOWED_VLAN_TAG (\\w+)\nValue List FORBIDDEN_VLAN (\\d+)\nValue List FORBIDDEN_VLAN_TAG (\\w+)\nValue PRIVATE_VLAN_MODE (.*)\nValue PRIVATE_VLAN_HOST_ASSOCIATION (.*)\nValue PRIVATE_VLAN_MAPPING (.*)\nValue TUNNEL_STATUS_802_1Q (.*)\nValue TUNNEL_MODE_802_1Q (.*)\nValue TUNNEL_TPID_802_1Q (.*)\nValue LAYER_2_PROTOCOL_TUNNEL (.*)\n\nStart\n  ^\\s*Information\\sof\\s.*$$ -> Continue.Record\n  ^\\s*Information\\sof\\s${INTERFACE}\\s*$$\n  ^\\s*Broadcast\\s+Threshold:\\s*${BROADCAST_THRESHOLD}\\s*$$\n  ^\\s*Multicast\\s+Threshold:\\s*${MULTICAST_THRESHOLD}\\s*$$\n  ^\\s*Unicast\\s+Threshold:\\s*${UNICAST_THRESHOLD}\\s*$$\n  ^\\s*Unknown-unicast\\s+Threshold:\\s*${UNKNOWN_UNICAST_THRESHOLD}\\s*$$\n  ^\\s*LACP\\s+Status:\\s*${LACP_STATUS}\\s*$$\n  ^\\s*Ingress\\s+Rate\\s+Limit:\\s*${INGRESS_RATE_LIMIT}\\s*$$\n  ^\\s*Egress\\s+Rate\\s+Limit:\\s*${EGRESS_RATE_LIMIT}\\s*$$\n  ^\\s*VLAN\\sMembership\\sMode:\\s*${VLAN_MEMBERSHIP_MODE}\\s*$$\n  ^\\s*Ingress\\s+Rule:\\s*${INGRESS_RULE}\\s*$$\n  ^\\s*Acceptable\\s+Frame\\s+Type:\\s*${ACCEPTABLE_FRAME_TYPE}\\s*$$\n  ^\\s*Native\\sVLAN:\\s*${NATIVE_VLAN}\\s*$$\n  ^\\s*Priority\\s+for\\s+Untagged\\s+Traffic:\\s*${PRIORITY_FOR_UNTAGGED_TRAFFIC}\\s*$$\n  ^\\s*GVRP\\s+Status:\\s*${GVRP_STATUS}\\s*$$\n  ^\\s*Allowed\\sVLAN:\\s*${ALLOWED_VLAN}\\(${ALLOWED_VLAN_TAG}\\).*$$ -> Continue\n  ^\\s*Allowed\\sVLAN:\\s*(\\d+\\(\\w+\\),\\s*){1}${ALLOWED_VLAN}\\(${ALLOWED_VLAN_TAG}\\).*$$ -> Continue\n  ^\\s*Allowed\\sVLAN:\\s*(\\d+\\(\\w+\\),\\s*){2}${ALLOWED_VLAN}\\(${ALLOWED_VLAN_TAG}\\).*$$ -> Continue\n  ^\\s*Allowed\\sVLAN:\\s*(\\d+\\(\\w+\\),\\s*){3}${ALLOWED_VLAN}\\(${ALLOWED_VLAN_TAG}\\).*$$ -> Continue\n  ^\\s*Allowed\\sVLAN:\\s*(\\d+\\(\\w+\\),\\s*){4}${ALLOWED_VLAN}\\(${ALLOWED_VLAN_TAG}\\).*$$ -> Continue\n  ^\\s*Allowed\\sVLAN:\\s*(\\d+\\(\\w+\\),\\s*){5}${ALLOWED_VLAN}\\(${ALLOWED_VLAN_TAG}\\).*$$ -> Continue\n  ^\\s*Allowed\\sVLAN:\\s*(\\d+\\(\\w+\\),\\s*){6}${ALLOWED_VLAN}\\(${ALLOWED_VLAN_TAG}\\).*$$ -> Continue\n  ^\\s*Allowed\\sVLAN:\\s*(\\d+\\(\\w+\\),\\s*){7}${ALLOWED_VLAN}\\(${ALLOWED_VLAN_TAG}\\).*$$ -> Continue\n  ^\\s*Allowed\\sVLAN:\\s*(\\d+\\(\\w+\\),\\s*){8}${ALLOWED_VLAN}\\(${ALLOWED_VLAN_TAG}\\).*$$ -> Continue\n  ^\\s*Allowed\\sVLAN:\\s*(\\d+\\(\\w+\\),\\s*){9}${ALLOWED_VLAN}\\(${ALLOWED_VLAN_TAG}\\).*$$ -> Continue\n  ^\\s*Allowed\\sVLAN:\\s*(\\d+\\(\\w+\\),?\\s*)*$$\n  ^\\s+${ALLOWED_VLAN}\\(${ALLOWED_VLAN_TAG}\\).*$$ -> Continue\n  ^\\s+(\\d+\\(\\w+\\),\\s*){1}${ALLOWED_VLAN}\\(${ALLOWED_VLAN_TAG}\\).*$$ -> Continue\n  ^\\s+(\\d+\\(\\w+\\),\\s*){2}${ALLOWED_VLAN}\\(${ALLOWED_VLAN_TAG}\\).*$$ -> Continue\n  ^\\s+(\\d+\\(\\w+\\),\\s*){3}${ALLOWED_VLAN}\\(${ALLOWED_VLAN_TAG}\\).*$$ -> Continue\n  ^\\s+(\\d+\\(\\w+\\),\\s*){4}${ALLOWED_VLAN}\\(${ALLOWED_VLAN_TAG}\\).*$$ -> Continue\n  ^\\s+(\\d+\\(\\w+\\),\\s*){5}${ALLOWED_VLAN}\\(${ALLOWED_VLAN_TAG}\\).*$$ -> Continue\n  ^\\s+(\\d+\\(\\w+\\),\\s*){6}${ALLOWED_VLAN}\\(${ALLOWED_VLAN_TAG}\\).*$$ -> Continue\n  ^\\s+(\\d+\\(\\w+\\),\\s*){7}${ALLOWED_VLAN}\\(${ALLOWED_VLAN_TAG}\\).*$$ -> Continue\n  ^\\s+(\\d+\\(\\w+\\),\\s*){8}${ALLOWED_VLAN}\\(${ALLOWED_VLAN_TAG}\\).*$$ -> Continue\n  ^\\s+(\\d+\\(\\w+\\),\\s*){9}${ALLOWED_VLAN}\\(${ALLOWED_VLAN_TAG}\\).*$$ -> Continue\n  ^\\s+(\\d+\\(\\w+\\),?\\s*)*$$\n  ^\\s*Forbidden\\sVLAN:\\s*${FORBIDDEN_VLAN}\\(${FORBIDDEN_VLAN_TAG}\\).*$$ -> Continue\n  ^\\s*Forbidden\\sVLAN:\\s*(\\d+\\(\\w+\\),\\s*){1}${FORBIDDEN_VLAN}\\(${FORBIDDEN_VLAN_TAG}\\).*$$ -> Continue\n  ^\\s*Forbidden\\sVLAN:\\s*(\\d+\\(\\w+\\),\\s*){2}${FORBIDDEN_VLAN}\\(${FORBIDDEN_VLAN_TAG}\\).*$$ -> Continue\n  ^\\s*Forbidden\\sVLAN:\\s*(\\d+\\(\\w+\\),\\s*){3}${FORBIDDEN_VLAN}\\(${FORBIDDEN_VLAN_TAG}\\).*$$ -> Continue\n  ^\\s*Forbidden\\sVLAN:\\s*(\\d+\\(\\w+\\),\\s*){4}${FORBIDDEN_VLAN}\\(${FORBIDDEN_VLAN_TAG}\\).*$$ -> Continue\n  ^\\s*Forbidden\\sVLAN:\\s*(\\d+\\(\\w+\\),\\s*){5}${FORBIDDEN_VLAN}\\(${FORBIDDEN_VLAN_TAG}\\).*$$ -> Continue\n  ^\\s*Forbidden\\sVLAN:\\s*(\\d+\\(\\w+\\),\\s*){6}${FORBIDDEN_VLAN}\\(${FORBIDDEN_VLAN_TAG}\\).*$$ -> Continue\n  ^\\s*Forbidden\\sVLAN:\\s*(\\d+\\(\\w+\\),\\s*){7}${FORBIDDEN_VLAN}\\(${FORBIDDEN_VLAN_TAG}\\).*$$ -> Continue\n  ^\\s*Forbidden\\sVLAN:\\s*(\\d+\\(\\w+\\),\\s*){8}${FORBIDDEN_VLAN}\\(${FORBIDDEN_VLAN_TAG}\\).*$$ -> Continue\n  ^\\s*Forbidden\\sVLAN:\\s*(\\d+\\(\\w+\\),\\s*){9}${FORBIDDEN_VLAN}\\(${FORBIDDEN_VLAN_TAG}\\).*$$ -> Continue\n  ^\\s*Forbidden\\sVLAN:\\s*(\\d+\\(\\w+\\),?\\s*)*$$\n  ^\\s+${FORBIDDEN_VLAN}\\(${FORBIDDEN_VLAN_TAG}\\).*$$ -> Continue\n  ^\\s+(\\d+\\(\\w+\\),\\s*){1}${FORBIDDEN_VLAN}\\(${FORBIDDEN_VLAN_TAG}\\).*$$ -> Continue\n  ^\\s+(\\d+\\(\\w+\\),\\s*){2}${FORBIDDEN_VLAN}\\(${FORBIDDEN_VLAN_TAG}\\).*$$ -> Continue\n  ^\\s+(\\d+\\(\\w+\\),\\s*){3}${FORBIDDEN_VLAN}\\(${FORBIDDEN_VLAN_TAG}\\).*$$ -> Continue\n  ^\\s+(\\d+\\(\\w+\\),\\s*){4}${FORBIDDEN_VLAN}\\(${FORBIDDEN_VLAN_TAG}\\).*$$ -> Continue\n  ^\\s+(\\d+\\(\\w+\\),\\s*){5}${FORBIDDEN_VLAN}\\(${FORBIDDEN_VLAN_TAG}\\).*$$ -> Continue\n  ^\\s+(\\d+\\(\\w+\\),\\s*){6}${FORBIDDEN_VLAN}\\(${FORBIDDEN_VLAN_TAG}\\).*$$ -> Continue\n  ^\\s+(\\d+\\(\\w+\\),\\s*){7}${FORBIDDEN_VLAN}\\(${FORBIDDEN_VLAN_TAG}\\).*$$ -> Continue\n  ^\\s+(\\d+\\(\\w+\\),\\s*){8}${FORBIDDEN_VLAN}\\(${FORBIDDEN_VLAN_TAG}\\).*$$ -> Continue\n  ^\\s+(\\d+\\(\\w+\\),\\s*){9}${FORBIDDEN_VLAN}\\(${FORBIDDEN_VLAN_TAG}\\).*$$ -> Continue\n  ^\\s+(\\d+\\(\\w+\\),?\\s*)*$$\n  ^\\s*Private-VLAN\\s+Mode:\\s*${PRIVATE_VLAN_MODE}\\s*$$\n  ^\\s*Private-VLAN\\s+host-association:\\s*${PRIVATE_VLAN_HOST_ASSOCIATION}\\s*$$\n  ^\\s*Private-VLAN\\s+Mapping:\\s*${PRIVATE_VLAN_MAPPING}\\s*$$\n  ^\\s*802.1Q-tunnel\\s+Status:\\s*${TUNNEL_STATUS_802_1Q}\\s*$$\n  ^\\s*802.1Q-tunnel\\s+Mode:\\s*${TUNNEL_MODE_802_1Q}\\s*$$\n  ^\\s*802.1Q-tunnel\\s+TPID:\\s*${TUNNEL_TPID_802_1Q}\\s*$$\n  ^\\s*Layer\\s+2\\s+Protocol\\s+Tunnel\\s*:\\s*${LAYER_2_PROTOCOL_TUNNEL}\\s*$$\n  ^\\s*$$\n  ^. -> Error\n"
}