{
  "command": "edgecore_show_interfaces_status",
  "source": "ntc",
  "status": "success",
  "match_ratio": 1.0,
  "textfsm_rows": 10,
  "ttp_rows": 10,
  "ttp_template": "<group name=\"multicast_storm\">\n  Multicast Storm: {{MULTICAST_STORM | ORPHRASE}}\n</group>",
  "error": null,
  "textfsm_parsed": [
    {
      "PORT": "Eth 1/1",
      "PORT_TYPE": "100TX",
      "ADDRESS": "12-34-56-78-AA-00",
      "NAME": "PC1",
      "PORT_ADMIN": "Up",
      "MDIX_MODE": "Auto",
      "NEGOTIATION": "Auto",
      "SPEED": "100",
      "DUPLEX": "full",
      "CAPABILITIES": "10half, 10full, 100half, 100full",
      "BROADCAST_STORM": "Enabled",
      "BROADCAST_STORM_LIMIT": "64 Kbits/second",
      "MULTICAST_STORM": "Disabled",
      "MULTICAST_STORM_LIMIT": "64 Kbits/second",
      "UNKNOWNUNICAST_STORM": "Disabled",
      "UNKNOWNUNICAST_STORM_LIMIT": "64 Kbits/second",
      "FLOW_CONTROL": "Disabled",
      "VLAN_TRUNKING": "Disabled",
      "LACP": "Disabled",
      "PORT_SECURITY": "Disabled",
      "MAX_MAC_COUNT": "0",
      "PORT_SECURITY_ACTION": "None",
      "MEDIA_TYPE": "None",
      "GIGA_PHY_MODE": "Auto preferred master",
      "LINK_STATUS": "Down",
      "FLOW_CONTROL_TYPE": "None"
    },
    {
      "PORT": "Eth 1/2",
      "PORT_TYPE": "100TX",
      "ADDRESS": "12-34-56-78-AA-01",
      "NAME": "PC2",
      "PORT_ADMIN": "Up",
      "MDIX_MODE": "Auto",
      "NEGOTIATION": "Auto",
      "SPEED": "100",
      "DUPLEX": "full",
      "CAPABILITIES": "10half, 10full, 100half, 100full",
      "BROADCAST_STORM": "Enabled",
      "BROADCAST_STORM_LIMIT": "64 Kbits/second",
      "MULTICAST_STORM": "Disabled",
      "MULTICAST_STORM_LIMIT": "64 Kbits/second",
      "UNKNOWNUNICAST_STORM": "Disabled",
      "UNKNOWNUNICAST_STORM_LIMIT": "64 Kbits/second",
      "FLOW_CONTROL": "Disabled",
      "VLAN_TRUNKING": "Disabled",
      "LACP": "Disabled",
      "PORT_SECURITY": "Disabled",
      "MAX_MAC_COUNT": "0",
      "PORT_SECURITY_ACTION": "None",
      "MEDIA_TYPE": "None",
      "GIGA_PHY_MODE": "Auto preferred master",
      "LINK_STATUS": "Down",
      "FLOW_CONTROL_TYPE": "None"
    },
    {
      "PORT": "Eth 1/3",
      "PORT_TYPE": "100TX",
      "ADDRESS": "12-34-56-78-AA-03",
      "NAME": "AH1100-DevTest",
      "PORT_ADMIN": "Up",
      "MDIX_MODE": "Auto",
      "NEGOTIATION": "Auto",
      "SPEED": "100",
      "DUPLEX": "full",
      "CAPABILITIES": "10half, 10full, 100half, 100full",
      "BROADCAST_STORM": "Enabled",
      "BROADCAST_STORM_LIMIT": "64 Kbits/second",
      "MULTICAST_STORM": "Disabled",
      "MULTICAST_STORM_LIMIT": "64 Kbits/second",
      "UNKNOWNUNICAST_STORM": "Disabled",
      "UNKNOWNUNICAST_STORM_LIMIT": "64 Kbits/second",
      "FLOW_CONTROL": "Disabled",
      "VLAN_TRUNKING": "Disabled",
      "LACP": "Disabled",
      "PORT_SECURITY": "Disabled",
      "MAX_MAC_COUNT": "0",
      "PORT_SECURITY_ACTION": "None",
      "MEDIA_TYPE": "None",
      "GIGA_PHY_MODE": "Auto preferred master",
      "LINK_STATUS": "Down",
      "FLOW_CONTROL_TYPE": "None"
    },
    {
      "PORT": "Eth 1/4",
      "PORT_TYPE": "100TX",
      "ADDRESS": "12-34-56-78-AA-04",
      "NAME": "PC3",
      "PORT_ADMIN": "Up",
      "MDIX_MODE": "Auto",
      "NEGOTIATION": "Auto",
      "SPEED": "100",
      "DUPLEX": "full",
      "CAPABILITIES": "10half, 10full, 100half, 100full",
      "BROADCAST_STORM": "Enabled",
      "BROADCAST_STORM_LIMIT": "64 Kbits/second",
      "MULTICAST_STORM": "Disabled",
      "MULTICAST_STORM_LIMIT": "64 Kbits/second",
      "UNKNOWNUNICAST_STORM": "Disabled",
      "UNKNOWNUNICAST_STORM_LIMIT": "64 Kbits/second",
      "FLOW_CONTROL": "Disabled",
      "VLAN_TRUNKING": "Disabled",
      "LACP": "Disabled",
      "PORT_SECURITY": "Disabled",
      "MAX_MAC_COUNT": "0",
      "PORT_SECURITY_ACTION": "None",
      "MEDIA_TYPE": "None",
      "GIGA_PHY_MODE": "Auto preferred master",
      "LINK_STATUS": "Down",
      "FLOW_CONTROL_TYPE": "None"
    },
    {
      "PORT": "Eth 1/5",
      "PORT_TYPE": "100TX",
      "ADDRESS": "12-34-56-78-AA-05",
      "NAME": "Client_part",
      "PORT_ADMIN": "Up",
      "MDIX_MODE": "Auto",
      "NEGOTIATION": "Auto",
      "SPEED": "100",
      "DUPLEX": "full",
      "CAPABILITIES": "10half, 10full, 100half, 100full",
      "BROADCAST_STORM": "Enabled",
      "BROADCAST_STORM_LIMIT": "64 Kbits/second",
      "MULTICAST_STORM": "Disabled",
      "MULTICAST_STORM_LIMIT": "64 Kbits/second",
      "UNKNOWNUNICAST_STORM": "Disabled",
      "UNKNOWNUNICAST_STORM_LIMIT": "64 Kbits/second",
      "FLOW_CONTROL": "Disabled",
      "VLAN_TRUNKING": "Disabled",
      "LACP": "Disabled",
      "PORT_SECURITY": "Disabled",
      "MAX_MAC_COUNT": "0",
      "PORT_SECURITY_ACTION": "None",
      "MEDIA_TYPE": "None",
      "GIGA_PHY_MODE": "Auto preferred master",
      "LINK_STATUS": "Down",
      "FLOW_CONTROL_TYPE": "None"
    },
    {
      "PORT": "Eth 1/6",
      "PORT_TYPE": "100TX",
      "ADDRESS": "12-34-56-78-AA-06",
      "NAME": "LAB LAN to VM",
      "PORT_ADMIN": "Up",
      "MDIX_MODE": "Auto",
      "NEGOTIATION": "Auto",
      "SPEED": "100",
      "DUPLEX": "full",
      "CAPABILITIES": "10half, 10full, 100half, 100full",
      "BROADCAST_STORM": "Enabled",
      "BROADCAST_STORM_LIMIT": "64 Kbits/second",
      "MULTICAST_STORM": "Disabled",
      "MULTICAST_STORM_LIMIT": "64 Kbits/second",
      "UNKNOWNUNICAST_STORM": "Disabled",
      "UNKNOWNUNICAST_STORM_LIMIT": "64 Kbits/second",
      "FLOW_CONTROL": "Disabled",
      "VLAN_TRUNKING": "Disabled",
      "LACP": "Disabled",
      "PORT_SECURITY": "Disabled",
      "MAX_MAC_COUNT": "0",
      "PORT_SECURITY_ACTION": "None",
      "MEDIA_TYPE": "None",
      "GIGA_PHY_MODE": "Auto preferred master",
      "LINK_STATUS": "Down",
      "FLOW_CONTROL_TYPE": "None"
    },
    {
      "PORT": "Eth 1/7",
      "PORT_TYPE": "100TX",
      "ADDRESS": "12-34-56-78-AA-07",
      "NAME": "Stand",
      "PORT_ADMIN": "Up",
      "MDIX_MODE": "Auto",
      "NEGOTIATION": "Auto",
      "SPEED": "100",
      "DUPLEX": "full",
      "CAPABILITIES": "10half, 10full, 100half, 100full",
      "BROADCAST_STORM": "Enabled",
      "BROADCAST_STORM_LIMIT": "64 Kbits/second",
      "MULTICAST_STORM": "Disabled",
      "MULTICAST_STORM_LIMIT": "64 Kbits/second",
      "UNKNOWNUNICAST_STORM": "Disabled",
      "UNKNOWNUNICAST_STORM_LIMIT": "64 Kbits/second",
      "FLOW_CONTROL": "Disabled",
      "VLAN_TRUNKING": "Disabled",
      "LACP": "Disabled",
      "PORT_SECURITY": "Disabled",
      "MAX_MAC_COUNT": "0",
      "PORT_SECURITY_ACTION": "None",
      "MEDIA_TYPE": "None",
      "GIGA_PHY_MODE": "Auto preferred master",
      "LINK_STATUS": "Down",
      "FLOW_CONTROL_TYPE": "None"
    },
    {
      "PORT": "Eth 1/8",
      "PORT_TYPE": "100TX",
      "ADDRESS": "12-34-56-78-AA-08",
      "NAME": "Stand fa4",
      "PORT_ADMIN": "Up",
      "MDIX_MODE": "Auto",
      "NEGOTIATION": "Auto",
      "SPEED": "100",
      "DUPLEX": "full",
      "CAPABILITIES": "10half, 10full, 100half, 100full",
      "BROADCAST_STORM": "Enabled",
      "BROADCAST_STORM_LIMIT": "64 Kbits/second",
      "MULTICAST_STORM": "Disabled",
      "MULTICAST_STORM_LIMIT": "64 Kbits/second",
      "UNKNOWNUNICAST_STORM": "Disabled",
      "UNKNOWNUNICAST_STORM_LIMIT": "64 Kbits/second",
      "FLOW_CONTROL": "Disabled",
      "VLAN_TRUNKING": "Disabled",
      "LACP": "Disabled",
      "PORT_SECURITY": "Disabled",
      "MAX_MAC_COUNT": "0",
      "PORT_SECURITY_ACTION": "None",
      "MEDIA_TYPE": "None",
      "GIGA_PHY_MODE": "Auto preferred master",
      "LINK_STATUS": "Down",
      "FLOW_CONTROL_TYPE": "None"
    },
    {
      "PORT": "Eth 1/9",
      "PORT_TYPE": "1000T",
      "ADDRESS": "12-34-56-78-AA-09",
      "NAME": "PC4",
      "PORT_ADMIN": "Up",
      "MDIX_MODE": "Auto",
      "NEGOTIATION": "Auto",
      "SPEED": "1000",
      "DUPLEX": "full",
      "CAPABILITIES": "10half, 10full, 100half, 100full, 1000full",
      "BROADCAST_STORM": "Enabled",
      "BROADCAST_STORM_LIMIT": "64 Kbits/second",
      "MULTICAST_STORM": "Disabled",
      "MULTICAST_STORM_LIMIT": "64 Kbits/second",
      "UNKNOWNUNICAST_STORM": "Disabled",
      "UNKNOWNUNICAST_STORM_LIMIT": "64 Kbits/second",
      "FLOW_CONTROL": "Disabled",
      "VLAN_TRUNKING": "Disabled",
      "LACP": "Disabled",
      "PORT_SECURITY": "Disabled",
      "MAX_MAC_COUNT": "0",
      "PORT_SECURITY_ACTION": "None",
      "MEDIA_TYPE": "SFP preferred auto",
      "GIGA_PHY_MODE": "Auto preferred master",
      "LINK_STATUS": "Up",
      "OPERATION_STATUS": "Up",
      "PORT_UPTIME": "1w  12d  11h   37m  14s (1078634 seconds)",
      "FLOW_CONTROL_TYPE": "None"
    },
    {
      "PORT": "Eth 1/10",
      "PORT_TYPE": "1000T",
      "ADDRESS": "12-34-56-78-AA-10",
      "NAME": "Videowall-PC",
      "PORT_ADMIN": "Up",
      "MDIX_MODE": "Auto",
      "NEGOTIATION": "Auto",
      "SPEED": "1000",
      "DUPLEX": "full",
      "CAPABILITIES": "10half, 10full, 100half, 100full, 1000full",
      "BROADCAST_STORM": "Enabled",
      "BROADCAST_STORM_LIMIT": "64 Kbits/second",
      "MULTICAST_STORM": "Disabled",
      "MULTICAST_STORM_LIMIT": "64 Kbits/second",
      "UNKNOWNUNICAST_STORM": "Disabled",
      "UNKNOWNUNICAST_STORM_LIMIT": "64 Kbits/second",
      "FLOW_CONTROL": "Disabled",
      "VLAN_TRUNKING": "Disabled",
      "LACP": "Disabled",
      "PORT_SECURITY": "Disabled",
      "MAX_MAC_COUNT": "0",
      "PORT_SECURITY_ACTION": "None",
      "MEDIA_TYPE": "SFP preferred auto",
      "GIGA_PHY_MODE": "Auto preferred master",
      "LINK_STATUS": "Up",
      "OPERATION_STATUS": "Up",
      "PORT_UPTIME": "3w  22d  1h   15m  40s (1905340 seconds)",
      "FLOW_CONTROL_TYPE": "None"
    }
  ],
  "ttp_parsed": [
    {
      "multicast_storm": [
        {
          "MULTICAST_STORM": "Disabled"
        },
        {
          "MULTICAST_STORM": "Disabled"
        },
        {
          "MULTICAST_STORM": "Disabled"
        },
        {
          "MULTICAST_STORM": "Disabled"
        },
        {
          "MULTICAST_STORM": "Disabled"
        },
        {
          "MULTICAST_STORM": "Disabled"
        },
        {
          "MULTICAST_STORM": "Disabled"
        },
        {
          "MULTICAST_STORM": "Disabled"
        },
        {
          "MULTICAST_STORM": "Disabled"
        },
        {
          "MULTICAST_STORM": "Disabled"
        }
      ]
    }
  ],
  "cli_content": "Information of Eth 1/1\n Basic Information:\n  Port Type:              100TX\n  Mac Address:            12-34-56-78-AA-00\n Configuration:\n  Name:                   PC1\n  Port Admin:             Up\n  MDIX mode:              Auto\n  Speed-duplex:           Auto\n  Capabilities:           10half, 10full, 100half, 100full\n  Broadcast Storm:        Enabled\n  Broadcast Storm Limit:  64 Kbits/second\n  Multicast Storm:        Disabled\n  Multicast Storm Limit:  64 Kbits/second\n  UnknownUnicast Storm:        Disabled\n  UnknownUnicast Storm Limit:  64 Kbits/second\n  Flow Control:           Disabled\n  VLAN Trunking:          Disabled\n  LACP:                   Disabled\n  Port Security:          Disabled\n  Max MAC Count:          0\n  Port Security Action:   None\n  Media Type:             None\n  Giga PHY mode: Auto preferred master\n Current Status:\n  Link Status:            Down\n  Operation Speed-duplex: 100full\n  Flow Control Type:      None\n\nInformation of Eth 1/2\n Basic Information:\n  Port Type:              100TX\n  Mac Address:            12-34-56-78-AA-01\n Configuration:\n  Name:                   PC2\n  Port Admin:             Up\n  MDIX mode:              Auto\n  Speed-duplex:           Auto\n  Capabilities:           10half, 10full, 100half, 100full\n  Broadcast Storm:        Enabled\n  Broadcast Storm Limit:  64 Kbits/second\n  Multicast Storm:        Disabled\n  Multicast Storm Limit:  64 Kbits/second\n  UnknownUnicast Storm:        Disabled\n  UnknownUnicast Storm Limit:  64 Kbits/second\n  Flow Control:           Disabled\n  VLAN Trunking:          Disabled\n  LACP:                   Disabled\n  Port Security:          Disabled\n  Max MAC Count:          0\n  Port Security Action:   None\n  Media Type:             None\n  Giga PHY mode: Auto preferred master\n Current Status:\n  Link Status:            Down\n  Operation Speed-duplex: 100full\n  Flow Control Type:      None\n\nInformation of Eth 1/3\n Basic Information:\n  Port Type:              100TX\n  Mac Address:            12-34-56-78-AA-03\n Configuration:\n  Name:                   AH1100-DevTest\n  Port Admin:             Up\n  MDIX mode:              Auto\n  Speed-duplex:           Auto\n  Capabilities:           10half, 10full, 100half, 100full\n  Broadcast Storm:        Enabled\n  Broadcast Storm Limit:  64 Kbits/second\n  Multicast Storm:        Disabled\n  Multicast Storm Limit:  64 Kbits/second\n  UnknownUnicast Storm:        Disabled\n  UnknownUnicast Storm Limit:  64 Kbits/second\n  Flow Control:           Disabled\n  VLAN Trunking:          Disabled\n  LACP:                   Disabled\n  Port Security:          Disabled\n  Max MAC Count:          0\n  Port Security Action:   None\n  Media Type:             None\n  Giga PHY mode: Auto preferred master\n Current Status:\n  Link Status:            Down\n  Operation Speed-duplex: 100full\n  Flow Control Type:      None\n\nInformation of Eth 1/4\n Basic Information:\n  Port Type:              100TX\n  Mac Address:            12-34-56-78-AA-04\n Configuration:\n  Name:                   PC3\n  Port Admin:             Up\n  MDIX mode:              Auto\n  Speed-duplex:           Auto\n  Capabilities:           10half, 10full, 100half, 100full\n  Broadcast Storm:        Enabled\n  Broadcast Storm Limit:  64 Kbits/second\n  Multicast Storm:        Disabled\n  Multicast Storm Limit:  64 Kbits/second\n  UnknownUnicast Storm:        Disabled\n  UnknownUnicast Storm Limit:  64 Kbits/second\n  Flow Control:           Disabled\n  VLAN Trunking:          Disabled\n  LACP:                   Disabled\n  Port Security:          Disabled\n  Max MAC Count:          0\n  Port Security Action:   None\n  Media Type:             None\n  Giga PHY mode: Auto preferred master\n Current Status:\n  Link Status:            Down\n  Operation Speed-duplex: 100full\n  Flow Control Type:      None\n\nInformation of Eth 1/5\n Basic Information:\n  Port Type:              100TX\n  Mac Address:            12-34-56-78-AA-05\n Configuration:\n  Name:                   Client_part\n  Port Admin:             Up\n  MDIX mode:              Auto\n  Speed-duplex:           Auto\n  Capabilities:           10half, 10full, 100half, 100full\n  Broadcast Storm:        Enabled\n  Broadcast Storm Limit:  64 Kbits/second\n  Multicast Storm:        Disabled\n  Multicast Storm Limit:  64 Kbits/second\n  UnknownUnicast Storm:        Disabled\n  UnknownUnicast Storm Limit:  64 Kbits/second\n  Flow Control:           Disabled\n  VLAN Trunking:          Disabled\n  LACP:                   Disabled\n  Port Security:          Disabled\n  Max MAC Count:          0\n  Port Security Action:   None\n  Media Type:             None\n  Giga PHY mode: Auto preferred master\n Current Status:\n  Link Status:            Down\n  Operation Speed-duplex: 100full\n  Flow Control Type:      None\n\nInformation of Eth 1/6\n Basic Information:\n  Port Type:              100TX\n  Mac Address:            12-34-56-78-AA-06\n Configuration:\n  Name:                   LAB LAN to VM\n  Port Admin:             Up\n  MDIX mode:              Auto\n  Speed-duplex:           Auto\n  Capabilities:           10half, 10full, 100half, 100full\n  Broadcast Storm:        Enabled\n  Broadcast Storm Limit:  64 Kbits/second\n  Multicast Storm:        Disabled\n  Multicast Storm Limit:  64 Kbits/second\n  UnknownUnicast Storm:        Disabled\n  UnknownUnicast Storm Limit:  64 Kbits/second\n  Flow Control:           Disabled\n  VLAN Trunking:          Disabled\n  LACP:                   Disabled\n  Port Security:          Disabled\n  Max MAC Count:          0\n  Port Security Action:   None\n  Media Type:             None\n  Giga PHY mode: Auto preferred master\n Current Status:\n  Link Status:            Down\n  Operation Speed-duplex: 100full\n  Flow Control Type:      None\n\nInformation of Eth 1/7\n Basic Information:\n  Port Type:              100TX\n  Mac Address:            12-34-56-78-AA-07\n Configuration:\n  Name:                   Stand\n  Port Admin:             Up\n  MDIX mode:              Auto\n  Speed-duplex:           Auto\n  Capabilities:           10half, 10full, 100half, 100full\n  Broadcast Storm:        Enabled\n  Broadcast Storm Limit:  64 Kbits/second\n  Multicast Storm:        Disabled\n  Multicast Storm Limit:  64 Kbits/second\n  UnknownUnicast Storm:        Disabled\n  UnknownUnicast Storm Limit:  64 Kbits/second\n  Flow Control:           Disabled\n  VLAN Trunking:          Disabled\n  LACP:                   Disabled\n  Port Security:          Disabled\n  Max MAC Count:          0\n  Port Security Action:   None\n  Media Type:             None\n  Giga PHY mode: Auto preferred master\n Current Status:\n  Link Status:            Down\n  Operation Speed-duplex: 100full\n  Flow Control Type:      None\n\nInformation of Eth 1/8\n Basic Information:\n  Port Type:              100TX\n  Mac Address:            12-34-56-78-AA-08\n Configuration:\n  Name:                   Stand fa4\n  Port Admin:             Up\n  MDIX mode:              Auto\n  Speed-duplex:           Auto\n  Capabilities:           10half, 10full, 100half, 100full\n  Broadcast Storm:        Enabled\n  Broadcast Storm Limit:  64 Kbits/second\n  Multicast Storm:        Disabled\n  Multicast Storm Limit:  64 Kbits/second\n  UnknownUnicast Storm:        Disabled\n  UnknownUnicast Storm Limit:  64 Kbits/second\n  Flow Control:           Disabled\n  VLAN Trunking:          Disabled\n  LACP:                   Disabled\n  Port Security:          Disabled\n  Max MAC Count:          0\n  Port Security Action:   None\n  Media Type:             None\n  Giga PHY mode: Auto preferred master\n Current Status:\n  Link Status:            Down\n  Operation Speed-duplex: 100full\n  Flow Control Type:      None\n\nInformation of Eth 1/9\n Basic Information:\n  Port Type:              1000T\n  Mac Address:            12-34-56-78-AA-09\n Configuration:\n  Name:                   PC4\n  Port Admin:             Up\n  MDIX mode:              Auto\n  Speed-duplex:           Auto\n  Capabilities:           10half, 10full, 100half, 100full, 1000full\n  Broadcast Storm:        Enabled\n  Broadcast Storm Limit:  64 Kbits/second\n  Multicast Storm:        Disabled\n  Multicast Storm Limit:  64 Kbits/second\n  UnknownUnicast Storm:        Disabled\n  UnknownUnicast Storm Limit:  64 Kbits/second\n  Flow Control:           Disabled\n  VLAN Trunking:          Disabled\n  LACP:                   Disabled\n  Port Security:          Disabled\n  Max MAC Count:          0\n  Port Security Action:   None\n  Media Type:             SFP preferred auto\n  Giga PHY mode: Auto preferred master\n Current Status:\n  Link Status:            Up\n  Port Operation Status:  Up\n  Operation Speed-duplex: 1000full\n  Port Uptime:            1w  12d  11h   37m  14s (1078634 seconds)\n  Flow Control Type:      None\n\nInformation of Eth 1/10\n Basic Information:\n  Port Type:              1000T\n  Mac Address:            12-34-56-78-AA-10\n Configuration:\n  Name:                   Videowall-PC\n  Port Admin:             Up\n  MDIX mode:              Auto\n  Speed-duplex:           Auto\n  Capabilities:           10half, 10full, 100half, 100full, 1000full\n  Broadcast Storm:        Enabled\n  Broadcast Storm Limit:  64 Kbits/second\n  Multicast Storm:        Disabled\n  Multicast Storm Limit:  64 Kbits/second\n  UnknownUnicast Storm:        Disabled\n  UnknownUnicast Storm Limit:  64 Kbits/second\n  Flow Control:           Disabled\n  VLAN Trunking:          Disabled\n  LACP:                   Disabled\n  Port Security:          Disabled\n  Max MAC Count:          0\n  Port Security Action:   None\n  Media Type:             SFP preferred auto\n  Giga PHY mode: Auto preferred master\n Current Status:\n  Link Status:            Up\n  Port Operation Status:  Up\n  Operation Speed-duplex: 1000full\n  Port Uptime:            3w  22d  1h   15m  40s (1905340 seconds)\n  Flow Control Type:      None\n\nInformation of VLAN 1\n MAC Address:             12-34-56-78-90-00\n\nInformation of VLAN 150\n MAC Address:             12-34-56-78-90-00\n\nInformation of VLAN 203\n MAC Address:             12-34-56-78-90-00\n",
  "textfsm_template": "Value Required PORT (.*)\nValue PORT_TYPE (.*)\nValue ADDRESS (.*)\nValue NAME (.*)\nValue PORT_ADMIN (.*)\nValue MDIX_MODE (.*)\nValue NEGOTIATION (Auto)\nValue SPEED (\\d+)\nValue DUPLEX (\\S+)\nValue CAPABILITIES (.*)\nValue BROADCAST_STORM (.*)\nValue BROADCAST_STORM_LIMIT (.*)\nValue MULTICAST_STORM (.*)\nValue MULTICAST_STORM_LIMIT (.*)\nValue UNKNOWNUNICAST_STORM (.*)\nValue UNKNOWNUNICAST_STORM_LIMIT (.*)\nValue FLOW_CONTROL (.*)\nValue VLAN_TRUNKING (.*)\nValue LACP (.*)\nValue PORT_SECURITY (.*)\nValue MAX_MAC_COUNT (.*)\nValue PORT_SECURITY_ACTION (.*)\nValue MEDIA_TYPE (.*)\nValue GIGA_PHY_MODE (.*)\nValue LINK_STATUS (.*)\nValue OPERATION_STATUS (.*)\nValue PORT_UPTIME (.*)\nValue FLOW_CONTROL_TYPE (.*)\n\nStart\n  ^\\s*Information\\s+of.*$$ -> Continue.Record\n  ^\\s*Information\\s+of\\s+${PORT}\\s*$$\n  ^\\s*M(ac|AC)\\s+Address:\\s*${ADDRESS}\\s*$$\n  ^\\s*Basic\\s+Information:\\s*$$ -> BasicInfo\n  ^\\s*$$\n  ^. -> Error\n\nBasicInfo\n  ^\\s*Port\\s+Type:\\s*${PORT_TYPE}\\s*$$\n  ^\\s*M(ac|AC)\\s+Address:\\s*${ADDRESS}\\s*$$\n  ^\\s*Configuration:\\s*$$ -> Configuration\n  ^\\s*$$\n  ^. -> Error\n\nConfiguration\n  ^\\s*Name:\\s*${NAME}\\s*$$\n  ^\\s*Port\\s+Admin:\\s*${PORT_ADMIN}\\s*$$\n  ^\\s*MDIX\\s+mode:\\s*${MDIX_MODE}\\s*$$\n  ^\\s*Speed-duplex:\\s*${NEGOTIATION}\\s*$$\n  ^\\s*Capabilities:\\s*${CAPABILITIES}\\s*$$\n  ^\\s*Broadcast\\s+Storm:\\s*${BROADCAST_STORM}\\s*$$\n  ^\\s*Broadcast\\s+Storm\\s+Limit:\\s*${BROADCAST_STORM_LIMIT}\\s*$$\n  ^\\s*Multicast\\s+Storm:\\s*${MULTICAST_STORM}\\s*$$\n  ^\\s*Multicast\\s+Storm\\s+Limit:\\s*${MULTICAST_STORM_LIMIT}\\s*$$\n  ^\\s*UnknownUnicast\\s+Storm:\\s*${UNKNOWNUNICAST_STORM}\\s*$$\n  ^\\s*UnknownUnicast\\s+Storm\\s+Limit:\\s*${UNKNOWNUNICAST_STORM_LIMIT}\\s*$$\n  ^\\s*Flow\\s+Control:\\s*${FLOW_CONTROL}\\s*$$\n  ^\\s*VLAN\\s+Trunking:\\s*${VLAN_TRUNKING}\\s*$$\n  ^\\s*LACP:\\s*${LACP}\\s*$$\n  ^\\s*Port\\s+Security:\\s*${PORT_SECURITY}\\s*$$\n  ^\\s*Max\\s+MAC\\s+Count:\\s*${MAX_MAC_COUNT}\\s*$$\n  ^\\s*Port\\s+Security\\s+Action:\\s*${PORT_SECURITY_ACTION}\\s*$$\n  ^\\s*Media\\s+Type:\\s*${MEDIA_TYPE}\\s*$$\n  ^\\s*Giga\\s+PHY\\s+mode:\\s*${GIGA_PHY_MODE}\\s*$$\n  ^\\s*Current Status:\\s*$$ -> CurrentStatus\n  ^\\s*$$\n  ^. -> Error\n\nCurrentStatus\n  ^\\s*Link\\s+Status:\\s*${LINK_STATUS}\\s*$$\n  ^\\s*Port\\s+Operation\\s+Status:\\s*${OPERATION_STATUS}\\s*$$\n  ^\\s*Operation\\s+Speed-duplex:\\s*${SPEED}${DUPLEX}\\s*$$\n  ^\\s*Port\\s+Uptime:\\s*${PORT_UPTIME}\\s*$$\n  ^\\s*Flow\\s+Control\\s+Type:\\s*${FLOW_CONTROL_TYPE}\\s*$$\n  ^\\s*$$ -> Start\n  ^. -> Error\n"
}