{
  "command": "juniper_junos_show_lacp_interfaces",
  "source": "ntc",
  "status": "success",
  "match_ratio": 1.75,
  "textfsm_rows": 4,
  "ttp_rows": 7,
  "ttp_template": "<group name=\"member_interface_receive_state_transmit_state_mux_state\">\n      {{MEMBER_INTERFACE | ORPHRASE}} {{RECEIVE_STATE | ORPHRASE}} {{TRANSMIT_STATE | ORPHRASE}} {{MUX_STATE | ORPHRASE}}\n</group>",
  "error": null,
  "textfsm_parsed": [
    {
      "BUNDLE_NAME": "ae33",
      "MEMBER_INTERFACE": "xe-0/0/0:0",
      "RECEIVE_STATE": "Current",
      "TRANSMIT_STATE": "Slow periodic",
      "MUX_STATE": "Collecting distributing"
    },
    {
      "BUNDLE_NAME": "ae111",
      "MEMBER_INTERFACE": "et-0/0/32, et-0/0/33",
      "RECEIVE_STATE": "Current, Current",
      "TRANSMIT_STATE": "Fast periodic, Fast periodic",
      "MUX_STATE": "Collecting distributing, Collecting distributing"
    },
    {
      "BUNDLE_NAME": "ae112",
      "MEMBER_INTERFACE": "et-0/0/34, et-0/0/35",
      "RECEIVE_STATE": "Current, Current",
      "TRANSMIT_STATE": "Fast periodic, Fast periodic",
      "MUX_STATE": "Collecting distributing, Collecting distributing"
    },
    {
      "BUNDLE_NAME": "ae115",
      "MEMBER_INTERFACE": "et-0/0/25, et-0/0/29",
      "RECEIVE_STATE": "Current, Current",
      "TRANSMIT_STATE": "Fast periodic, Fast periodic",
      "MUX_STATE": "Collecting distributing, Collecting distributing"
    }
  ],
  "ttp_parsed": [
    {
      "member_interface_receive_state_transmit_state_mux_state": [
        {
          "MEMBER_INTERFACE": "xe-0/0/0:0",
          "RECEIVE_STATE": "Current",
          "TRANSMIT_STATE": "Slow",
          "MUX_STATE": "periodic Collecting distributing"
        },
        {
          "MEMBER_INTERFACE": "et-0/0/32",
          "RECEIVE_STATE": "Current",
          "TRANSMIT_STATE": "Fast",
          "MUX_STATE": "periodic Collecting distributing"
        },
        {
          "MEMBER_INTERFACE": "et-0/0/33",
          "RECEIVE_STATE": "Current",
          "TRANSMIT_STATE": "Fast",
          "MUX_STATE": "periodic Collecting distributing"
        },
        {
          "MEMBER_INTERFACE": "et-0/0/34",
          "RECEIVE_STATE": "Current",
          "TRANSMIT_STATE": "Fast",
          "MUX_STATE": "periodic Collecting distributing"
        },
        {
          "MEMBER_INTERFACE": "et-0/0/35",
          "RECEIVE_STATE": "Current",
          "TRANSMIT_STATE": "Fast",
          "MUX_STATE": "periodic Collecting distributing"
        },
        {
          "MEMBER_INTERFACE": "et-0/0/25",
          "RECEIVE_STATE": "Current",
          "TRANSMIT_STATE": "Fast",
          "MUX_STATE": "periodic Collecting distributing"
        },
        {
          "MEMBER_INTERFACE": "et-0/0/29",
          "RECEIVE_STATE": "Current",
          "TRANSMIT_STATE": "Fast",
          "MUX_STATE": "periodic Collecting distributing"
        }
      ]
    }
  ],
  "cli_content": "Aggregated interface: ae33\n    LACP state:       Role   Exp   Def  Dist  Col  Syn  Aggr  Timeout  Activity\n      xe-0/0/0:0     Actor    No    No   Yes  Yes  Yes   Yes     Fast    Active\n      xe-0/0/0:0   Partner    No    No   Yes  Yes  Yes   Yes     Slow    Active\n    LACP protocol:        Receive State  Transmit State          Mux State\n      xe-0/0/0:0                Current   Slow periodic Collecting distributing\n\nAggregated interface: ae111\n    LACP state:       Role   Exp   Def  Dist  Col  Syn  Aggr  Timeout  Activity\n      et-0/0/32      Actor    No    No   Yes  Yes  Yes   Yes     Fast    Active\n      et-0/0/32    Partner    No    No   Yes  Yes  Yes   Yes     Fast    Active\n      et-0/0/33      Actor    No    No   Yes  Yes  Yes   Yes     Fast    Active\n      et-0/0/33    Partner    No    No   Yes  Yes  Yes   Yes     Fast    Active\n    LACP protocol:        Receive State  Transmit State          Mux State\n      et-0/0/32                 Current   Fast periodic Collecting distributing\n      et-0/0/33                 Current   Fast periodic Collecting distributing\n\nAggregated interface: ae112\n    LACP state:       Role   Exp   Def  Dist  Col  Syn  Aggr  Timeout  Activity\n      et-0/0/34      Actor    No    No   Yes  Yes  Yes   Yes     Fast    Active\n      et-0/0/34    Partner    No    No   Yes  Yes  Yes   Yes     Fast    Active\n      et-0/0/35      Actor    No    No   Yes  Yes  Yes   Yes     Fast    Active\n      et-0/0/35    Partner    No    No   Yes  Yes  Yes   Yes     Fast    Active\n    LACP protocol:        Receive State  Transmit State          Mux State\n      et-0/0/34                 Current   Fast periodic Collecting distributing\n      et-0/0/35                 Current   Fast periodic Collecting distributing\n\nAggregated interface: ae115\n    LACP state:       Role   Exp   Def  Dist  Col  Syn  Aggr  Timeout  Activity\n      et-0/0/25      Actor    No    No   Yes  Yes  Yes   Yes     Fast    Active\n      et-0/0/25    Partner    No    No   Yes  Yes  Yes   Yes     Fast    Active\n      et-0/0/29      Actor    No    No   Yes  Yes  Yes   Yes     Fast    Active\n      et-0/0/29    Partner    No    No   Yes  Yes  Yes   Yes     Fast    Active\n    LACP protocol:        Receive State  Transmit State          Mux State\n      et-0/0/25                 Current   Fast periodic Collecting distributing\n      et-0/0/29                 Current   Fast periodic Collecting distributing\n\n{master:0}\n",
  "textfsm_template": "Value Required BUNDLE_NAME (\\S+)\nValue List MEMBER_INTERFACE (\\S+)\nValue List RECEIVE_STATE (\\S+\\s?\\w+)\nValue List TRANSMIT_STATE (\\S+\\s?periodic)\nValue List MUX_STATE (\\S+\\s?\\S*)\n\nStart\n  ^Aggregated -> Continue.Record\n  ^Aggregated\\sinterface:\\s${BUNDLE_NAME}(\\s|$$)\n  ^\\s+LACP\\s+state:\n  ^\\s+LACP\\sprotocol: -> LACP_PROTO\n  ^\\s+\\S+\n  ^\\s*$$\n  ^{master:\\d+}\n  ^. -> Error\n\nLACP_PROTO\n  ^\\s+${MEMBER_INTERFACE}\\s+${RECEIVE_STATE}\\s+${TRANSMIT_STATE}\\s+${MUX_STATE}(\\s|$$)\n  ^\\s*$$\n  ^Aggregated -> Continue.Record\n  ^Aggregated\\sinterface:\\s${BUNDLE_NAME}(\\s|$$) -> Start\n  ^{master:\\d+}\n  ^. -> Error\n"
}